Title,Description,PublishedAt,URL,Content
The Morning After: The best of CES 2023,"After canceling our CES plans in 2022 (and there wasn’t even a show in 2021), the Engadget team sent a dozen staffers to this year’s CES. The show wasn't as busy as in pre-pandemic years, but many events were packed, and companies had plenty of announcements …",2023-01-09T12:38:01Z,https://www.engadget.com/the-morning-after-the-best-of-ces-2023-123801480.html,After canceling our CES plans in 2022 and there wasnt even a show in 2021 the Engadget team sent a dozen staffers to this years CES. The show wasnt as busy as in prepandemic years but many events were packed and companies had plenty of announcements to dig into. So what was the best of CES You can check out all the award winners right here. Our Best of the Best winner wasnt a car or a TV that sticks to the wall. No its Project Leonardo. This is Sonys first piece of gaming hardware designed specifically for people with limited motor control and its rather eyecatching. This controller kit works out of the box with the PlayStation 5 offering two circular gamepads lined with swappable buttons thirdparty accessory ports and other customizable inputs. The controllers sit flat on a table or mounted on a standard tripod. They can also pair with a DualSense to turn all three devices into a single gamepad offering plenty of flexibility. To make sure it delivered on its accessibility promises Sony partnered with advocacy organizations including AbleGamers SpecialEffect and Stack Up much like Microsoft did with the revolutionary Xbox Adaptive Controller. Though theres no release date or price for Project Leonardo yet Sony is finally seizing an opportunity to expand the PS5 player base. Mat Smith The Morning After isnt just a newsletter its also a daily podcast. Get our daily audio briefings Monday through Friday by subscribing right here. The biggest stories you might have missed New York City public schools ban OpenAIs ChatGPT LG Displays latest foldable OLED can bend in both directions MSI made a router with antennas that follow you around your house Amazons Kindle Scribe is on sale for the first time US Department of Agriculture approves firstever vaccine for honeybees Seattle schools sue TikTok Meta and other platforms over youth mental health crisis Twitter has reportedly laid off more of its global content moderation team Apples longrumored mixed reality headset could finally debut this spring The launch could come at the expense of the companys other products. According to Bloombergs Mark Gurman Apple plans to announce its first mixed reality headset this spring ahead of its annual WWDC conference in June. In a sign that a launch is finally on the horizon Apple has reportedly shared the headset with a handful of highprofile software developers giving them a first look at its new xrOS software. A focus on its newest hardware line will allegedly affect its heavy hitters however. The next version of the companys iOS operating system will likely ship with fewer major changes than originally planned due to Apple reassigning software engineers to the xrOS team. The same goes for macOS 14 Gurman adds. The company apparently has no updates of note for its iPad Apple Watch and audio product lines. Rolands 50th Anniversary Concept Piano has flying speaker drones Ridiculous but beautiful. Rolands 50thanniversary celebration included a gorgeous Anniversary Concept Piano built in collaboration with Japanese furniture maker Karimoku. The outside is one piece molded from Japanese Nara oak that hides a 360degree 14speaker system. Roland also built speakers into drones that hover above the piano controlled by the player. Unfortunately those couldnt be flown on the showfloor at CES because safety so Roland dangled a pair of them from wires. Boo. Samsung might unveil the Galaxy S23 series on February 1st A Galaxy Unpacked event is scheduled that day. Samsung may have inadvertently confirmed itll unveil its next flagship phones early next month. The companys Colombian website published a page revealing its next Galaxy Unpacked event is scheduled for February 1st 2023. Epic moments are approaching it read before the page was pulled offline. Samsungs showcase for its flagship devices has crept earlier in the calendar over the years For the Galaxy S22 series Samsung held an event on February 9th 2022. HTCs Vive XR Elite is its portable answer to the Meta Quest Pro The features that matter in a lighter package. HTC is hitting back at Metas Pro VR headset with the Vive XR Elite. The XR Elite matches plenty of the Quest Pros highlight specs including support for 2K resolution to each eye a 90Hz refresh rate and full standalone operation. However weighing 625 grams versus 722 for the Quest Pro and with a more comfortable headband the XR Elite does an even better job of delivering a breezy portable VRAR experience. Despite its high points the XR Elite also shares a lot of the same flaws as the Quest Pro. Starting at 1099 its a bit cheaper than Metas 1500 rival but still pretty expensive. We put it to the test on the showfloor at CES 2023. There was a lot of pee on the CES 2023 showfloor Trend alert Urine analysis tech. While none claimed a Best of CES award from Engadget there was a boom in toiletbowl technology. You could pitch this as a natural evolution of the fitness tracker testing your pee for many easytoidentify maladies. But is this truly the next frontier of consumer health tracking These devices might never have the popularity of a Fitbit but for medical facilities and assisted living complexes they could be gamechanging.
Sony’s electric car plans become clearer as it shows off prototype at CES,The new brand is called Afeela and goes on sale late 2025.,2023-01-05T14:44:16Z,https://arstechnica.com/cars/2023/01/sonys-electric-car-plans-become-clearer-as-it-shows-off-prototype-at-ces/,One of the more intriguing stories to have emerged from the annual Consumer Electronics Show in Las Vegas over the past few years has been Sonys electric vehicle. The Japanese tech giant stunned people in 2020 when it debuted the VisionS a handsome EV designed to showcase Sonys sensors and camera tech on the outside and its entertainment portfolio on the inside. The following year brought more developed prototypes of the VisionS into view then in 2022 it took an SUV version to CES as well. At that time Sony told the media it was exploring commercial possibilities for a Sony EV and last March it announced a strategic alliance with Honda with the latter providing vehicle body engineering and aftersales support and Sony providing the electronics sensors networking telecom and infotainment. For CES 2023 Sonys automotive ambitions have become a lot clearer. Sony Honda Mobility the joint venture is launching a brand called Afeela which it says is because feel is at the center of the mobility experience as people feel mobility as an intelligent entity and mobility feels people and society using sensing and network IT technologies. The car has changed a little since we saw it last year but the dominant design cues remain reminiscent of Porsche and LucidIm far from the only person to think it looks like a 911 Targa from the rear wheels back and theres a strong touch of the Lucid Air to the front of the new EV. Something to note on the exterior is a light bar at the front that the Afeela can use to express itself to surrounding people using light enabling interactive communication between mobility and people including displaying text messages like greetings or displaying the current weather. One wonders if theres an ability to display mirrorimage text to show messages to cars in front... The people inside the Afeela EV might not notice anything going on outside howeverSony wants the car to be a conduit for its entertainment offerings whether thats movies or music or gaming. To that end SHM has signed a deal with Epic Games to develop new entertainment. At Epic we are passionate about cars and the automotive industry and we couldnt be happier to see Sony and Sony Honda Mobility enter the innovative world of mobility and automotive technology. Together with them we look forward to bringing you exciting updates within this revolutionary space said Epic Chief Technical Officer Kim Libreri. Afeela isnt promising a fully autonomous futurenot yet at leastbut SHM says that it will develop a partially automated socalled level 3 driving system for highways as well as a socalled level 2 system for use in more builtup environments. The Afeela prototype packs 45 cameras and sensors inside and out to enable various advanced driver assistance systems. The entertainment and the ADAS features will require processing power and SHM has chosen Qualcomm as its partner in this area. The car is becoming increasingly connected and intelligent and how we experience our vehicles is changing. The Snapdragon Digital Chassis serves as the foundation for nextgeneration softwaredefined vehicles enabling new mobility experiences and services. We are excited to collaborate with Sony Honda Mobility to deliver on our shared vision for the car of the future said Qualcomm President and CEO Cristiano Amon. SHM says it will spend the next couple of years turning the Afeela prototype into a production car. It plans to start taking preorders in the first half of 2025 with production beginning in one of Hondas US factories. Cars will go to Japan and Europe first with North American deliveries planned for spring 2026.
Sony Claims The PlayStation 5 Shortage Is Over In 2023,"If you or a loved one has been struggling to find a PlayStation 5 since its launch in 2020, Sony says the box should be easier to find in your store of choice in 2023.Read more...",2023-01-05T15:50:00Z,https://kotaku.com/sony-ps5-supply-stock-availability-where-to-find-1849953356,If you or a loved one has been struggling to find a PlayStation 5 since its launch in 2020 Sony says the box should be easier to find in your store of choice in 2023. Sony Interactive Entertainment President Jim Ryan said during the companys Consumer Electronics Presentation last night that everyone who wants a PS5 should have a much easier time finding one at retailers globally starting from this point forward. shoutout to The Verge You heard it here folks the shortage is over according to Sony at least. At the end of last year Kotaku looked into the status of PS5 and Xbox Series X availability and found the systems were at least marginally more available than they were after launch. So some tangible progress has been made since 2020. Back in December Sony said it had resolved supply issues in Asian territories but here in January it claims to have overcome this worldwide. Despite this the tech industry is dealing with semiconductor shortages that have made manufacturing devices like the PS5 much more difficult and some estimate this shortage will last well into 2023 and possibly 2024. So just how available the console will be in the coming months remains to be seen. As of this writing scalpers are still selling PlayStation 5 consoles at inflated prices on sites like eBay though theyre much closer to the systems shelf price of 499. If Sony can make good on its promise that the shortage is over hopefully the console is more widely available in 2023 and at its typical asking price. Regardless of the supply issues the PlayStation 5 has still managed to sell pretty well as Sony also announced at its CES conference that the console has surpassed 30 million units sold since its launch in 2020.
"New Sony Car Plays PS5 Games, But Also Turns Your Ride Into A Billboard","Announced last week at CES 2023, Sony and Honda’s new smart car prototype seems to be taking a page from Elon Musk’s Tesla, letting folks boot up PlayStation 4 and 5 games via its interior screens. But Sony may also be planning to use the car as a way to adve…",2023-01-09T21:35:00Z,https://kotaku.com/sony-smart-car-ev-afeela-spider-man-ad-media-bar-ps5-1849966974,Announced last week at CES 2023 Sony and Hondas new smart car prototype seems to be taking a page from Elon Musks Tesla letting folks boot up PlayStation 4 and 5 games via its interior screens. But Sony may also be planning to use the car as a way to advertise shit on the outside of it while you drive around. Welcome to the future. It sucks. The Afeela Sony and Hondas new smart EV electric vehicle is a joint venture between the two large companies designed to leverage both Sonys advanced tech and Hondas decades of car manufacturing. The result is a new superfancy and technologypacked prototype EV that Sony claims will be hitting the streets in a few years. And when it does apparently youll be able to use it to play PS5 games. Now to be clear you wont be able to just pop a PS5 disc into the car as Afeela will utilize cloud streaming to let owners and passengers play PS5 and PS4 games on the go provided you have a decent signal or internet connection. Youll also be able to watch movies and TV via the various screens inside the car. But the Afeela doesnt just have screens on the interior. No like a weird future episode of a Pimp My Ride reboot the Afeela also features an exterior widescreen display. Sony calls this the cars Media Bar and says it will let owners display a variety of data including the current weather and battery level of the car. It can also be used to display different colors or images too. Yasuhide Mizuno CEO of Sony Honda Mobility says with the media bar owners can express themselves by sharing various types of information to people around the car. Sony also has some less cool plans for this new media bar. During its CES showcase Sony briefly displayed an ad for SpiderMan No Way Home on the outside screen. Not much more was said about this brief moment from the event beyond Mizuno suggesting Sony was talking to partners about how they can create fun and exciting interactions using the media bar. That sounds a lot like Sony wants Afeelas to be mobile advertising billboards. Vertagear 800 Series Gaming Chair Ergonomic comfort Adjustable seat height neck support memory foam pillow adjustable back rest and tilt locking system and 4D armrests that move in 4 directions to fit you best. Of course all of this is still a few years away as Sony and Honda say the Afeela isnt coming out until 2026. But as a tease of what to expect from future smart cars its not looking good. Considering how adriddled smart TVs already are in 2023 Im not looking forward to cars getting covered in screens and ads too. I guess Ill barely notice as I play a laggy PS5 game via the cloud in the backseat of the Afeela. Anyway I thought the future would be cooler.
"Sony unveils Project Leonardo, a new controller for accessible gaming","Sony Playstation chief Jim Ryan said that the company will launch Project Leonardo, a new controller aimed at people with limited mobility. The controller will make gaming more accessible for people who have challenges playing with ordinary controllers. Ryan …",2023-01-05T01:38:00Z,https://venturebeat.com/games/sony-unveils-project-leonardo-a-new-controller-for-accessible-gaming/,At CES Sony PlayStation chief Jim Ryan said that the company will launch Project Leonardo a new controller designed for gamers with limited mobility. The controller will make gaming more accessible for players who have challenges using ordinary controllers. Its quite reminiscent of Microsofts efforts with the Xbox Adaptive Controller. Ryan said more than 30 million PlayStation 5 consoles have been sold to date. Project Leonardo will allow more gamers to enjoy the console. Ryan said that Sony is working with experts on accessibility such as Able Gamers. You can read the details here. Leonardo is basically an accessibility kit designed to remove barriers to gaming and help players with disabilities play more easily more comfortably and for longer periods on PS5. Hideaki Nishino senior vice president for platform experience at SIE said in a blog post that accessibility is an important topic to us at PlayStation and the company wants to continue raising the bar to enable every gamer to experience the joy of play. Whether its the robust accessibility options in PlayStation Studios games like Santa Monica Studios God of War Ragnark or Naughty Dogs The Last of Us Part I or the wide array of features in our PS4 and PS5 console UI were passionate about reducing barriers to play for every gamer Nishino said. He added Today at CES we announced the next step in our journey to make gaming more accessible Project Leonardo for PlayStation 5. Developed with key contributions from accessibility experts community members and game developers Project Leonardo is our codename for a new highly customizable controller kit that works out of the box to help many players with disabilities play games more easily more comfortably and for longer periods. He said Sony talked to experts at AbleGamers SpecialEffect and Stack Up and then came up with the design for the highly configurable controller that works in tandem with many thirdparty accessibility accessories and integrates with the PS5 console to open up new ways of gaming. It is built to address common challenges faced by many players with limited motor control including difficulty holding a controller for long periods accurately pressing small clusters of buttons or triggers or positioning thumbs and fingers optimally on a standard controller Nishino said. The controller is highly customizable with a kit of swappable components including a variety of analog stick caps and buttons in different shapes and sizes. Players can use these components to craft a wide array of control layouts. And the distance of the analog stick from the game pad can be adjusted to suit the players preference. These components allow players to find a configuration that works for their strength range of motion and particular physical needs. You can remap the buttons as needed. Players can store their programmed button settings as control profiles and easily switch between them by pressing the profile button. For example players can augment their DualSense controller with a Project Leonardo controller or use two Project Leonardo controllers on their own. A friend or family member can also assist by helping to control the players game character with a DualSense controller or a second Project Leonardo controller. The controllers can be dynamically turned on or off and used in any combination. Project Leonardo is expandable through four 3. 5mm AUX ports to support a variety of external switches and thirdparty accessibility accessories. This enables users to integrate specialty switches buttons or analog sticks with the Project Leonardo controller. The external accessories can be dynamically connected or disconnected and each can be configured to act like any other button. Project Leonardos split symmetric design allows players to reposition the analog sticks as close together or as far apart as they like. The controller lies flat and does not need to be held so players can lay it on a tabletop or a wheelchair tray. It can be easily secured to AMPS mounts or tripods and can be oriented 360 degrees for the most comfortable use. Players can also program the north orientation on the analog sticks to match their preferred controller orientation. GamesBeats creed when covering the game industry is where passion meets business. What does this mean We want to tell you how the news matters to you not just as a decisionmaker at a game studio but also as a fan of games. Whether you read our articles listen to our podcasts or watch our videos GamesBeat will help you learn about the industry and enjoy engaging with it. Discover our Briefings.
Sony Playstation VR will launch with at least 30 titles,"Sony PlayStation chief Jim Ryan said the PlayStation VR will launch with at least 30 titles, including a newly announced VR version of Gran Turismo.",2023-01-05T01:50:00Z,https://venturebeat.com/games/sony-playstation-vr-will-launch-with-at-least-30-titles/,At CES president and CEO of Sony Interactive Entertainment Jim Ryan announced that the PlayStation VR 2 will launch with at least 30 titles including a newly announced VR version of Gran Turismo. Other titles will include Horizon Call of the Mountain and other VR games based on Sonys IP and third party franchises as well. The secondgeneration VR headset debuts on February 22 for 550. Ryan also said that Beat Saber will becoming to the PSVR 2. The PSVR 2 comes a couple of years after Sony launched the console and it could bring a midlife pop to sales for the PlayStation 5. Sony said it has sold more than 30 million copies to date. GamesBeats creed when covering the game industry is where passion meets business. What does this mean We want to tell you how the news matters to you not just as a decisionmaker at a game studio but also as a fan of games. Whether you read our articles listen to our podcasts or watch our videos GamesBeat will help you learn about the industry and enjoy engaging with it. Discover our Briefings.
"At CES 2023, Sony's 'Gran Turismo' flags new entertainment strategy - Financial Post","<ol><li>At CES 2023, Sony's 'Gran Turismo' flags new entertainment strategy  Financial Post
</li><li>Will there be PSVR 2 at CES 2023?  WePC - PC Tech & PC Gaming News
</li><li>What Time Is Sony's CES 2023 Press Conference Livestream?  Push Square
</li><li…",2023-01-04T14:26:54Z,https://financialpost.com/pmn/business-pmn/at-ces-2023-sonys-gran-turismo-flags-new-entertainment-strategy,
One Hacker’s Battle To Slightly Improve A Sadistic Sony Headset,"One thing you won’t read in reviews of pricey Sony WH-1000XM3 headphones – if you choose them, you’re going to find yourself in a one-sided abusive relationship. A button press …read more",2022-12-27T12:00:00Z,https://hackaday.com/2022/12/27/one-hackers-battle-to-slightly-improve-a-sadistic-sony-headset/,One thing you wont read in reviews of pricey Sony WH1000XM3 headphones if you choose them youre going to find yourself in a onesided abusive relationship. A button press or lowbattery notification makes the headphones scream at you ignoring the actual sound volume of what youre currently listening to. Once theyre discharged they suddenly emit loud noises lecture you about how the battery is low then shut down. Oh and you cant use them as theyre charging if your voicecall lasts longer than expected you might find yourself being shouted at and forced to fumble around with wires silently pleading for call participants to wait while you change over to a different headset. MisterHW decided to dig in and figure out how to work around at least some of the shortcomings. Naturally the no charge while using limit looked like lowhanging fruit and a hefty usability improvement too plus he suspected the charge cutoff to be masking noise issues already abundant on these headphones. Some painful disassembly later he was inspecting the charger IC the MP2625 responsible for power management. Its signals were connected to the MCU using viainpad and some pads had to be cut in half to disconnect the vias. However the laborious pad cutting and subsequent careful soldering didnt turn out to be fruitful. Even with external control of the output inhibition pins the shutoff still continued something affected the circuit whether it was VBUS detection some other unnoticed viaconnected pins on the charger or sensing on DD. About to run out of life force for this mod MisterHW added a Qi charging circuit powering a TP4056 wired in parallel with the MP2625. The mod dubbed HW1000XM3 made these headphones all that more reliable and less annoying charger and MCU none the wiser. Now all thats needed to charge these headphones is to slap a magnetic charger coil onto them and it doesnt interfere with voicecalls as much as the screaming and forced shutoffs do. Hopefully Sony eventually learns to test their headphones by having humans use them its far from the only gripes with this lineup after all. We also hope that the voice notifications will be conquered eventually this summer weve seen a hacker firmware mod a Bluetooth speaker to make the sounds more pleasant. If your headphones are based on a relatively popular module repurposing them might be even easier than that Introducing Son HW1000XM3 MagSafe Charger support low noise charging during conference calls the usual USBC charging that switches them off httpst. coeqc4xv6lk6 pic. twitter. comU92b7T3LJO Helge Wurst MisterHW December 12 2022
