Title,Description,PublishedAt,URL,Content
Watch Sony's CES 2023 keynote in under 9 minutes,"Sony has focused its CES efforts of late on electric cars, now in partnership with Honda, and this year was more of the same. Sony Honda Mobility unveiled its first prototype called Afeela, replacing the previous Vision-S 02. Its laden with sensors (radar, ul…",2023-01-05T09:25:21Z,https://www.engadget.com/watch-sonys-ces-2023-keynote-in-under-9-minutes-092521672.html,Sony has focused its CES efforts of late on electric cars now in partnership with Honda and this year was more of the same. Sony Honda Mobility unveiled its first prototype called Afeela replacing the previous VisionS 02. Its laden with sensors radar ultrasonic cameras and more uses Qualcomms new automotive chip and promises interactive communication between mobility and people via the socalled Media Bar. Preorders will start in mid2025 with deliveries scheduled for spring of 2026. Sony also provided a first look at its Neill Blomkampdirected Gran Turismo movie revealed that the Gran Turismo 7 game would be getting PlayStation VR 2 support and announced that Beat Saber was also coming to PSVR 2. The PlayStation 5 console has now passed 30 million units sold and from now on anyone who wants a PS5 should be able to get one. Finally the company revealed Project Leonardo aimed at building controllers that are easier to use for people with limited motor control. Taking a page from Microsofts gaming accessibility efforts it uses a set of customizable circular gamepads. Theres no release date window or price yet.
Every Game Coming to PlayStation Plus and Xbox Game Pass in January 2023 (So Far),"Happy new year! I hope you got a chance to catch up on your gaming backlog over the holidays, because 2023 is starting off strong with a litany of great games coming to PlayStation Plus and Xbox Game Pass in this month, including freebies you can download and…",2023-01-04T16:00:00Z,https://lifehacker.com/every-game-coming-to-playstation-plus-and-xbox-game-pas-1849946592,Happy new year I hope you got a chance to catch up on your gaming backlog over the holidays because 2023 is starting off strong with a litany of great games coming to PlayStation Plus and Xbox Game Pass in this month including freebies you can download and keep forever and limitedtime additions to each services rotating library. Heres everything coming to and leaving PlayStation Plus and Xbox Game Pass in January 2023. Everything coming to PlayStation Plus in January 2023 so far PlayStation Plus members can download a trio of excellent games this month through the PS Plus Essentials lineup starting Jan. 3. First is EAs Star Wars Jedi Fallen Order an actionadventure game where you play as Kal Kestis a fugitive Jedi that survived the Order 66 massacre. Players travel to various planets to explore ancient Jedi temples infiltrate Imperial bases and face off against evil Sith Inquisitors in Dark Soulsinspired Lightsaber duels. Axiom Verge 2 is a 2D Metroidvaniastyle platformer set in a mindbending scifi world. Axiom Verge 2 released in 2021 to rave reviews praising its music pixel art and large open world that players are free to explore at their own pace. Finally theres Fallout 76 an online multiplayer spin on the longrunning Fallout RPG series. Like Bethesdas other Fallout games players explore an open world in firstperson scavenging for resources in a postapocalyptic nuclear wasteland. But instead of hoofing it alone you can team up with friends or face off against other players you run into online. PS Plus Essentials Monthly Games Lineup Jan. 3 Axiom Verge 2 Fallout 76 Star Wars Jedi Fallen Order All three games are available to PlayStation Plus subscribers at no extra cost starting Jan. 3 and are yours to keep forever or at least as long as your subscription is active. PS Plus Premium and Classics Each month Sony also adds new games to the PlayStation Plus Game Catalog for PS Plus Extra members and new Classics Catalog games for PS Premium members. Sony usually announces these additions in the middle of the month so we dont yet know what games if any will show up in January. That said this is a good opportunity to try out some of the many new Game Catalog titles added in December like Yakuza Like a Dragon Far Cry New Dawn Mortal Shell and more. December also saw Heavenly Sword PS3 Oddworld Abes Oddysey PS1 and Pinball Heroes PSP join the Classics catalog. Expect to hear about Januarys additions later in the month over on the official PlayStation Blog. Leaving While not officially confirmed by Sony the PlayStation Store currently lists several PS Plus Game Catalog titles as leaving soon in January. In previous months those listings normally turn out to be true so take this as an opportunity to try these games before theyre gone for good. Leaving PS Plus Jan. 17 Bound by Flame The Council Shiness the Lightning Kingdom Space Hulk Tactics Leaving PS Plus January TBD Seasons After Fall Masters of Anima Electronic Super Joy Jumpjet Rex Leos Fortune HD Edition Enigmatis The Ghost of Maple Creek The Last Tinker City of Colors Everything Coming to Xbox Game Pass in January 2023 so far Xbox is starting 2023 off with two Games With Gold freebies plus several big new games launching for Game Pass throughout January. Games With Gold Iris Fall Jan. 1 Autonauts Jan. 16 Starting Jan. 1 Game Pass and Games With Gold subscribers can download the creepy adventure game Iris Fall until Jan. 31. Then on Jan. 16 the indie farming and crafting sim Autonauts will be available through Feb. 15. Both games will be permanent additions to your digital library as long as you download them by the deadline. Game Pass Library Game Pass members can also access several new games immediately on launch day at no extra cost including the indie survival game Stranded Deep on Jan. 3 and the Xbox ports of beloved JRPGs Persona 4 Golden and Person 3 Portable on Jan. 19. The next day Jan. 20 the Xbox port of Monster Hunter Rise also arrives finally giving console players a way to play the latest entry in Capcoms popular actionRPG series. Then at the end of the month the realtime strategy classic Age of Empires 2 Definitive Edition and the handdrawn medieval strategy game Inkulinati both join Game Pass on Jan. 31. We also know that roguelite FPS Roboquest is also coming to Game Pass this month but there is no firm date set. Its also possible Microsoft will announce even more new Game Pass additions later this month so keep an eye on the official Xbox Wire blog. Jan. 3 Stranded Deep Jan. 19 Persona 3 Portable Persona 4 Golden Jan. 20 Monster Hunter Rise Jan. 31 Age of Empires 2 Definitive Edition Inkulinati January TBD Roboquest Everything Leaving Xbox Game Pass in January 2023 Theres also a crop of game leaving the Game Pass this month. So far 6 games are leaving the service on Jan. 15 including last months Games With Gold freebie Bladed Fury which you can still keep and play forever as long as you download it before Jan. 15. Leaving Game Pass Jan. 15 Bladed FuryGames With Gold Danganronpa Trigger Happy Havoc Anniversary Edition Nobody Saves the World Pupperazzi The Anacrusis Windjammers 2
Sony Honda Mobility weighs future IPO for electric vehicle joint venture - Reuters,"Sony and Honda's year-old electric vehicle joint venture is in early discussions about a potential stock offering as a way to raise cash, the chairman of Sony Honda Mobility said on Thursday.",2023-01-05T23:23:00Z,https://www.reuters.com/business/autos-transportation/sony-honda-mobility-weighs-future-ipo-electric-vehicle-joint-venture-2023-01-05/,Sony Honda Mobility weighs future IPO for electric vehicle joint venture Companies Jan 5 Reuters Sony and Hondas yearold electric vehicle joint venture is considering a stock offering as one option to raise cash in the future although those discussions are preliminary the chairman of Sony Honda Mobility said on Thursday. Yasuhide Mizuno said the costs of building a highvalue electric vehicle such as the newly unveiled Afeela would be significant and a stock offering has been discussed as one potential avenue for raising funds. IPO is one of our options Mizuno told a group of journalists Thursday in a roundtable discussion. We have to be able to stand on our own two feet. Honda Chief Executive Toshihiro Mibe said in March that while he was not thinking about taking the joint venture public immediately he would not dismiss that as an option to expand the firm. Sony unveiled the lowslung sedan prototype on Wednesday at a news conference in which it announced the Afeela brand name intended to evoke an emotional connection with customers. Mizuno said the car is scheduled to be delivered in the United States starting in early spring 2026 then in Japan later that year. Sony Honda Mobility plans a global rollout that includes Europe parts of Asia and the Middle East he added. Sony Honda Mobility also is contemplating selling the vehicle in China which Mizuno described as an attractive but intensely competitive market for electric vehicles. Though Honda has an extensive network of auto dealerships the Afeela will be sold online said Mizuno. The joint venture is discussing how to service the vehicles. Mizuno declined to discuss pricing saying the cost of chips and materials is variable. A full line of vehicles is planned under the Afeela banner he added. Shares of Sony Group Corp 6758. T rose 2. 4 and Honda Motor Co Ltd 7267. T advanced 1. 9 in Tokyo trade on Friday. Our Standards The Thomson Reuters Trust Principles.
2022 was an incredible year for handheld gaming,"The past year was stellar for handheld gaming, no matter the size of your actual hands. Between the Steam Deck, Playdate and an explosion of retro consoles, we received an embarrassing amount of mobile gaming goodness in 2022, and cloud play is only encouragi…",2022-12-23T15:00:38Z,https://www.engadget.com/handheld-gaming-pc-retro-indie-handhelds-steam-deck-playdate-150038001.html,The past year was stellar for handheld gaming no matter the size of your actual hands. Between the Steam Deck Playdate and an explosion of retro consoles we received an embarrassing amount of mobile gaming goodness in 2022 and cloud play is only encouraging more innovation. Even though Sony still hasnt revived the Vita it feels like the handheld market is in the throes of a renaissance so lets celebrate the milestones of the year right here. December is a historic month for handheld gaming. Sony released the PlayStation Portable in Japan on December 12th 2004 and then debuted the Vita in Japan on December 17th 2011. Both of these consoles were hits with players critics and developers but a disorganized marketing scheme and failed cloud ambitions kept Sony from investing in handheld gaming after the Vita. RIP etc. Basically for the past decade weve been waiting very patiently mind you for a breakthrough mobile device to finally make this industry viable again. Finally in 2022 the handheld market is flush. The Switch paved the way for mobile play over the past few years and massive corporations like Valve are finally getting in on the action. Cloud gaming has found its foothold and the market for portable Android and Linux devices is buzzing with major names like Razer getting involved. Meanwhile more underground companies like Analogue Ayaneo and Panic are quietly churning out highquality handhelds for retro PC and indie gaming. But of course Valves Steam Deck dominated the portable conversation in 2022. The Steam Deck is big its heavy it doesnt have a great battery life and its everything PC players have been waiting for apparently. Valve started rolling out the Steam Deck in February and by October it had shipped more than 1 million of these beasts across the western world with plans to expand into additional regions. Steam Deck comes in three flavors ranging from 400 to 650 which makes it more affordable than existing handheld PC devices from companies like Ayaneo. It comes with Steam preinstalled but itll also run Windows if you really want to spend an afternoon screaming why at the machine in your lap. Imperfect though it may be Steam Deck proved theres heat in the handheld PC market in 2022. Its a relatively accessible way to play PC games on a portable screen and it successfully combines the Steam software with decades of hardware research at Valve. The Steam Deck is a great start from a company thats known to lose focus easily so hopefully it doesnt all end here. Even if Valve gets too distracted to make a Steam Deck 2. 0 plenty of other companies are eager to pick up the thread in the mobile PC space. The most prominent name is Ayaneo a brand that took off in 2021 thanks to an Indiegogo campaign that raised more than 2 million. Today Ayaneo is continuing to iterate on its original PC device with sleek Switchsized machines capable of running titles from Steam the Epic Games Store Game Pass and other hubs. The Ayaneo Air Pro starts at 700 and can technically handle highfidelity games though youll likely have to lower your framerate resolution and expectations. The beefiest Ayaneo the Next Pro starts at 1500 and itll run anything a Steam Deck can but without the extra bulk. Ayaneo makes extremely cute gadgets and the company is emerging as Valves main competitor for portable PC glory. The Ayaneo 2 is poised to pack even more power into a sleek package though itll have a price tag of 1000 at least. The exciting thing here is that theres actual competition in the handheld space companies are investing in mobile hardware more than ever and not just when it comes to PC play. Recent upgrades in mobile processors are powering a ton of new devices built specifically for retro and cloud gaming. At the end of 2022 the market for retro handhelds is lush covering every era from NES to GameCube at relatively affordable prices. On the NES to PSP side of things this year we got the Miyoo Mini and Retroid Pocket 3 The Miyoo Mini costs about 60 and has a modern dualcore processor that can handle even some PS1 games while the Pocket 3 is an Androidpowered handheld that costs 120. For more modern emulation experiences theres the Odin by Ayn which can run PS2 and GameCube titles at 1080p on a 5. 9inch screen. The Odin costs between 200 and 290 depending on the model. For retro handhelds the general rule is the hardware gets more expensive as the era progresses. In the honorable mention section we have the Analogue Pocket which plays actual physical cartridges from the Game Boy Game Boy Color and Game Boy Advance and is unsurprisingly about the size of a classic Game Boy. Analogue started shipping the Pocket at the end of 2021 and it enjoyed a soldout year with more orders and accessories due in 2023. Pocket is a special little handheld that breathes new life into classic cartridge libraries and it comes with a price tag of 220 which is just about what a Game Boy would cost in todays coin. OK thats enough about the past. If 2022 has proven anything its that portable gaming has a strong future and this is going to include cloud and phone play. Cloud technology has finally become reliable enough that even Sony figured it out this year and Microsoft has continued to grow its enormous cloud network which is intrinsically tied to Game Pass. Our slowly encroaching subscriptionbased future has created a rich environment for Android and Linuxbased handhelds that dont need a ton of onboard processing power as the Steam Deck does. Logitech recently dropped the G Cloud Gaming Handheld which costs 350 while the Razer Edge is an Androidbased handheld starting at 400 and expected to start shipping in January. This year Razer also released the Kishi V2 which is a 100 gamepad that essentially turns your smartphone into a cloud gaming device. Backbone makes a similar product for iPhone and Android players and this year the company rolled out an officially licensed PlayStation gamepad just for iPhone. As mobile processors continue to evolve and cloud technology further stabilizes smartphone gaming is only going to grow as an industry and already mainstream entertainment companies like Netflix are joining the fray. Netflix specifically has ushered acclaimed games like Kentucky Route Zero Into the Breach and Spiritfarer onto mobile devices this year and its introduced gems like Poinpy and Hello Kitty Happiness Parade. Finally Id like to take a moment to honor Playdate. This brilliant businesscardsized indie gaming machine came out in April it costs 180 it has a crank and it doesnt fit into any existing video game category. Playdate exemplifies innovation. Its an opensource crankpowered piece of magic offering some of the most unique experiences the video game industry has to offer distilled on a miniscule monochromatic screen. Playdate is pure joy in a tiny yellow package and for me its the standout handheld of 2022. And thats a wrap. Heres to you handheld gaming. Thank you for a fantastic year and may the momentum of 2022 continue to generate creative ideas in this space. To the years and games ahead cheers.
Neill Blomkamp's Gran Turismo film certainly looks and sounds like Gran Turismo,"So that's what Gran Turismo is really about. The first Gran Turismo teaser shows off sleek cars and angles ripped straight out of the game franchise, all from the lens of District 9 director Neill Blomkamp. Blomkamp helped introduce the short video during Son…",2023-01-05T01:32:18Z,https://www.engadget.com/gran-turismo-movie-trailer-harbour-bloom-ginger-013218031.html,So thats what Gran Turismo is really about. The first Gran Turismo teaser shows off sleek cars and angles ripped straight out of the game franchise all from the lens of District 9 director Neill Blomkamp. Blomkamp helped introduce the short video during Sonys CES 2023 show where executives played up their plans to adapt even more game franchises to film and television. Gran Turismo is due to hit theaters on August 11th. The film is based on a true story apparently it follows a teenage Gran Turismo player who uses his sweet gaming skills to become a realworld racecar driver. The teenager is played by Archie Madekwe Simon from Midsommar and the movie also stars David Harbour Stranger Things Orlando Bloom the early 2000s and Geri Halliwell Ginger Spice. The Gran Turismo movie has spent some time in development hell much like the video game series itself which has a reputation for being delayed. A version of the film was completely scrapped in 2018 after spending five years in development and Blomkamp is the second director to be attached to a Gran Turismo project. However things have moved quickly since development on the current movie started in May 2022 with filming wrapped by that December. Gran Turismo isnt the only gamefilm crossover project in the works at Sony. Theres a whole HBO series based on The Last of Us premiering January 15th a Twisted Metal show heading to Peacock and a film based on Ghost of Tsushima still to come.
Disney+ is adding DTS audio to IMAX Enhanced Marvel films,"Disney+
 is bolstering its IMAX Enhanced films
, including some Marvel Cinematic Universe movies, with another audio option. The streaming service will enable IMAX signature sound by DTS
 on select titles this year, offering viewers high-fidelity audio to …",2023-01-04T18:00:15Z,https://www.engadget.com/disney-plus-dts-audio-imax-enhanced-films-marvel-cinematic-universe-180015935.html,is bolstering its including some Marvel Cinematic Universe movies with another audio option. The streaming service will enable IMAX signature sound by on select titles this year offering viewers highfidelity audio to go with the expanded aspect ratio. Youll need compatible equipment to hear DTS audio however. At the outset some certified TVs from manufacturers such as Sony and Hisense will support DTS on Disney as will certain AV receivers from the likes of Denon Marantz and JBL. However you dont need any particular devices to view IMAXs expanded aspect ratio of 1. 901 which offers up to 26 percent taller pictures during certain sequences. Some may find that the addition of DTS audio will help them to better replicate the IMAX experience at home. DTS will provide a higher bitrate alternative to but many folks prefer the latter. In the near future you may be able to watch a Disney movie in either audio format and decide for yourself. Meanwhile Disney has announced when Black Panther Wakanda Forever is coming to the platform. Youll be able to stream the most recent MCU movie at home starting on February 1st. The film will have IMAX Enhanced support. Marvel Studios Black Panther WakandaForever is streaming February 1 only on DisneyPlus. pic. twitter. comFRMxxsTkAd Disney DisneyPlus January 4 2023
Google Pixel 7a hands-on leak reportedly shows the 90Hz display,"A new hands-on video was posted today of the alleged Google Pixel 7a. The 49-second clip shows a device that reflects previous leaks and rumors about Google’s next mid-ranged Pixel.The device in question, posted on Slashleaks (first spotted by 9to5Google), lo…",2023-01-03T18:55:34Z,https://www.engadget.com/google-pixel-7a-leak-video-90hz-smooth-display-185534569.html,A new handson video was posted today of the alleged Google Pixel 7a. The 49second clip shows a device that reflects previous leaks and rumors about Googles next midranged Pixel. The device in question posted on Slashleaks first spotted by 9to5Google looks similar to the Pixel 6a and Googles 2022 flagships. The device name in Android 13 settings says Pixel 7a and the handset runs internal prerelease design validation test software. The phones language is also set to Vietnamese where Google manufactures its Aseries phones. The phone in question has a Smooth Display that can adjust its refresh rate from 60Hz to 90Hz which would be a first in the Aseries line. The Pixel 6as 60Hz display is one of its most gripedabout features. Previous leaks suggested that the upcoming model uses a Samsung display and an upgraded primary camera sensor from Sony. Although todays video leak doesnt address it previous rumors suggest the 7a will be the first Aseries Pixel with wireless charging. If history is any indication Google will announce the new phone at Google IO 2023 in May. Other rumors include 10. 1mm depth a SIM tray on its left side suggesting Google wont follow Apple in going allin on eSim this year and no headphone jack.
