Title,Description,PublishedAt,URL,Content
Universal Audio launches two new premium microphones,"Universal Audio is known for its leading software emulation that mimics the quality of more expensive gear. After entering the modeling microphone space last year with the L22, the company is back with a pair of mics that, while fairly pricey, could appeal to…",2023-01-11T20:00:40Z,https://www.engadget.com/universal-audio-sphere-dlx-lx-emulation-mics-release-2023-200040245.html,Universal Audio is known for its leading software emulation that mimics the quality of more expensive gear. After entering the modeling microphone space last year with the L22 the company is back with a pair of mics that while fairly pricey could appeal to serious bedroom producers. The Sphere DLX is the higherend model at 1499. It emulates 38 classic ribbon condenser and dynamic studio mics including models from Neumann Telefunken AKG Sony and others. Thats up from the 34 models that last years LP22 emulated. UA says the DLX can capture acoustic guitars and drum overheads in stereo with a single mic. In addition it can easily tame room coloration for cleaner more professional recordings using IsoSphere presets tailored for bedroom studios and popular isolation filters. The Sphere LX is a smaller and slightly cheaper model supporting 20 ribbon condenser and dynamic mic models. The 999 mic has dual goldsputtered diaphragms and what UA describes as the lowest noise of any mic in its class. UA says both models let you change the mic type polar pattern and other characteristics even after tracking with any interface in any DAW. Additionally they have Apollo interface presets designed to help users attain professionalsounding audio quickly with nearzero latency. Each device ships with a carrying case mic stand mount and cable 25 feet for the Sphere DLX and 10 feet for the LX. The DLX also includes a shock mount. Both mics are now shipping worldwide. Although the new models will likely be too expensive for many burgeoning creators the mics are still relatively affordable compared to the premium gear they emulate some could cost upwards of 5000. At the very least they provide more options for experienced podcasters streamers and musicians who want to upgrade their sound quality.
"The Most Innovative EVs, Electric Bikes and Rideables We Saw at CES 2023 - CNET","Mercedes-Benz, Sony, and BMW are creating the next generation of electric transport.",2023-01-08T18:14:05Z,https://www.cnet.com/roadshow/news/the-most-innovative-evs-electric-bikes-and-rideables-we-saw-at-ces-2023/,CES is the place to see new and super weird innovations in tech but that doesnt stop at giant TVs wild computers and futuristic gadgetry. This year the annual tech show returned to Las Vegas in full force and reminded us its one of the best places to see topoftheline automobiles of all sorts including those that run on renewable energy. Sustainability and environmental friendliness are growing trends in every segment of the tech industry so its a nobrainer to see more electric vehicles and related innovations at CES 2023. Here are some of the best. Curious about what else you might have missed from CES 2023 Take a look at the top products from this years show and some that are plain bad. MercedesBenz Vision EQXX is a sexy EV that makes gas guzzlers drool The Vision EQXX concept car was designed from the ground up and can travel up to 620 miles on a full charge without adding additional bulky batteries making this concept car the most efficient Mercedes to date. The EQXX has an AI avatar like K. I. T. T. from Knight Rider only more futuristic all of this is on a single freefloating display. I need to figure out which I find more attractive the interior or the exterior. Verge TS Ultra Motorcycle has serious Tron vibes The Verge TS line is coming to the US in 2023. The highend Ultra will have a top speed of 124 mph and be able to charge quickly in 25 minutes making it the coolest bike on the block. With an estimated 233 miles on a full charge the Ultra puts out 201 horsepower. The bike can go 060 mph in 2. 5 seconds. The motor is located in the rear rim giving the bike a lower center of gravity and allowing for a larger battery in the bike frame. The Ultra will cost you 44900. If thats too rich for your blood there are two other models the TS Pro for 29900 and the TS for 26900. Who needs an outlet when you have a Squad The Squad is a twopassenger car with a small solar panel on its roof that offers up to 19. 2 miles on a sunny day. The golf cartstyle vehicle can travel up to 60 miles on a single full charge. The powertrain consists of two 2kilowatt rear inwheel motors powered by four 1. 6kWh batteries that are swappable. It has a top speed of just under 30 mph. The car has fourwheel disc brakes seat belts and a roll cage for safety. It may not be the sportiest car on the block but it saves you money both at the pump and with its US price of 6250. Ride a bike in the snow The Moonbike is a 163pound rideable thats part snowmobile part bike. It can support a rider weight of 264 pounds puts out 170 nm of torque and hits a top speed of 26 mph. The latest Moonbike adds mobile support for its products with an iOS and Android app that allows riders to track their trails and altitude and connect with other moonbikers. The bike is currently retailing for 8900. Read more Best Electric Bike for 2023 BMWs concept car doubles as your buddy Technology can be so impersonal. BMWs i Vision Dee hopes to fix that. Using sophisticated AI this concept car ditches the servant schtick of Siri and Alexa. Instead it hopes to double as both your car and your friend. The i Vision Dee is an EV sports car with an exterior made up of 240 E Ink panels. You can use those panels to program a digital face into the cars grille because its an EV the ventilation that a grille typically provides isnt needed or change the cars colors at the click of a button. The BMW i Vision Dee is for now just a concept but some of its features will trickle out to BMWs actual cars. BMW CEO Oliver Zipse said for instance that the AIpowered HUB technology the company put into the i Vision Dee will come to real cars in 2025. Daniel Van Boom A flying car is actually happening for real this time Weve been waiting on flying cars since at least the Jetsons and we now appear on the precipice of realizing that dream. And by we I mean a company called Aska which revealed its A5 flying car at CES 2023. Its more than a concept Aska has opened preorders for the 789000 vehicle. At CES 2023 Aska cofounder Guy Kaplinsky said Federal Aviation Administration approval for the A5 could happen within a month. Aska hopes to use the A5 to start a ridesharing service in 2026. Daniel Van Boom Read more This 789000 Flying Car Could Get Off the Ground Faster Than You Think The Tesla of the sea As youve probably noticed EVs are hot right now. But why stop on the roads Candelas C8 EV hydrofoil boat is a slick vessel that glides along the water like a flying carpet according to CNETs Bridget Carey. Apart from making EVs sexy Candelas C8 takes cues from Tesla in another key way Its autonomous boating where the C8 can stick to a set course. The entire boat is made of carbon fiber including the seats which explains the 390000 price tag. Daniel Van Boom Read more CES 2023 Car Tech The Coolest Auto News Out of Las Vegas This Week Sonys first car is coming in 2026 EVs are big business and Sony wants in. The electronics giant is teaming up with Honda on a new brand of electric vehicle called Afeela. The Afeela logo appears on a narrow screen or media bar on the vehicles front bumper. This can also interact with people outside the vehicle and share information such as the weather or the cars state of charge. Unlike the car Sony showed off at CES 2020 all those years ago this one is actually hitting the market. No word yet on pricing but Sony said its Afeela car will hit North American roads in 2026. Japan and Europe will follow. Daniel Van Boom A Transformersinspired bike that fits under a desk Is this electric bike more than meets the eye Theres little risk of confusing the Tatamel with a robot in disguise but it isnt often you see an electric bike that can fold up like a Transformer to the size of a suitcase and fit under a desk. At CES 2023 thats exactly what Japanese company Icoma showed off with the Tatamel. Its more than a lastmile bike too. Its electric battery pack can be used to charge devices which can be handy in an emergency. Read more A TransformersInspired EV Bike That Folds Up to Fit Under Your Desk
"At CES 2023, Sony's 'Gran Turismo' flags new entertainment strategy - HT Tech","<ol><li>At CES 2023, Sony's 'Gran Turismo' flags new entertainment strategy  HT Tech
</li><li>Sony-Honda EV takes form with new prototype, Afeela brand  Green Car Reports
</li><li>CES 2023: The world's biggest technology show, Sony and Honda reveal their ne…",2023-01-05T03:46:56Z,https://tech.hindustantimes.com/tech/news/at-ces-2023-sony-s-gran-turismo-flags-new-entertainment-strategy-71672859461484.html,At CES 2023 Sonys Gran Turismo flags new entertainment strategy When Sony Corp Group teases Gran Turismo its longawaited adrenalinefueled film adaptation of Sony PlayStations hit carracing franchise at the CES 2023 technology trade show this week it will really be showing off its new identity as a contentdriven company. The movie reflects the transformation of the maker of the Walkman and Bravia TVs from a primarily hardwarefocused innovator to broadbased entertainment provider. It also represents a significant bridging of the divides between Sony Pictures Entertainment Sony PlayStation and Sony Music according to a dozen current and former senior executives interviewed by Reuters. I defined our identity as a creative entertainment company with a solid foundation on technology Sony chief executive Kenichiro Yoshida said. The films appearance at CES on a stage typically reserved for bigscreen TVs and robot pets caps 10 billion in investments in music games and anime over the last five years. Gran Turismo is one of 10 gameinspired film and television projects in various stages of development. HBOs The Last of Us about a man hired to smuggle a 14yearold girl across a pandemicplagued America debuts on Jan. 15. The New Yorker suggested the series could break the curse of bad videogame adaptations. Last month Amazon Prime Video ordered God of War a live action adaptation of the PlayStation hit based on Greek mythology. Sonys creative entertainment company approach extends beyond content. A SonyHonda electric vehicle scheduled to reach consumers by 2026 is being framed as a rolling showcase of Sonys entertainment gaming and camera sensor prowess. It will also generate recurring subscription revenue like other content services. Eventually we think in the long term the mobility space will become an entertainment space Yoshida said. The highprofile projects which could not have happened even three years ago grew out of regular conversations among Sony executives as they sought a way to work together more effectively. Sony resisted chasing after Netflix with a rival service and fended off an activist shareholders call to sell or spin off its media and entertainment assets in 2013. Instead it struck deals to provide movies to Netflix and Walt Disney Cos Disney and series to HBO Amazon and Apple Incs Apple TV. The shift is reflected in Sonys results with twothirds of operating profit coming from games music and the film studio. Operating profit rose 8 to 344 billion yen 2. 6 billion for the JulySeptember quarter beating analyst estimates. In November with the music business offsetting weakness in the games group Sony hiked its fullyear operating profit forecast. This is a complete pivot of this company into something thats no longer an electronics company said Ulrike Schaede a professor of Japanese Business at UC San Diegos School of Global Policy and Strategy. Schaede said the company now has a coherent corporate narrative that would make it easier to unite the companys divisions. Thats the new Sony she said. Now can they deliver I dont know. TREASURE CHEST When veteran media executive Tony Vinciquerra was recruited as chairman of Sony Pictures in 2017 the division was reeling after a string of box office flops including the 2016 reboot of the Ghostbusters franchise. DVD and Bluray disc revenue had plummeted under pressure from streaming services and there were rumors of a possible sale media executives said. But Vinciquerra was attracted by the opportunity to leverage the companys assets Sony is the only company in the media business that has not only television or film but music PlayStation and technology he said in an interview. Sony had struggled for decades to achieve the synergy the company touted with its 1989 acquisition of Columbia Pictures Entertainment. At best these forced collaborations ended up as product placement in a movie or marketing promotion. At worst they got in the way of adapting to the digital era. Entertainment executives then came up with PlayStation Productions a division within the games group located on the Culver City studio lot and dedicated to film and television adaptations. It acted as a cultural attach to Hollywood someone who could talk in their language PlayStation chief Jim Ryan said in an interview in a nonconfrontational nonadversarial way just you know just try to do the best thing for both divisions. The result was Uncharted last years release starring SpiderMans Tom Holland and Mark Wahlberg in a hunt for Magellans lost treasure. The film delivered 401 million in global ticket sales and became the mostwatched film on Netflix when it was released on the streaming service in August. Meanwhile one of the most popular artists distributed by Sony Music the Puerto Rican rapper Benito Antonio Martnez Ocasio who performs as Bad Bunny will star in El Muerto a film drawn from Sonys Marvel Universe of characters due out in 2024. Bad Bunny is a Rimas Entertainment artist. Sony Music Entertainment CEO Rob Stringer said Yoshidas light touch has proven successful. Quite frankly the ideas are flying around and everyones much much more comfortable about talking to each other Stringer said. This August will bring another test of Sonys strategy when Gran Turismo hits theaters after languishing for 12 years. The movie is based on British racer Jann Mardenborough who won the 2011 GT Academy Europe at 19 and went on to a podium finish at the 24Hours of Le Mans in 2013. Academy Awardnominated director of District 9 Neil Blomkamp directs a cast that includes Lord of the Rings star Orlando Bloom and Stranger Things actor David Harbour. Were telling a true story about wish fulfillment PlayStation Productions chief Asad Qizilbash said. This kid loved playing Gran Turismo and at the same time were celebrating the game. Follow HT Tech for the latest tech news and reviews also keep up with us on Twitter Facebook Google News and Instagram. For our latest videos subscribe to our YouTube channel. 71672859461484 NEXT ARTICLE BEGINS
Sony and Honda Collab on New Electric Vehicle,The electronics giant and carmaker have revealed the name of their new car brand.,2023-01-06T04:41:00Z,https://www.entrepreneur.com/business-news/sony-and-honda-collab-on-new-afeela-electric-vehicle/442350,Sony and Honda Collab on New Electric Vehicle The electronics giant and carmaker have revealed the name of their new car brand. On January 4 at the 2023 Consumer Electronics Show CES in Vegas Sony and Honda revealed the product of a partnership they announced last year an electric vehicle dubbed Afeela. CES is the worlds largest technology trade show. Held annually its a big deal serving as a platform for companies to introduce their new technologies to the public. Sony Honda Mobility chief executive Yasuhide Mizuno unveiled the Afeela prototype in a presentation for the CES crowd inside the Mandalay Bay Convention Center. While there arent many details about the vehicle available it looks like Sony x Honda has eschewed the sleek look of eventual competitors like Lucid and Tesla for an accessible and familiar fourdoor sedanstyle design. Mizuno sketched a timeline of Afeelas availability stating that consumers can put in purchase orders by 2025 though U. S. customers might not expect delivery until 2026. Regarding the car itself he said At the heart of this mobility experience is the word feel. CNN has more about the presentation The car will have safety and driver assistance systems from Honda along with entertainment and interactive features from Sony Mizuno said. When developing the car the emphasis has been on software and user interface technology as much as on driving dynamics and performance he said. Running above the cars front bumper is a narrow exterior display screen the company calls the media bar. It will allow the vehicle to show information and interact with people outside the vehicle Mizuno said. Intriguingly for gamers Sony and Honda have incorporated graphics technology from Unreal Engine the company behind the uberpopular game Fortnite. Unsurprisingly perhaps Mizuno indicated there would be many entertainment choices inside the Afeela plus dozens of cameras and sensors for driver and passenger safety. Interested EV consumers can go to shmafeela. com scroll to the bottom and subscribe with an email address to stay up to date. Entrepreneur Editors Picks These Are the Hottest Franchises to Watch in 2023 This One Question Will Make You a Better Thinker. Are You Asking It Already How the CEO of Zoom Room Is Leading the Way in Dog Training and Education Before Pressing the Layoff Button Leaders Need to Ask Themselves 1 Question Then Do These 3 Things 3 Simple Strategies for Coping With Overwork Pressure Taco Bell Uses This LittleKnown Secret to Stay on Top Year After Year Once a Skeptic Elon Musk Now Embraces This Divisive Workplace Policy and You Should Too.
Sony and Honda Drive New Electric Car Afeela Onto the CES Stage - CNET,The Sony sensors on its Afeela-branded electric car can detect objects around the vehicle as well as detecting the driver's condition.,2023-01-05T22:59:00Z,https://www.cnet.com/roadshow/news/sony-and-honda-drive-new-electric-car-afeela-onto-the-ces-stage/,Sony and Honda have built a prototype of a new electric car. The vehicle which is branded Afeela and looks like a midsized sedan was driven on stage at CES 2023 on Wednesday. Afeela represents our concept of an interactive relationship where people feel the sensation of interactive mobility and where mobility can detect and understand people and society by utilizing sensing and AI technologies said Yasuhide Mizuno Sony Honda Mobility chief executive. The Afeela logo appears on a narrow screen or media bar on the vehicles front bumper. The bar can also interact and share information such as the weather or the cars state of charge with people outside the vehicle as demonstrated on stage. Mizuno didnt offer many details on why the name Afeela was selected but said the word feel is at the heart of the mobility experience. Leaning into Sonys strength in sensors the Afeela concept car comes equipped with 45 cameras and sensors on the interior and exterior of the vehicle some of which will be able to detect the drivers condition to help ensure safety the company said. The car will use technology from Qualcomm including its Snapdragon Digital Chassis while Unreal Engine graphics technology which was used in General Motors Hummer EV is slated to design interfaces for the vehicle. Thanks to Sonys side of the partnership the Afeela car is expected to have bestinclass entertainment for movies and games on tap as well. Also at CES BMWs i Vision Dee doubles as both a car and a friend. And VW unveiled a car clad in digital camouflage that changes color along with your music. For the design we are taking an approach that aims to set new value standards for mobility as we evolve automotive design to focus not only driving dynamics and performance but also on software networks and interfaces Mizuno said. Sony and Honda announced a joint venture at CES last year to develop and build electric cars. The JV called Sony Honda Mobility aims to have preorders established for its electric vehicle in the first half of 2025 with sales to follow in the latter half of that year. The first shipments are earmarked to be delivered to customers in North America in the spring of 2026 Mizuno said. The company appears to be focusing on online sales and Sony Honda Mobility has previously said it wants customers to take part in the product development process whatever that means. The car will be produced at Hondas facilities in North America.
