Title,Description,PublishedAt,URL,Content
DJI's lightweight RS 3 Mini camera stabilizer is designed to be used with one hand,"Where DJI's RS 3 and RS 3 Pro stabilizers were about maximum convenience and power, the company's latest is designed to reduce as much weight as possible. The new RS 3 Mini weighs in at just 1.8 pounds, but can carry cameras up to 4.4 pounds, meaning many hea…",2023-01-10T13:00:25Z,https://www.engadget.com/dj-is-new-ronin-rs-3-mini-mirrorless-camera-stabilizer-is-lighter-than-ever-130025802.html,Where DJIs RS 3 and RS 3 Pro stabilizers were about maximum convenience and power the companys latest is designed to reduce as much weight as possible. The new RS 3 Mini weighs in at just 1. 8 pounds but can carry cameras up to 4. 4 pounds which includes heavy mirrorless models like Canons EOS R3 and even some cinema cameras. At the same time it offers DJIs latest stabilization algorithms easy controls and more. DJI has tested the RS 3 Mini with cameras like the Sony A7S III with a 2470mm f2. 8 GM lens the Canon EOS R5 with an RF2470mm f2. 8 STM lens or a Fuji XH2S and XF 1855mm f2. 84. 0 lens. I tried it with a Panasonic GH6 and 1260mm f2. 84 and a Canon EOS R6 Mark II with a 24104mm f4 and had no problems. A powerful motor ensures that even when the zoom reaches the maximum focal length the footage captured remains stable and there is no need to repeat balancing DJI says. Gallery DJI RS 3 Mini camera gimbal 15 Photos Its relatively easy to mount cameras thanks to the newly designed dual layer quickrelease plate. That also allows for vertical shooting if you attach the plate to vertical arm and there are no rotation angle limitations in that mode. As with the RS3 the sliding quick release plates make it easy to balance in just a few minutes. It supports both wired and wireless Bluetooth shutterrecord activation via the RS3 Minis record button with the camera ready to go as soon as its turned on. For Sony cameras with supported power zoom lenses you can also control the zoom using the front dial without the need for a camera control cable. It offers the usual other DJI Ronin control dials including a joystick M button to switch modes a trigger a front dial and the aforementioned record button. You can also add Ronin accessories like the Briefcase handle fill lights or microphones. Functions are controlled by the 1. 4inch fullcolor touchscreen letting you change shooting modes balance the gimbal motors and more. You can also do much of that with the app or set functions like Timelapse Track recording move along up to 10 preset points and Panorama. Finally it can go up to 10 hours on a charge with the integrated battery handle and can be fully charged in as little as 2. 5 hours with a 10W charger. I had a chance to briefly try out DJIs RS 3 Mini and my early impressions were good. Im not much of a gimbal guy as I often work alone and dont have the need for tracking shots very often. However this one is so light that I was able to use it a fair while without tiring out. Its also very convenient there was no need to rebalance even if I zoomed out or changed my cameras configuration. And I was able to shoot most of my footage onehanded as DJI promises. The results were great it produced very smooth footage both in the horizontal and vertical configurations. The RS 3 Mini is also a relative bargain compared to the 550 RS 3 Pro. Its available for purchase today at authorized retailers or DJIs Store for 369 339 GBP 389 EUR. If youre concerned about knocking it into a wall DJIs Care Refresh insurance is now available for the RS 3 Mini as well.
Sony announces new controller aimed at gamers with disabilities,Announcement comes over four years after Microsoft's own Adaptive Controller launch.,2023-01-05T16:04:48Z,https://arstechnica.com/gaming/2023/01/sony-announces-new-controller-aimed-at-gamers-with-disabilities/,The Project Leonardo device as shown consists of a single arcadestyle analog joystick and a control ring circled with eight large white input plates and a massive circular input surface in the center. Those buttons can all be customized to any standard input or combination of inputs and the device itself can lie flat on a surface without needing to be actively held. Project Leonardo will come with a number of swappable stick caps buttons and labels for customization as well as a support to adjust the distance between the stick and buttons. Players will be able to use up to two Project Leonardo controllers andor mix and match them with a DualSense controller as a single input letting a friend or family member assist cooperatively with the secondary device. Players will also be able to connect a variety of existing external accessibility accessories through four standard 3. 5 mm AUX ports. The greatest part about the new PlayStation controller is its designed from the ground up to be not standard AbleGamers Senior Director of Development Steve Spohn said in a promotional video alongside the announcement. Still the promise of an official PS5 accessibility controller in the future should be welcome news to many players. Krissie A. who cant use a DualSense for extended periods without excessive hand pain told Ars last year Ive played on Sony consoles since the original PlayStation and to be excluded from a console due to my disability is a bit of a kick in the teeth and to be honest quite unacceptable in 2022.
PlayStation 5 Controllers Are at Their Lowest-Ever Price Right Now,"PlayStation 5 DualSense wireless controllers are selling for $50 right now at Walmart, and it’s the lowest price since their release. If you’re the only PS5 player in your family, consider this your Christmas present for yourself. You deserve it.Read more...",2022-12-20T21:00:00Z,https://lifehacker.com/playstation-5-controllers-are-at-their-lowest-ever-pric-1849915503,PlayStation 5 DualSense wireless controllers are selling for 50 right now at Walmart and its the lowest price since their release. If youre the only PS5 player in your family consider this your Christmas present for yourself. You deserve it. Where to find PS5 Controllers for 25 off Right now the DualSense Wireless controllers are also available for 50 at Target Best Buy Amazon Newegg and Walmart. However only Walmart seems to be able to ship your order by Dec. 23 when buying online although that always varies by ZIP code. If Walmart sells out of stock check out the other storesthere might be a chance you live close to one of their shipping distribution centers and could get it by Christmas. Also most of the retailers give you the option to pick up the controller in person right away when you buy online. Whats the DualSense Wireless Controller anyway The DualSense Wireless Controller is the same controller that comes with the console out of the box. The controller features haptic feedback technology adaptive triggers and a builtin microphone. The haptic feedback is a more advanced type of rumble vibrations that simulate whatevers happening in the game so youll feel the motion when driving over a rocky road or the thud of been punched. And the adaptive triggers are tension on the trigger buttons that give a more realistic feel to whatever action is happening in the game so youll feel the tension of a bow increase as you pull it further or the brakes of a car as you reach maximum speed. Keep in mind that Sony will be releasing the new DualSense Edge wireless controller in Jan 26 2023. It will be 200 and you can preorder it now. That remote will come with new features that you can check out here.
"Sony, Honda roll out prototype of 'Afeela' electric vehicle that uses Qualcomm tech - The Globe and Mail","<ol><li>Sony, Honda roll out prototype of 'Afeela' electric vehicle that uses Qualcomm tech  The Globe and Mail
</li><li>Sony unveils prototype EV, Afeela, to be made with Honda - Business News  Castanet.net
</li><li>Sony And Honda Name Their New EV Car Bra…",2023-01-05T16:15:42Z,https://www.theglobeandmail.com/drive/article-sony-honda-roll-out-prototype-of-afeela-electric-vehicle-that-uses/,Japans Sony on Wednesday unveiled a prototype of the new Afeela electric vehicles it will build together with Honda saying it would harness its vast entertainment content as it looks to become a player in nextgeneration cars. Sony SONYN gave a glimpse of the Afeela which sports rounded corners and a sleek black roof at the CES 2023 technology trade show in Las Vegas. The car will use technology from hardware maker Qualcomm Inc QCOMQ including its Snapdragon digital chassis. Sonys longawaited push into electric vehicles it announced the venture with Honda HMCN in March shows how manufacturers are increasingly focused on the cockpit experience in cars which offers the potential to sell content via subscription services cars especially as autonomous driving capabilities improve. In order to realize intelligent mobility continuous software updates and highperformance computing are required Yashuhide Mizuno the chief executive of Sony Honda Mobility told the trade show. To that end we will work closely with Qualcomm. Qualcomm on Wednesday launched a new processor the Snapdragon Ride Flex SoC that handles both assisted driving and cockpit functions including entertainment. Previously those functions were handled on different chips and bringing them together can help bring down costs a Qualcomm executive told Reuters. Sony is also looking to harness its traditional strengths in sensors. The Afeela will be equipped with more than 40 sensors Mizuno said. The car will use the Unreal Engine 3D creation tool from Epic Games the maker of the Fortnite series of games. For Honda the venture with Sony may allow it to speed up what has so far been a slow shift to electric. It has also struggled over the years to make gains in the luxury vehicle market with its Acura brand. The new EV will be priced at a premium the venture has said. The venture between Sony Group Corp and Honda Motor Co Ltd aims to deliver its first electric vehicles by early 2026 in North America. Shares of Sony were up 1. 6 in Tokyo trade while Honda shares were flat. The benchmark Nikkei 225 was little changed.
"CES 2023 Day 2 recap: Sony, Google and a Ram 1500 concept - Yahoo Finance Australia","<ol><li>CES 2023 Day 2 recap: Sony, Google and a Ram 1500 concept  Yahoo Finance Australia
</li><li>Afeela: The First EV from Sony and Honda! | MotorTrend  MotorTrend Channel
</li><li>Sony-Honda EV takes form with new prototype, Afeela brand  Green Car Repo…",2023-01-06T20:00:13Z,https://au.news.yahoo.com/ces-2023-day-2-recap-sony-google-and-a-ram-1500-concept-200013415.html,CES 2023 Day 2 recap Sony Google and a Ram 1500 concept The annual tradition of ridiculously grand concept vehicles continues. Well CES is officially underway. The floor is open and hordes of PR reps journalists and eager entrepreneurs are coursing through the arteries of the Las Vegas Convention Center. Of course even before the LVCC opened its doors today theres been plenty of news coming out of CES 2023. Sony Sony held its big press conference Wednesday night covering everything from highend cinema cameras and nano satellites to video game movies and accessible controllers. The companys Project Leonardo controller will offer a variety of customizable buttons and other hardware in a kit built for those with limited motor ability. Like Microsofts Xbox Adaptive controller Project Leonardo reflects a growing trend in tech especially in the gaming industry to better serve those living with disabilities. The Sony announcement that made the biggest splash though might have been that the endlessly delayed Gran Turismo movie is coming out in 2023. Personally Im not a big fan of the Gran Turismo series or racing games in general but even I got a bit excited watching the trailer. The camera work in the upcoming Neill Blomkamp film is shaping up to be pretty intense. And in a weird bit of synergy Sony also unveiled a car of its own the newly christened Afeela concept which was born out of partnership with Honda. The first Sony Honda Mobility vehicle wont be ready for the road until 2026 at least. AMD AMD also made a splash two CPUs and a GPU. The beefiest of the bunch is definitely the new Ryzen 9 7950X3D CPU which packs an insane 144MB of cache using the companys 3D VCache technology and reaches boost speeds of 5. 7GHz. The other two AMD announcements focused on the mobile side including the first RDNA 3 GPUs for laptops and a lineup of performancefocused Ryzen HX CPUs. Razer Another company focusing on raw power this CES was Razer which announced two new laptop models the Blade 16 and Blade 18. Theyre loaded to the brim with highend components like Intel Corei9 HX chips and NVIDIAs topoftheline RTX 4090 graphics cards. But personally I think the most interesting feature is the Blade 16s dual mode screen that can run either 4K at 120Hz and peak brightness of 1000 nits or full HD plus at 240Hz and 600 nits depending on whether speed or resolution are more important at that particular moment. Razer also finally gave us a release date for its Edge cloud gaming handheld which will land on January 26th. Lenovo The biggest dump of news though probably belongs to Lenovo. It announced two laptops a giant tablet an eink notepad and even a Think branded phone. The ThinkPhone finally brings some of Lenovos enterprise expertise to bear on Motorola mobile devices while the Smart Paper tablet syncs handwritten notes with audio recordings so you can scrub through a lecture and immediately see the notes associated with that moment. The most unique device though is the dual screen YogaBook 9i. Sure weve seen plenty of concept dualscreen machines before but the 9i isnt a pipe dream its an actual product that will go on sale later this year. Lenovo will even bundle all the accessories you need to make the most of its form factor including a foldable stand a stylus and a bluetooth keyboard. You can simply use the foldable as is and pull up a virtual keyboard on the bottom screen or you can attach the physical one to the screen and use the exposed bit of the display either as touchpad or to show widgets. But you could also set it up as basically a portable dualscreen workstation with the displays either side by side or stacked one over the other. Switching to the world of automobiles Google was finally ready to put its major overhaul of Android Auto on display and has started rolling it out to users. The new UI has a split screen mode and puts Maps in easier reach at all times. And speaking of Maps Google debuted a new HD version that will be coming to the Polestar 3. These higherresolution maps will be useful for Pilot Assist but might prove essential for future selfdriving features. Unfortunately no word on when or if the HD Maps will be coming to other vehicles. Stellantis Last but not least Stellantis revealed its Ram 1500 Revolution BEV Concept truck. In the grand tradition of truly outlandish concept vehicles showing up at CES the Revolution BEV has an augmented reality heads up display a collapsable steering wheel some sort of 3D animated avatar that the driver can interact with and will even follow you around like some sort of sad puppy dog if you want. On the more practical side it also sports four wheel steering and an 800 volt architecture that would allow it to get up to 100 miles of charge in just 10 minutes. Of course youll never actually be able to buy the Ram 1500 Revolution BEV Concept. But there is supposedly a Ram 1500 BEV coming in 2024 that will be loosely based on this. And dont worry theres still plenty more to come from CES Weve only just begun scouring the floor for hidden gems. So for all the details on anything you might have missed check out our comprehensive coverage on Engadget. com or our YouTube channel. And stay tuned more from CES 2023.
"At CES 2023, Sony's 'Gran Turismo' flags new entertainment strategy - Reuters","When Sony Corp Group <a href=""https://www.reuters.com/companies/6758.T"" target=""_blank"">(6758.T)</a> teases “Gran Turismo,” its long-awaited adrenaline-fueled film adaptation of Sony PlayStation’s hit car-racing franchise at the CES 2023 technology trade show…",2023-01-04T14:33:00Z,https://www.reuters.com/business/media-telecom/ces-2023-sonys-gran-turismo-flags-new-entertainment-strategy-2023-01-04/,At CES 2023 Sonys Gran Turismo flags new entertainment strategy Jan 4 Reuters When Sony Corp Group 6758. T teases Gran Turismo its longawaited adrenalinefueled film adaptation of Sony PlayStations hit carracing franchise at the CES 2023 technology trade show this week it will really be showing off its new identity as a contentdriven company. The movie reflects the transformation of the maker of the Walkman and Bravia TVs from a primarily hardwarefocused innovator to broadbased entertainment provider. It also represents a significant bridging of the divides between Sony Pictures Entertainment Sony PlayStation and Sony Music according to a dozen current and former senior executives interviewed by Reuters. I defined our identity as a creative entertainment company with a solid foundation on technology Sony chief executive Kenichiro Yoshida said. The films appearance at CES on a stage typically reserved for bigscreen TVs and robot pets caps 10 billion in investments in music games and anime over the last five years. Gran Turismo is one of 10 gameinspired film and television projects in various stages of development. HBOs The Last of Us about a man hired to smuggle a 14yearold girl across a pandemicplagued America debuts on Jan. 15. The New Yorker suggested the series could break the curse of bad videogame adaptations. Last month Amazon Prime Video ordered God of War a live action adaptation of the PlayStation hit based on Greek mythology. Sonys creative entertainment company approach extends beyond content. A SonyHonda electric vehicle scheduled to reach consumers by 2026 is being framed as a rolling showcase of Sonys entertainment gaming and camera sensor prowess. It will also generate recurring subscription revenue like other content services. Eventually we think in the long term the mobility space will become an entertainment space Yoshida said. The highprofile projects which could not have happened even three years ago grew out of regular conversations among Sony executives as they sought a way to work together more effectively. Sony resisted chasing after Netflix with a rival service and fended off an activist shareholders call to sell or spin off its media and entertainment assets in 2013. Instead it struck deals to provide movies to Netflix and Walt Disney Cos DIS. N Disney and series to HBO Amazon and Apple Incs AAPL. O Apple TV. The shift is reflected in Sonys results with twothirds of operating profit coming from games music and the film studio. Operating profit rose 8 to 344 billion yen 2. 6 billion for the JulySeptember quarter beating analyst estimates. In November with the music business offsetting weakness in the games group Sony hiked its fullyear operating profit forecast. This is a complete pivot of this company into something thats no longer an electronics company said Ulrike Schaede a professor of Japanese Business at UC San Diegos School of Global Policy and Strategy. Schaede said the company now has a coherent corporate narrative that would make it easier to unite the companys divisions. Thats the new Sony she said. Now can they deliver I dont know. TREASURE CHEST When veteran media executive Tony Vinciquerra was recruited as chairman of Sony Pictures in 2017 the division was reeling after a string of box office flops including the 2016 reboot of the Ghostbusters franchise. DVD and Bluray disc revenue had plummeted under pressure from streaming services and there were rumors of a possible sale media executives said. But Vinciquerra was attracted by the opportunity to leverage the companys assets Sony is the only company in the media business that has not only television or film but music PlayStation and technology he said in an interview. Sony had struggled for decades to achieve the synergy the company touted with its 1989 acquisition of Columbia Pictures Entertainment. At best these forced collaborations ended up as product placement in a movie or marketing promotion. At worst they got in the way of adapting to the digital era. Entertainment executives then came up with PlayStation Productions a division within the games group located on the Culver City studio lot and dedicated to film and television adaptations. It acted as a cultural attach to Hollywood someone who could talk in their language PlayStation chief Jim Ryan said in an interview in a nonconfrontational nonadversarial way just you know just try to do the best thing for both divisions. The result was Uncharted last years release starring SpiderMans Tom Holland and Mark Wahlberg in a hunt for Magellans lost treasure. The film delivered 401 million in global ticket sales and became the mostwatched film on Netflix when it was released on the streaming service in August. Meanwhile one of the most popular artists distributed by Sony Music the Puerto Rican rapper Benito Antonio Martnez Ocasio who performs as Bad Bunny will star in El Muerto a film drawn from Sonys Marvel Universe of characters due out in 2024. Bad Bunny is a Rimas Entertainment artist. Sony Music Entertainment CEO Rob Stringer said Yoshidas light touch has proven successful. Quite frankly the ideas are flying around and everyones much much more comfortable about talking to each other Stringer said. This August will bring another test of Sonys strategy when Gran Turismo hits theaters after languishing for 12 years. The movie is based on British racer Jann Mardenborough who won the 2011 GT Academy Europe at 19 and went on to a podium finish at the 24Hours of Le Mans in 2013. Academy Awardnominated director of District 9 Neil Blomkamp directs a cast that includes Lord of the Rings star Orlando Bloom and Stranger Things actor David Harbour. Were telling a true story about wish fulfillment PlayStation Productions chief Asad Qizilbash said. This kid loved playing Gran Turismo and at the same time were celebrating the game. This story has been refiled to fix the date when activist investor requested spinoff to 2013 from 2020 in paragraph 13 Our Standards The Thomson Reuters Trust Principles.
Raspberry Pi's new 12-megapixel camera modules provide powered autofocus,"Raspberry Pi has launched the Camera Module 3 with big improvements, including higher resolution, infrared, HDR, autofocus, a wide angle FOV and more, the company announced. Not counting the interchangeable lens model introduced in 2020, it's the company's fi…",2023-01-09T11:29:11Z,https://www.engadget.com/raspberry-pis-latest-camera-modules-provide-powered-autofocus-112911815.html,Raspberry Pi has launched the Camera Module 3 with big improvements including higher resolution infrared HDR autofocus a wide angle FOV and more the company announced. Not counting the interchangeable lens model introduced in 2020 its the companys first new camera module in six years. The previous Module 2 cameras used a Sony IMX219 8megapixel sensor. However the new models carry Sonys new 12megapixel IMX708 chip which is not only larger but has more resolution. That translates to sharper images and also better lowlight sensitivity. It also has a 169 aspect ratio so HD video up to 1080p50 can be captured using the entire sensor area. Better still where the previous module had fixed autofocus Module 3 has builtin powered autofocus capability. That makes them a bit thicker up to 12. 4mm compared to 9mm but more versatile letting you focus on objects ranging in distance from 5cm 2 inches to infinity. The standard fieldofview FoV variants provide a 66 degree horizontal field of view roughly equivalent to a 28mm fullframe lens. The wide angle version however bumps that to 102 degrees horizontal a 14mm fullframe lens. With a more expensive and complex optical stack the wideangle version is a bit thicker 12. 4 compared to 11. 5mm according to Raspberry Pi. It also offers HDR capability taking multiple simultaneous exposures with different exposure times. That lets you capture interior shots for instance with the correct exposure on both interior and exterior details. And finally the NoIR no infrared filter sensors first introduced with the Module 2 can effectively convert your Raspberry Pi into a nightvision camera. The launch includes no less than four modules including standard and wide angle models both in visible light and NoIR infrared versions. Both the normal models start at 25 while the wide angle versions cost 35. Theyre now available at Raspberry Pis store.
