Title,Description,PublishedAt,URL,Content
Elon Musk Says () Kevin McCarthy () Should Be Speaker,Twitter CEO Elon Musk is throwing his support behind the foundering ship that is Rep. Kevin McCarthy’s bid for House Speaker. The two have been friendly for years: Musk has donated to McCarthy’s campaign five times and attended the California Republican’s don…,2023-01-05T14:55:00Z,https://gizmodo.com/house-speaker-kevin-mccarthy-elon-musk-endorses-donate-1849952870,Twitter CEO Elon Musk is throwing his support behind the foundering ship that is Rep. Kevin McCarthys bid for House Speaker. The two have been friendly for years Musk has donated to McCarthys campaign five times and attended the California Republicans donors retreat last year as McCarthys personal guest. McCarthy has called Musk the Thomas Edison of our time and run political interference on his behalf. Musk tweeted out his support for McCarthy on Thursday morning hours before the House of Representatives was set to reconvene to try to elect a Speaker for a seventh time. Kevin McCarthy should be Speaker Musk said via his social network. Musks support of McCarthy who has already lost six consecutive votes to become Speaker this week aligns with the billionaires pivot to the political right in recent months. Most recently Musk recommended that people vote Republican in the midterms. Although the Tesla CEO isnt a big political donor he has made donations to McCarthys campaigns at least five times according to Federal Election Commission records albeit in small amounts no more than 2700. In August of last year Musk attended McCarthys annual donor retreat in Wyoming as the Republicans personal guest. At the event McCarthy introduced Musk as the Thomas Edison of our time Axios reported. Its not clear whether Musks support McCarthy will do any good. The California Republican is dealing with 20 hardright defectors who refuse to vote for him. Even McCarthys endorsement from former President Donald Trump has failed to sway the hardliners so its hard to believe that Musks seal of approval would be any different. The House is scheduled to reconvene at noon ET. The House Republican also spoke up on behalf of Musk in November telling reporters that the White House should stop picking on Elon Musk after White House officials said they were keeping an eye on Musks reforms at Twitter. That is offensive to me. Governments going to go after someone that wants to have free speech. What do they have to look at Twitter about McCarthy said on Nov. 29. I think the American public have spoken on this. I think our First Amendment stands up and I think they should stop picking on Elon Musk. McCarthys praise and defense of Musk stands in stark contrast to President Joe Bidens administration which Musks feels has snubbed him by ignoring Tesla. Biden has repeatedly praised automakers like Ford and GM for their innovation in electric vehicles since taking office but he hasnt mentioned Tesla.
Tesla suspends production at Shanghai plant - Reuters,"Tesla suspended production at its Shanghai plant on Saturday, according to an internal notice and two people with knowledge of the matter, bringing ahead a previous plan to pause most work at the plant in the last week of December.",2022-12-24T12:52:00Z,https://www.reuters.com/business/autos-transportation/tesla-suspends-production-shanghai-plant-internal-notice-2022-12-24/,Tesla suspends production at Shanghai plant SHANGHAI Dec 24 Reuters Tesla suspended production at its Shanghai plant on Saturday according to an internal notice and two people with knowledge of the matter bringing ahead a previous plan to pause most work at the plant in the last week of December. The U. S. automaker cancelled the morning shift and told all workers at its most productive manufacturing hub they could start their break said the people and the notice seen by Reuters. The company did not give a reason. Reuters reported earlier this month that the electric car giant planned to suspend Model Y production at the plant from Dec. 25 to Jan. 1. The suspension comes among a rising wave of infections after China eased its zeroCOVID policy earlier this month an abrupt move welcomed by businesses and the public but heavily disrupting business operations in the short term. One of the people said workers at Tesla and its suppliers have also been falling sick as part of this wave posing challenges to operations in the past week. Tesla is also grappling with elevated inventory levels as its second largest market braces for a downturn. The Shanghai plant has been focused on making models for export in the last week the person added. A media representative at Tesla China did not immediately respond to request for comment. The plants suspension of Model Y assembly at the end of the month would be part of a cut in planned production of about 30 in the month for the model Teslas bestselling model at the Shanghai factory Reuters had reported. The Shanghai factory the most important manufacturing hub for Elon Musks electric vehicle company kept normal operations during the last week of December last year. It has not been an established practice for the plant to shut down for a yearend holiday. Our Standards The Thomson Reuters Trust Principles.
Hands-On With the Apple Music App for Tesla,"Car manufacturer Tesla last week rolled out a holiday software update that added Apple Music support to Tesla vehicles, so we thought we'd check it out for those who are interested in a hands-on demo of how Apple's streaming music service works on the Tesla p…",2022-12-20T21:04:28Z,https://www.macrumors.com/2022/12/20/apple-music-tesla-hands-on/,HandsOn With the Apple Music App for Tesla Car manufacturer Tesla last week rolled out a holiday software update that added Apple Music support to Tesla vehicles so we thought wed check it out for those who are interested in a handson demo of how Apples streaming music service works on the Tesla platform. Apple Music support for Tesla cars is something that Tesla owners have long been waiting for as the electric car company has previously only worked with streaming services like Spotify. The experience works as you might expect and the full Apple Music service is available. The navigation experience is superior compared to Spotify such as options for tapping into songs from a playlist to get to the entire album along with better interface interactions. Navigation is also straightforward though its worth noting that it does not appear that iTunes Match content is available for access. Lossless and Dolby Atmos also do not appear to be available at this time in Teslas and it is not clear if that functionality is going to be enabled at a later date. If youre a Tesla owner you will need the 2022. 44. 25 Tesla Holiday Update to access Apple Music which has been rolling out over the last seven days. Popular Stories Apple has broken a tradition it maintained for 21 years releasing no new Macs in the fourth quarter of the year for the first time since 2000 as previously anticipated devices like the nextgeneration MacBook Pro and Mac Pro models have apparently been pushed out to this year. Historically Apple launched at least one new Mac model every year in the fourth quarter that runs between October... Apples nextgeneration iPhone 15 Pro and iPhone 15 Pro Max are expected to be announced in September as usual. Already rumors suggest the devices will have at least six exclusive features not available on the standard iPhone 15 and iPhone 15 Plus. An overview of the six features rumored to be exclusive to iPhone 15 Pro modelsA17 chip iPhone 15 Pro models will be equipped with an A17... Amazon today has Apples 2021 11inch iPad Pro 2TB WiFi for 1299. 97 down from its original price of 1899. 00. This is the lowest price weve ever tracked for this previousgeneration M1 model of the iPad Pro. Note MacRumors is an affiliate partner with Amazon. When you click a link and make a purchase we may receive a small payment which helps us keep the site running. You can get... While there are still around five months remaining until Apple unveils iOS 17 were already able to piece together a few details about the upcoming software update based on Apples previous announcements and reported information. Below weve recapped everything that we have heard about iOS 17 so far. Apple is expected to announce iOS 17 alongside iPadOS 17 macOS 14 watchOS 10 and tvOS... A sketchy app claiming to be the bot ChatGPT has soared up App Store charts charging users a 7. 99 weekly subscription to use a service that is entirely free to use on the web and seemingly has no affiliation to the actual bot. ChatGPT has soared in popularity recently with some calling it the iPhone moment for AI given its mainstream appeal. ChatGPT can articulate short and longform... The iPhone 15 Pro models could face a price hike over the iPhone 14 Pro and iPhone 14 Pro Max according to recent reports. According to a rumor from an unverified source on Weibo Apple will increase the price of this years iPhone 15 Pro models to widen the gap with the iPhone 15 Plus. The extent of the potential price hike is not yet clear. The iPhone 14 Pro and iPhone 14 Pro Max start at... The iPhone 16 Pro will feature underdisplay Face ID technology to provide more usable display area according to The Elec. The Koreanlanguage report explains that Apple will move the components required for Face ID authentication directly under the iPhones display in 2024. When not in use the TrueDepth camera for Face ID will not be visible under the display which will appear seamlessly... Mass shipments of secondgeneration AirPods Max and more affordable AirPods will likely begin in the second half of 2024 or the first half of 2025 according to the latest information shared by Apple supply chain analyst MingChi Kuo. In a series of tweets today Kuo said Apple is aiming for a 99 price for the more affordable standard AirPods. Currently the 129 secondgeneration AirPods... Despite years of resistance Apple is now working on adding touchscreens to Macs according to a report today from Bloombergs Mark Gurman. The report claims that a new MacBook Pro with an OLED display could be the first touchscreen Mac in 2025. Gurman said Apple engineers are actively engaged in the project indicating that the company is seriously considering producing touchscreen...
"Elon Musk says we're 'overdue' for a recession, won't sell any more Tesla stock for 18-24 months: 'I need to sell some stock to make sure there was powder dry to account for a worst-case scenario'","In a Twitter Spaces chat, Elon Musk said he wouldn't sell Tesla stock until 2025. Tesla shares have plummeted since he took over as CEO of Twitter.",2022-12-23T00:01:26Z,https://www.businessinsider.com/elon-musk-wont-sell-tesla-stock-next-year-recession-overdue-2022-12,Elon Musk says were overdue for a recession wont sell any more Tesla stock for 1824 months I need to sell some stock to make sure there was powder dry to account for a worstcase scenario Elon Musk said in a Twitter Spaces chat that he would not sell more Tesla stock for the next 1824 months. Musk told listeners on the chat that he needed powder dry to prepare for a potential recession. Elon Musk told Tesla investors he wouldnt sell additional shares of his EV company in the near future and that he only sold recently to prepare for a potential recession. Im not selling any stock for I dont know at minimum 18 to 24 months. So you can count on no stock sales until 2025 or something Musk said in a Twitter Spaces chat on Thursday. I needed to sell some stock to make sure there was powder dry to account for a worstcase scenario he added. This isnt the first time Musk has vowed not to sell more Tesla stock this year. In August after selling more than 8 billion worth of Tesla stock to help finance his purchase of Twitter Musk tweeted no further TSLA sales planned after today. Earlier this month he sold another 3. 6 billion in Tesla shares though. The stock traded at a 52week low as of Thursdays close. Musk weighed in on the broader economy with a gloomy outlook for the coming year from a longterm standpoint theres a natural economic cycle that happens and frankly were overdue for a recession he said. Its shocking that we havent had an economic recession in any meaningful sense of the word since 2009 he added. Some investors have expressed worry that Musk has become disengaged as Teslas CEO as he shifts his focus to leading Twitter further causing Teslas stock to sink. However Musk said that there was not a single important meeting that I missed at Tesla since taking the reigns at Twitter telling listeners in the Spaces chat that he only sold Tesla shares because hes somewhat paranoid having gone through two very intense recessions. SMBs can easily upskill their workforce using this effective learning management solution Device deployment hits 1 million for two straight quarters How Paytm Soundbox is fuelling growth Jack Ma the billionaire founder of Alibaba who disappeared from public view in 2020 appears to resurface in Thailand as he prepares to give up control of his company Amazon Great Republic Day Sale best deals on phones iPhone 13 OnePlus Nord 2T 5G Redmi A1 and more Wipro sees FY23 revenue growth at 11. 512 Q3 profit growth beats analyst expectations Rupee falls 4 paise to close at 81. 34 against US dollar 13th Gen Intel Core i913900KS brings unprecedented speed to desktop users Credit expansion will taper down next year if deposits growth doesnt rise Axis Bank MD
California Pay Transparency Reveals Big Tech Salaries,"California’s salary transparency law has officially gone into effect as of January 1, forcing companies to unveil the wages they pay to their workers. As such, the curtain is being pulled on the mystery behind the cash flowing through some of Silicon Valley’s…",2023-01-06T15:45:00Z,https://gizmodo.com/salary-transparency-big-tech-apple-meta-tesla-1849957910,Californias salary transparency law has officially gone into effect as of January 1 forcing companies to unveil the wages they pay to their workers. As such the curtain is being pulled on the mystery behind the cash flowing through some of Silicon Valleys biggest companies. This past September California Governor Gavin Newsom officially signed Senate Bill 1162 into law which requires California companies with more than 15 employees to post a positions salary in its job posting. Likewise current employees can request the pay scale of their position from the company. New York City enacted a similar pay transparency law earlier this year with only minor hiccups and New York State has also signed a statewide pay transparency law. Senate Bill 1162 was specifically designed to tackle gender pay gaps according to quotes from Governor Newsom but an unintended side effect of the states transparency law is that it now sheds light on how much some of the worlds largest tech companies pay their workers. Gizmodo took a look at three random job openings each from Meta Apple and Tesla to find out how much these companies are paying for different positions. While job posting websites like Indeed do offer salary estimates these salary ranges are likely more accurate as they are straight from the horses mouth. Californiabased jobs at Meta pay Software Engineer Leadership Product at Meta requires 12 years of programming experience and 8 years of experience with web or mobile technologies 205000 to 281000 per year Data Scientist Machine Learning at Facebook requires at minimum a 197000 to 269000 per year Research Scientist Intern Computer Vision and Machine Learning for Messenger requires that the applicant either has or is in the process of getting a Ph. D. and Meta says that internships last anywhere from 1224 weeks long 7313 to 10250 per month. Californiabased jobs at Apple pay Shipping Receiving and Mail Lead requires 5 years experience in a fastpaced Shipping Receiving and Mail team or similar environment 29. 04 to 43. 59 per hour 60403. 20 to 90667. 20 per yearassuming a 40 hour work week for 52 weeks Display Technologist generally requires a Ph. D. or a Masters degree with more than 5 years of experience in relevant field 113500 and 207000 per year WiFi Quality Engineer is an entrylevel position that requires at least two years of experience with both 802. 11 protocols andor Bluetooth and software quality assurance methodologies and practices and only requires a Bachelors degree 113500 and 171000 per year. Californiabased jobs at Tesla pay Solar Maintenance Lead Roofer requires general hardware and wiring expertise along with customer service skills and a valid drivers license 14. 63 to 52. 62 per hour 30430. 40 to 109449. 60per year assuming a 40 hour work week for 52 weeks Automotive Painter requires at least 5 years experience in refinishing cars and you must be 18 years or older 18. 24 to 82. 08 per hour 37939. 20 to 170726. 40assuming a 40 hour work week for 52 weeks Associate Quality Engineer requires a Bachelors degree in engineering or a related technical field and a willingness to travel 57600 to 309600per year. The salary ranges on some of the positions are comically massive which probably isnt great for the potential employee if theyre being offered a job on the lower end. But it does give both the company and the job seekers wiggle room to negotiate. Each of these corporations had hundreds of job openings in California alone and Gizmodo took at look at a few more from each company. On the surface it appeared that Meta offered less entrylevel positions than Apple and Tesla. Tesla meanwhile seems to be leaning heavier into positions that pay hourly as opposed to annually. And while Tesla has positioned itself as a tech company theres been recent pushback among investors labeling it a carmaker not a tech firm.
A Tesla driver watched in horror as another Tesla burst into flames after hitting a barrier,"Josh Kaplan spoke with the other driver, who said he was using the Autopilot system when his Tesla failed to follow a bend and then struck a barrier.",2022-12-26T12:51:37Z,https://www.businessinsider.com/tesla-driver-watched-in-horror-tesla-crashed-burst-into-flames-2022-12,A Tesla driver watched in horror as another Tesla burst into flames after hitting a barrier A Tesla driver watched in horror as another Tesla hit a barrier and burst into flames. Josh Kaplan was driving on the 405 freeway in Los Angeles when he encountered the crash. Josh Kaplan was driving his Tesla Model X on the 405 freeway in Los Angeles last month when he saw a vehicle ahead of him had suddenly stopped. I noticed a car facing left against the barrier despite the road veering to the right he told Insider. He realised that vehicle was also a Tesla and had smoke coming from it. In the time it took me to call 911 it caught fire. Kind of looked like sparklers going off Kaplan said. He got out and spoke to the driver of the crashed Tesla who was not injured in the incident. The driver told Kaplan he had his 2018 Model X in Autopilot but it suddenly veered hard to the left and stopped against the wall. Kaplan bought his Tesla about four months ago with 6000 miles on the clock but said It has been a complete disappointment software notwithstanding the fit and finish are miserable. He said hes also experienced many frightening miscalculations by Autopilot in his Model X. Just last week it completely ignored a traffic cone on the highway and ran over it he told Insider. That was just before the car turned from an inside of a doubleturn lane into the outside lane despite there being other vehicles already occupying that space. Commenting on the latest version of the system Kaplan said The user interface would often display a blank screen when the software crashes or the system doesnt update that some basic functions including navigation voice being turned off instead of the previous setting. This means that if youre driving and the computer crashes which it has done multiple times you are left with a blank screen and no way to know what your car is doing. Kaplan quipped that Tesla should advertise Autopilot as the scariest ride youll ever take. Vehicles using Teslas Autopilot software were involved in 273 crashes over roughly the last year according to a report released earlier this year by the US roadsafety regulator. Tesla didnt immediately respond to a request for comment by Insider. Has your Tesla been involved in an Autopilot mishap Contact this reporter at stabahritiinsider. com SMBs can easily upskill their workforce using this effective learning management solution Device deployment hits 1 million for two straight quarters How Paytm Soundbox is fuelling growth Jack Ma the billionaire founder of Alibaba who disappeared from public view in 2020 appears to resurface in Thailand as he prepares to give up control of his company Amazon Great Republic Day Sale best deals on phones iPhone 13 OnePlus Nord 2T 5G Redmi A1 and more Wipro sees FY23 revenue growth at 11. 512 Q3 profit growth beats analyst expectations Rupee falls 4 paise to close at 81. 34 against US dollar 13th Gen Intel Core i913900KS brings unprecedented speed to desktop users Credit expansion will taper down next year if deposits growth doesnt rise Axis Bank MD
Elon Musk Tweet Inspires Fan to File Boat Trademark On Behalf of Tesla — Without Telling Tesla,A Tesla superfan said filed a trademark application for boats because Elon Musk mentioned the Cybertruck might be able to go in the water.,2023-01-05T17:57:00Z,https://www.entrepreneur.com/business-news/tesla-fan-files-trademark-for-tesla-unbeknownst-to-tesla/442310,Elon Musk Tweet Inspires Fan to File Boat Trademark On Behalf of Tesla Without Telling Tesla A Tesla superfan said they filed a trademark application for boats because Elon Musk mentioned the Cybertruck might be able to go in the water. There are fans and then there are fans who want to help you deal with the U. S. Patent and Trademark Office USPTO. And thats just what one loyal fan did on behalf of the company according to Bloomberg. Tesla superfan Jerome Eady filed a trademark application on December 28 with the Tesla company listed as the owner of the trademark for not for land vehicles. The trademark would give the company protection from a general IP perspective to sell a Teslabranded product that was covered by this trademark application and then sue anyone who was using its name to sell such a product. The application covers per the trademark filing application page asynchronous motors not for land vehicles including airplane and boat motors. Typically a companys trademark filings are indicators of the companys plans to expand into other products. And as such news outlets started reporting that Tesla had filed the application and was planning to potentially expand into boats and airplanes. But that wasnt exactly what happened. Eady who spoke with Bloomberg via the phone said that he did it proactively on the companys behalf because Elon Musk said in September that Teslas planned Cybertruck product an electric vehicle truck that you can reserve online for 100 could be a shortterm boat. Keegan Caldwell founder and managing member of an intellectual property firm told Entrepreneur that takes about an hour and a half to file an initial trademark application. The entire trademark process takes 12 to 18 months per the USPTO. Typically customers do not engage in proactive IP management on behalf of their favorite companies Caldwell said. Eady said he has no affiliation with Tesla and the filing was made without the companys knowledge Bloomberg wrote. Its a surprise to see something like this happen Caldwell added. It is exceedingly rare. Cybertruck will be waterproof enough to serve briefly as a boat so it can cross rivers lakes even seas that arent too choppy Elon Musk elonmusk September 29 2022 The trademark applications status was last updated on December 31 and is waiting to be assigned to an attorney to review it. Caldwell is also not sure if a trademark can be filed on behalf of Tesla or any company without that specific company signing it or endorsing it in some way. Related From Using Children As Props to Embedding Car Keys In a Hand Tesla Owners Are a Passionate Bunch Regardless of actions taken by Tesla superfans the company does have an interesting approach to IP. Tesla said in 2014 it But Tesla has not taken such a handsoff approach when it comes to enforcing its trademarks. It sued an accessories seller that was using the Tesla name and trademark in March for trademark infringement for example. The attorney listed on Eadys application had a Washington D. C. based address. Entrepreneur was unable to reach them for comment. Entrepreneur Editors Picks These Are the Hottest Franchises to Watch in 2023 This One Question Will Make You a Better Thinker. Are You Asking It Already How the CEO of Zoom Room Is Leading the Way in Dog Training and Education Before Pressing the Layoff Button Leaders Need to Ask Themselves 1 Question Then Do These 3 Things 3 Simple Strategies for Coping With Overwork Pressure Taco Bell Uses This LittleKnown Secret to Stay on Top Year After Year Once a Skeptic Elon Musk Now Embraces This Divisive Workplace Policy and You Should Too.
