Title,Description,PublishedAt,URL,Content
Elon Musk isn’t serious about giving power to a new CEO,"Elon Musk says that he’ll still be in charge of Twitter’s software and server teams after he resigns his CEO seat to “someone foolish enough” to take the job. In a recent poll, Twitter users voted in favor of him stepping down.",2022-12-21T01:57:28Z,https://www.theverge.com/2022/12/20/23520019/elon-musk-stop-twitter-ceo-software-server-teams,Elon Musk said Tuesday that hell still be in charge of Twitters software and server teams after he resigns his CEO seat to someone foolish enough to take it. He broke the news in a response to a poll he ran earlier this week where around 58 percent of respondents said that he should step down as CEO. Given that the social networking site is mainly made up of software and servers especially after the massive layoffs its clear Musk will still have direct control over the company even if he doesnt have the explicit CEO title. Thats not necessarily a surprise Musk has defacto control over product at most of his companies and hes still Twitters owner at the end of the day. But the announcement likely means disappointment for anyone hoping that him stepping down as CEO would bring an end to Twitters wild rollercoaster ride. While Musk has indicated that hes mainly interested in the Twitter users that are willing to pay him for the service there are another group of people he has to satisfy Tesla shareholders. The companys share price has been tumbling since Musk bought Twitter dropping almost 100 in value since November 1st down to around 137 when markets closed on Tuesday. Musk has several times blamed the drop on interest rates making saving more appealing than investing but some Tesla shareholders have raised concerns about the companys engineers going to work at Twitter and how Musks antics at Twitter reflect on his other companies. The only problem is the optics of having the CEO on Twitter every day discussing the problems of Hunter Biden said Ross Gerber a head of a firm invested in Tesla according to Business Insider. Musk has also sold billions in Tesla stock since he promised to stop doing that this spring and again in the summer. It seems likely that some of the money from the Tesla selloff went to help prop up Twitter. Unfortunately for Tesla shareholders a group that involves Musk whose shares once made him the worlds richest man until the stock price slip cost him that title it doesnt seem like Musk intends on stepping away from Twitter any time soon. Sure whoever he gets as CEO may be tasked with trying to corral advertisers and policymakers both of which have been suspiciously eyeing Twitters new management. But when it comes to the Twitter that people are actually using it sounds like Elon will still be Chief Twit.
"Tesla delivered a record 1.3 million vehicles in 2022, but it still disappointed Wall Street","Tesla delivered a record number of cars last year, as sales continued to grow by percentages any other major automaker would dream about. But Tesla still managed to disappoint Wall Street throughout 2022 -- and the last quarter was no different.",2023-01-02T17:49:41Z,https://www.cnn.com/2023/01/02/investing/tesla-deliveries-production/index.html,Tesla delivered a record number of cars last year as sales continued to grow by percentages any other major automaker would dream about. But Tesla still managed to disappoint Wall Street throughout 2022 and the last quarter was no different. The electric automaker delivered 1. 3 million vehicles in 2022 up 40 from 2021. It produced nearly 1. 4 million vehicles up 47 from the prior year. Yet the fourth quarter underwhelmed Tesla delivered only 405278 vehicles well below the median estimate of 431000 according to analysts polled by Refinitiv as recession fears and higher interest rates led to a slowdown in demand. Although 40 growth is nothing to sneeze at Teslas pace of growth is slowing. Deliveries nearly doubled in 2021 and more than quadrupled in 2020. Teslas TSLA stock plunged 65 in 2022 as demand weakened. Competition in electric vehicles from established automakers surged last year. The company missed its growth targets throughout the year and it scaled back production in China. Evidence of car buyers sinking interest in Teslas became apparent last month after the company announced a rare sale in a bid to clear out inventory. Tesla offered two rebates for buyers taking delivery of a vehicle before the end of the year initially offering a 3750 discount then doubling the rebate to 7500 with two weeks left in 2022. Investors were rattled by the rebates sending the stock plunging 37 in December alone. Tesla thanked customers and employees for helping the company achieve a great 2022 in light of significant Covid and supply chain related challenges throughout the year according to a statement released on Monday. The company also said it was proud of its growth and progress. We continued to transition towards a more even regional mix of vehicle builds which again led to a further increase in cars in transit at the end of the quarter the statement read. Tesla said it delivered 1. 25 million of its lessexpensive Model 3 and Model Y electric cars and nearly 67000 of its higherend Model X and Model X lines.
Tesla Delivered a Record 1.31 Million Cars in 2022 Despite Elon,"Tesla delivered 1.31 million electric vehicles in 2022, a 40% increase year-over-year and a record for the company, despite a hot mess CEO who spent the year tweeting and throwing his brands—and $200 billion in net worth—in the toilet.Read more...",2023-01-03T13:27:00Z,https://gizmodo.com/tesla-elon-musk-electric-car-deliveries-131-million-1849943789,Tesla delivered 1. 31 million electric vehicles in 2022 a 40 increase yearoveryear and a record for the company despite a hot mess CEO who spent the year tweeting and throwing his brandsand 200 billion in net worthin the toilet. The deliveries marked a new high for Tesla but they werent enough to make Wall Street happy. Analysts expected Tesla to ship 431000 cars in the fourth quarter but the company only managed to deliver 405000. Overall Tesla delivered 1. 2 million of its less expensive Model 3 and Y cars in 2022 and 66700 Model S and Model X cars which are higherend. On the production side Tesla whipped up 439000 vehicles in the fourth quarter which was notable given that the company rarely produces more cars than it delivers according to Reuters. Production increased by 47 yearoveryear to 1. 37 million cars. Since Tesla doesnt release specific sales data analysts use delivery numbers as one metric to measure the companys performance each quarter. We continued to transition towards a more even regional mix of vehicle builds which again led to a further increase in cars in transit at the end of the quarter the company said in a short statement alongside its production and delivery update. In addition Tesla thanked its customers employees and suppliers among others for helping it achieve a great 2022 in light of significant COVID and supply chain related challenges throughout the year. Teslas disappointing delivery numbers are the newest problem in the automakers pile of woes many of which were created by CEO Elon Musk who also owns Twitter and SpaceX. The companys stock started sliding rapidly downhill beginning in April when Musk decided he wanted to buy Twitter. He would spend the summer attempting to back out of that deal. Upon realizing he couldnt Musk begrudgingly completed his purchase much to the horror of investors who wanted the billionaire to focus on Tesla. Tesla stock fell 65 in 2022 and the company has been forced to deal with the fallout of Musks actions at Twitter which include laying off thousands of workers forcing people to sign a pledge to stay at an extremely hardcore Twitter firing the janitors and refusing to pay rent for the companys office space. And thats only a snapshot. There are growing indications that the Musk train wreck has soured Teslas devoted customers and investors on the billionaire. CNET reported that customers are canceling their preorders and terminating their leases. Some of the angry buyers posted that Musk is tanking the Tesla brand and that theyre embarrassed to drive their Teslas. Others say that their next electric car wont be a Tesla. Meanwhile Musk fans have become more critical of the man they once worshipped. In December major Tesla shareholder Leo KoGuan criticized the billionaire for abandoning the electric car company. Elon abandoned Tesla and Tesla has no working CEO KoGuan tweeted. Tesla needs and deserves to have working full time CEO.
The EV revolution became an eventuality in 2022,"It’s been a decade since the first Tesla EV made its commercial debut and the electrification of American automotive society began in earnest. Acceptance at the newfangled technology was slow at first but, over the past ten years as battery capacities have gr…",2022-12-29T16:00:22Z,https://www.engadget.com/the-ev-revolution-became-an-eventuality-in-2022-160022818.html,Its been a decade since the first Tesla EV made its commercial debut and the electrification of American automotive society began in earnest. Acceptance at the newfangled technology was slow at first but over the past ten years as battery capacities have grown and range anxieties have shrunk electric vehicles have become a daily sight in most parts of the country. Doesnt hurt that virtually every notable automaker on the planet has jumped on the electric bandwagon with sizable investments in battery and production technologies as well as pledges to electrify their lineups within a decade or so. Not even recent years production slowdowns and supply chain disruptions brought on by the COVID pandemic managed to stall the industrys momentum. The International Energy Agency in January reported that EVs had managed to triple their market share between 2019 and 2021 with 6. 6 million units being sold globally last year. Thats not to discount the crippling impacts of the chip shortage which saw fleets of nearlyfinished electrified vehicles parked and idled as they awaited necessary components. Or in Teslas case simply sold without the needed part oh calm down its just the steering column theres nothing critical in there anyway thats what autopilot is for right 2022 has eliminated any lingering doubts about whether EVs are here to stay hint they are. So far in 2022 global EV sales are up 70 percent or around 2 million units from 2021s figures according to Morgan Stanley. It is expecting a further 22 percent increase around another 1. 8 million units in 2023. Chinas BYD set monthly EV sales records throughout the year. Domestically an Experian study released in October noted more than 600000 new EV registrations through the first ten months of 2022 a 60 percent yearoveryear jump. EVs may not be quite as ruggedized as their hybrid cousins but who cares about that when youve got Ken Lets See If I Can Barrel Roll This Car Block blowing the doors off of the Vegas Strip in an 800V Audi S1 Hoonitron Or have VW tickling the American publics deep seated nostalgia with a reimagined Hippy Wagon for the 21st century Even Sony is getting into the EV game. EVs are no longer niche theyve become an indelible part of the culture. In terms of market share Tesla and BYD both retained their dominant positions within their relative markets and briefly jockeyed for the world number one spot before BYD pulled away. The Chinese automakers EV sales now account for nearly 20 percent of the global total. For its part Tesla passed notable milestones in its 10000th Model Y produced at the Texas Gigafactory and the millionth vehicle to roll out of production at Gigafactory Shanghai. 2022 also saw big moves and bigger investments from the rest of the automotive industry from Ford and General Motors especially. Ford began delivering its highlyanticipated F150 Lightning EV pickup in May turned them into roving conference rooms with help from Cisco began beta testing their bidirectional charging capabilities with Californias public utility as did GM developed a new battery chemistry announced plans to bring seven more EV models to the European market by 2024 and imagined a world without dealer showrooms for EV sales. General Motors had a banner year of its own. The company began production on its new marquee Lyriq EV unveiled its Yukon Denali Silverado Blazer and Celestiq EVs teased its upcoming Corvette hybrid and secured a sizable federal loan to expand its battery manufacturing base. Not to be left out Hyundai announced in 2022 a 5 billion investment in its USbased production capacity including a new EV factory in Georgia. The Korean automaker which has quietly risen to prominence in the US market in recent years announced its next EV flagship the Ioniq 6 in July the latest in Hyundais effort to release 17 electric vehicle models by the end of the decade. Kia Hyundais sister brand showed off the companys brawnier EV6 GT at Monterey Car Week. VWs 2022 was fruitful as well and it appears that the automaker has fully embraced its electrified future following the dieselgate scandal how could it not. VW opened a new ID. 4 production plant in Tennessee announced plans to invest an additional 7. 1 billion into its North American production capacity over the next five years and dipped its toes into the EV battery business as well. Pfft all Volvo did this year was debut the safest car ever. And it wasnt just the established brands Lucid Motors is riding high this holiday season buoyed by the November unveiling of its new top of the line Air Sapphire along with two ahem relatively less expensive Air model variants which will start at 87000 with 410 miles of range and go up from there. The company also revealed plans this year to sell 100000 units to the Saudi government which has heavily invested in the company. 2022 also saw a drastic expansion of the nations various fast charging networks. In June the Biden White House proposed a set of standards for the national EV charging network. The following month GM announced that it will partner with EVGo to create a 500station coasttocoast fastcharge network and in December opened its first two Community Charging Initiative sites in Wisconsin and Detroit. Hertz fresh off two significant purchase contracts with Polestar and GM revealed it is working with BP to host the latters BP Pulse chargers at select Hertz car rental locations not unlike what VW and BP have planned for Europe. Similarly IKEA will team up with Electrify America to bring EAs fast charging network to the Swedish homeware makers parking lots. Perhaps most exciting the White House in July confirmed rumors that Tesla would be opening its expansive North American SuperCharger network to nonTesla EVs by the end of the year thats an additional 1700plus charging points for drivers to fill up at. But 2022 wasnt all smooth asphalt and sunshine. Rivian fell on hard times this year struggling with production issues layoffs price hikes lawsuits in response to said price hikes followed by reversals of said price hiles delays to the R1S delivery schedule and trim level cullings. Rivian performed so badly in 2022 that it dragged Fords stock value down alongside it but it was still a better year than Lordstown had. And hey at least they didnt use the tip of their tongue to test for live wires like BMW did in July when it tried to paywall access to seat heaters that vehicle owners had already paid for. Even Mercedes had the good sense to charge 1200 a year only for funtime performance extras like added torque and a shortened 060 rather than essential capabilities like retaining rearend sensation on cold winter mornings. We also saw significant pricing fluctuations in EVs this year. Tesla raised prices across the board for its entire lineup as did Polestar with its single motor variant while VW dropped the price of its 2023 ID. 4 by around 4000 thanks to its use of a slightly smaller battery pack. For as eventful as 2022 turned out to be 2023 and beyond is sure to be even bigger for the EV industry. Were expecting debuts of the VW ID. 3 the Lucid Gravity Polestar 3 Jeep one of four and Honda Prologue SUVs. The Kia EV9 is slated for release in the second half of the year while the Buick Wildcat wont be realized until 2024. With any luck these EVs will serve merely as stopgaps until Volkswagen can perfect its Gen. Travel concept and begin shuttling us around in automated transport pods. Like WallE but just as fat.
Tesla shares are down 70% for the year as Morgan Stanley cuts price target,"Tesla's stock is finishing out its tumultuous year with yet more turbulence: It's up almost 6% Thursday, but still down more than 10% since last week. And a new cut to its price target from Morgan Stanley isn't helping.",2022-12-29T18:46:21Z,https://www.cnn.com/2022/12/29/business/tesla-stock/index.html,Teslas stock is finishing out its tumultuous year with yet more turbulence Its up almost 6 Thursday but still down more than 10 since last week. And a new cut to its price target from Morgan Stanley isnt helping. Yeartodate the stock is down about 70. Morgan Stanley analysts on Thursday said that the companys sliding stock price represents a buying opportunity but they cut its price target from 330 per share to 250. Tesla shares are trading at 122 with the stock up about 8 Thursday. Morgan Stanley still believes the company is somewhat undervalued as a result of the big recent selloffs citing its head start over the electric car competition and potential tax advantages as a result of the Inflation Reduction Act passed earlier this year. The losses however have further put a dent in the fortunes of one of the worlds richest people. According to the Bloomberg Billionaires Index CEO Elon Musk is now worth 132 billion less than half what he was worth at the beginning of the year. He lost the worlds richest person title two weeks ago to Bernard Arnault the chairman of French luxury goods giant LVMH LVMHF. Why Tesla is tanking A popular misconception has emerged about Elon Musk and Tesla The megabillionaires love affair with Twitter is the main reason Tesla shares have lost so much value this year. Even as Musk signals he may give up his CEO title at Twitter investors became concerned that the outlook for Teslas sales and profit is taking a turn for the worse. A sign of the weakening demand Tesla has announced a rare sale. The company offered two rebates for buyers who take delivery of a vehicle before the end of the year initially offering a 3750 discount earlier this month. Tesla then doubled that rebate to 7500 last Thursday. Tesla clearly is starting to see demand cracks in China and in the US at a time that EV competition is increasing across the board said Dan Ives tech analyst with Wedbush Securities and a Tesla bull who cut his price target for the stock last Friday from 250 to 175. The price cuts that Tesla enacted was the straw that broke the camels back on the stock. Another reason Teslas stock is sinking The US economy could tip into recession next year hurting car sales. Musk said on a Twitter Spaces call two weeks ago that he foresees the economy will be in a serious recession in 2023. I think there is going to be some macro drama thats higher than people currently think he said according to Reuters adding that homes and cars will get disproportionately impacted by economic conditions. Teslas questionable valuation Part of the problem with Teslas stock price is that critics question whether it was ever worth the trilliondollar valuation it had at the start of the year. At its peak Tesla was worth more than the 12 largest automakers on the planet combined despite having a fraction of the sales of any of them. Today it is worth 399 billion. It got ahead of itself in the nearterm said Gene Munster of Loup Ventures another Tesla fan. I still believe this can be a much bigger company. I think it will see those kinds of numbers again. But it could take a long long time to get there. Teslas growth prospects a target of 50 sales growth annually helped drive that valuation. It conceded in October that it will miss that sales target for this year. The stocks climb to dizzying heights rising 743 in 2020 alone was driven by Musks reputation as a genius who would disrupt the massive global auto industry. Tesla was viewed as a disruptive technology company not as an automaker and a large part of that premium is related to Musk said Ives. Overpromising and underdelivering Critics of Tesla said much of its skyhigh valuation was based on promises that Musk made about future products many of which came years after they were originally promised. A prime example is the Cybertruck the Tesla pickup truck first unveiled three years ago with promises that production would start in 2021. Now production is slated to start next year with a rampup in production in 2024 putting it years behind other electric pickup offerings from Ford and upstart EV maker Rivian both of which have electric pickups available for purchase today. It could also trail planned electric pickup offerings from General Motors. Elon Musk has a pathological problem with the truth said Gordon Johnson one of the largest critics of Tesla among analysts. When people say hes a genius and innovator its based on all his promises he never lives up to. Johnson said Tesla shares will have a much steeper fall ahead once it starts being priced like other automakers rather than on its promises. He said that for Tesla to hit its growth targets it needs to be building new plants almost every year but that new factories in Germany and Texas that opened in spring are still not operating at full capacity. And he said that its plant in China has had to scale back production due to weak sales in the market in the face of the Covid restrictions. Demand in the US has collapsed he said. Two months ago your wait time was two or three months. Now you can get one immediately. Theyre going to build more cars than they sell for a third straight quarter. Its the definition of excess capacity. Tesla is still by far the largest EV maker worldwide although that title is being challenged in some key markets by Volkswagen in Europe and by BYD in China. And more competition is coming from established automakers such as Ford and GM. The Twitter factor Thats not to say Twitter has played no role in Teslas stock price demise this year Tesla shares have lost over 65 of their value since Musks interest in Twitter was first disclosed in April with a nearly 50 decline since he closed on the deal in late October. Investors have been disappointed that Musk appears to be paying for so much of his 44 billion purchase of Twitter by selling Tesla stock. Musk Teslas largest shareholder has sold 23 billion worth of Tesla shares since his interest in Twitter became public in April. On a Twitter Spaces call last week call Musk promised he was done selling shares of Tesla TSLA stock until at least 2024 if not beyond. But he hasnt lived up to a previous promise in April that he was done selling Tesla TSLA shares selling 14. 4 billion of that stock since that time. Its been a Pinocchio situation for Musk saying he is done selling stock. Investors want to see him walk the walk and not just talk the talk said Ives.
Tesla's Model Y could fall foul of new EV tax credit eligibility rules,"Certain variants of Tesla's Model Y may not qualify for the $7,500 federal EV tax credit based on the IRS's latest guidelines, a situation that Elon Musk has called ""messed up."" It looks as though the five-seat Long Range version of the hatchback is too expen…",2023-01-04T10:12:29Z,https://www.engadget.com/teslas-long-range-model-y-may-not-qualify-for-the-ev-tax-credit-101229812.html,Certain variants of Teslas Model Y may not qualify for the 7500 federal EV tax credit based on the IRSs latest guidelines a situation that Elon Musk has called messed up. It looks as though the fiveseat Long Range version of the hatchback is too expensive as a car and not considered an SUV so it falls outside the current guidelines. That could change though as the rules wont be finalized until March 2023. The IRS has divided vehicles into two categories vans SUVs and pickup trucks under 80000 and other vehicles under 55000. For the first category the vehicle must have 4wheel drive or be rated at more than 6000 pounds of gross weight. It also has to meet four of five other characteristics most notably front and rear axle clearances of 18 centimeters or higher and a running clearance of at least 20 centimeters no Model Y meets these specs. According to the IRS only the 7seat variants of the Model Y qualify as SUVs in the category up to 80000 while the 5seat vehicles Long Range AWD and Performance are in the 55000 section. The 7seaters comfortably fall under the 85000 limit but all the 5seaters exceed the 55000 price so they dont qualify. Tesla doesnt have a specific AWD variant of the Model Y in the US both the Long Range and Performance models are AWD so its not clear which model the IRS is referring to. The 5 and 7seat versions cost the same starting at 65990 for the Long Range version before destination and order charges. Critics are pointing out that far more polluting hybrid vehicles qualify for the tax credits including two Jeeps the Audi Q5 e Quattro BMW X5 xDrive45e and Fords Escape PHEV. However if someone buys a Jeep Wrangler with 56 MPGe 23 MPG after the battery is depleted instead of a Tesla Model Y with 122 MPGe then the government clearly isnt doing the most it can to reduce carbon emissions. The IRS has invited consumers to comment on the matter and Musk encouraged people to do so in a tweet.
