Title,Description,PublishedAt,URL,Content
Tesla cuts prices in China for the second time in three months as demand slows,"Tesla has slashed car prices in China for the second time in less than three months, in an effort to boost sales amidst slowing demand in the world's largest car market.",2023-01-06T11:12:16Z,https://www.cnn.com/2023/01/06/economy/tesla-china-price-cut-slowdown-intl-hnk/index.html,Tesla has slashed car prices in China for the second time in less than three months The electric vehicle maker cut prices for all versions The starting price for Model 3 has been reduced by 13. 5 to 229900 yuan 33515 while the starting price for Model Y has been slashed by 10 to 259900 yuan 37889 according to CNN calculations. This is the second price cut since October 24 when Tesla TSLA reduced the prices of Model 3 and Model Y by as much as 9. 4. Previously Tesla TSLA had increased prices by several times in the past two years. Teslas price cuts are backed by innumerable engineering innovations said Grace Tao Teslas vice president for external relations in China on her Weibo account on Friday. We are responding to the countrys call with practical actions to promote economic development and release the potential of domestic demand. The discount comes at a time when the American electric vehicles maker is struggling to maintain its sales in China its biggest international market. In December Teslas Shanghai factory delivered 55796 vehicles down 44 from November according to figures released by the China Passenger Car Association on Thursday. Overall sales in December reported by automakers fell 4 from the same month a year ago as the worlds second largest economy slows to the weakest pace in decades. Teslas price cuts come days after Beijing The Chinese government had planned to phase out its costly EV subsidy program by the end of 2020 but extended it during the pandemic to avert a sharp economic slowdown. The company has been struggling outside China as well. Last year Tesla produced more cars than it delivered which means its inventory has increased. On Tuesday Teslas stock on Wall Street had its worst day in two years dragged down by weakerthanexpected sales data globally. The companys shares ended 2022 down 65 greatly cutting into CEO Elon Musks net worth. The major worry now for Tesla is that the demand story especially out of China is showing heavy cracks in the armor said analysts from Wedbush Securities earlier this week. EV competition is also increasing domestically in China with Nio BYD Xpeng and other brands fighting for a smaller pie they said. A potential pricing war could take place to gain market share they added. CNNs Chris Isidore and David Goldman contributed to the article.
Tesla plunges 250 feet off a California cliff and the 4 occupants survive,Two adults and two children somehow escaped serious injuries after their Tesla plunged off a cliff along California's Pacific Coast Highway and crashed on a rocky beach some 250 feet below.,2023-01-03T21:16:34Z,https://www.cnn.com/2023/01/03/us/tesla-crash-cliff-california-cec/index.html,Editors Note The man was arrested after allegedly driving off a cliff intentionally on the Pacific Coast Highway. Find the latest story here. Two adults and two children somehow escaped serious injuries after their Tesla plunged off a cliff along Californias Pacific Coast Highway and crashed on a rocky beach some 250 feet below. The incident occurred Monday morning at an area called Devils Slide some 20 miles south of San Francisco. We were very shocked to discover that people in the car had survived the crash said Brian Pottenger battalion chief with Cal Fires Coastside Fire Protection District. Accidents on that cliff are not rare. We do respond to a lot of vehicles on that cliff he told CNN. Whats rare is that we do not get a lot of survivors surviving this type of accident is very rare. Pottenger said the car contained an adult male an adult female a 9yearold boy and a 4yearold girl. The children were both secured in car seats which remained intact and in place he said. Officials said the fourdoor white Tesla sedan was traveling southbound on Highway 1 just south of the Tom Lantos Tunnel between Pacifica and Montara when it veered off the roadway. They did not cite a reason for the crash. A spokesperson for the California Highway Patrol told CNN they do not believe any of the Teslas selfdriving features were active at the time. The damage to the vehicle would indicate that it hit and then flipped several times Pottenger said. The car came to rest on its wheels he added. Firefighters rappelled down the cliff to the car while other first responders watched through binoculars. As we were doing that we were able to notice movement in the front seat through the windshield Pottenger said. So we knew that we had at least one person that was alive. The cars occupants were trapped inside the mangled vehicle officials said. All four were conscious when the fire department reached them Pottenger told CNN. Crews freed the two children and used a rope to lift them up the cliff in baskets. Later a California Highway Patrol helicopter hoisted the two adults to safety. The California Highway Patrol posted dramatic video of the helicopter lowering a rescuer on a cable to the crash site while surf crashed against the rocks below. The San Mateo Sheriffs Office said Monday that the two adults suffered nonlife threatening injuries and the two children were unharmed. The cars occupants were transported to Stanford Medical Center for treatment Pottenger said. An update on their conditions was not available Tuesday. Officials have not released the identities of the four survivors or said whether all four were from the same family. The CHP is investigating and will determine the cause of the crash Pottenger said. This was a traumatic accident and they survived he said. And it was a good outcome to a very bad situation. CNNs Taylor Romine contributed to this story.
Top Tesla investor has buyer's remorse and says Elon Musk is 'killing' the EV company with stock sales,"""I am 100% in Tesla bc I believe in Elon Musk and Tesla. But he is killing SH and Tesla. If I knew I wouldn't invest in Tesla,"" Leo KoGuan tweeted.",2023-01-09T17:48:33Z,https://markets.businessinsider.com/news/stocks/tesla-stock-investor-leo-koguan-elon-musk-share-sales-twitter-2023-1,Teslas third largest shareholder appeared to show some buyers remorse as he criticized Elon Musks share sales. I am 100 in Tesla bc I believe in Elon Musk and Tesla. But he is killing SH and Tesla. If I knew I wouldnt invest in Tesla Leo KoGuan tweeted. But in a series of weekend tweets he also said he bought more Tesla stock last week. Teslas thirdlargest individual shareholder thinks Elon Musk is damaging shareholders and the company through massive sales of personal stock. In a series of tweets over the weekend Leo KoGuan seemed to express some buyers remorse but still reaffirmed his commitment to the stock. I am 100 in Tesla bc I believe in Elon Musk and Tesla. But he is killing SH and Tesla. If I knew I wouldnt invest in Tesla. Elon invested 200mm but took out 40B Larry invested 1B I invested over 3B I have no choice but to act and speak out. I cry out to U for help KoGuan said on Saturday. Musk has cashed in nearly 40 billion of Tesla stock since November 2021. Meanwhile Tesla earned less than 9 billion of net income in the nine months to September 30. Tesla stock lost a staggering 65 in 2022. KoGuans comments come as Musk draws scrutiny for his focus on his latest role as chief executive at Twitter the social media company he acquired in October. In his tweetstorm over the weekend he dismissed some of his critics as cult followers and directed his criticism largely at Musk whom he seems to refer to as the one. I contacted the board and the one for about 1 year what I got was nothing or at best only empty promises. Actually from these interactions I found out Tesla is one man show company but it is no longer a family business. It is a public company with more than 100000 employees added KoGuan founder and chairman of IT provider SHI International. He currently sits on roughly 23 million shares as of September 2022 and amassed the majority of the fortune during the pandemic months of 2020. Despite his criticism of Musk KoGuan tweeted Friday that he bought 450000 additional Tesla shares last week and plans to buy a million more. He remains a fervent supporter of the company and last month said he plans to invest more billion bc Tesla will be the biggest company with or without Elon. Also last month KoGuan said that it may be time for a new CEO saying Musk has abandoned Tesla. And last week he suggested Musk was intentionally sending the electriccar makers stock lower.
The truth about 'medbeds' - a miracle cure that doesn't exist,Why has a fictional miracle cure taken off online - and who's making money out of it?,2022-12-27T00:45:37Z,https://www.bbc.co.uk/news/blogs-trending-64070190,The truth about medbeds a miracle cure that doesnt exist Published Strange corners of the internet are awash with chatter about miracle devices that can cure nearly any ailment you can think of using the power of mystical energy. Some companies charge thousands for these medbeds but their claims are far from proven. A converted motel in a small town on the Mississippi River seems an unlikely home for a worldchanging technology what a flyer in the mostly deserted lobby calls a new wave of scientific healing. But since last summer this building in East Dubuque Illinois three hours west of Chicago has been outfitted with medical devices that supposedly imbue patients with life force energy. Its one of a number of locations run by Tesla BioHealing no relation to the car company dotted around the US. I tried out a medbed on a recent gloomy weekday afternoon. After being greeted at the front desk a doctor tested my energy levels by having me place my fingers inside a metal box. Then I was ushered into one of the rooms mostly unchanged from its motel days and I waited for pure biophoton lifeforce energy to stream into my body. The idea of medbeds short either for medical beds or meditation beds has become increasingly popular on fringe medical channels on mainstream social networks and chat apps. But people have very different ideas about what they actually are. Some insist that the technology is secret unlikely to be encountered by mere mortals hidden from the public by billionaires and the deep state. The more conspiratorial theorising includes speculation about alien technology and bizarre claims like the idea that John F Kennedy is still alive strapped to a medbed. A separate more earthly avenue of thought holds that medbeds are very real and publicly available just not part of the medical mainstream. Its this strand that Tesla BioHealing and a range of other companies are staking their rather expensive claims on. Tesla BioHealing offers home generators for prices up to 19999 16500 although an hour in one of their medbed motel rooms will only set you back 160 130. But even in the consumerfocused medbed world where there is no talk of aliens or JFK theres disagreement about what a medbed actually is. And theres a very good reason for that says Sara Aniano a disinformation analyst at the Anti Defamation Leagues Centre on Extremism. Its really hard to define something that doesnt exist she says. Ms Aniano has been researching the spread of medbed chat online and as part of her inquiries signed up for trial with a different medbed company 90. 10. The trial is nothing she says. It tells you to lay on your bed and think really hard about the medbed. In their defence they do list on their website in the very fine print down at the bottom that the medbed is not meant to treat or diagnose illnesses she says. Its a common disclaimer that we saw used in some form by just about every company offering a medbedrelated product. Even though companies put out long lists of ailments that can supposedly be helped by their technologies and provide testimonials from satisfied customers they say that their products are not meant to replace treatments by a qualified doctor. Tesla BioHealing is no exception. The top of the companys website clearly states We cannot diagnose treat cure or prevent any disease or condition. And yet their promotional material states Many people note improvements in their wellbeing even after only an hour of resting on a Tesla MedBed. They also make a number of specific unsupported claims about particular diseases. The staff at the Tesla BioHealing motel in East Dubuque told me about legions of customers with all manner of ailments all of whom they said had been helped by medbeds. But in my room I felt nothing more than curiosity and a slight sense of unease as I gazed out the window at a mostly empty car park. The Tesla Medbed cannisters were sealed in wooden boxes and a bedside table. Cutting short my hour I returned to the doctors office where she repeated the test with my fingers in the metal box. Sure enough my energy as measured by the doctors laptop was already rising. But neither the doctor nor anyone else at Tesla BioHealing could tell me what was inside the medbed cannisters themselves. Some enterprising customers have taken it upon themselves to try to find out. We came across a TikTok video where an upset punter appears to have opened up a cannister only to find a concretelike substance. For anyone whos thinking about buying one of those Tesla biohealers dont waste your money she says. The company wouldnt be drawn on what active ingredients if any are inside the cannisters. But they told us in an email There is much more going on with our technology than meets the eye. And while they said the Tesla cannisters were not intended to replace a doctors care they also made further claims of cures and said Health benefits are priceless. Both Tesla BioHealing and 90. 10 pointed us to thousands of positive customer testimonials. And despite the prominent claim on the company website that 90. 10 offers Quantumfrequency medicine with scientific proof 90. 10 chief executive Oliver Schalke told us It is not a medical product and was never intended to be. How then are the medbed companies allowed to offer their products hint at miraculous effects but escape any regulatory oversight Dr Steven Barrett a retired psychiatrist who has been investigating questionable claims for decades says the health care regulator in the United States the Food and Drug Administration FDA is partly to blame. FDA registration is required by any manufacturer who wants to market products but it just means that youve notified the FDA that you exist he says. Tesla BioHealing and other companies advertise that they are FDA registered but that is next to meaningless. FDA registration says nothing about whether a device is useful says Dr Barrett. When it comes to making vague claims about general wellbeing or unprovable statements about increased energy authorities do almost nothing about it he says. He speaks with a note of weariness perhaps because of a lack of biophotons but more likely the result of spending decades tracking dubious health claims. Do I think that exposure to whatever it is that theyre giving you in the bed is going to make you more energetic I seriously doubt that he says. Indeed as I began a long evening drive home from East Dubuque under cloudy skies I felt distinctly lacking in life force energy. With reporting by Elizabeth Hotson and Shayan Sardarizadeh
U.S. asks Tesla about Musk tweet on driver monitoring function - Reuters,"The National Highway Traffic Safety Administration (NHTSA) said Monday it is in contact with Tesla <a href=""https://www.reuters.com/companies/TSLA.O"" target=""_blank"">(TSLA.O)</a> about a tweet Tesla Chief Executive Elon Musk wrote about a driver monitoring fu…",2023-01-09T15:56:00Z,https://www.reuters.com/business/autos-transportation/us-asks-tesla-about-musk-tweet-driver-monitoring-function-2023-01-09/,U. S. asks Tesla about Musk tweet on driver monitoring function WASHINGTON Jan 9 Reuters The National Highway Traffic Safety Administration NHTSA Monday said it was in contact with Tesla TSLA. O about a tweet Chief Executive Elon Musk wrote about a driver monitoring function. A Dec. 31 tweet suggested drivers with more than 10000 miles using Teslas Full SelfDriving FSD software system should be able to disable the steering wheel nag an alert that instructs drivers to hold the wheel to confirm they are paying attention. Musk responded Agreed update coming in Jan. NHTSA Monday said it is in contact with Tesla to gather additional information. The Associated Press reported NHTSAs statement earlier. Tesla did not immediately comment. The auto safety agency confirmed the questions about Musks tweet are in connection with its ongoing defect probe into 830000 Tesla vehicles with driver assistance system Autopilot and involving crashes with parked emergency vehicles. NHTSA is reviewing whether Tesla vehicles adequately ensure drivers are paying attention and previously said evidence suggested drivers in most crashes under review had complied with Teslas alert strategy that seeks to compel driver attention raising questions about its effectiveness. Tesla sells the 15000 FSD software as an addon which enables its vehicles to change lanes and park autonomously. That complements its standard Autopilot feature which enables cars to steer accelerate and brake within their lanes without driver intervention. Both systems use the steering wheel monitoring function. Last month NHTSA said it had opened two new special investigations into crashes involving Tesla vehicles where advanced driver assistance systems are suspected to have been in use. Since 2016 NHTSA has opened more than three dozen Tesla special crash investigations where advanced driver assistance systems such as Autopilot were suspected of being used with 19 crash deaths reported. In December 2021 NHTSA opened a probe into Teslas decision to allow games to be played by passengers on the front center touchscreen covering 580000 vehicles over the vehicles Passenger Play over driver distraction concerns. Soon after the investigation was opened Tesla told NHTSA it would stop allowing video games to be played on vehicle screens while its cars are moving the agency said. Our Standards The Thomson Reuters Trust Principles.
"Man Who Survived 250-Foot Cliff Plunge in Tesla Was Trying to Kill His Family, Police Say","A 41-year-old man from California, was arrested on Tuesday on charges of attempted murder and child endangerment after police concluded that he had intentionally driven a Tesla with his family inside over a 250-foot cliff. Although the car was left mangled, a…",2023-01-04T14:15:00Z,https://gizmodo.com/tesla-cliff-dharmesh-patel-murder-family-devils-slide-1849947767,A 41yearold man from California was arrested on Tuesday on charges of attempted murder and child endangerment after police concluded that he had intentionally driven a Tesla with his family inside over a 250foot cliff. Although the car was left mangled all four people in itthe driver his wife and their two young childrensurvived. California authorities received a report Monday about the crash which occurred on Highway 1 in an area called Devils Slide known as being hard to drive through. Upon arriving at the scene they found that Dharmesh Patel his wife their 9yearold son and their 4yearold daughter were not only alive but conscious. After reviewing the evidence collected the California State Highway Patrol said on Tuesday that there was probable cause to believe this incident was an intentional act according to CNN. Brian Pottenger a battalion chief with the Coastside Fire Protection District told news outlets that the damage to the Tesla indicated that it hit the ground and then flipped several times before landing upright on its wheels. In an interview with the New York Times Pottenger underscored how noteworthy it was that the story ended the way it did. It is very unusual for anyone to survive an accident of this magnitude in this area Pottenger told the outlet. Firefighters rappelled down the cliff to the car to rescue the two children while California Highway Patrol used a helicopter to extricate the two adults. The rescue of the adults can be seen in a dramatic and jawdropping video highway patrol posted on Facebook. Due to conflicting media reports the extent of the familys injuries is currently not clear. Given Teslas dangerous track record of accidents involving its selfdriving modes some questioned whether the car itself was to blame for the horrifying incident. However the California Highway Patrol said the vehicle didnt appear to be the culprit. There has been no determination as to what driving mode the Tesla was in however that does not appear to be a contributing factor in this incident the highway patrol said as reported by CNN.
Elon Musk: Only blue tick users to vote in Twitter polls on policy,The billionaire says he will change the policy on Twitter votes after users say he should step down.,2022-12-20T12:10:16Z,https://www.bbc.co.uk/news/business-64034892,Elon Musk Only blue tick users to vote in Twitter polls on policy Published Elon Musk has said Twitter will only allow accounts with a blue tick to vote on changes to policy after a majority of users voted for him to quit. Mr Musk launched a Twitter poll asking if he should step down as chief executive 57. 5 of users voted yes. Since then he has not commented directly on the result of the poll. But he has said that Twitter will alter its rules so that only people who pay for a subscription can vote on company policy. One user claimed that socalled bots appeared to have voted heavily in the poll about Mr Musks role at the firm. Mr Musk said he found the claim interesting. The billionaire had said when he ran the poll that he would abide by the result. If he does quit as chief executive he will remain as Twitters owner. Bruce Daisley former vice president of Twitter compared any potential change to that of a football manager. The chairman still remains and Elon Musk is going to be that everpresent voice in the back of the room he told the BBCs Today programme. However Mr Musks intentions remain unclear. Although US broadcaster CNBC tweeted on Tuesday that Mr Musk is actively searching for a new chief executive for Twitter Mr Musk responded with two laughing emojis. In response to a tweet saying Twitter Blue subscribers should be the only ones that can vote in policy related polls. We actually have skin in the game Mr Musk said Good point Twitter will make that change. Twitters paidfor verification feature was rolled out for a second time last week after its launch was paused. The service costs 8 per month or 11 for people using the Twitter app on Apple devices and gives subscribers a blue tick. Previously a blue tick was used as verification tool for highprofile accounts as a badge of authenticity and was free. On Monday Mr Musk held a poll on his future as chief executive. More than 17. 5 million users voted and the majority backed him stepping down. Should I step down as head of Twitter I will abide by the results of this poll. Elon Musk elonmusk December 18 2022 While the poll was running he replied to one user suggesting there was no replacement chief executive lined up saying No one wants the job who can actually keep Twitter alive. There is no successor. The technology tycoon who also runs electric car maker Tesla and space rocket firm Space X has faced much criticism since taking over the site. He has obeyed the results of his Twitter polls in the past and quoted the phrase vox populi vox dei a Latin phrase which roughly means the voice of the people is the voice of God. Mr Musk bought Twitter for 44bn 36bn in October after attempting to back out of the deal. Since taking control he has been criticised for his approach to content moderation with some civil liberties groups accusing him of taking steps that will increase hate speech and misinformation. On Friday he was condemned by the United Nations and European Union over Twitters decision to suspend some journalists who cover the social media firm. He has also fired about half of Twitters staff. Mr Daisley said through Mr Musks activity you could get a hint over what he was thinking through his replies to users. He does seem to be quibbling with the vote he added. Mr Musk has also been accused of neglecting his electric car company Tesla which is where most of his wealth is. Tesla shares have lost more than 60 in value this year with some saying his obsession with Twitter is destroying the brand. Last week Leo KoGuan the third largest individual shareholder in Tesla called for Mr Musk to step down as the boss of the electric car maker. Elon abandoned Tesla and Tesla has no working CEO. Tesla needs and deserves to have a working full time CEO he tweeted.
