Title,Description,PublishedAt,URL,Content
Tax credit confusion could create a rush for electric vehicles in early 2023,"As the new year begins, a number of popular electric vehicles, specifically some Tesla and General Motors models, could be eligible for $7,500 worth of tax credits they weren't eligible for in 2022. But that eligibility may last only last a few months.",2022-12-28T18:09:22Z,https://www.cnn.com/2022/12/28/business/ev-tax-credit/index.html,As the new year begins a number of popular electric vehicles specifically some Tesla and General Motors models could be eligible for 7500 worth of tax credits they werent eligible for in 2022. But that eligibility may last only last a few months. Thats because The US Treasury Department which is implementing the rules recently announced that rules for some of the new restrictions on the tax credits including around where the vehicles battery pack is assembled and where the minerals used in it came from were being postponed until at least March of 2023 when it announces proposed rules around that part of the requirements. According to language in the legislation though just the publication of the proposed guidance around these rules which Treasury said would happen in March will immediately trigger the reductions in tax credits. General Motors While that could create a buying opportunity in the first months of the year the downside is that it just adds to confusion around what is already a baffling set of rules even by tax regulation standards. I was kind of hoping for more clarity not less said Chris Harto a senior Essentially the tax rules are designed to incentivize automakers to make their electric vehicles and all the parts of those vehicles as much as possible in the United States or in countries with which the US has trade agreements. Theyre also designed so tax credits dont go to wealthy Americans buying expensive luxury vehicles. The latest announcement which will temporarily open up more tax credit money is likely Figuring out who and what qualifies The lopsided tax credit at the start of the year is just one of several potential sources of confusion. Under the new EV tax credit rules the Chevrolet Bolt EV and EUV are eligible for tax credits in the new year. They had previously been ineligible because even though theyre built in North America one of the requirements Still not every buyer and not every electric vehicle will be eligible for credits. For instance besides the requirement that the vehicle must be built in North America there will be restrictions on its price too. If its an SUV van or pickup its sticker price must not be higher than 80000 and if its a car not more than 55000. These price caps will be based on the vehicles full Manufacturers Suggested Retail Price MSRP or sticker price including all factoryinstalled options. If the dealer charges more for the vehicle or it theres a discount or rebate that wont matter. Eligibility for the rebate is based only the actually MSRP. As a result most Tesla models including It shuffles the deck as to whos eligible and then the deck will get shuffled again when this guidance comes out in March said Harto. And it just makes a giant mess for consumers and automakers and dealers. Also no flipping allowed. The person purchasing the vehicle has to be the end user. If youre purchasing the vehicle just to immediately resell it to someone else you cant claim the credit. There are also limits on the buyers income. The purchaser cant have a modified adjusted gross income over 150000 for an individual 300000 for a couple filing jointly or 225000 for a single head of a household. These restrictions will keep many luxury electric vehicle buyers from getting tax credits. The best thing vehicle shoppers can do is ask whether the specific vehicle theyre buying qualifies for a tax credit said Andrew Koblenz vice president for legal and regulatory affairs at the National Automobile Dealers Association. Some vehicle models are made in more than one factory so two identical looking electric SUVs on the same dealer lot might not both qualify or might not qualify for the same amount of credit. Its a great time to be shopping. Its great that there will be more vehicles eligible now but youve still got to make sure the one youre interested in is eligible Koblenz said. You need to ask your dealer and your manufacturer that question and youve got to make sure that you qualify too. CNNs Christine Romans contributed to this story.
Factbox: Tesla's key managers in China - Reuters,"Tesla Inc <a href=""https://www.reuters.com/companies/TSLA.O"" target=""_blank"">(TSLA.O)</a> has <a href=""/business/autos-transportation/tesla-sends-shanghai-boss-aides-jumpstart-us-output-2022-12-21/"">tapped China chief Tom Zhu</a> to troubleshoot production en…",2022-12-22T09:39:00Z,https://www.reuters.com/business/autos-transportation/teslas-key-managers-china-2022-12-22/,Factbox Teslas key managers in China SHANGHAI Dec 22 Reuters Tesla Inc TSLA. O has tapped China chief Tom Zhu to troubleshoot production engineering challenges in the United States according to two people with knowledge of the matter. They are working on upcoming projects including the Cybertruck the people said adding that Zhus colleagues in China believe he is being groomed for a bigger role at a time when CEO Elon Musk is seeking to overhaul Twitter. Here is a look at Zhu and other key China managers who have helped Teslas Shanghai factory roar back from lockdowns to bring the electric vehicle maker close to its global growth targets for the year. TOM ZHU Zhu who was born in China but now holds a New Zealand passport joined Tesla in 2014. Before that he was a project manager at a company established by his MBA classmates at Duke University advising Chinese contractors working on overseas infrastructure projects. Zhu was overseeing projects for Kaibo Engineering in Libya and Sudan when he was introduced to Cal Lankton then director of global EV charging infrastructure at Tesla. Lankton later hired Zhu to take charge of Teslas charging facility construction in China according to one of the people who is close to Zhu. The people were not authorized to speak to media and declined to be identified. Zhu could not be reached for comment and Telsa did not respond to requests for comment. Zhu took over as China country manager for Tesla at end 2014 when sales of the Model S were declining in the worlds largest auto market. Under Zhu Tesla cars were exempted from traffic restriction rules in major cities such as Beijing and the automaker launched an adapter so the cars could be charged using a revamped Chinese charging standard. The moves boosted Teslas sales in China and its revenue from China more than tripled in 2016 from 2015. During Shanghais twomonth COVID lockdown Zhu was among the first batch of employees sleeping in the factory as they sought to keep it running people who work with him said. After 22 days of shutdown the Shanghai plant resumed partial production with a closed loop system where thousands of workers and suppliers lived and worked in the factory for weeks. Zhu a nofuss manager who sports a buzz cut favors Teslabranded fleece jackets and lives in a governmentsubsidized apartment that is a 10minute drive from the Shanghai Gigafactory. When Tesla posted a picture on Twitter last week to celebrate its Austin Texas plant hitting a production milestone Zhu was among hundreds of workers smiling on the factory floor. ALLAN WANG Allan Wang was promoted to vice president in charge of sales and delivery in China in July according to his Linkedin profile. Since November Tesla has been offering incentives and discounts to buyers in its secondlargest market. Wang who joined Tesla in 2014 worked for Apple and AMD previously. SONG GANG Song Gang has been plant manager of Giga Shanghai since 2018. He was a longtime project engineer at General Motors GM. N and Ford Motor Co F. N before moving to oversee production for Zhidou an EV startup in 2015. Song has been among the Tesla executives who have been traveling with Zhu. Our Standards The Thomson Reuters Trust Principles.
Tesla nears deal to build production facilities in Indonesia ... - Reuters,"Tesla Inc <a href=""https://www.reuters.com/companies/TSLA.O"" target=""_blank"">(TSLA.O)</a> is nearing a preliminary deal to build production facilities in Indonesia with a capacity of one million units, Bloomberg News <a href=""https://www.bloomberg.com/news/ar…",2023-01-11T13:47:00Z,https://www.reuters.com/business/autos-transportation/tesla-nears-deal-build-production-facilities-indonesia-bloomberg-news-2023-01-11/,Tesla nears deal to build production facilities in Indonesia Bloomberg News Jan 12 Reuters Tesla Inc TSLA. O is nearing a preliminary deal to build production facilities in Indonesia with a capacity of one million units Bloomberg News reported on Wednesday citing unidentified people familiar with the matter. Chief Executive Elon Musk tweeted on Wednesday Please be cautious about writing articles citing unnamed sources as they are frequently false in a comment on a tweet referencing the report. Indonesias senior cabinet minister Luhut Pandjaitan who has been leading the talks with Tesla said negotiations were still ongoing but declined to say more citing a nondisclosure agreement. The electricvehicle maker did not immediately respond to Reuters requests for comment. Musk last month said Tesla was close to picking the location of its new Gigafactory following media reports that the automaker could announce a new factory in the northern Mexican state of Nuevo Leon as soon as December. In November Musk said South Korea was among its top candidate locations for a factory it plans to build in Asia for making EVs according to South Koreas presidential office. Tesla makes its electric cars in Chinas Shanghai Germanys Berlin and Austin and Fremont in the United States. The latest report said the Indonesia talks include plans for production facilities and to facilitate the companys supply chain. Tesla has signed contracts worth about 5 billion to buy materials for batteries from nickel processing companies in Indonesia Luhut told CNBC Indonesia last year. Indonesian President Joko Widodo urged the electric vehicle maker to manufacture its cars as well as batteries in the country in comments made to Bloomberg News in August. Our Standards The Thomson Reuters Trust Principles.
"Factbox: Details of Tesla price cuts in China, other Asian markets - Reuters","Tesla <a href=""https://www.reuters.com/companies/TSLA.O"" target=""_blank"">(TSLA.O)</a> cut electric car prices in China and other Asian markets on Friday, part of efforts to stoke demand for output from its Shanghai plant, a person with direct knowledge of the…",2023-01-06T09:12:00Z,https://www.reuters.com/technology/details-tesla-price-cuts-china-other-asian-markets-2023-01-06/,Factbox Tesla cuts prices globally in a bid to spur demand Jan 13 Reuters Tesla Inc TSLA. O has slashed prices of its electric vehicles in the United States and Europe doubling down on a discount drive it started in Asia as demand slows against the backdrop of a weakening economy. The Elon Muskled company missed its target in 2022 to grow deliveries by 50 annually and reported that sales of its Chinamade cars hit a fivemonth low in December underlining the hit from rising interest rates and growing recession fears. Following are details of the price cuts CHINA Tesla slashed prices for all versions of its Model 3 and Model Y cars in China by between 6. 0 and 13. 5 according to Reuters calculations based on the prices shown on its website. The starting price for Model 3 for instance was cut to 229900 yuan 33427 from 265900 yuan. The latest cut in China along with a price cut in October and incentives extended to Chinese buyers over the past three months mean a 13 to 24 reduction in Teslas prices from September in its secondlargest market after the United States according to Reuters calculations. JAPAN Tesla cut the prices of Model 3 and Model Y cars by about 10 each in the country the first time it had done so since 2021. The price for the Model 3 rearwheel drive version is now 5. 369 mln yen 40091 down from 5. 964 mln yen. SOUTH KOREA Teslas price cuts in the country differed from model to model but ranged from about 6 mln won to 10 mln won 4725 to 7875 a local Tesla sales official said. The price of Teslas basic Model 3 rearwheel drive vehicle was listed as 64. 34 mln won 50637 on the companys website on Friday. Its Model Y Long Range sports utility vehicle was 84. 999 mln won. UNITED STATES Teslas U. S. price cuts on its global topsellers the Model 3 sedan and Model Y crossover SUV were between 6 and 20 Reuters calculations showed. The basic version of its Model Y now costs 52990 down from 65990 previously. The company also cut prices for its Model X luxury crossover SUV and Model S sedan in the United States. GERMANY Tesla cut prices on the Model 3 and the Model Y by about 1 to almost 17 depending on the configuration. FRANCE Customers buying the Model 3 for 44990 euros 48638. 69 will now get a further price reduction through a government subsidy of 5000 euros. The upper limit for the EV scheme is 47000 euros. 1 6. 8775 Chinese yuan 1 133. 9200 yen 1 0. 9250 euros This story has been refiled to change picture Our Standards The Thomson Reuters Trust Principles.
NVIDIA's GeForce Now game streaming is coming to cars,You'll soon have access to a host of PC games in your car without buying a Tesla. NVIDIA has announced that it's bringing GeForce Now game streaming to cars using the company's Drive platform. The rollout will offer access to titles like Cyberpunk 2077 on a d…,2023-01-03T16:45:11Z,https://www.engadget.com/nvidia-geforce-now-game-streaming-in-cars-164511641.html,Youll soon have access to a host of PC games in your car without buying a Tesla. NVIDIA has announced that its bringing GeForce Now game streaming to cars using the companys Drive platform. The rollout will offer access to titles like Cyberpunk 2077 on a driver display while youre charging or parked or any time from the backseat. That could be more than a little helpful on a vacation especially if youd rather not buy a Steam Deck or Switch for a budding young gamer. The cloud gaming option already has initial support from major brands like the Hyundai group including Genesis and Kia Polestar and Chinas BYD. NVIDIA didnt offer a timeframe for GeForce Now access although it noted that BYD would offer Drive Hyperionpowered cars in the first half of 2023. The Polestar 3 SUV built using Drive Orin arrives in late 2023. The incar GeForce Now client works on either Android or webbased infotainment systems. NVIDIAs service provides a catalog of 1500 games over 1000 of which are playable using gamepads. While most of the selection is paid there are freetoplay options like Destiny 2 and Fortnite. As with other game streaming services this could get costly if you plan to use it often. While basic GeForce Now use is free you can pay up to 200 per year for the full experience before you factor in the cost of the games themselves. In some cases though this might make more sense than buying a handheld console or tablet. You only need to pay for a higherend plan when you expect to use it after all you could subscribe during a road trip and stick to free usage when youre commuting around town.
"U.S. Senate Finance Committee asks GM, Tesla, Toyota about ... - Reuters","The U.S. Senate Finance Committee asked eight major automakers, including General Motors <a href=""https://www.reuters.com/companies/GM.N"" target=""_blank"">(GM.N)</a>, Tesla <a href=""https://www.reuters.com/companies/TSLA.O"" target=""_blank"">(TSLA.O)</a>, Ford M…",2022-12-22T17:01:00Z,https://www.reuters.com/business/autos-transportation/us-senate-finance-committee-asks-gm-tesla-toyota-about-chinese-supply-chain-2022-12-22/,U. S. Senate committee asks carmakers about Chinese supply chain WASHINGTON Dec 22 Reuters The U. S. Senate Finance Committee has asked eight major automakers including General Motors GM. N Tesla TSLA. O and Ford Motor F. N to disclose whether any of their components are linked to alleged forced labor use in China according to letters made public on Thursday. In June a U. S. law took effect banning the import of forcedlabor goods from Xinjiang in a pushback against Beijings treatment of Chinas Uyghur Muslim minority which Washington has labeled genocide. Senate Finance Committee Chair Ron Wyden wrote the chief executives of major automakers inquiring about Chinese supply chain issues saying it is vital that automakers scrutinize their relationships with all suppliers linked to Xinjiang. Beijing denies abuses in Xinjiang but says it had established vocational training centers to curb terrorism separatism and religious radicalism. The letters which were also sent to Toyota Motor 7203. T Volkswagen VOWGp. DE Chryslerparent Stellantis STLA. MI and MercedesBenz said unless due diligence confirms that components are not linked to forced labor automakers cannot and should not sell cars in the United States that include components mined or produced in Xinjiang. Wyden wants to know whether the automakers have ever canceled or curtailed use of any supplier because of its use of raw materials mining processing or parts manufacturing linked to Xinjiang He cited a new report released earlier this month by researchers at Britains Sheffield Hallam University on the auto industrys use of steel aluminum copper batteries electronics and other components produced in Xinjiang. Between raw materials miningprocessing and auto parts manufacturing we found that practically every part of the car would require heightened scrutiny to ensure that it was free of Uyghur forced labor the report said. GM said Thursday it actively monitors its global supply chain and that its supplier contracts forbid the use of any forced or involuntary labor abusive treatment of employees or corrupt business practices in the supplying of goods and services to GM. Honda said it expects suppliers to follow its global sustainability guidelines with respect to labor. Stellantis said building strong responsible supply chains is an important focus for us and monitors suppliers compliance with its code of conduct through contractual commitments and ongoing evaluations. Volkswagen said it would respond to the Senate letter and emphasized it takes corporate responsibility seriously and rejects forced labor and all forms of modern slavery including human trafficking. The other automakers either did not comment or did not immediately comment. The United Auto Workers UAW union this month called on automakers to shift their entire supply chain out of Chinas Xinjiang region saying the time is now for the auto industry to establish highroad supply chain models outside the Uyghur Region that protect labor and human rights and the environment. Our Standards The Thomson Reuters Trust Principles.
"Futures rise ahead of jobless claims data, Tesla jumps - Reuters","U.S. stock index futures gained on Thursday ahead of labor market data that will give clues on future interest rate hikes, while Tesla extended gains after top boss Elon Musk told staff to ignore the ""stock market craziness"".",2022-12-29T12:19:00Z,https://www.reuters.com/markets/us/futures-rise-ahead-jobless-claims-data-tesla-jumps-2022-12-29/,Wall St ends firmer growth stocks lead in thin trading Summary Companies U. S. weekly jobless claims show modest rise Tesla extends gains after Musks comment Indexes up Dow 1. 05 SP 500 1. 75 Nasdaq 2. 59 Dec 29 Reuters Wall Streets main indexes closed higher on Thursday led by growth stocks in light trading as U. S. unemployment data signaled the Federal Reserves interest rate hikes might be starting to dent labor market strength in its bid to fight inflation. All 11 SP 500 sector indexes rose with communication service. SPLRCL and technology. SPLRCT as the biggest winner with gains of nearly 3. Its just relief said Keith Buchanan portfolio manager at GLOBALT Investments in Atlanta. Selling pressure has been overwhelming the market recently and we could be having a break. That allowed room for stocks to move and with lower volume that can materialize into a pretty good day. Apple Inc AAPL. O Alphabet Inc GOOGL. O Microsoft Corp MSFT. O and Amazon. com Inc AMZN. O whose shares have been battered in the past few sessions each gained more than 2. 5. The U. S. Labor Department reported an increase in the number of Americans filing new claims for unemployment benefits last week. But the data indicates a tight U. S. job market even as the Fed works to cool demand for labor in its bid to lower inflation. read more The yield on 10year Treasury notes fell 2. 2 basis points to 3. 864 on the news. The Feds aggressive interest rate hikes have hammered equities this year with the benchmark SP 500. SPX shedding 19. 3 and the techheavy Nasdaq tumbling nearly 33. The technology consumer discretionary and communication services sectors. SPLRCL which house several ratesensitive high growth shares are down between 29 and 40 this year making them the worst performers among SP 500 sector indexes. Energy. SPNY shares have bucked the trend with stellar annual gains of 57. Wall Streets main indexes dropped more than 1 on Wednesday with the Nasdaq Composite Index. IXIC hitting a 2022 closing low as rising COVID cases in China and geopolitical tensions added to fears of a likely recession in 2023. However investor preference for highdividend yielding stocks with steady earnings has limited losses in the Dow Jones Industrial Average. DJI which is down just 8. 5 for the year. The Dow rose 345. 09 points or 1. 05 to 33220. 8 the SP 500. SPX gained 66. 06 points or 1. 75 at 3849. 28 and the Nasdaq Composite. IXIC added 264. 80 points or 2. 59 at 10478. 09. Tesla Inc TSLA. O shares rose after Chief Executive Elon Musk told staff they should not be bothered by stock market craziness. For 2022 Teslas 66 slump and Amazon. coms 50 drop played a big part in the SP 500 consumer discretionary sectors 38 loss. Some 1. 6 trillion worth of shareholder value evaporated after investors abandoned highgrowth stocks with pricey earnings multiples. Volume on U. S. exchanges was 8. 78 billion shares compared with the 10. 95 billion average for the full session over the last 20 trading days. Advancing issues outnumbered decliners on the NYSE by a 4. 80to1 ratio on Nasdaq a 4. 30to1 ratio favored advancers. The SP 500 posted one new 52week high and no new lows the Nasdaq Composite recorded 75 new highs and 160 new lows. Our Standards The Thomson Reuters Trust Principles.
Tesla offers discount in Singapore on EVs in inventory - Reuters.com,"Tesla <a href=""https://www.reuters.com/companies/TSLA.O"" target=""_blank"">(TSLA.O)</a> has begun offering discounts to electric vehicle buyers in Singapore who agree to purchase existing inventory of the Model 3 or Model Y, a company sales representative said …",2023-01-09T07:00:54Z,https://www.reuters.com/business/autos-transportation/tesla-offers-discount-singapore-evs-inventory-2023-01-09/,Tesla offers discount in Singapore on EVs in inventory SINGAPORE Jan 9 Reuters Tesla TSLA. O has begun offering discounts to electric vehicle buyers in Singapore who agree to purchase existing inventory of the Model 3 or Model Y a company sales representative said on Monday. Tesla is offering a discount of 5000 for electric vehicle purchasers who trade in an existing internal combustion vehicle and another 5000 credit against the cost of the certificate to operate a car in Singapore. In addition for qualified buyers who have a place for home installation Tesla will provide the wall connector for charging although the consumer has to pay for the cost of installation. The limitedterm discounts in Singapore come just days after Tesla cut prices in China South Korea Japan and Australia. Our Standards The Thomson Reuters Trust Principles.
