Article,Title,Description,URL,Content
25,Dr. Dre Sends Cease to Desist to Marjorie Taylor Greene Over “Still D.R.E.”,"The controversial Republican congresswoman used the 2001 single in a promotional video. Through his attorney, Dre told Greene, “You are wrongfully exploiting this work through the various social media outlets to promote your divisive and hateful political age…",https://pitchfork.com/news/dr-dre-sends-cease-to-desist-to-marjorie-taylor-greene-over-still-dre/,Dr. Dre has condemned Representative Marjorie Taylor Greenes use of his 2001 song Still D. R. E. in a promotional video TMZ reports. In a statement to the media outlet the rapper and producer said I dont license my music to politicians especially someone as divisive and hateful as this one. Dr. Dres attorney Howard E. King has also sent a letter to Taylor Greene demanding that she cease the unauthorized use of Dres music. You are wrongfully exploiting this work through the various social media outlets to promote your divisive and hateful political agenda King wrote. Demand is hereby made that you cease and desist from any further unauthorized use of Dr. Dres music. Greene the controversial Republican congresswoman from Georgia had used the Still D. R. E. instrumental in a sinceremoved video she posted on Twitter to celebrate Kevin McCarthys election as speaker of the House. When reached by Pitchfork a representative shared the following statement from the congresswoman to Dr. Dre While I appreciate the creative chord progression I would never play your words of violence against women and police officers and your glorification of the thug life and drugs. Musicians have often asked politicians to stop using their music without permission. Neil Young for one went so far as to sue Donald J. Trumps presidential campaign over the use of Rockin in the Free World and Devils Sidewalk at rallies and events. Marjorie Taylor Greene is a Trump supporter who has repeated false claims of election fraud. She has also shown support for the conspiracy theory movement QAnon made Islamophobic and antisemitic remarks and had her Twitter account suspended for months after spreading misinformation about COVID19.
26,Dr. Dre Selling Music Assets to Universal Music Group and Shamrock Capital: Report,The deals include the master recordings for The Chronic and are reportedly worth upwards of $200 million,https://pitchfork.com/news/dr-dre-selling-music-assets-to-universal-music-group-and-shamrock-capital-report/,Dr. Dre is selling several of his music assets and income streams in deals with both Universal Music Group UMG and Shamrock Capital Billboard and Variety report. The combined sale price is said to exceed 200 million. Pitchfork has reached out to representatives for Dr. Dre UMG and Shamrock for comment. Assets acquired by Shamrock Capital reportedly include Dres artist royalties from two of his solo albums his share of N. W. A. artist royalties his producer royalties and the writers share of his song catalog where he doesnt own publishingwhich potentially includes his writers share of The Chronic which is published by Sony Music Publishing. UMG has reportedly acquired the master recordings for Dres 1992 debut LP The Chronicwhich are set to revert to Dre from Death Row Entertainment in August 2023and his share of Kendrick Lamars releases through the Top Dawg Entertainment deal with Interscope a UMG subsidiary and Dres Aftermath imprint. Dre is said to retain his stake in Aftermath which he coowns with Interscope. The sale of Dres assets come in the wake of the recent ceaseanddesist that his lawyers sent Rep. Marjorie Taylor Green who used Dres song Still D. R. E. in a video posted to Twitter. The letter promised Dre will never grant the congresswoman permission to broadcast or disseminate any of his music. It is unclear to what degree Dre will be able to restrict anyone from licensing his music after the sale. The speculative market for music assets continues to grow expanding from classic rock and pop artists like Genesis Bob Dylan Leonard Cohen David Bowie and Bruce Springsteen to include hiphop artists like Chuck D Future and now Dr. Dre. In 2020 the institutionally backed investment firm Shamrockoriginally founded in 1978 by Roy E. Disney as Shamrock Holdingsacquired six Taylor Swift albums from Scooter Brauns Ithaca Holdings which famously purchased the rights from her former label Big Machine. Swift has since rerecorded two of the albums purchased by Shamrock.
27,"Weapons-grade 808s, luscious horns and a megastar’s early steps: the best music our writers discovered this year","From a slept-on Chief Keef banger to an overlooked Taylor Swift classic and a neglected jazz Kenny, we reveal the older releases that have got us going this yearAs someone generally averse to the fact that album releases never seem to slow down any more, even…",https://www.theguardian.com/music/2022/dec/30/the-best-music-our-writers-discovered-this-year,Chief Keef 4NEM 2021 As someone generally averse to the fact that album releases never seem to slow down any more even at the end of December I managed to miss Chief Keefs 4NEM when it dropped in late December last year. Known for pioneering drill before it splintered into a thousand different global subgenres the Chicago rapper is beloved for the kind of abrasive pottymouthed raps that older listeners shake their fists at but which send younger listeners into a craze. The cover art of 4NEM depicting a gang of toy soldiers engaged midcombat is an apt taste of what the album contains. Keefs hilarious one liners make intense violence sound comical. On Hadouken he even references classic teen films Yous a fuckin cheerleader bring it on. The production is equally zany designed to match Keefs frenetic energy. His army of producers mash together samples of guns being loaded explosions and synths that resemble operatic choirs. Most striking is 4NEMs use of earthshattering bass I dont think Ive ever heard harder 808s. This is music that requires loud speakers it splits eardrums as much as it does public opinion. CO Half Man Half Biscuit Bob Wilson Anchorman 2016 Because there are so many Half Man Half Biscuit songs out there and because so many of them seem utterly impenetrable on first listen either because the lyrical references are so obscure or because the music sounds like a total racket I find that new instances of Nigel Blackwells genius slowly reveal themselves to me each year. This years pick a song pondering how the former Arsenal goalkeeper Bob Wilson became one of our most prominent sports broadcasters featuring a completely tangential verse about being cold in the Irish town of Dundalk Its raining soup and Ive got a fork. Its hard to think of a record that could possibly be any less relevant in 2022 and thank God for that. TJ Handsome Boy Modeling School and Cat Power Ive Been Thinking 2004 I went down a deep Cat Power rabbit hole earlier this year pushed over the edge by her fantastic and underrated new covers collection. Reading every Pitchfork review of her catalogue I was introduced to Ive Been Thinking a 2004 collaboration with Handsome Boy Modeling School Dan the Automator and Prince Paul thats totally unlike anything else in her catalogue. Its five minutes of honeyed atmospheric soul music anchored by Cat Powers luxuriant and understated vocal which drifts and meanders as if it has floated in from another song entirely. Its perfect mood music evoking the image of Cat Power as a lounge singer in some smokefilled underground jazz club. SD Kenny Wheeler Music for Large and Small Ensembles 1990 Jazz is a medium full of Kennys there is the muchmaligned smooth jazzer Kenny G Miles Davis collaborator Kenny Garrett bebop trumpeter Kenny Dorham British bandleader Kenny Ball the list goes on. Earlier this year someone I interviewed referenced the Canadian composer Kenny Wheeler as an influence so I stuck on his Music for Large and Small Ensembles as I wrote up my piece. It blew me away. As its title suggests Wheeler composes 15 tracks for everything from orchestral big bands down to duo formations with John Taylor on piano and Peter Erskine on drums. His eightpart big band suite channels the luscious swing of Duke Ellington opening on an affecting choral fanfare while the small ensembles sink deep into delicate melodies as Wheeler slips and squeals on his trumpet. It embodies the wide spectrum of improvised music making Wheeler possibly my favourite jazz Kenny to date. AK Llwybr Llaethog Mad 1996 Novelty throwback edits and big drops are the order of the day at clubs right now so hearing ElectroSian by Llwybr Llaethog emerge on a dancefloor this summer felt refreshing. Its an explosive electro number with disorientating dub sensibilities and screeches of guitar flecked throughout a far cry from the clean and catchy crowd pleasers doing the rounds. Staying true to its title the rest of the record is just as bonkers. Alongside the pacier cuts are downtempo steppers with wonky percussion alien electronics and agitated Welsh language vocal samples flung in. Ambient noise interludes heavier moments Llandub and a slice of moody cold wave Ffanny add a layer of eerie quiet to the chaos. With its sleazy eccentricity and deep rattling instrumentals Mad is a collection of sounds that could easily have its origins in 80s Germany 90s New York or in London soundsystem culture. Its origin in a former mining town in Wales makes it even more exciting. SB Oby Onyioha Enjoy Your Life 1981 Perhaps it was grimly predictable but since turning 30 all the best new music I have discovered has been new to me but decades old. My occasional forays into the pop charts and Spotify trending playlists have left me feeling like an anthropologist in a strange land where what I understand as music is not necessarily worse but certainly more precise metallicsounding buffed and honed to a sharp point. Increasingly Ive been craving the musical equivalent of satin or corduroy languorous even baggy not a hook that grabs you by the jugular but a vibe that you can sink into like a bean bag. Im not sure how I first heard Enjoy Your Life by Nigerian singer Oby Onyioha maybe in a 6 Music mix true to my advancing age but I experienced it as a bodily relief. That midtempo beat the predictable strings and brass motifs the minimal escalation in energy over six minutes it has all of discos lust for life but it still works if your only vices are two glasses of red and an early bedtime. And better than anything else Ive heard lately it captures the necessity of pursuing pleasure the importance of prioritising fun even or especially when it seems elusive. Its your right to enjoy your life even in unprecedented times. EH Roy Montgomery Temple IV1996 This summer when interviewing Dry Cleaning for Mojo magazine I was tasked with asking each band member for one influence on their excellent new album Stumpwork. Guitarist Tom Dowse cited the New Zealand guitarist Roy Montgomery and mentioned that he had once been in a band Dadamah that was signed to US indie label Kranky. Liking both Dowses playing on the new album and Krankys output very much indeed I saved the album behind his most popular song on Spotify then forgot about it for months. I dont really believe in cosmic forces but I do think music sometimes finds you when its meant to and in a period of personal desolation not to mention during a subzero week in Berlin his 1996 album Temple IV hit me at the right time. Its a thick instrumental tundra of guitar playing alternately sharp and whiteknuckled shearing flesh from bone and loose jangling and searching music to lose yourself in to override the static of your mind. Its swiftly become an alltime favourite. Proof that you cant beat the human algorithm although Spotify took note of my obsessive listening and pointed me towards his new album which I would otherwise have missed so I indulged my editors privileges to commission an interview with him for our pages in the hope of minting some more new Montgomery fans. LS Takeshi Terauchi Nippon Guitars Instrumental Surf Eleki Tsugaru Rock 19661974 2011 To discover Takeshi Terauchis work this year has been a blessing. Rightfully lauded as one of Japans guitar pioneers Terauchis influence and work has been catalogued neatly by UK record label Ace Records. Charting Terachis career from the 1960s surf boom via groovy instrumentals through to 70s fuzz freakouts and funk rock his 2011 compilation Nippon Guitars charmed me from its first punchy guitar licks. Taking you through a decade of exuberance and fun Terauchis instrumentation is always acerbic and sizzling. Its a welcome path to wander down. DB Tangerine Dream Network 23 1981 Paul Hartnoll from Orbital pointed me towards this tune on Tangerine Dreams 1981 album Exit after I suggested that the Berlin electronic giants best work was already behind them by the end of the 70s. Network 23 which subsequently gave a name to Spiral Tribes record label is fantastic a gradually building hypnotic trance track. The motorik rhythm is slightly reminiscent of German peers Neu but it also clearly points the way to house and techno at a point when both were years away. The ethereal synth line that suddenly erupts at around three minutes and 20 seconds is just glorious. I consider myself told. DS Taylor Swift Today Was a Fairytale 2010 When Taylor Swift released Red in 2012 she put me in a headlock which I am yet to escape from. Her earlier releases hadnt captured me Id mistakenly judged them as too whimsical too middle American with a faint whiff of early2000s Silver Ring Thing energy. Buried among those early records was a nonalbum single called Today Was a Fairytale that Ive recently become obsessed with. Its not Swifts most sophisticated song but its guilelessness is its charm. Something about its simplicity hotwires my nervous system creating nostalgia for an innocent adolescence that as a queer person I never actually experienced. Three listens to its soaring chorus and I could walk through a brick wall. The campaign for Taylor to include it on her Eras tour setlist starts here. JS Whats the best old or newtoyou music you discovered this year Let us know in the comments
28,"Marilyn Manson sexual assault lawsuit dismissed, for now","A sexual assault lawsuit against Brian Warner—a.k.a. Marilyn Manson—has been dismissed without prejudice in a California court, with the Los Angeles Times reporting that the judge dismissed the suit because the accuser, model Ashley Morgan Smithline, fired he…",https://www.avclub.com/marilyn-manson-lawsuit-dismissed-1849954899,A sexual assault lawsuit against Brian Warnera. k. a. Marilyn Mansonhas been dismissed without prejudice in a California court with the Los Angeles Times reporting that the judge dismissed the suit because the accuser model Ashley Morgan Smithline fired her attorney in October and did not name a new one by the time of a December deadline. Since it was dismissed without prejudice though the suit can be refiled at any point over the same allegations. Smithline had accused Manson in 2021 of sexually assaulting her multiple times in 2010 with the LA Times story saying that her suit included an instance where Manson allegedly put a pillow over her face and used a knife to cut her shoulder inner arm and stomach as well as another instance where he allegedly cut his name into her and broke her nose. Manson has denied the allegations saying they were together for less than a week and that there are so many falsehoods within her claims that we wouldnt know where to begin to answer them. Pitchfork has shared a statement from Mansons attorney in light of this dismissal that not only frames it as a win for Manson but as an indication that Smithline is choosing to back down in lieu of being manipulated by others who are trying to pursue their own agendas. Heres the full statement We thank and commend Ashley Smithline for dismissing her claims against Brian Warner without seeking or receiving anything in return. Ms. Smithline has refused to be manipulated by others who are trying to pursue their own agendas against Mr. Warner. We wish her well and will continue to work to assure that a significant price will be paid by those who have tried to abuse our legal system. Manson is still facing a sexual assault lawsuit from actor Esm Bianco and he has filed a lawsuit against accuser Evan Rachel Wood who said in 2022 that she is very confident and not scared.
29,Pusha T Says He’s No Longer the President of Kanye West’s G.O.O.D. Music,The Virginia rapper was named the label’s president in 2015,https://pitchfork.com/news/pusha-t-says-hes-no-longer-the-president-of-kanye-west-good-music/,Pusha T has revealed in a new interview with XXL that he resigned as the president of Kanye Wests G. O. O. D. Music label. When explicitly asked if he was still the president of the company Pusha T responded No Im not. The interviewer then asked him to clarify that hes not tied with G. O. O. D. Music anymore in any way and the rapper confirmed thats the case. Pusha T originally accepted the presidential title back in 2015 but hes since established a 5050 deal with Def Jam for his solo music and his label Heir Wave Music Group. His most recent album Its Almost Dry is now his last for G. O. O. D. Music. Hes not speaking to me now Pusha T said of West in the XXL interview. If you aint with it you aint down. And I aint with it. Im not budging on that. Im not with it. I heard about this new stuff on InfoWars. I dont know. Its something that just sort of tells me hes not well at the same time. I will say that. Its going to places where its no way to move around it. During the InfoWars episode to which Pusha T referred West made a number of disturbing and hateful remarks while praising Adolf Hitler and Nazis. West also brought his new ally Nicholas J. Fuentesa white supremacist antisemite and Holocaust denierto the interview. Pitchfork has reached out to representatives for Pusha T for additional comment. West and G. O. O. D. Musics partnership with Def Jam ended back in 2021 prior to his recent antisemitism and hate speech. His relationship with Def Jam and parent company Universal Music Group was contentious for a number of years before splitting too. West sued UMG Def Jam and RocAFella Records as well as publisher EMI in 2019. The suit against EMI was settled the next year. He also tweeted his label contracts in 2020 amid a dispute with UMG. Last month Pusha T formally disavowed West in an interview with the Los Angeles Times. Its definitely affected me. Its been disappointing he said. As a Black man in America there is no room for bigotry or hate speech. So yeah. Its been very disappointing lets talk straight. Read about Pusha Ts Diet Coke at No. 89 on Pitchforks list The 100 Best Songs of 2022.
