Article,Title,Description,URL,Content,Headline,Headline Sentiment,Offense Rating,Negative Words,Offensive Words,Tags
21,The 10 biggest losers in the S&P 500 this year have erased $1.6 trillion in market value,"Meta, Tesla, and PayPal are among the 10 worst performers on the S&P 500 in what's been a bruising 2022 for the US stock market.",https://markets.businessinsider.com/news/stocks/worst-performing-stocks-meta-tesla-tech-inflation-economy-sp500-2022-12,In a losing year for US stocks here are the 10 biggest percentage decliners on the SP 500. Meta Tesla and Match made the cut as their shares veered toward losses of more than 60 each. The 10 largest SP 500 stock losers wiped out 1. 6 trillion in market value. Equity investors are no doubt eager to usher out 2022 after a turbulent year of sharp losses. Shaped greatly by Russias war in Ukraine and central banks responding to soaring inflation with massive rate hikes the relatively risky asset class was dragged into a bear market. The SP 500 was on course to fall about 20 and the Nasdaq Composite was looking at a decline of more than 30. Looking at the carnage another way about 70 of companies on the SP 500 were logging negative returns as 2022 wraps up. Largecap tech stocks including Apple and Amazon were beaten down as higher borrowing costs weigh on the value of future profits. With recession fears ramping up highprofile tech companies including Meta and Microsoft combined have laid off thousands of workers. The 10 SP 500 companies that have experienced the largest stockprice declines heading into the end of 2022 have wiped out a combined market value of more than 1. 6 trillion. Here are the benchmark indexs 10 biggest losers in 2022 on a percentage basis. 10. PayPal Ticker PYPL YTD Performance 63. 4 Market Value Decline 142. 49 billion Like many tech companies the digital payments processor is seeing a slowdown after a pandemic boom. Net new accounts in the third quarter increased by 2. 9 million compared with 13. 3 million in the yearago period. CEO Dan Schulman told analysts the macro environment looks difficult in part with inflationary pressures in Europe and in the US and a potentially shallow recession in the US. The shares popped higher earlier in December however after Schulman reportedly said fourthquarter pershare earnings were tracking slightly ahead of its expectations. 9. V. F. Corp. Ticker VFC YTD Performance 64. 4 Market Value Decline 18. 6 billion The company behind The North Face Supreme Vans and other apparel labels rounded off a rough year for its stock with the unexpected departure of Steve Randle as CEO. The Denverbased company said this year its been navigating through a more disrupted global marketplace pockmarked by COVIDrelated issues in China and consumers facing economic uncertainty. 8. Signature Bank Ticker SBNY YTD Performance 64. 5 Market Value Decline 12. 4 billion We are not just a crypto bank and we want that to come across loud and clear CEO Joe DePaolo reportedly said at a Goldman Sachs investor conference this month. The banks shares have been hit as the socalled crypto winter has slashed the cryptocurrency markets value from its high of more than 1 trillion and crypto deposits at the bank have declined. Signature anounced plans to reduce cryptorelated deposits by 8 billion to 10 billion. The stock did rise on the midNovember day that Signature said its deposit relationship with collapsed crypto exchange FTX was less than 0. 1 of its overall deposits. 7. Meta Platforms Ticker META YTD Performance 64. 9 Market Value Decline 611. 17 billion Investors have largely pushed back on CEO and major shareholder Mark Zuckerbergs metaverse ambitions that led to the companys rebranding from Facebook last year. Its Reality Labs unit centered on virtualworld technology has lost nearly 20 billion since last year. One prominent investor has called on Meta to cut back on its Reality Labs investment. Well aware of the backlash Zuckerberg recently said 80 of Metas investments are still directed to its core social media business. The drop in Metas valuation has sliced more than 80 billion off of Zuckerbergs vast wealth which recently stood at more than 44 billion. 6. Tesla Ticker TSLA YTD Performance 65Market Value Decline 703. 12 billion The pummeling of the EV makers stock price this year knocked CEO Elon Musk from his perch as the worlds richest man. A few forces were at work here Musk himself blames the Federal Reserve for driving down Teslas valuation saying its aggressive rate hikes have pushed up US Treasury bond yields boosting the appeal of that lowrisk debt over relatively riskier assets. Meanwhile some investors and analysts say Tesla has been hurt by Musks sales of billions of dollars worth of Tesla shares and his focus on Twitter after his controversial 44 billion acquisition of the social media site in October. Supply chain problems in China have also been a pressure point although the company has been able to log record monthly sales during 2022. For those watching Musks net worth its fallen by more than 130 billion on the Bloomberg Billionaires Index. 5. Catalent Ticker CTLT YTD Performance 66. 1 Market Value Decline 15. 1 billion The contract manufacturer for pharmaceutical consumer health and biotech companies has worked on producing coronavirus vaccines for Moderna and Johnson Johnson. But with coronavirus infections slowing overall the company has flagged headwinds from COVIDrelated volume declines and last month cut its 2023 revenue projection to a range of 4. 63 billion to 4. 88 billion. 4. SVB Financial Group Ticker SIVB YTD Performance 68 Market Value Decline 27 billion Silicon Valley Bank is a good proxy for deal flow in Tech Bespoke Investment Group said in October as SVB shares plunged doubledigits following fourthquarter results. The company has cut its 2022 outlook for net interest income as its seen market challenges hitting liquidity flows to private companies and the overall tech landscape hurt by fears of recession and spiking borrowing costs. Its also been a rough year for innovative companies seeking to go public with the global IPO market volumes down 45. 3. Align Technology Ticker ALGN YTD Performance 69 Market Value Decline 35. 8 billion CEO Joe Hogan told Yahoo Finance earlier this year that high inflation and supply chain constraints pressured the company behind Invisalign clear braces. The shutdowns in China really hurt our business he said about its secondlargest market. He made his observations months before China recently began easing restrictions in its strict zeroCOVID policy with economists broadly saying that should reinvigorate growth there and perhaps reignite inflation. 2. Match Group Ticker MTCH YTD Performance 69. 3 Market Value Decline 26. 2 billion Shares of the parent company of Tinder Match. com Plenty of Fish and other dating sites have hit their lowest since publicly launching in 2015. The company has run into slowing revenue growth in part as younger and less affluent customers feel the pinch in their discretionary spending. Match says its visibility into 2023 is challenging. 1. Generac Holdings Ticker GNRC YTD Performance 73. 8 Market Value Decline 16. 6 billion Mass COVID lockdowns helped sparked big demand for backup generators as people worked and studied at home. The power systems maker has since seen residential sales slow while commercial and industrial sales have grown. Generac last month slashed its 2022 sales outlook driving the stock down further from its pandemicera heights.,"Meta set to make decision on Trump’s return to Facebook, Financial Times reports",Extremely Negative,340,"['relentless', 'attacks']","['Republican', 'Republican']","[Trumps, Donald, Trump, 'lawsuit', Trump, Trump, Trump]"
22,These 5 Big Techs have wiped out an eye-popping $3.65 trillion in market value over a torrid year for stocks,"Apple, Microsoft, Google parent Alphabet, Amazon, and Meta have each seen over $500 billion wiped off their market caps this year.",https://markets.businessinsider.com/news/stocks/stock-market-crash-big-tech-amazon-apple-google-microsoft-facebook-2022-12,The Big Five tech stocks together have shed 3. 65 trillion in market value this year so far. Rising interest rates and the threat of a recession have fueled a brutal selloff in US stocks in 2022. Apple Microsoft Alphabet Amazon and Meta Platforms have each erased over 500 billion in market value. Just five Big Tech stocks have together lost 3. 65 trillion in market value this year as the Federal Reserves rapid interestrate hikes hammered the share price of some of the USs bestknown companies. Google parent Alphabet Amazon Meta Platforms Microsoft and Apple collectively seen as the Big Five tech stocks have each seen 500 billion erased from their market cap in 2022 so far according to data from Refinitiv. Those wipeouts have come in a year where the benchmark SP 500 stock market index has plummeted nearly 19 and the techheavy Nasdaq has plunged just under 32 as of Wednesdays close. The Feds aggressive interestrate hikes have helped fuel the slide in stocks overall but have particularly hit techs and other growth companies. The US central bank has raised its policy rate from nearzero in March to around 4. 5 by December to try to bring down inflation that has been running at fourdecade highs. Higher interest rates encourage people to save rather than spend and lift the cost of borrowing both of which drag on companies share price. And they tend to particularly weigh on stocks for fastgrowing companies like the Big Five as an increased cost of borrowing reduces their future cash flows which is the primary basis for their valuations. Facebook parent Meta and Amazon each suffered major hits to their market caps after they warned a recession in 2023 would lead to a fall in their earnings. Meta shares crashed 24 in a single day in October after it missed on earnings and flagged a slowdown in digital ad spending a risk mentioned by several in the online sector. The social media giant whose shift to the metaverse hasnt been well received by many analysts has shed 635 billion in market value this year according to Refinitiv. Its market cap stands at 318 billion after starting 2022 at 953 billion. Meanwhile Amazon plunged 11 the same month after it put out a gloomy sales forecast for the key holiday season. The online retail giant has wiped out 806 billion in 2022 so far losing its trilliondollar market cap for the first time since April 2020. Its at 885 billion now from 1. 691 trillion. Alphabets market value fell by 758 billion from 1. 921 trillion to 1. 163 trillion. Meanwhile Microsoft slipped from 2. 525 trillion to 1. 822 trillion for a drop of 703 billion. Apples total valuation tumbled 747 billion from its 2. 902 trillion level at the start of 2022. But it remains the worlds largest company with a market capitalization of just under 2. 155 trillion. Adding Tesla to the five Big Techs would take the groups total market value losses to 4. 2 trillion. The electricvehicle manufacturers share price has plummeted 61 this year as investors fret about the impact of Elon Musks Twitter takeover and an economic slowdown in China weighs on sales numbers. Thats wiped 572 billion off of Teslas market capitalization. This story was amended to correct the figure for the drop in market cap for Amazon. Read more Tesla has surpassed Apple as retail investors favorite stock in 2022 research firm says,The 10 biggest losers in the S&P 500 this year have seen $1.6 trillion in market value erased,Extremely Negative,800,"['losing', 'losses', 'losers', 'doubt', 'turbulent', 'losses', 'risky', 'dragged', 'fall', 'decline', 'carnage', 'negative', 'recession', 'fears', 'laid', 'declines', 'losers', 'Decline', 'difficult', 'inflationary', 'shallow', 'recession', 'Decline', 'rough', 'unexpected', 'issues', 'Decline', 'loud', 'Decline', 'lost', 'Decline', 'aggressive', 'debt', 'hurt', 'controversial', 'problems', 'fallen', 'Decline', 'infections', 'declines', 'Decline', 'hurt', 'fears', 'recession', 'rough', 'Decline', 'hurt', 'strict', 'Decline', 'pinch', 'challenging', 'Decline', 'slow']",['deposit'],"[Dan, Schulman, Schulman, Steve, Randle, Joe, DePaolo, Mark, Zuckerbergs, Zuckerbergs, Elon, Musk, Musk, 'lawsuit', Joe, Hogan]"
23,Meta wasn't showing the elderly and women the same housing ads as everyone else. It now says its new ad-targeting algorithm won't discriminate.,A recent settlement is the first time that Meta has been held accountable by the federal government for its targeted advertising delivery system.,https://www.businessinsider.com/meta-says-new-ad-targeting-system-wont-discriminate-against-people-2023-1,Meta wasnt showing the elderly and women the same housing ads as everyone else. It now says its new adtargeting algorithm wont discriminate. Meta Platforms unveiled a new adtargeting algorithm on Monday that will impact housing and credit ads. The move comes nearly four years after the company was sued for allegedly violating the Fair Housing Act. Facebooks parent company Meta Platforms launched a new adtargeting algorithm on Monday after settling a lawsuit filed by the US Department of Justice for allegedly violating the Fair Housing Act. The move is the culmination of nearly four years of litigation and negotiations between the US government and the tech giant. These efforts began in March 2019 when the US Department of Housing and Urban development filed a claim against the company for enabling housing discrimination with its targeted advertising algorithms. Six months later a class action lawsuit was filed against Facebook alleging that the platform discriminated against the elderly and women by not showing them the same housing and financial services advertisements as everyone else. In home sales and rentals the Fair Housing Act forbids the discrimination of anyone due to their sex religion color gender disabilities or familial status. Metas adtargeting algorithms have been regularly scrutinized for discriminatory practices. The company has also been investigated for allegedly contributing to widespread discrimination in employment and hiring based on peoples age and gender. Groups like the American Civil Liberties Union have accused Meta of digital redlining by allowing advertisers to select the demographics of people they do and do not want their ads to be shown to. The ACLU filed an amicus brief in January 2022 arguing that these practices are a civil rights violation and that the company shouldnt be shielded from scrutiny because the discrimination took place online. Meta settled the lawsuit with the DOJ who sued the company on behalf of HUD in June 2022 and agreed to build a new adtargeting system as part of the deal. On Monday the company launched its new system called a Variance Reduction System for housing advertisements in the US. Meta said it plans to expand its use to employment and credit ads according to a blog post on the companys website. Meta added that it has also ended its use of its Special Ads Audience feature as of August 2022. The feature allowed advertisers to select specific demographic groups to target and distribute ads to for housing employment and loans. Across the industry approaches to algorithmic fairness are still evolving particularly as it relates to digital advertising the blog post reads in part. But we know we cannot wait for consensus to make progress in addressing important concerns about the potential for discrimination especially when it comes to housing employment and credit ads where the enduring effects of historically unequal treatment still have the tendency to shape economic opportunities. Assistant Attorney General Kristen Clarke who leads the DOJs civil rights division said Metas new system represents a pivotal step in holding large tech companies accountable for discriminatory actions. Metas progress will be subject to federal oversight through June 2026 according to the settlement. SMBs can easily upskill their workforce using this effective learning management solution Device deployment hits 1 million for two straight quarters How Paytm Soundbox is fuelling growth Jack Ma the billionaire founder of Alibaba who disappeared from public view in 2020 appears to resurface in Thailand as he prepares to give up control of his company Amazon Great Republic Day Sale best deals on phones iPhone 13 OnePlus Nord 2T 5G Redmi A1 and more Wipro sees FY23 revenue growth at 11. 512 Q3 profit growth beats analyst expectations Rupee falls 4 paise to close at 81. 34 against US dollar 13th Gen Intel Core i913900KS brings unprecedented speed to desktop users Credit expansion will taper down next year if deposits growth doesnt rise Axis Bank MD,These 5 Big Techs have shed an eye-popping near $3.7 trillion in market value in a torrid year for stocks,Extremely Negative,370,"['threat', 'recession', 'brutal', 'lost', 'aggressive', 'suffered', 'warned', 'recession', 'fall', 'crashed', 'missed', 'risk', 'gloomy', 'losing', 'fell', 'tumbled', 'losses', 'fret']",[],"[Elon, Musks]"
24,"A Meta employee said they eat all their meals for free at the office, which is like 'teleporting to another universe'",A Meta worker praised the Instagram and Facebook owner's perks and company culture in a post on the anonymous professional networking site Blind.,https://www.businessinsider.com/meta-employee-eats-all-their-meals-for-free-at-office-2022-12,Editors note January 6 2023 This story was originally based on a post from Blind the anonymous professionalnetworking site where users give their work email addresses to register. The Blind post used as the source for this story was updated after publication to describe itself as a satirical republishing of an earlier post by another Blind user. Because this rendered Insiders story incorrect we have deleted the text. Weve kept the URL live for transparency. Sign up for notifications from Insider Stay up to date with what you want to know.,Meta wasn't showing the elderly and women the same housing ads as everyone else. It now says its new ad-targeting algorithm won't discriminate.,Somewhat Negative,480,"['discriminate', 'sued', 'discrimination', 'discrimination', 'discriminatory', 'discrimination', 'violation', 'discrimination', 'sued', 'concerns', 'discrimination', 'unequal', 'discriminatory', 'oversight', 'falls']",['sex'],"['harassment', 'lawsuit', 'lawsuit', 'harassment', 'lawsuit', Kristen, Clarke, Jack, Ma]"
25,"Meta alleges surveillance firm collected data on 600,000 users via fake accounts","The social media giant launched an investigation into Voyager’s use of fake accounts after a Guardian investigationMeta has sued to block a surveillance company from using Facebook and Instagram, alleging the firm, which has partnered with law enforcement, cr…",https://www.theguardian.com/technology/2023/jan/12/meta-voyager-labs-surveillance-fake-accounts,Meta has sued to block a surveillance company from using Facebook and Instagram alleging the firm which has partnered with law enforcement created tens of thousands of fake accounts to collect user data. A complaint filed on Thursday asks a judge to permanently ban Voyager Labs from accessing Metas sites and comes after a Guardian investigation revealed the company had partnered with the Los Angeles police department LAPD in 2019 and claimed that it could use social media information to predict who may commit a future crime. Public records obtained by the Brennan Center for Justice a nonprofit organization and shared with the Guardian in 2021 showed that Voyagers services enabled police to surveil and investigate people by reconstructing their digital lives and making assumptions about their activity including their network of friends. In one internal record Voyager suggested that it considered using an Instagram name displaying Arab pride or tweeting about Islam to be signs of potential extremism. The lawsuit in federal court in California details activities that Meta says it uncovered in July 2022 alleging that Voyager used surveillance software that relied on fake accounts to scrape data from Facebook and Instagram as well as Twitter YouTube LinkedIn and Telegram. Voyager created and operated more than 38000 fake Facebook accounts to collect information from more than 600000 Facebook users including posts likes friends lists photos comments and information from groups and pages according to the complaint. The affected users included employees of nonprofits universities media organizations healthcare facilities the US armed forces and local state and federal government agencies along with fulltime parents retirees and union members Meta said in its filing. It is unclear who Voyagers clients were at that time and what entities may have received the data. But Voyager which has offices in the US the United Kingdom Israel Singapore and the United Arab Emirates designed its software to hide its presence from Meta and sold and licensed for profit the data it obtained the suit says. Our hope is to amplify this message that this is not the right way to police people or the public Jessica Romero Metas director of platform enforcement and litigation said in an interview. Some of the types of people that were impacted really dont fit the kind of criminal profile that Voyager tries to sell as the focus of their data collection and analysis. Voyager representatives did not immediately respond to a request for comment on Thursday. Some features that Voyager advertised in the records obtained by the Brennan Center posed significant ethical questions including one the company called an active persona which appeared to facilitate police use of fake profiles to gain access to otherwise private information on Facebook. In November 2021 after the internal records were revealed Facebook sent the LAPD a letter demanding that it cease all social media surveillance use of dummy accounts saying fake accounts were a violation of the companys policy requiring that people use their real names. The Metaowned platform also said at the time that using data obtained from the platform for surveillance including the processing of platform data about people groups or events for law enforcement or national security purposes was prohibited. While it is unclear whether the LAPD ultimately used the fake profile feature while working with Voyager emails showed that officers said it was a great function and a needtohave service. Voyager is a part of a broader industry of betterknown players like Palantir that purport to make crime predictions based on past behaviors and activity including those shared on social media. While the practice has been criticized by privacy and civil liberty advocates as pseudoscience that does little more than perpetuate bias and discrimination in policing law enforcement continues to be eager to acquire solutions that purport to make their jobs more efficient and in turn validate their decisions. And tech firms working to offset the industrys slowing growth have increasingly answered law enforcements call for new surveillance and policing products. This is an industry that has a lot of technical capabilities some of which are pretty sophisticated and yet theres no oversight or accountability Romero said. We view this as us doing our part to bring to light the kinds of information and conduct weve uncovered. Rachel LevinsonWaldman managing director of the Brennan Centers liberty and national security program said Metas lawsuit demonstrated how software tools like Voyagers can enable mass scraping of data Its a really wide range of people who have been affected by this and the public should notice and be alarmed by the scope of this kind of collection. She said the case could also have an impact beyond Voyager and should discourage police from pursuing these kinds of technologies It sends a pretty clear signal generally to the surveillanceforhire industry that they could face legal action and I hope it also sends a signal to police departments and other law enforcement agencies that are considering these tools.,"A Meta employee said they eat all their meals for free at the office, which is like 'teleporting to another universe'",Extremely Negative,350,['incorrect'],"['Blind', 'Blind', 'Blind']",[]
