Article,Title,Description,URL,Content,Headline,Headline Sentiment,Offense Rating,Negative Words,Offensive Words,Tags
8,The Morning After: We tried Dyson’s air-purifying headphones,"Dyson’s Zone is a headset-visor that processes the air you breathe and pumps it, well, into your face. Now we know the price ($949!) and launch date (March 2023), the company invited press to strap the baffling device on and test it a little more extensively.…",https://www.engadget.com/the-morning-after-we-tried-dysons-air-purifying-headphones-121506892.html,Dysons Zone is a headsetvisor that processes the air you breathe and pumps it well into your face. Now we know the price 949 and launch date March 2023 the company invited press to strap the baffling device on and test it a little more extensively. In a dark blue with copper accents it looks a little subtler than the press images. But its still going to turn heads. The Dyson Zone is not designed to protect against COVID19 or other viruses as it does not seal to your face. The air purifier filters have a duallayer design with potassiumenriched carbon to capture acidic gasses. The company claims the filters will block 99 percent of particles including those as small as 0. 1 microns for filtering city fumes and pollutants. However you can use inserts like an N95 mask attachment also offered by Dyson. You can check out Engadgets Cherlynn Low wearing the Dyson Zone around New York. Mat Smith The Morning After isnt just a newsletter its also a daily podcast. Get our daily audio briefings Monday through Friday by subscribing right here. The biggest stories you might have missed Apples 11inch iPad Pro M2 drops to a new alltime low of 699 Epic Games will pay 520 million to settle FTCs Fortnite case The year organized labor finally took root in big tech Our favorite gadget purchases of 2022 Kias EV6 GT crams performance into a great EV Elon Musk will find someone else to run Twitter according to his poll He asked users if he should step down and they decisively voted yes. Elon Musk put his own leadership of Twitter on the line at the weekend. Should I step down as head of Twitter I will abide by the results of this poll he tweeted. The poll ended and 57. 5 percent of users voted Yes compared to 42. 5 percent who voted no with 17502391 votes a decisive 15point margin. It remains to be seen if and how and when Musk will abide by his poll as he has yet to issue any comment about the results. Shortly after publishing the vote and when it was already tilting toward Yes he tweeted as the saying goes be careful what you wish as you might get it. The vote follows a flurry of activity on Twitter after it announced a sudden rule change prohibiting users from linking to competing platforms and banning several influential users soon after. A massive backlash ensued prompting an apology from Musk who also tweeted that going forward there will be a vote for major policy changes. Then in yet another poll yesterday TwitterSafety asked users whether it should have a policy preventing the creation of or use of existing accounts for the main purpose of advertising other social media platforms. The Final Fantasy Pixel Remaster series heads to Switch and PS4 And you can buy a pricey physical edition of the first six games. If you were looking for a late and spendy Christmas gift for your favorite Engadget newsletter editor hi me Square Enix has you covered. To celebrate the Pixel Remaster series arrival on Switch and PlayStation the company is selling a limitededition bundle of all six entries in the Pixel Remaster series Final Fantasy Final Fantasy II Final Fantasy III Final Fantasy IV Final Fantasy V and Final Fantasy VI as well a vinyl soundtrack set a 128page art book and a set of pixel art figurines. A mere 260 to make my Christmas. The best Nintendo Switch games for 2023 A guide for beginners from A to Z trigger. In time for holiday shopping weve updated and expanded our guide to the best Switch games covering all the major games that have wowed us since the consoles launch. Sure theres Zelda and Mario in here but theres also a bug knight a witch with guns on her shoes and a skateboarding world to explore. Instagram lets you create your own 2022 Recap Reel Select at least three photos or videos and the app will automatically combine them into a Reel. Instagram has been placing a bigger focus on Reels this year and that extends to how users create their 2022 Recap whether you want it to or not. Select at least three photos or videos and Instagram will automatically stitch these together into a Reel with narration templates from the likes of Bad Bunny Priah Ferguson and DJ Khaled. Hopefully those can be toggled off too. Reels have been a major focus for Meta over the past year. Across Instagram and Facebook the company now says Reels are played over 140 billion times every day. Meta has been bolstering its answer to TikTok by making it easier to create Reels launching an inapp Reels scheduler and ways to post to Reels from thirdparty apps. European Commission tells Meta that Facebook Marketplace is unfair to rivals It abused its dominant position. Europe has hit Facebook owner Meta with a complaint that its Marketplace classified service is unfair to competitors. By tying its main social media site to Marketplace it has a substantial distribution advantage over rivals the EU Commission wrote in a press release. With its Facebook social network Meta reaches globally billions of monthly users and millions of active advertisers EU Antitrust Commissioner said in a statement. Our preliminary concern is that Meta ties its dominant social network Facebook to its online classified ad services called Facebook Marketplace. This means that users of Facebook automatically have access to Facebook Marketplace whether they want it or not. This all infringes on EU rules that prohibit the abuse of a dominant market position. The EU has the power to impose a fine of up to 10 percent of Metas annual revenue and prohibit the behavior. Metas head of EMEA competition said the claims made by the European Commission are without foundation. OnePlus 11 5G launch event set for February 7th The Alert Slider and Hasselblad camera tuning are back. OnePlus has revealed when it will formally show off its flagship products for 2023. The Cloud 11 event will take place in New Delhi India on February 7th. The company will showcase the OnePlus 11 5G OnePlus Buds Pro 2 and more. Along with revealing the event date OnePlus said it would bring a couple of fanfavorite features back for its next flagship smartphone. The OnePlus 11 will once again feature the companys Alert Slider which offers an easy way to shift between silent vibrate and alert modes.,"Amazon's expanded job cuts will affect over 18,000 employees",Extremely Negative,450,"['lost', 'losing', 'froze', 'broke', 'Slack', 'bloated']",[],"[Andy, Jassy, 'harassment', 'harassment', 'harassment', Mark, Zuckerberg, 'harassment']"
9,Meta faces exsanguination by small fines - Reuters,"Another day, another European fine for Meta Platforms <a href=""https://www.reuters.com/companies/META.O"" target=""_blank"">(META.O)</a>. The social network was penalized nearly $800 million last year in a series of charges for <a href=""https://www.dataprotectio…",https://www.reuters.com/breakingviews/meta-faces-exsanguination-by-small-fines-2023-01-04/,Meta faces exsanguination by small fines NEW YORK Jan 4 Reuters Breakingviews Another day another European fine for Meta Platforms META. O. The social network was penalized nearly 800 million last year in a series of charges for data breaches and privacy violations. While 2023 is young it isnt off to a good start. Irelands data privacy regulator on Wednesday fined Meta 419 million for improperly serving personalized ads without what it considered sufficient consent. European digital rules protecting customers leave room for more. In addition to the fines levied to date the Irish regulator has another 11 inquiries open into Metas services. Meta can perhaps avoid these and appeals could reduce fines. But other claims are close behind. In December the European Commission said preliminarily that the company breached European antitrust rules in tying its classified ad service to its Facebook social network. Worse Europes Digital Markets Act is gradually entering into force. The new rules offer dos and donts for firms like Meta that dominate industries in a way that make it far more painful for firms that do things like prefer their own offerings. With the recalcitrant facing fines up to 20 of revenue and even possible breakup future cuts could leave far more blood on the floor. By Robert Cyran Follow Breakingviews on Twitter The author is a Reuters Breakingviews columnist. The opinions expressed are their own. Capital Calls More concise insights on global finance Tesla merges into slower lane read more Barbarians at the checkin desk read more UAE gets ducks in a row with chemicals reshuffle read more Brenntag MA gambit may prompt its own breakup read more Satellites can fly higher in private read more Our Standards The Thomson Reuters Trust Principles.,The Morning After: We tried Dyson’s air-purifying headphones,Extremely Negative,570,"['baffling', 'dark', 'missed', 'issue', 'pricey', 'spendy', 'bug', 'Bad', 'abused', 'complaint', 'concern', 'prohibit', 'impose', 'prohibit']",['abuse'],"[Cherlynn, Low, Mat, Smith, Elon, Musk, Elon, Musk, Musk, 'lawsuit', Musk, Zelda, Mario, Priah, Ferguson, DJ, Khaled, 'harassment', 'harassment', 'lawsuit', 'lawsuit']"
10,Meta to pay $725 million to settle Cambridge Analytica lawsuit,Data harvested by Cambridge Analytica was used for political campaigns.,https://arstechnica.com/information-technology/2022/12/meta-to-pay-725-million-to-settle-cambridge-analytica-lawsuit/,Meta the parent company of Facebook will pay 725 million to settle a classaction lawsuit filed in 2018. The lawsuit came in the wake of Facebooks revelation that it had improperly shared data on 87 million users with Cambridge Analytica a British political consultancy tied to former President Donald Trumps election campaign. Cambridge Analytica got its access to Facebook user data via an app developed by a third party. While only around 270000 Facebook accountholders used the This is Your Digital Life app the apps permissions allowed it access to data on those users friends. The end result was a dataset covering 87 million users that the developer than passed on to Cambridge Analytica in contravention of Facebooks terms of service. The vast majority of those in the dataset had not given the consultancy firm permission to access their data. The unauthorized data sharing came to light in 2018 when reporters from The New York Times and The Observer informed Facebook that Cambridge Analytica still had copies of the data even though the UKbased firm had promised the social network back in 2015 that the data would be deleted. Cambridge Analytica filed for bankruptcy in May 2018 after determining it was no longer viable to continue operating the business. The lawsuit against Meta continued on and other instances of problematic datasharing practices by Facebook were added to the complaint. Indeed the lawsuit accused Facebook of giving numerous third parties access to their Facebook content and information without their consent and alleged that Facebook failed to adequately monitor the third parties access to and use of that information. Meta is admitting to no wrongdoing or illegal activity by settling the case. Instead the company says the 725 million agreement which must still be approved by a judge is in the best interest of our community and shareholders a Meta spokesperson told Reuters. Up to 280 million Facebook users are covered by the settlement which means that 725 million is going to be spread awfully thin after the plaintiffs attorneys take their 25 percent cut.,Meta faces exsanguination by small fines,Extremely Negative,260,"['improperly', 'Worse', 'painful', 'recalcitrant', 'breakup', 'slower', 'breakup']",[],"[Robert, Cyran]"
11,Meta Abandons Original Quest VR Headset,"Meta is dropping support for its first Meta Quest VR headset. The device will no longer receive future content updates, and by 2024 it will no longer get any bug fixes or security patches. Gizmodo reports: Notably, users will no longer have significant functi…",https://tech.slashdot.org/story/23/01/10/2229243/meta-abandons-original-quest-vr-headset,Meta Abandons Original Quest VR Headset gizmodo. com 54 Notably users will no longer have significant functionality. Though Meta promised you will still be able to use the headset and its installed games and apps Quest 1 users will no longer be able to join parties and they will also lose access to Metas feature product Horizon Home on March 5 this year. Users will no longer be able to invite others to their homes or travel over to another users home. Meta CEO Mark Zuckerberg announced what was originally called the Oculus Quest in 2018 as the premiere wireless VR headset. The company released the headset in 2019 so Meta is a little off in their letter when they said they launched the device over four years ago and this was all before Meta officially renamed the devices and its various services in 2021. So the Quest 1 is working off fouryearold tech and it would make some sense why Meta would not want to support aging hardware. Meta CEO Mark Zuckerberg announced what was originally called the Oculus Quest in 2018 as the premiere wireless VR headset. The company released the headset in 2019 so Meta is a little off in their letter when they said they launched the device over four years ago and this was all before Meta officially renamed the devices and its various services in 2021. So the Quest 1 is working off fouryearold tech and it would make some sense why Meta would not want to support aging hardware.,Meta to pay $725 million to settle Cambridge Analytica lawsuit,Extremely Negative,400,"['improperly', 'problematic', 'complaint', 'awfully']",['illegal'],"['lawsuit', 'lawsuit', Donald, Trumps, 'lawsuit', 'lawsuit']"
12,Facebook parent Meta to settle Cambridge Analytica scandal case ... - Reuters,"Facebook owner Meta Platforms Inc <a href=""https://www.reuters.com/companies/META.O"" target=""_blank"">(META.O)</a> has agreed to pay $725 million to resolve a class-action lawsuit accusing the social media giant of allowing third parties, including Cambridge A…",https://www.reuters.com/legal/facebook-parent-meta-pay-725-mln-settle-lawsuit-relating-cambridge-analytica-2022-12-23/,Facebook parent Meta to settle Cambridge Analytica scandal case for 725 million Companies Dec 23 Reuters Facebook owner Meta Platforms Inc META. O has agreed to pay 725 million to resolve a classaction lawsuit accusing the social media giant of allowing third parties including Cambridge Analytica to access users personal information. The proposed settlement which was disclosed in a court filing late on Thursday would resolve a longrunning lawsuit prompted by revelations in 2018 that Facebook had allowed the British political consulting firm Cambridge Analytica to access data of as many as 87 million users. Lawyers for the plaintiffs called the proposed settlement the largest to ever be achieved in a U. S. data privacy class action and the most that Meta has ever paid to resolve a class action lawsuit. This historic settlement will provide meaningful relief to the class in this complex and novel privacy case the lead lawyers for the plaintiffs Derek Loeser and Lesley Weaver said in a joint statement. Meta did not admit wrongdoing as part of the settlement which is subject to the approval of a federal judge in San Francisco. The company said in a statement settling was in the best interest of our community and shareholders. Over the last three years we revamped our approach to privacy and implemented a comprehensive privacy program Meta said. Cambridge Analytica now defunct worked for Donald Trumps successful presidential campaign in 2016 and gained access to the personal information from millions of Facebook accounts for the purposes of voter profiling and targeting. Cambridge Analytica obtained that information without users consent from a researcher who had been allowed by Facebook to deploy an app on its social media network that harvested data from millions of its users. The ensuing Cambridge Analytica scandal fueled government investigations into its privacy practices lawsuits and a highprofile U. S. congressional hearing where Meta Chief Executive Mark Zuckerberg was grilled by lawmakers. In 2019 Facebook agreed to pay 5 billion to resolve a Federal Trade Commission probe into its privacy practices and 100 million to settle U. S. Securities and Exchange Commission claims that it misled investors about the misuse of users data. Investigations by state attorneys general are ongoing and the company is fighting a lawsuit by the attorney general for Washington D. C. Thursdays settlement resolved claims by Facebook users that the company violated various federal and state laws by letting app developers and business partners harvest their personal data without their consent on a widespread basis. The users lawyers alleged that Facebook misled them into thinking they could keep control over personal data when in fact it let thousands of preferred outsiders gain access. Facebook argued its users have no legitimate privacy interest in information they shared with friends on social media. But U. S. District Judge Vince Chhabria called that view so wrong and in 2019 largely allowed the case to move forward. The settlement covers an estimated 250 to 280 million Facebook users according to Thursdays court filing. How much an individual user receives will depend on how many people submit valid claims for a share of the settlement. Lawyers for the plaintiffs say they plan to ask the judge to award them up to 25 of the settlement as attorneys fees equaling about 181 million. Our Standards The Thomson Reuters Trust Principles.,No Headline,Extremely Negative,200,['lose'],[],"[Mark, Zuckerberg, Mark, Zuckerberg]"
13,Irish privacy regulator fines Meta more than $400 mln - Reuters,"Ireland's data privacy regulator fined Meta <a href=""https://www.reuters.com/companies/META.O"" target=""_blank"">(META.O)</a> 390 million euros ($414 million) on Wednesday for breaches at its Facebook and Instagram services and said both must reassess the legal…",https://www.reuters.com/technology/irish-privacy-regulator-fines-meta-more-than-400-mln-2023-01-04/,Meta told to reassess legal basis for EU personalised ads Summary Companies Meta to appeal ruling says personalised ads unaffected Meta fines under new EU data regime rise to 1. 3 bln eur Irish privacy watchdog is Metas lead regulator in EU DUBLIN Jan 4 Reuters Meta META. O must reassess the legal basis on how Facebook and Instagram use personal data to target advertising in the European Union its lead privacy regulator in the bloc said on Wednesday when it fined the social media giant 390 million euros 414 million for the breaches. Meta said it intended to appeal both the substance of the rulings and the fines imposed and that the decisions do not prevent personalised advertising on its platforms. The order on personalised advertising was made in December by the EUs privacy watchdog according to a decision seen by Reuters in which it overruled a draft ruling by Irelands Data Privacy Commissioner DPC Metas lead EU privacy regulator. It related to a 2018 change in the terms of service at Facebook and Instagram following the introduction of new EU privacy laws where Meta sought to rely on the socalled contract legal basis for most of its processing operations. Having previously relied on the consent of users to the processing of their personal data for targeted advertising the DPC said Meta instead considered that a contract was entered into upon acceptance of the updated 2018 terms and that this made such advertising lawful. The DPC which is the lead privacy regulator for many of the worlds largest technology companies within the EU directed Meta to bring its data processing operations into compliance within three months. Meta said it strongly believes that its approach respects EU privacy laws that allow for a range of legal bases under which data can be processed and that the decisions also do not mandate the use of consent for the processing of data. We want to reassure users and businesses that they can continue to benefit from personalised advertising across the EU through Metas platforms Meta said in a statement. The penalties brought the total fines levied against Meta to date by the Irish regulator to 1. 3 billion euros. It currently has 11 other inquiries open into Meta services. The DPC said that as part of its decision the EUs privacy watchdog had purported to direct the Irish regulator to conduct a fresh investigation that would span all of Facebook and Instagrams data processing operations. The DPC said it was not open to the European Data Protection Board EDPB to direct an authority to engage in such investigations and that it intended to ask the EU Court of Justice to set aside the EDPBs direction as it may involve an overreach. 1 0. 9423 euros Our Standards The Thomson Reuters Trust Principles.,Facebook parent Meta to settle Cambridge Analytica scandal case for $725 million,Extremely Negative,400,"['scandal', 'accusing', 'defunct', 'scandal', 'misuse', 'wrong']",[],"['lawsuit', 'lawsuit', 'lawsuit', Derek, Loeser, Lesley, Weaver, Donald, Trumps, 'lawsuit', Mark, Zuckerberg, 'lawsuit', Vince, Chhabria]"
