Article,Title,Description,URL,Content,Published
0,Monster winter storm across U.S. claims at least 34 lives,"The scope of the storm has been nearly unprecedented, stretching from the Great Lakes near Canada to the Rio Grande along the border with Mexico.",https://www.npr.org/2022/12/25/1145492047/monster-winter-storm-across-u-s-claims-at-least-34-lives,Monster winter storm across U. S. claims at least 34 lives BUFFALO N. Y. Millions of people hunkered down against a deep freeze Sunday to ride out the winter storm that has killed at least 34 people across the United States and is expected to claim more lives after trapping some residents inside houses with heaping snow drifts and knocking out power to tens of thousands of homes and businesses. The scope of the storm has been nearly unprecedented stretching from the Great Lakes near Canada to the Rio Grande along the border with Mexico. About 60 of the U. S. population faced some sort of winter weather advisory or warning and temperatures plummeted drastically below normal from east of the Rocky Mountains to the Appalachians the National Weather Service said. Travelers weather woes are likely to continue with hundreds of flight cancellations already and more expected after a bomb cyclone when atmospheric pressure drops very quickly in a strong storm developed near the Great Lakes stirring up blizzard conditions including heavy winds and snow. Some 1707 domestic and international flights were canceled on Sunday as of about 2 p. m. EDT according to the tracking site FlightAware. The storm unleashed its full fury on Buffalo with hurricaneforce winds and snow causing whiteout conditions paralyzing emergency response efforts. New York Gov. Kathy Hochul said almost every fire truck in the city was stranded Saturday. Officials said the airport would be shut through Tuesday morning. The National Weather Service said the snow total at the Buffalo Niagara International Airport stood at 43 inches 109 centimeters at 7 a. m. Sunday. Daylight revealed cars nearly covered by 6foot snowdrifts and thousands of houses some adorned in unlit holiday displays dark from a lack of power. With snow swirling down untouched and impassable streets forecasters warned that an additional 1 to 2 feet of snow was possible in some areas through early Monday morning amid wind gusts of 40 mph. Two people died in their suburban Cheektowaga New York homes Friday when emergency crews could not reach them in time to treat their medical conditions and another died in Buffalo. Four more deaths were confirmed overnight bringing the total to seven in Erie County. County Executive Mark Poloncarz warned there may be more dead. Some were found in cars some were found on the street in snowbanks said Poloncarz. We know there are people who have been stuck in cars for more than 2 days. Freezing conditions and dayold power outages had Buffalonians scrambling to get to anywhere that had heat amid what Hochul called the longest sustained blizzard conditions ever in the city. But with streets under a thick blanket of white that wasnt an option for people like Jeremy Manahan who charged his phone in his parked car after almost 29 hours without electricity. Theres one warming shelter but that would be too far for me to get to. I cant drive obviously because Im stuck Manahan said. And you cant be outside for more than 10 minutes without getting frostbit. Ditjak Ilunga of Gaithersburg Maryland was on his way to visit relatives in Hamilton Ontario for Christmas with his daughters Friday when their SUV was trapped in Buffalo. Unable to get help they spent hours with the engine running buffeted by wind and nearly buried in snow. By 4 a. m. Saturday their fuel nearly gone Ilunga made a desperate choice to risk the howling storm to reach a nearby shelter. He carried 6yearold Destiny on his back while 16yearold Cindy clutched their Pomeranian puppy following his footprints through drifts. If I stay in this car Im going to die here with my kids Ilunga recalled thinking. He cried when the family walked through the shelter doors. Its something I will never forget in my life. The storm knocked out power in communities from Maine to Seattle. But heat and lights were steadily being restored across the U. S. According to poweroutage. us less than 200000 customers were without power Sunday at 3 p. m. EDT down from a peak of 1. 7 million. Concerns about rolling blackouts across eastern states subsided Sunday after PJM Interconnection said its utilities could meet the days peak electricity demand. The midAtlantic grid operator had called for its 65 million consumers to conserve energy amid the freeze Saturday. In North Carolina less than 6500 customers had no power down from a peak of 485000. Across New England power has been restored to tens of thousands with just under 83000 people mostly in Maine still without it. In New York about 34000 households were still without power Sunday including 26000 in Erie County where utility crews and hundreds of National Guard troops battled high winds and struggled with getting stuck in the snow. Stormrelated deaths were reported in recent days all over the country 12 in Erie County New York ranging in age from 26 to 93 years old and another in Niagara County where a 27yearold man was overcome by carbon monoxide after snow blocked his furnace 10 in Ohio including an electrocuted utility worker and those killed in multiple car crashes six motorists killed in crashes in Missouri Kansas and Kentucky a Vermont woman struck by a falling branch an apparently homeless man found amid Colorados subzero temperatures and a woman who fell through Wisconsin river ice. In Jackson Mississippi city officials on Christmas Day announced that residents must now boil their drinking water due to water lines bursting in the frigid temperatures While in Tampa Florida the thermometer plunged below freezing for the first time in almost five years according to the National Weather Service a drop conducive to coldblooded iguanas falling out of trees. In Buffalo William Kless was up at 3 a. m. Sunday. He called his three children at their mothers house to wish them Merry Christmas and then headed off on his snowmobile for a second day spent shuttling people from stuck cars and frigid homes to a church operating as a warming shelter. Through heavy winddriven snow he brought about 15 people to the church in Buffalo on Saturday he said including a family of five transported onebyone. He also got a man in need of dialysis who had spent 17 hours stranded in his car back home where he could receive treatment. I just felt like I had to Kless said.,2022-12-25T22:54:24Z
1,Razer's Blade 15 gaming laptops with 12th-gen Intel CPUs are $400 off,"You can now save $400 on one of the best premium gaming laptop out there. The configuration of Razer's Blade 15 we recommend in our latest gaming laptop guide combines bleeding-edge performance and speedy graphics, all wrapped up in a sleek and sturdy aluminu…",https://www.engadget.com/razers-blade-15-gaming-laptops-with-12-th-gen-intel-cp-us-are-400-off-184549939.html,You can now save 400 on one of the best premium gaming laptop out there. The configuration of Razers Blade 15 we recommend in our latest gaming laptop guide combines bleedingedge performance and speedy graphics all wrapped up in a sleek and sturdy aluminum chassis. Usually 3000 both Amazon and Razer are offering our recommended unit for 2600 or 13 percent off the list price. Thats the lowest price this configuration has seen yet and while its still not a cheap laptop we think you get what you pay for in a laptop that can game with the best of them. The quadHD display is highly responsive with a 240Hz refresh rate and NVIDIAs GeForce RTX 3070 Ti graphics card is fast enough to keep up. It runs on a 12thgen Intel i712800H processor a powerful chip thats focused on performance and offers 16GB of dualchannel slotted upgradable memory. Storage is handled with 1TB of SSD with an open M. 2 slot should you want to add more. Windows 11 Home is loaded onto the unit and it has one of the best glass touchpads weve tried on a Windows laptop. The larger keys make the Blade 15 easier to use for both gaming and general productivity. Overall this model of the Blade 15 not only excels at gaming it makes for a worthy desktop replacement too. Other configurations of the Intel 12thgen Blade 15s are also on sale right now. Razer announced the option to pair up a Blade with the first 240Hz OLED laptop screen earlier last year. If you want that display with the same RTX 3070 Ti graphics plus a slightly faster Intel i9 processor its on sale at both Amazon and Razer for 400 off bringing the price down to 2900. The fully loaded unit we tried out in our handson review is also 400 off at Razers site bringing the 3700 monster down to 3300. Its got a 12thgen Intel i712800H processor a faster RTX 3080 Ti graphics card and the quadHD 240Hz display. While none of these are budget options if youre looking for a big luxury laptop thats capable of holding its own while playing any of the latest gaming titles now might be a good time to grab a Blade 15 while you can keep 400 in your pocket. Follow EngadgetDeals on Twitter and subscribe to the Engadget Deals newsletter for the latest tech deals and buying advice.,2023-01-05T18:45:49Z
2,See who won at the Golden Globes,The 80th Golden Globes Awards are being presented Tuesday.,https://www.cnn.com/2023/01/10/entertainment/golden-globe-winners-2023/index.html,The 80th Golden Globes Awards were presented Tuesday in Los Angeles. ABCs Abbott Elementary and HBOs The White Lotus were some of the big TV winners of the night and in film The Banshees of Inisherin and The Fabelmans walked away with two of the most coveted awards of the night. See below for a full list of nominees with the winners indicated in bold. TELEVISION Best Performance by an Actor in a Television Series Musical or Comedy Donald Glover Atlanta Bill Hader Barry Steve Martin Only Murders in the Building Martin Short Only Murders in the Building Jeremy Allen White The Bear WINNER Best Performance by an Actress in a Television Series Musical or Comedy Quinta Brunson Abbott Elementary WINNER Kaley Cuoco The Flight Attendant Selena Gomez Only Murders in the Building Jenna Ortega Wednesday Jean Smart Hacks Best Performance by an Actor in a Television Series Drama Jeff Bridges The Old Man Kevin Costner Yellowstone WINNER Diego Luna Andor Bob Odenkirk Better Call Saul Adam Scott Severance Best Performance by an Actress in a Television Series Drama Emma DArcy House of the Dragon Laura Linney Ozark Imelda Staunton The Crown Hilary Swank Alaska Daily Zendaya Euphoria WINNER Best Performance by an Actor in a Limited Series or Motion Picture Made for Television Taron Egerton Black Bird Colin Firth The Staircase Andrew Garfield Under the Banner of Heaven Evan Peters Monster The Jeffrey Dahmer Story WINNER Sebastian Stan Pam and Tommy Best Performance by an Actress in a Limited Series or Motion Picture Made for Television Jessica Chastain George and Tammy Julia Garner Inventing Anna Lily James Pam and Tommy Julia Roberts Gaslit Amanda Seyfried The Dropout WINNER Best Television Series Drama Better Call Saul The Crown House of the Dragon WINNER Ozark Severance Best Television Limited Series or Motion Picture Made for Television Black Bird Monster The Jeffrey Dahmer Story Pam and Tommy The Dropout The White Lotus WINNER Best Performance by an Actress in a Supporting Role in a MusicalComedy or Drama Television Series Elizabeth Debicki The Crown Hannah Einbinder Hacks Julia Garner Ozark WINNER Janelle James Abbott Elementary Sheryl Lee Ralph Abbott Elementary Best Performance by an Actor in a Supporting Role in a MusicalComedy or Drama Television Series John Lithgow The Old Man Jonathan Pryce The Crown John Turturro Severance Tyler James Williams Abbott Elementary WINNER Henry Winkler Barry Best Performance by an Actress in a Supporting Role in a Series Limited Series or Motion Picture Made for Television Jennifer Coolidge The White Lotus WINNER Claire Danes Fleishman Is in Trouble Daisy EdgarJones Under the Banner of Heaven Niecy NashBetts Monster The Jeffrey Dahmer Story Aubrey Plaza The White Lotus Best Performance by an Actor in a Supporting Role in a Series Limited Series or Motion Picture Made for Television F. Murray Abraham The White Lotus Domhnall Gleeson The Patient Paul Walter Hauser Black Bird WINNER Richard Jenkins Monster The Jeffrey Dahmer Story Seth Rogen Pam and Tommy Best Television Series Musical or Comedy Abbott Elementary WINNER The Bear Hacks Only Murders in the Building Wednesday FILM Best Motion Picture Musical or Comedy Babylon The Banshees of Inisherin WINNER Everything Everywhere All at Once Glass Onion A Knives Out Mystery Triangle of Sadness Best Motion Picture Drama Avatar The Way of Water Elvis The Fabelmans WINNER TAR Top Gun Maverick Best Motion Picture Foreign Language RRR India All Quiet on the Western Front Germany Argentina 1985 Argentina WINNER Close Belgium Decision to Leave South Korea Best Screenplay Motion Picture Todd Field Tr Tony Kushner Steven Spielberg The Fabelmans Daniel Kwan Daniel Scheinert Everything Everywhere All at Once Martin McDonagh The Banshees of Inisherin WINNER Sarah Polley Women Talking Best Original Song Motion Picture Carolina Taylor Swift Where the Crawdads Sing Ciao Papa Guillermo del Toro Roeban Katz Guillermo del Toros Pinocchio Hold My Hand Lady Gaga and Bloodpop Top Gun Maverick Lift Me Up Tems Ludwig Gransson Rihanna and Ryan Coogler Black Panther Wakanda Forever Naatu Naatu Kala Bhairava M. M. Keeravani Rahul Sipligunj RRR WINNER Best Actor in a Supporting Role in Any Motion Picture Brendan Gleeson The Banshees of Inisherin Barry Keoghan The Banshees of Inisherin Brad Pitt Babylon Ke Huy Quan Everything Everywhere All at Once WINNER Eddie Redmayne The Good Nurse Best Actress in a Supporting Role in Any Motion Picture Angela Bassett Black Panther Wakanda Forever WINNER Kerry Condon The Banshees of Inisherin Jamie Lee Curtis Everything Everywhere All at Once Dolly De Leon Triangle of Sadness Carey Mulligan She Said Best Actor in a Motion Picture Musical or Comedy Diego Calva Babylon Daniel Craig Glass Onion A Knives Out Mystery Adam Driver White Noise Colin Farrell The Banshees of Inisherin WINNER Ralph Fiennes The Menu Best Motion Picture Animated Guillermo del Toros Pinocchio WINNER Marcel the Shell With Shoes On Puss in Boots The Last Wish Turning Red Best Actor in a Motion Picture Drama Austin Butler Elvis WINNER Brendan Fraser The Whale Hugh Jackman The Son Bill Nighy Living Jeremy Pope The Inspection Best Actress in a Motion Picture Drama Cate Blanchett Tr WINNER Olivia Colman Empire of Light Viola Davis The Woman King Ana de Armas Blonde Michelle Williams The Fabelmans Best Actress in a Motion Picture Musical or Comedy Lesley Manville Mrs. Harris Goes to Paris Margot Robbie Babylon Anya TaylorJoy The Menu Emma Thompson Good Luck to You Leo Grande Michelle Yeoh Everything Everywhere All at Once WINNER Best Director Motion Picture James Cameron Avatar The Way of Water Daniel Kwan and Daniel Scheinert Everything Everywhere All at Once Baz Luhrmann Elvis Martin McDonagh The Banshees of Inisherin Steven Spielberg The Fabelmans WINNER Best Original Score Alexandre Desplat Guillermo del Toros Pinocchio Hildur Gunadttir Women Talking Justin Hurwitz Babylon WINNER John Williams The Fabelmans Carter Burwell The Banshees of Inisherin,2023-01-11T01:38:33Z
3,"Xbox Game Pass starts 2023 with Persona, Monster Hunter",Xbox Game Pass starts January off with a relatively lean offering -- three massive RPGs to be released over the course of a week.,https://venturebeat.com/games/xbox-game-pass-starts-2023-with-persona-monster-hunter/,Game Pass subscribers are getting their first new games of 2023. Xbox announced its adding three new titles to the service next week. Its a smaller addition than usual for Game Pass but this is somewhat mitigated by all three games being massive RPGs. The titles are Persona 3 Portable Persona 4 Golden and Monster Hunter Rise. The two Persona titles join their JRPG sibling Persona 5 Royal on the service on January 19. Both tell supernatural comingofage stories. Monster Hunter Rise another RPG about as the name suggests hunting giant monsters launches on the service on January 20. While usually Game Pass additions comprise more titles and are spread over a number of weeks its first addition of 2023 is a shorter one. It didnt announce or launch any titles during the first week of the year. This is in contrast with January 2022 where Game Pass added several games throughout the month. Whether this is due to a lack of big launches or a shortage of games joining Game Pass remains to be seen. The first titles to leave Game Pass in 2023 depart on the 15th. These include Danganronpa Trigger Happy Havoc Nobody Saves The World Pupperazzi The Anacrusis We Happy Few and Windjammers 2. Most of these were added to the service last January. GamesBeats creed when covering the game industry is where passion meets business. What does this mean We want to tell you how the news matters to you not just as a decisionmaker at a game studio but also as a fan of games. Whether you read our articles listen to our podcasts or watch our videos GamesBeat will help you learn about the industry and enjoy engaging with it. Discover our Briefings.,2023-01-10T17:27:58Z
