Article,Title,Description,URL,Content,Published,Headline,Headline Sentiment,Offense Rating,Negative Words,Offensive Words,Tags
17,1 Stock That Proves You Shouldn't Buy What You Know,"Chip stock NVIDIA Corporation (NVDA) is highly popular among investors. However, the company is facing demand softness in China and export restrictions. Demand for GPUs from the gaming industry has...",https://stocknews.com/news/nvda-umc-stm-aeis-1-stock-that-proves-you-shouldnt-buy-what-you-know/,Chip designer and computing major NVIDIA Corporation NVDA reported higherthanexpected revenues in the third quarter on the back of solid demand in its data center business. Its revenue was 1. 9 above analyst estimates. The companys EPS was 17. 6 below the consensus estimate. Its gross margin fell 11. 6 percentage points to 53. 6. Data center revenue grew 31 yearoveryear while gaming revenue declined 51 from the prioryear period. The companys revenue was hit due to soft demand from China and the U. S. governments ban on the export of GPUs A100 and H100. To counter the financial loss from the ban the company unveiled the A800 GPU which would be an alternative to the A100. The A800 complies with the export control rules and it helped NVDA lessen the financial implication of the ban. After the pandemicinduced rise in gaming NVDAs gaming segment suffered in the third quarter due to the lower GPU sales for desktops and laptops. Moreover with the severe decline in crypto mining the demand for its GPU chips has slowed down. With many analysts expecting an extended crypto winter NVDAs demand from the crypto market could take a hit. For the fiscal fourth quarter ended December 31 2022 NVDA expects its revenue to be 6 billion plus or minus 2 compared to analyst expectations of 6. 09 billion. NVDAs stock has gained 14. 4 over the past three months. On the other hand it has declined 52. 5 in price over the past year to close the last trading session at 143. 15. Heres what could influence NVDAs performance in the upcoming months Disappointing Financials NVDAs revenue declined 16. 5 yearoveryear to 5. 93 billion for the third quarter ended October 30 2022. Its nonGAAP operating income declined 54. 6 yearoveryear to 1. 54 billion. The companys nonGAAP net income decreased 51 yearoveryear to 1. 46 billion. Also its nonGAAP EPS came in at 0. 58 representing a decline of 50. 4 yearoveryear. Mixed Analyst Estimates Analysts expect NVDAs EPS for fiscal 2023 is expected to decline 25. 7 yearoveryear to 3. 30. On the other hand its EPS for fiscal 2024 is expected to increase 32. 5 yearoveryear to 4. 37. Its revenue for fiscal 2023 and 2024 is expected to increase 0. 1 and 9. 2 yearoveryear to 26. 94 billion and 29. 43 billion respectively. Its EPS and revenue for the quarter ending January 31 2023 is expected to decline 39. 3 and 21. 2 yearoveryear to 0. 80 and 6. 02 billion respectively. Stretched Valuation In terms of forward EVS NVDAs 13. 03x is 424. 8 higher than the 2. 48x industry average. Likewise its 13. 08x forward PS is 429. 3 higher than the 2. 47x industry average. Also its forward PB of 16. 02x is 316. 2 higher than the 3. 85x industry average. Likewise its 39. 10x forward EVEBIT is 149. 8 higher than the 15. 66x industry average. High Profitability NVDAs 20. 85 trailing12month net income margin is 542. 5 higher than the 3. 25 industry average. Likewise its 25. 52 trailing12month EBIT margin is 285. 4 higher than the 6. 62 industry average. Furthermore the stocks 18. 04 trailing12month levered FCF margin is 141. 1 higher than the 7. 48 industry average. POWR Ratings Reflect Bleak Prospects NVDA has an overall D rating equating to Sell in our POWR Ratings system. The POWR Ratings are calculated by considering 118 distinct factors with each factor weighted to an optimal degree. Our proprietary rating system also evaluates each stock based on eight distinct categories. NVDA has a D grade for Value consistent with its stretched valuation. It has a D grade for Stability in sync with its 1. 75 beta. NVDA is ranked 80 out of 92 stocks in the Semiconductor Wireless Chip industry. Click here to access NVDAs Growth Momentum Sentiment and Quality ratings. Bottom Line NVDAs stock is trading below its 50day and 200day moving averages of 153. 62 and 169. 66 respectively indicating a downtrend. Although its revenues declined yearoveryear its data center revenues displayed strong growth. The softness of consumer demand in China and the weak demand for GPUs to be used in gaming and crypto mining will likely keep NVDA under pressure. Moreover NVDAs top and bottom lines could remain under pressure with the global economy expected to face a slowdown. Given its disappointing financials and stretched valuation it could be wise to avoid the stock now. How Does NVIDIA Corporation NVDA Stack up Against Its Peers NVDA has an overall POWR Rating of D equating to a Sell rating. Therefore one might want to consider investing in other Semiconductor Wireless Chip stocks with an A Strong Buy or B Buy rating such as United Microelectronics Corporation UMC STMicroelectronics N. V. STM and Advanced Energy Industries Inc. AEIS. Want More Great Investing Ideas 2023 Stock Market Outlook Updated Bear Market Game Plan 7 SEVERELY Undervalued Stocks 3 Stocks to DOUBLE This Year NVDA shares were trading at 143. 23 per share on Wednesday morning up 0. 08 0. 06. Yeartodate NVDA has declined 1. 99 versus a 0. 32 rise in the benchmark SP 500 index during the same period. About the Author Dipanjan Banchur Since he was in grade school Dipanjan was interested in the stock market. This led to him obtaining a masters degree in Finance and Accounting. Currently as an investment analyst and financial journalist Dipanjan has a strong interest in reading and analyzing emerging trends in financial markets. More...,2023-01-04T15:51:23Z,"
							AMD, NVDA and 1 Other Semiconductor Stock to Sell Before 2023",Extremely Positive,310,"['recessionary', 'decline', 'falling', 'waning', 'conflict', 'deterioration', 'weakening', 'decline', 'bleak', 'weak', 'fell', 'decline', 'decline', 'weak', 'proprietary', 'loss', 'decline', 'poor', 'proprietary', 'debt', 'loss', 'loss', 'loss', 'negative', 'lost', 'weak', 'proprietary']",['fear'],"[Mark, Liu, Shweta, Kumari]"
18,NVIDIA vs. Taiwan Semi: Which Chip Stock Is the Better Buy in 2023,"Chip demand has been under pressure lately. However, industry executives have a positive outlook for 2023. Also, the industry is expected to witness steady growth in the long term. So,...",https://stocknews.com/news/tsm-nvda-nvidia-vs-taiwan-semi-which-chip-stock-is-the-better/,Chip demand has declined in recent months. However the longterm prospects of the industry look stable. The global semiconductor chip handler market is estimated to grow at a CAGR of 4. 2 until 2026. KPMG LLP and the Global Semiconductor Alliances GSA global semiconductor industry survey in the fourth quarter of 2022 reveals 81 project their companys revenue will grow over 2023. Moreover 65 of the executives surveyed think the semiconductor supply shortage will ease this year. The Semiconductor Industry Confidence Index score came in at 56 for 2023 indicating a positive outlook. Moreover investors interest in chip stocks is evident from the iShares Semiconductor ETFs SOXX 24. 2 gains over the past three months. Therefore chip stocks NVIDIA Corporation NVDA and Taiwan Semiconductor Manufacturing Company Limited TSM are expected to benefit. NVDA has lost 5. 9 over the past month while TSM has gained marginally. However NVDA has gained 38. 1 over the past three months while TSM has gained 28. 9. But which of these stocks is the better pick now Lets find out. Latest Developments On January 3 2023 NVDA and Hon Hai Technology Group Foxconn the worlds largest technology manufacturer announced a strategic partnership to develop automated and autonomous vehicle platforms. This agreement is aimed at meeting growing industry demand. On the other hand on October 26 2022 TSM announced the Open Innovation Platform OIP 3DFabric Alliance at the 2022 Open Innovation Platform Ecosystem Forum. Dr. L. C. Lu TSMs fellow and vice president of design and technology platform said Through the collective leadership of TSMC and our ecosystem partners our 3DFabric Alliance offers customers an easy and flexible way to unlocking the power of 3D IC in their designs and we cant wait to see the innovations they can create with our 3DFabric technologies. Moreover TSM registered record financials in its latest reported quarter. Recent Financial Results NVDAs revenue came in at 5. 93 billion for the third quarter that ended October 30 2022 down 16. 5 yearoveryear. Its gross profit came in at 3. 18 billion down 31. 4 yearoveryear. Also its net income came in at 680 million down 72. 4 yearoveryear while its EPS came in at 0. 27 down 72. 2 yearoveryear. TSMs net sales came in at NT625. 53 billion 20. 56 billion for the fiscal 2022 fourth quarter ended December 2022 up 42. 8 yearoveryear. Its gross profit came in at NT389. 19 billion 12. 79 billion up 68. 7 yearoveryear. Also its net income came in at NT295. 90 billion 9. 73 billion up 78 yearoveryear while its EPS came in at NT11. 41 up 78 yearoveryear. Past and Expected Financial Performance NVDAs revenue is expected to increase marginally yearoveryear to 26. 97 billion in 2023. However its revenue is expected to decrease 21. 4 yearoveryear to 6. 01 billion for the quarter ending January 2023 and 22. 5 yearoveryear to 6. 42 billion for the quarter ending April 2023. Its EPS is expected to fall 26. 4 yearoveryear to 3. 27 in 2023. On the other hand TSMs revenue is expected to increase 2. 2 yearoveryear to 76. 24 billion in 2023. Moreover its EPS is expected to rise 21. 5 per annum for the next five years. It surpassed EPS estimates in all four trailing quarters. Profitability NVDAs gross profit margin of 57. 84 is higher than TSMs 57. 30. However TSMs EBITDA and net income margins of 68. 04 and 42. 51 are higher than NVDAs 30. 52 and 20. 85. In addition TSMs ROE ROA and ROTC of 36. 57 19. 92 and 19. 33 are higher than NVDAs 26. 39 16. 88 and 13. 23 respectively. Thus TSM is more profitable. Valuation In terms of forward EVSales TSMs 5. 26x is 63. 9 lower than NVDAs 14. 57x. Its forward EVEBITDA of 7. 64x is significantly lower than NVDAs 63. 05x. Moreover its forward PE of 12. 78x compares with NVDAs 96. 08x. Thus TSM is relatively more affordable. POWR Ratings TSM has an overall rating of B equating to Buy in our proprietary POWR Ratings system. On the other hand NVDA has an overall rating of D which translates to Sell. The POWR Ratings are calculated considering 118 different factors with each factor weighted to an optimal degree. TSM has a B grade for Growth consistent with its steady financials in the latest reported quarter. Comparatively NVDA has a D grade for Growth consistent with its bleak financials. In addition TSM has a C grade for Stability in sync with its 24month beta of 1. 04. In contrast NVDA has a D grade for Stability in sync with its 24month beta of 2. 03. Furthermore TSM has a B grade for Sentiment consistent with its favorable analyst expectations while NVDA has a C for Sentiment consistent with its mixed analyst expectations. Of the 93stock Semiconductor Wireless Chip industry TSM is ranked 12 and NVDA is ranked 81. Beyond what weve stated above we have also rated the stocks for Value Momentum Sentiment and Quality. Click here to view TSM ratings. Get all NVDA ratings here. The Winner While the semiconductor industry is witnessing macro headwinds its longterm prospects look bright. Therefore popular chip stocks TSM and NVDA should benefit. However TSMs robust financials attractive valuations and profitability make it a better Buy. Our research shows that the odds of success increase when one invests in stocks with an Overall Rating of Strong Buy or Buy. View all the toprated stocks in the Semiconductor Wireless Chip industry here. Want More Great Investing Ideas 2023 Stock Market Outlook Updated Bear Market Game Plan 7 SEVERELY Undervalued Stocks 3 Stocks to DOUBLE This Year TSM shares rose 3. 47 4. 24 in premarket trading Thursday. Yeartodate TSM has gained 14. 24 versus a 3. 55 rise in the benchmark SP 500 index during the same period. About the Author Riddhima Chakraborty Riddhima is a financial journalist with a passion for analyzing financial instruments. With a masters degree in economics she helps investors make informed investment decisions through her insightful commentaries. More...,2023-01-12T14:14:13Z,"
							1 Stock That Proves You Shouldn't Buy What You Know",Extremely Negative,430,"['fell', 'loss', 'implication', 'suffered', 'severe', 'decline', 'slowed', 'Disappointing', 'decline', 'decline', 'decline', 'Bleak', 'proprietary', 'weak', 'disappointing']",[],"['lawsuit', 'lawsuit', 'lawsuit', Dipanjan, Banchur, Dipanjan, Dipanjan]"
19,You're Gonna Need a Bigger Desk: Samsung's New Gaming Monitor Is a Beast - CNET,"Samsung brought a 57-inch curved high-res display, a 49-inch QD-OLED and some smaller fry to CES 2023.",https://www.cnet.com/tech/computing/youre-gonna-need-a-bigger-desk-samsungs-new-gaming-monitor-is-a-beast/,CES is when gamingmonitor companies bring out the big guns and few are bigger than the new 57inch Samsung Odyssey Neo G9 a curved DisplayHDR 1000 model. Teased by AMD during its RX 7000series GPU launch in November as the first monitor announced with DisplayPort 2. 1 support the Neo G9 has 7680x2160pixel resolution. The high resolution plus HDR and fast 240Hz refresh rate make the highbandwidth DP 2. 1 essential even though its not a full 8K its a 329 aspect ratio. However theres still a bit of a disconnect between this level of resolution and GPU performance. At the moment the only GPU that can handle it with all the frills is probably the Nvidia GeForce RTX 4090 but Nvidia hasnt leveled up to DP 2. 1 HDMI 2. 1 can support it but only at 60Hz. AMDs RX 7900 XTX does have DP2. 1 connections but isnt quite up to that level or might be but just under limited circumstances. Its slated to ship later this year but we dont know how much this bad boy is going to cost. Read More CES 2023 Watch Every Announcements from Samsung LG Nvidia The 49inch Odyssey OLED G9 G95SC isnt the companys first Quantum Dot OLED monitor announcement it unveiled a 34inch G8 model similar to the Alienware 34 QDOLED at IFA in August which was supposed to ship by the end of 2022 but thats been bumped to very soon. In addition to the QDOLED panel the G9 has 5120x1440pixel resolution essentially 329ratio 1440p but with a better pixel density than the typical 219 3440x1440 and is DisplayHDR True Black 400 certified. It also has a fasterthanAlienware 240Hz refresh rate and incorporates Samsungs Gaming Hub for cloud gaming. Samsung opted to go with mini DisplayPort instead of fullsize DisplayPort for this model in addition to HDMI and USBC with 65watt power delivery. Samsung expects to ship it later this year and has yet to give us pricing. A little more mundane if you consider 43inch monitors have reached that level of commonplace the flat Odyssey Neo G7 goes a little sleeker and more gamingslashentertainment hybrid than its predecessors. The 144Hz Quantum Dot DisplayHDR 600compliant monitor has integrated stereo speakers and comes with a remote and all the streamingandgaming apps Samsungs Hubs can include. Its scheduled to ship by the end of March in the US for an as yet unspecified number of dollars.,2023-01-04T19:01:50Z,"
							NVIDIA vs. Taiwan Semi: Which Chip Stock Is the Better Buy in 2023",Extremely Positive,80,"['shortage', 'Limited', 'lost', 'marginally', 'vice', 'marginally', 'fall', 'proprietary', 'bleak']",[],"[L., C., Lu, Riddhima, Chakraborty, Riddhima]"
20,Yearning for a Bigger Gaming Laptop Display? Acer's About to Make You Very Happy - CNET,"Acer is going big at CES 2023, with 16- and 18-inch Predator Helios gaming laptops.",https://www.cnet.com/tech/computing/yearning-for-a-bigger-gaming-laptop-display-acers-about-to-make-you-very-happy/,A lot of gamers will be pleased with whats coming in 2023 from Acer. The new 16 and 18inch Predator Helios gaming laptops announced Tuesday at CES 2023 feature the latest 13thgen Intel Core processors Nvidia GeForce RTX 40 series graphics enhanced cooling beautiful big displays and a whole lot of lights. Read more CES 2023 How to Watch the Biggest Announcements from Samsung LG Nvidia Predator Helios is a premium gaming line so Acer will offer the best in new components inside. Along with the latest Intel and Nvidia options theyll support up to 32GB of DDR54800 RAM and up to 2TB PCIe Gen4 NVMe solidstate drives in RAID 0. The components will be kept cool with dual customengineered fifthgen AeroBlade 3D metal fans and vector heat pipes in the shape of rectangles for improved heat transfer Acer said in its announcement. The Helios 16 will come with three 2560x1600pixel display options with a 165Hz or 240Hz refresh rate or a Mini LED panel with a 250Hz refresh rate 100 P3 color gamut and a peak brightness over 1000 nits. The 18inch Helios has those panel options as well as an entrylevel 1920x1200pixel display at 165Hz. The new designs use a miniLED backlit keyboard with deep 1. 8millimeter key travel. The perkey lighting uses less power while giving the keys bright uniform color. A customizable RGB light bar also runs across the top of the back vents. The Predator Helios 16 is expected in March starting at 1650 with the Helios 18 following in April with a starting price of 1700. Both laptops are expected to be available in Europe a month earlier than in the US though. Pricing for the UK and Australia wasnt immediately available but the price for the Helio 16 converts to approximately 1370 or AU2445. Acer also introduced new Nitro gaming laptops for those who want a bigger display still but at a lower entry price. Available in 16 and 17. 3inch sizes the new Nitro gaming laptops will also be available with the latest Intel and Nvidia chips up to 32GB of DDR5 memory and up to a 2TB PCIe Gen4 SSD for storage. Display options will include a 2560x1600pixel panel with a 165Hz refresh rate on the 16inch version and either a 144Hz or 165Hz fullHD or 165Hz quadHD display on Nitro 17. Both the Acer Nitro 16 and 17 are expected in May with a starting price of 1200.,2023-01-03T22:49:35Z,You're Gonna Need a Bigger Desk: Samsung's New Gaming Monitor Is a Beast,Extremely Positive,50,"['limited', 'bad', 'bumped', 'mundane', 'commonplace', 'unspecified']",[],[]
21,The Razer Blade 16 Doesn't Make You Choose Between 4K and a High FPS,"Normally, when you buy a gaming laptop, you have to make a choice. Do you want a high resolution, for pretty visuals, or a high frame rate, for smooth gameplay? Most of the time, you can only choose one, with some middle ground in the 1440p and 120Hz area. Th…",https://gizmodo.com/razer-blade-16-4k-high-fps-mini-led-nvidia-rtx-price-1849952313,Normally when you buy a gaming laptop you have to make a choice. Do you want a high resolution for pretty visuals or a high frame rate for smooth gameplay Most of the time you can only choose one with some middle ground in the 1440p and 120Hz area. The new Razer Blade 16 with its dualmode miniLED display is getting rid of that choice for you. The laptop which launches in Q1 of this year for a not insignificant starting price of 2699 is at least doing its best to keep you from getting buyers remorse. Regardless of the model you pick youll be able to press a button to swap the display between Creator Mode and a Gamer Mode. The Creator Mode swaps your laptop over to a 4K resolution The representing the small number of extra pixels it has to hit its 1610 aspect ratio with a 120Hz refresh rate while the Gamer Mode sets your laptop to an FHD resolution with a 240Hz refresh rate. Your current laptop can swap resolutions and potentially even refresh rates yes. But most 4K laptops dont have the option to hit refresh rates as high as 240Hz even if you lower the resolution. The panel focusing on supporting 4K just cant do that. Now giving yourself the option of fidelity doesnt preclude you from hitting a high fps when youd prefer to lower the quality in exchange for extra smooth animation. Razer hasnt been entirely clear with me about how this works and I assume Ill get more details on that closer to launch as well as an opportunity to test it out myself. What I do know now is that the laptops poised to be as powerful as youd expect from Razer with Intel Core HX CPUs and Nvidias new mobile GPUs. Anecdotally I played a racing sim at a meeting with Nvidia at CES that ran three 4K displays off a single RTX 4090 Razer Blade 16 and I easily would have thought I was playing off a desktop if I hadnt known. I also saw Cyberpunk 2077 running at 121 fps on an RTX 4070 Ti Razer Blade 16 with its power artificially restricted to 30 less than what a neighboring RTX 3090 Ti equipped system was pullingsaid system was only hitting 80 fps. Its always wise to take such demos with a grain of salt since theyre specifically tailored to show the systems in their best lights and may not take them through the most demanding tasks. Were excited to review this system later this year.,2023-01-05T18:00:00Z,Acer's Newest Gaming Laptops Have Huge 16- and 18-inch Display Options,Extremely Positive,0,[],[],[]
22,Asus Gaming Laptops Overwhelm with 2023 Updates - CNET,Even the most basic refreshes announced at CES have some useful enhancements.,https://www.cnet.com/tech/computing/asus-gaming-laptops-overwhelm-with-2023-updates/,Asus CES gaming laptop announcements seem to touch every single model in its portfolio and include 2023s biggest gaming hardware trend so far an 18inch gaming laptop. Yes there are also the usual everythingisupdatedto2023generation components like Intel 13thgen H and HXseries processors and the Nvidia GeForce RTX 40series GPUs as well as nextgen AMD CPUs and GPUs which were expecting to hear about during the keynote on Wednesday night Jan. 4. The company has announced a couple of interesting gaming monitors as well. Screen updates abound there are lots of 240Hz 1440p displays with smaller bezels and 1610 aspect ratios which youll see everywhere in gaming laptops and youll see 15 and 17inch models swapped out for 16 and 18inch ones which is another big trend at the show. The actual physical redesigns are modest so dont look for an allver new look just new components and features. Optimized for Optimus My fave new feature is the rollout of Nvidia Advanced Optimus support across all Asus gaming laptops with Nvidia GPUs or at least most of them. Thats the technology that enables the laptop screen to switch between operating on the discrete GPU or the integrated GPU without forcing you to reboot and which finally lets the laptop display use GSync. Its potentially a big energy efficiency and battery life saver. Asus ROG Nebula HDR displays available on the Zephyrus M16 Zephyrus G14 Strix Scar 16 and Flow X16 have double the mini LED backlight zones 1024. Theyre DisplayHDR 1000compliant screens with a peak brightness of 1100 nits. They have larger heatsinks too because that level of brightness can get hot. As mentioned above theyre 1440p 240Hz plus 100 P3 gamut coverage. One exception is the Nebula HDR screen in the Zephyrus G14 which is a dimmer DisplayHDR 600. The 3ms pixel refresh isnt stellar though. Asus also has an external GPU box called the XG Mobile. It works with systems like the 13inch Flow X13 and Flow Z13 laptops and the 16inch Flow X16 adding extra graphics power. That XG Mobile previously contained an Nvidia RTX 3080 GPU and this year itll get bumped up to a newer 40series RTX GPU. Thatll help this expensive addon feel like a better longterm investment. AMD isnt getting left out. theres a new model that highlights all the latest and greatest technology on offer from that company called the TUF Gaming A16 Advantage Edition. Its one of the few laptops incorporating an AMD GPU which is up to generation RDNA 3 this year. Sadly the MUX switch a clunky way to toggle between the discrete and integrated GPU lives on here. Its not as elegant a solution as Optimus nor does it have Thunderbolt 4 support it does have USB 4 because thats still an Intel thing. There are a few other AMD CPUbased models as well and several of the new gaming laptops including the 16inch Zephyrus models have newer sixspeaker arrays. Perhaps more importantly many of the ROG offerings have been finally upgraded to 1080p webcams which is something we should expect from every laptop now. We dont have any pricing yet but they all seem to be slated for Q2 shipping.,2023-01-03T22:49:52Z,The Razer Blade 16 Doesn't Make You Choose Between 4K and a High FPS,Somewhat Negative,120,"['insignificant', 'remorse', 'restricted']",[],[]
