Article,Title,Description,URL,Content,Published
78,"Microsoft acquires Fungible, a maker of data processing units, to bolster Azure - Yahoo Movies Canada","In December, reports suggested that Microsoft had acquired Fungible, a startup fabricating a type of data center hardware known as a data processing unit...",https://ca.movies.yahoo.com/microsoft-acquires-fungible-maker-data-185737148.html,Microsoft acquires Fungible a maker of data processing units to bolster Azure In December reports suggested that Microsoft had acquired Fungible a startup fabricating a type of data center hardware known as a data processing unit DPU for around 190 million. Today Microsoft confirmed the acquisition but not the purchase price saying that it plans to use Fungibles tech and team to deliver multiple DPU solutions network innovation and hardware systems advancements. Fungibles technologies help enable highperformance scalable disaggregated scaledout data center infrastructure with reliability and security Girish Bablani the CVP of Microsofts Azure Core division wrote in a blog post. Todays announcement further signals Microsofts commitment to longterm differentiated investments in our data center infrastructure which enhances our broad range of technologies and offerings including offloading improving latency increasing data center server density optimizing energy efficiency and reducing costs. A DPU is a dedicated piece of hardware designed to handle certain data processing tasks including security and network routing for data traffic. The approach is intended to help reduce the load on CPUs and GPUs for core computing tasks related to a given workload. Fungible was launched in 2016 by Bertrand Serlet a former Apple software engineer who sold a cloud storage startup Upthere to Western Digital in 2017 alongside Krishna Yarlagadda and Juniper Networks cofounder Pradeep Sindhu. Fungible sold DPUs that relied on two operating systems one open source and the other proprietary and a microprocessor architecture called MIPS to control flash storage volumes. Fungible managed to raise over 300 million in venture capital prior to the Microsoft acquisition from investors including SoftBanks Vision Fund and Norwest Venture Partners. But its DPU architecture was difficult to develop for reportedly which mightve affected its momentum. In August after a rumored failed sale to Meta the company revealed that it had laid off staff and was scaling back its product portfolio. Increasing competition in the market for DPUs put pressure on Fungible as well. Nvidia acquired DPU maker BlueField in 2019 while AMD snatched up Pensando late last year. Other rivals included GigaIO Liqid Lightbits VMwares Project Monterey and Amazon Web Services Nitro cards which provide DPUlike functionality. In Fungible Microsoft gets DPU tech it could use to bolster Azure perhaps by selling it as a subscription product or tiered service for block storage. Its the second data centercentric acquisition in recent months for the tech giant interestingly following the purchase of highspeed fiber startup Lumenisity in December. The Fungible DPU was invented in 2016 to address the most significant problems in scaleout data centers the inefficient execution of datacentric computations within server nodes Fungible wrote in a statement on its website. We are proud to be part of a company that shares Fungibles vision and will leverage the Fungible DPU and software to enhance its storage and networking offerings. The Fungible team will join Microsofts data center infrastructure engineering teams Bablani said.,2023-01-09T18:57:37Z
79,Nvidia RTX 40 Series laptop GPUs are ready for PC gamers this February,The GeForce RTX 40 Series laptop GPS have three times the performance compared to the last generation of Nvidia's notebook GPUs.,https://www.androidauthority.com/nvidia-geforce-rtx-40-3261890/,Links on Android Authority may earn us a commission. Learn more. Nvidia RTX 40 Series laptop GPUs are ready for PC gamers this February Nvidia announced during CES 2023 its new family of GeForce RTX 40 Series laptop GPUs which will officially launch on February 8 The new laptop GPUs have three times the performance of Nvidias previous generation It also announced the Geforce RTX 4070 Ti PC desktop graphics card and more. Nvidia had a lot to announce as part of its CES 2023 live event. The chip maker trying to bounce back after calling off its planned Arm purchase just under a year ago announced a new laptop GPU family the GeForce RTX 40 series. Starting on February 8 the higherend GeForce RTX 4090 and 4080 laptop GPUs will be available to buy in laptops from many of Nvidias notebook partners. On February 22 the same will happen for the GeForce RTX 4070 4060 and 4050 laptop GPUs. These chips will offer up to three times the performance compared to the last generation of Nvidia GeForce laptop chips. The higherend 4080 and 4090 chips will also support features like DLSS 3 for faster FPS in PC games. The lowerend chips will offer performance at RTX 3080 levels with about onethird of that chips power allowing those RTX 40 series chips to be used in thinner and lighter gaming laptops. Speaking of DLSS support Nvidia also announced that its frame rate boosting tech is currently supported by over 250 games. Its new DLSS 3 technology is already supported by 17 games including Portal with RTX The Witcher 3 Wild Hunt Warhammer 40000 Darktide and more. Over 30 upcoming PC games will support DLSS 3 including Atomic Heart Dakar Desert Rally Marvels Midnight Suns The Day Before Warhaven Witchfire and more. Nvidia also announced its new PC desktop gaming graphics card the GeForce RTX 4070 Ti. The starting price for this new card will be 799 and it will launch on January 5 from several thirdparty graphics card makers and PC gaming desktop builders.,2023-01-03T18:14:38Z
80,Lenovo reveals Legion desktops with next-generation hardware at CES,Lenovo unveils updated Legion desktop gaming PCs at CES with Intel 13th Gen and AMD Ryzen 7000 CPUs alongside simple overclocking and fan control tools.,https://www.windowscentral.com/hardware/computers-desktops/lenovo-legion-desktops-ces-2023,Lenovo reveals Legion desktops with nextgeneration hardware at CES Skip the build with Lenovo and a highend Legion Tower machine. What you need to know Lenovo unveils modern component configurations for its prebuilt Legion desktop gaming PCs at CES 2023 in Las Vegas supporting the latest Intel 13th Gen and AMD Ryzen 7000 CPUs. All three refreshed Tower models include the Legion Vantage suite designed to enable simple overclocking and fan control. Specific graphics card options have not yet been confirmed but are said to be nextgeneration choices from NVIDIA and Radeon RX 7000 from AMD. Lenovo has revealed its latest lineup of prebuilt gaming PCs at CES 2023 in Las Vegas the Legion Tower 7i Tower 5i and Tower 5. They offer highend components and advanced features for gaming and content creation without the need to source individual parts yourself. The Tower 7i and Tower 5i come with up to the latest 13th Gen Intel Core desktop processors and NVIDIA GeForce RTX series graphics cards while the Tower 5 features an AMD Ryzen 9 CPU and either an AMD Radeon RX 7000 series or an NVIDIA GeForce RTX next generation series GPU. In addition to the upgraded hardware the new Legion desktops include Lenovos Vantage software a software suite offering realtime performance statistics component overclocking and intelligent fan controls. Gamers can also use the bundled Legion Arena app to search and consolidate their entire library of games from multiple platforms and launchers. Legion Tower 7i Intel CPU 2479. 99 from April 2023 Legion Tower 5i Intel CPU 1199. 99 from April 2023 Legion Tower 5 AMD CPU 1299. 99 from May 2023 For additional postpurchase care Lenovo offers Legion Ultimate Support. This 247 service provides access to advanced support provided by a community of experts with gamespecific knowledge. Users get the most out of their Lenovo Legion devices with remote solutions and nextbusinessday onsite support available. The Legion desktops join a varied range of Lenovo products demonstrated at CES this year including Legion Pro gaming laptops unique spins on the ThinkBook range an allinone Yoga AIO 9i desktop PC the classic Yoga laptop range and the beautiful ThinkPad X1 Fold which reminds us of the fabled Microsoft Surface Neo. Offering prebuilt gaming PCs to newcomers with highend hardware means skipping the process of learning how to build your own and can sometimes lead to cheaper methods of obtaining cuttingedge graphics cards. Windows Central Newsletter Get the best of Windows Central in in your inbox every day Ben is the channel editor for all things techrelated at Windows Central. That includes PCs the components inside and any accessory you can connect to a Windows desktop or Xbox console. Not restricted to one platform he also has a keen interest in Valves Steam Deck handheld and the Linuxbased operating system inside. Fueling this career with coffee since 2021 you can usually find him behind one screen or another. Find him on Mastodon trzombmastodon. online to ask questions or share opinions. Sean EndicottNews Writer and apps editor Windows Central Newsletter Thank you for signing up to Windows Central. You will receive a verification email shortly. There was a problem. Please refresh the page and try again.,2023-01-05T18:06:06Z
81,Colorful GeForce RTX 4080 NB EX-V review: 4K gaming extraordinaire,"Colorful's GeForce RTX 4080 has an elegant design and offers huge gains over the RTX 30 series, outshining even the mighty RTX 3090 Ti.",https://www.windowscentral.com/hardware/colorful-geforce-rtx-4080-review,Windows Central Verdict Thanks to an energyefficient node and architectural changes the GeForce RTX 4080 delivers huge gains in all key areas over the RTX 3080. This is the secondfastest video card available today and while youre paying a hefty premium you are getting a lot of power the card offers better performance than the 2000 RTX 3090 Ti. If you intend to play at 4K this is the card to get. Pros Amazing at 4K gaming DLSS 3 is groundbreaking 16GB of video memory Noticeably faster than 3090 Ti Understated design without overt RGB lighting Cons Costly Power connector is finicky Threeslot design Why you can trust Windows Central Our expert reviewers spend hours testing and comparing products and services so you can choose the best for you. Find out more about how we test. The GeForce RTX 30 series was characterized be extremes. An overwhelming demand for these video cards at launch coincided with a pandemicdriven manufacturing shortage and it was extremely difficult to get a hold of any of these cards I had to wait over eight months to get my RTX 3080. But even as NVIDIA and its AIB partners started to get manufacturing under control in 2022 demand for the best mining GPUs declined as the industry crashed leading to a glut of inventory. Its in this setting that the RTX 40 series makes its debut. NVIDIA is taking things to a new level with the Ada Lovelace architecture and the RTX 4080 and RTX 4090 deliver huge gains over their RTX 30 series predecessors. The RTX 4080 in particular is in an interesting position this year the card was originally meant to launch in two variants a standard 16GB model and a lowercost 12GB variant with fewer cores and user backlash against the 12GB model led NVIDIA to spin off that card into its own SKU. That leaves us with the 16GB version of the RTX 4080. NVIDIA has a lot to offer with this generation other than new cores the overhauled architecture aims to deliver much better efficiency figures and the introduction of DLSS 3 is a huge differentiator for the brand. For this review Im using Colorfuls base variant of the RTX 3080 the Colorful GeForce RTX 4080 16GB NB EXV. This card is in line with NVIDIAs RTX 4080 Founders Edition offering the same 9729 cores with a 16GB GDDR6X interface over a 256bit memory bus and a base frequency of 2205Mhz. The RTX 4080 starts off at a lofty 1199 500 more than the RTX 3080 when it debuted two years ago. Both launches in the RTX 40 series thus far have been listed at a premium with the RTX 4090 starting off at a ridiculous 1599. So lets take a look at what youre getting with the RTX 4080 and whether it makes sense to get the card over the RTX 3080. Colorful GeForce RTX 4080 Pricing and availability NVIDIA unveiled the RTX 4080 series on November 15 2022 with sales kicking off the same week. Like previous generations NVIDIA sells its Founders Edition on its own and there are several AIB partners that offer their own version of the RTX 4080 with the notable omission of EVGA. The Founders Edition of the RTX 4080 retails for 1199 and youll find AIB cards that start off at the same 1199 figure and go all the way up to 1550. The Colorful variant Im using costs 1249. Thankfully availability isnt an issue here and as of January 2023 the RTX 4080 is available direct from NVIDIA as well as major retailers. The card is selling at its list price unlike the RTX 4090 which is sold out at most retailers or going for upwards of 2000. Colorful GeForce RTX 4080 Hardware overview NVIDIA made a lot of tweaks with this generation not least among which is how the GPUs are manufactured. Unlike previous years NVIDIA isnt reusing the same silicon with fewer cores the RTX 4080 features its own AD103 silicon that has a smaller surface area than the AD102 thats used for the RTX 4090 and this allows for savings in manufacturing costs. That said youll find a wider gulf than usual between the RTX 4090 and 4080 with the latter offering 9728 cores 40 less than the 4090 and 16GB of memory over a narrower 256bit wide interface versus 14GB at 384bit for the 4090. Similar to its predecessor the 4080 gets a TDP of 320W. NVIDIA went with a new 124 pin 12VHPWR connector that delivers up to 450W of power and youll find a connector in the box that lets you plug in three PCIe 8pin cables to the card. Not much has altered when it comes to the ports with the RTX 4080 offering three DisplayPort 1. 4a ports along with one HDMI 2. 1a. The RTX 30 series introduced hardwarelevel AV1 decode and thats available here as well. Heres a highlevel overview of what youre getting with the RTX 4080 and how it fares against the RTX 4090 and the RTX 3080 Colorful GeForce RTX 4080 Architecture The RTX 4080 sees the introduction of the Ada Lovelace cores and a new Optical Flow Accelerator along with new RT cores. NVIDIA has shifted from Samsungs 8nm to TSMCs 4nm node for this generation leading to much better efficiency figures after all the best Android phones are made on the same node. The GPU has a PCIE 4. 0 x16 host interface and features 16GB of GDDR6X memory over a 256bit interface leading to bandwidth of 716GBs. The AD103 silicon has seven raster engines and each of these has six Texture Processing Clusters. The TPC houses two Streaming Multiprocessors and a Polymorph unit. These SMs contain 128 CUDA cores each and like the RTX 30 series theyre divided into two clusters half of the cores are solely for FP32 while the other half is for FP32 or INT32 with a distinct data path available for both clusters. With six TPCs in an engine we get 1536 cores for each unit and the AD103 silicon has a total of 10752 cores. But NVIDIA lobbed off four TPCs for the RTX 4080 so we get 9728 cores instead. NVIDIA overhauled the RT cores and the thirdgen cores are able to deliver better shading performance while utilizing fewer resources. Possibly the biggest change with this generation is the introduction of DLSS 3. It now comes with a new Frame Generation mode that leverages AI to automatically create every alternate frame and this is achieved with the new Optical Flow Accelerator and fourthgen Tensor units. How it works is that the Optical Flow Accelerator predicts what the next frame in a scene will be and it uses Optical Multiframe Generation to inject an intermediate frame in between so you basically get higher framerates without any decline in quality. As the Optical Flow Accelerator is a key part of the feature Frame Generation is limited to RTX 40 series cards. Colorful GeForce RTX 4080 Design Having used NVIDIAs Founders Edition cards for the last two generations in my gaming machine and then switching to the RGB lighting extravaganza that is the EVGA GeForce RTX 3080 FTW3 I was interested in seeing what Colorful is doing in this category. The GeForce RTX 4080 16GB NB EXV has a dark grey color scheme that looks quite good and the red accents with the jagged edges add a bit of flair to the design. I also got Zotacs GeForce RTX 4090 and 4080 alongside the Colorful RTX 4080 and they have a much more aggressive style. Colorful did a good job delivering a clean aesthetic here and if you dont want a card with too much RGB lighting this is a great alternative. That said the RTX 4080 is inherently larger and heavier than its predecessor and the threeslot design means it will take up a lot of room in your gaming rig. It is also quite heavy at 3. 7 lb 1. 7kg and thats in no small part down to the backplate. Like NVIDIAs own cards Colorful went with a vented design here to allow air to flow via the backplate and that makes a difference. The 124 pin 12VHPWR connector is located at the top and I thankfully didnt see any issues in this area. I was initially worried when plugging in the three PCIe 8pin cables to the connector but after using the card for a month things have been rocksolid. Colorful GeForce RTX 4080 Efficiency and performance The RTX 4080 is aimed at gamers looking to get the best possible framerates and is frankly overkill if you dont have a 4K monitor youre better served by the RTX 3080 or even the RTX 3070 if youre using a QHD or FHD monitor. It still makes sense to get the RTX 4080 if you have a QHD monitor with 144Hz or higher refresh rates as it will deliver better framerates than the RTX 3080 but you will be paying a huge premium. Thanks to the switch to 4nm there are huge gains on the efficiency side of things and the RTX 4080 consumes less power for the same workloads as its predecessor. It consumes less than 20W when idling going up to 25W for video playback. While gaming it hits just over 300W a full 40W less than the Founders Edition RTX 3080. It can go up to 370W under full load and from an efficiency point of view it demolishes the RTX 3080. At 4K resolution and the settings maxed out in each game the RTX 4080 delivers huge gains across the board against the RTX 3080. Whats particularly interesting is that the card is consistently faster than the best of the RTX 30 series the 2000 3090 Ti. Theres a noticeable 10 to 15 uptick against the mighty RTX 3090 Ti in most games and whats incredible is that youll see a performance delta of an insane 45 between the RTX 3080 and 4080 in 4K titles. The RTX 4080 is second only to the RTX 4090 in this regard and if youve invested in a 4K monitor and want to make the most of it the RTX 4080 is the way to go here. Youll find a similar story at QHD resolution and the RTX 4080 has a comfortable lead over the RTX 3080 and even the 3090 Ti bested only by the 4090. The card is a great choice if you have a QHD monitor with a high refresh rate but if you want to maximize value Id still suggest getting the RTX 3080 for this resolution. As with the last two generations enabling ray tracing leads to a huge hit in framerates but thanks to the new cores and architecture the RTX 4080 fares significantly better than its predecessors particularly at 4K. The RTX 4080 has a huge advantage over the RTX 3080 at QHD as well and youll see nearly double the scores for most titles. There arent many titles out with DLSS 3 at this moment but in games like The Witcher 3 Wild Hunt the card was able to deliver over 80fps with the new Frame Generation feature an increase of 35. Overall DLSS 3 is a groundbreaking new addition that turbocharges ray tracing and NVIDIA has managed to carve out a significant lead over AMD in this area. Colorful GeForce RTX 4080 The alternatives The biggest issue with the RTX 4080 is just how much it costs and if youre not willing to shell out that much money youre in luck. NVIDIA and its AIB partners have a lot of unsold inventory of the RTX 30 series and you can get the RTX 3080 or 3080 Ti at a decent discount. While the RTX 30 series doesnt quite hold up against the RTX 4080 when it comes to 4K you are getting a much better value. AMDs Radeon RX 7900 XT is also an enticing choice if youre interested in 4K gaming. It retails for a few hundred dollars less than the RTX 4080 and while it doesnt quite deliver the same smooth framerates it gets quite close. Colorful GeForce RTX 4080 Should you buy it You should buy this if Youre looking for the ultimate video card for 4K gaming You need a card that excels at ray tracing You need good energy efficiency You want a card thats faster than the RTX 3090 Ti You shouldnt buy this if You want a video card thats affordable You need a video card that isnt too big With the RTX 4080 NVIDIA is delivering huge gains in all key areas against the RTX 3080. The Ada Lovelace architecture and the shift to a new 4nm node lead to much better efficiency and the card is nearly twice as fast as the RTX 3080 at 4K resolution you finally get 60fps in most titles without breaking a sweat. However all of those gains come at a cost. The RTX 4080 starts off at a hefty 1199 and while you are getting good value here it is demonstrably faster than the 2000 RTX 3090 Ti at 4K that is a lot of money to pay for a video card particularly given that discounted RTX 30 cards are still available. At the end of the day you will have to decide if you want to invest that kind of money toward a video card. For what its worth the RTX 4080 is the ideal choice if youre using a 4K monitor or QHD monitor with a high refresh rate and NVIDIA is doing all the right things with DLSS 3. That feature has plenty of potential and Im interested in seeing how game makers leverage it in the future. For now though the RTX 4080 is the best option if you want effortless 4K gaming. If you dont want to shell out that kind of money the RTX 30 series is still a reliable option as is AMDs recent Radeon RX 7900 XT theres no shortage of choice at the moment. Colorful did a great job with the GeForce RTX 4080 NB EXV. The card has an elegant design that looks great and it is on par with other AIB cards that arent factory overclocked. If youre in a country where it is available this is a great alternative to the Founders Edition RTX 4080. Harish Jonnalagadda is a Senior Editor overseeing Asia for Android Central Windows Centrals sister site. When not reviewing phones hes testing PC hardware including video cards motherboards gaming accessories and keyboards. Windows Central Newsletter Thank you for signing up to Windows Central. You will receive a verification email shortly. There was a problem. Please refresh the page and try again.,2023-01-02T16:14:46Z
