Article,Title,Description,URL,Content,Published
32,The Worst Hacks of 2022,"The year was marked by sinister new twists on cybersecurity classics, including phishing, breaches, and ransomware attacks.",https://www.wired.com/story/worst-hacks-2022/,With the pandemic evolving into an amorphous new phase and political polarization on the rise around the world 2022 was an uneasy and often perplexing year in digital security. And while hackers frequently leaned on old chestnuts like phishing and ransomware attacks they still found vicious new variations to subvert defenses. Heres WIREDs look back on the years worst breaches leaks ransomware attacks statesponsored hacking campaigns and digital takeovers. If the first years of the 2020s are any indication the digital security field in 2023 will be more bizarre and unpredictable than ever. Stay alert and stay safe out there. For years Russia has pummeled Ukraine with brutal digital attacks causing blackouts stealing and destroying data meddling in elections and releasing destructive malware to ravage the countrys networks. Since invading Ukraine in February though times have changed for some of Russias most prominent and most dangerous military hackers. Shrewd longterm campaigns and grimly ingenious hacks have largely given way to a stricter and more regimented clip of quick intrusions into Ukrainian institutions reconnaissance and widespread destruction on the networkand then repeated access over and over again whether through a new breach or by maintaining the old access. The Russian playbook on the physical battlefield and in cyberspace seems to be the same one of ferocious bombardment that projects might and causes as much pain as possible to the Ukrainian government and its citizens. Ukraine has not been digitally passive during the war though. The country formed a volunteer IT Army after the invasion and it along with other actors around the world have mounted DDoS attacks disruptive hacks and data breaches against Russian organizations and services. Over the summer a group of researchers dubbed 0ktapus also sometimes known as Scatter Swine went on a massive phishing bender compromising nearly 10000 accounts within more than 130 organizations. The majority of the victim institutions were USbased but there were dozens in other countries as well according to researchers. The attackers primarily texted targets with malicious links that led to fake authentication pages for the identity management platform Okta which can be used as a single signon tool for numerous digital accounts. The hackers goal was to steal Okta credentials and twofactor authentication codes so they could get access to a number of accounts and services at once. One company hit during the rampage was the communications firm Twilio. It suffered a breach at the beginning of August that affected 163 of its customer organizations. Twilio is a big company so that only amounted to 0. 06 percent of its clients but sensitive services like the secure messaging app Signal twofactor authentication app Authy and authentication firm Okta were all in that slice and became secondary victims of the breach. Since one of the services Twilio offers is a platform for automatically sending out SMS text messages one of the knockon effects of the incident was that attackers were able to compromise twofactor authentication codes and breach the user accounts of some Twilio customers. As if that wasnt enough Twilio added in an October report that it was also breached by 0ktapus in June and that the hackers stole customer contact information. The incident highlights the true power and menace of phishing when attackers choose their targets strategically to magnify the effects. Twilio wrote in August we are very disappointed and frustrated about this incident. In recent years countries around the world and the cybersecurity industry have increasingly focused on countering ransomware attacks. While there has been some progress on deterrence ransomware gangs were still on a rampage in 2022 and continued to target vulnerable and vital social institutions including health care providers and schools. The Russianspeaking group Vice Society for example has long specialized in targeting both categories and it focused its attacks on the education sector this year. The group had a particularly memorable showdown with the Los Angeles Unified School District at the beginning of September in which the school ultimately took a stand and refused to pay the attackers even as its digital networks went down. LAUSD was a highprofile target and Vice Society may have bitten off more than it could chew given that the system includes more than 1000 schools serving roughly 600000 students. Meanwhile in November the US Cybersecurity and Infrastructure Security Agency the FBI and the Department of Health and Human Services released a joint warning about the Russialinked ransomware group and malware maker known as HIVE. The agencies said the groups ransomware has been used to target over 1300 organizations around the world resulting in roughly 100 million in ransom payments from victims. From June 2021 through at least November 2022 threat actors have used Hive ransomware to target a wide range of businesses and critical infrastructure sectors the agencies wrote including Government Facilities Communications Critical Manufacturing Information Technology and especially Healthcare and Public Health. The digital extortion gang Lapsus was on an intense hacking spree at the beginning of 2022 stealing source code and other sensitive information from companies like Nvidia Samsung Ubisoft and Microsoft and then leaking samples as part of apparent extortion attempts. Lapsus has a sinister talent for phishing and in March it compromised a contractor with access to the ubiquitous authentication service Okta. The attackers appeared to be based primarily in the United Kingdom and at the end of March British police arrested seven people in association with the group and charged two at the beginning of April. In September though the group flared back to life mercilessly breaching the rideshare platform Uber and seemingly the Grand Theft Auto developer Rockstar as well. On September 23 police in the UK said they had arrested an unnamed 17yearold in Oxfordshire who seems to be one of the individuals previously arrested in March in connection with Lapsus. The beleaguered password manager giant LastPass which has repeatedly dealt with data breaches and security incidents over the years said at the end of December that a breach of its cloud storage in August led to a further incident in which hackers targeted a LastPass employee to compromise credentials and cloud storage keys. The attackers then used this access to steal some users encrypted password vaultsthe files that contain customers passwordsand other sensitive data. Additionally the company says that some source code and technical information were stolen from our development environment during the August incident. LastPass CEO Karim Toubba said in a blog post that in the later attacks hackers compromised a copy of a backup that contained customer password vaults. It is not clear when the backup was made. The data is stored in a proprietary binary format and contains both unencrypted data like website URLs and encrypted data like usernames and passwords. The company did not provide technical details about the proprietary format. Even if LastPasss vault encryption is strong hackers will attempt to bruteforce their way into the password troves by attempting to guess the master passwords that users set to protect their data. With a strong master password this may not be possible but weak master passwords could be at risk of being defeated. And since the vaults have already been stolen LastPass users cant stop these bruteforce attacks by changing their master password. Users should instead confirm that they have deployed twofactor authentication on as many of their accounts as they can so even if their passwords are compromised attackers still cant break in. And LastPass customers should consider changing the passwords on their most valuable and sensitive accounts.,2022-12-29T12:00:00Z
33,BMW Motorrad x NVIDIA electric bike has swappable modules for flexibility of use,"BMW Motorrad x NVIDIA electric bike has swappable modules for flexibility of useWhile BMW Motorrad is cooking up interesting bike designs of the current generation, NVIDIA is at the pinnacle of microchip technology delivering class-leading Graphics Processing…",https://www.yankodesign.com/2023/01/12/bmw-motorrad-x-nvidia-electric-bike-has-swappable-modules-for-flexibility-of-use/,While BMW Motorrad is cooking up interesting bike designs of the current generation NVIDIA is at the pinnacle of microchip technology delivering classleading Graphics Processing Units. Do they have anything in common well presumably not This is where the realms of the design world make us believe in things unfathomable and outrightly defying logic. So how about a BMW Motorrad electric bike powered by NVIDIA guts Designer Aaryaman Mistry Just like youd have the freedom to upgrade your PC with a new GPU or other hardware the idea of swapping old motorbike parts with a new one sounds adventurous. Aaryman has created an NVIDIApowered architecture for electric motorcycles of the future that caught my attention. Of course the level of standardization for each of those parts will be a herculean task on its own and whether or not all automotive manufacturers will comply with the idea is still a looming query. If hypothetically everything goes to plan the scope for modularity personalization and upgradability will be immense. Users can reflect their personality with custom parts and even 3D print those parts or buy them. When these parts have served the purpose they can be swapped with newer components rather than changing the electric twowheeler. Just like on this BMW x NVIDIA bike with the option to swap battery console saddle microchip or body frame components. A good example is toggling the handlebar section for racing or city riding configuration. This will give motorbike enthusiasts the flexibility of having different twowheelers for a specific purpose without having to buy a new one. The swapping will be effortless and as easy as changing a toddlers diaper. The bikes core houses the advanced GPU and CPU which can adapt to the ides current configuration. There are highend cooling systems by NVIDIA that keep the electric battery at the optimum operating temperature for peak performance. Everything about this bike seems very balanced without any overpowering elements while maintaining a scifi persona of a highly agile set of wheels. The designer has opted for a mix of familiar BMW Motorrad aesthetics and colors fused with the geeky look of NVIDIApowered PCs.,2023-01-12T23:30:55Z
34,"Nvidia RTX 4070 Ti officially announced, will ""max out"" 1440p monitors","Annual tech bonanza CES is underway over in Las Vegas this week, and Nvidia have used the occasion to announce the latest graphics card in their RTX 40 series family, the RTX 4070 Ti. Out tomorrow, January 5th, at a starting price of £799 / $799, Nvidia say i…",https://www.rockpapershotgun.com/nvidia-rtx-4070-ti-officially-announced-will-max-out-1440p-monitors,Nvidia RTX 4070 Ti officially announced will max out 1440p monitors Out tomorrow January 5th for 799 799 Annual tech bonanza CES is underway over in Las Vegas this week and Nvidia have used the occasion to announce the latest graphics card in their RTX 40 series family the RTX 4070 Ti. Out tomorrow January 5th at a starting price of 799 799 Nvidia say its faster than their previous flagship the RTX 3090 Ti and will max out 1440p monitors. In terms of specs youre looking at 12GB of GDDR6X memory a boost clock speed of 2. 61GHz 7680 CUDA cores as well as DLSS 3 support. Its power usage also sits at 285W but Nvidia recommend you pair it with a 700W PSU. Of course if youve been following the drama over Nvidias cancelled 12GB RTX 4080 graphics card those specs will all look intimately familiar and thats because they are. Theyre exactly the same as that cancelled RTX 4080 variant suggesting that Nvidia have indeed just rebadged the unlaunched GPU as the RTX 4070 Ti. To briefly recap said drama the 12GB RTX 4080 was originally meant to launch alongside its 16GB sibling the RTX 4080 proper on November 16th last year. But Nvidia ended up cancelling the card about a month before it was meant to release citing that its not named right and that having two GPUs with the 4080 designation is confusing so in the bin it went. Or so we thought. Instead its seemingly now resurfaced as the RTX 4070 Ti which is more or less what hardware editor James expected theyd do at the end of last year. The main upshot of this slightly protracted renaming process is that the resulting RTX 4070 Ti is now quite a bit cheaper than what it was going to be originally with partner cards starting at 799 799. Dont get me wrong thats still a sizable chunk of change but it is at least a smidge better than the 12GB RTX 4080s proposed launch price of 949 899 which is a particularly good turn out for us folks in the UK I might add. Hardware ed James will no doubt be putting the RTX 4070 Ti through its paces very soon so youll be able to see whether its worth the money in the coming weeks. If you dont want to wait for benchmarks to drop though youll hopefully be able to start putting orders in for RTX 4070 Ti cards tomorrow January 5th.,2023-01-04T11:56:09Z
35,"The Ratings Game: These four chip stocks could double from here, according to Guggenheim","Nvidia, Marvell, and AMD shares each lost more than half their value during 2022, but Guggenheim analysts see them as well positioned for the new year",https://www.marketwatch.com/story/these-four-chip-stocks-could-double-from-here-according-to-guggenheim-11672748391,Oncehot chip stocks Nvidia Corp. Marvell Technology Inc. and Advanced Micro Devices Inc. each lost more than half their value over the course of 2022 but Rosenblatt analysts see them as well positioned for the new year. Those three chip stocks cracked Rosenblatts list of top picks for 2023 along with Micron Technology Inc. MU The reemergence of silicon customization after 20 years of secular decline the ASIC applicationspecific integrated circuit market has become a strategic thrust for both Broadcom and Marvell and a skill set not available to other semi players in our lifetime the Rosenblatt analysts wrote. Marvell MRVL Mosesmann has a 125 price target on Marvells stock which closed Friday just north of 34. See also Wall Street places more bets on chip sectors soft landing in 2023 The Rosenbaktt analysts liked Nvidia NVDA Next up is AMD AMD For years we took incoming flak on the crazy notion that AMD yes that AMD could capture 10 market share the analysts wrote. The narrative has changed to AMDs favor however there is skepticism on the 30 share level in x86 CPUs vs. Intel. We think 50 is coming and there is no reason why it cannot go much more than that. Read Fundamental bottom is coming for chips and this stock could be the biggest winner analyst says Mosesmann also said he liked Micron as a cyclical play. He acknowledged that inventories could peak in the first half of 2023 adding to pressure on average selling prices in the DRAM dynamic randomaccess memory market but he predicted a ripe 2H23 memory market for investors. Mosesmann has a 100 price target on Microns stock which closed Friday just shy of 50. Other top picks at Rosenblatt outside the chip industry include Lions Gate Entertainment Corp. LGF. B,2023-01-03T12:19:00Z
36,Acer launches Nitro and Swift gaming laptops with AMD Ryzen 7000 processors,Acer today announced the new Nitro 16 and Nitro 17 gaming laptops and the new Swift Go 14 laptop powered by AMD Ryzen 7000 Series processors.,https://venturebeat.com/games/acer-launches-nitro-and-swift-gaming-laptops-with-amd-ryzen-7000-processors/,Acer today announced the new Nitro 16 and Nitro 17 gaming laptops and the new Swift Go 14 laptop powered by AMD Ryzen 7000 Series processors. The latest Acer Nitro laptops designed to provide casual gamers with a new level of immersive gameplay experience come with 16inch WUXGAWQXGA displays or 17. 3inch FHDQHD displays and are supported by liquid metal thermal grease on the processor. The Swift Go 14 brings the new processor together with colorrich OLED displays and allday battery life compressed in a new thinandlight design. The company announced the laptops at the CES 2023 tech trade show in Las Vegas. Acer launched Nitro and Swift laptops with Intel processors yesterday. The new AMD Ryzen mobile processors deliver poweroptimized performance along with a plethora of enhanced user experiences. Leveraging its new Zen 4 core architecture which is designed for high performance and efficiency gamers and mobile workers are treated with accelerated performance for outstanding productivity and power efficiency. In addition select models feature AMDs RyzenAI technology for video effects like eye gaze correction. Acer Nitro 16 The 16inch Nitro 16 AN1641 gaming notebook features an upgraded WUXGA or WQXGA display with a 165 Hz refresh rate and 5 more screen area than its previous model. With up to Nvidia GeForce RTX 40 Series Laptop GPUs it also supports NVIDIA Advanced Optimus which lets players seamlessly switch between integrated graphics and discrete graphics. Users can see a colorrich and immersive viewing experience with 100 sRGB color gamut support and 84 screentobody ratio while also integrating a large 125. 0 millimeter x 76. 7 millimeter touchpad and a 4zone RGB backlit keyboard. Acer Nitro 17 The Nitro 17 AN1741 houses the latest AMD Ryzen 7000 Series processors and Nvidia GeForce RTX 40 Series GPUs within its slim but solid construction. The 17. 3 display comes in either an FHD display with 144 Hz or 165 Hz refresh rates or a quad highdefinition display QHD with a 165 Hz refresh rate supported by an 81 screentobody ratio. Its large gaming space is topped off with a big touchpad 125. 0 mm x 81. 6 mm and an RGB 4zone backlit keyboard. The two Acer Nitro devices come with up to 32 GB of DDR5 5600 MHz memory and up to 2 TB of M. 2 PCIe Gen 4 storage so gamers and content creators can do more at once. The laptops utilize dual fans four fan outlets strategicallyplaced at their sides and rear upper air intake and are further supported by liquid metal thermal grease to improve cooling. These are also integrated with NitroSense software and a NitroSense key so users can monitor their systems temperatures and easily manage the devices performance settings. Players can stream with the laptops HD camera two microphones and two speakers with DTSX Ultra for clearcut audio. The AMDpowered gaming notebooks also provide a full range of connectivity options with an HDMI 2. 1 port a microSD card reader USB 2. 0 USB 4 a Type C USB3. 2 Gen 2 display port supporting Power Delivery and two USB 3. 2 Gen 2 ports with one that allows for offline charging. Each model comes with LAN E2600G and is WiFi 6Eenabled providing greater bandwidth and faster connectivity for wired and cordless connections. Both laptops also include one month of Xbox Game Pass or PC Game Pass providing access to hundreds of highquality PC games. Acer Swift Go 14 thinandlight model The new Acer Swift Go 14 SFG1442 highlights a lightweight design featuring defined edges and structural lines to suit the Swift lines stylish appearance. The 0. 58inch aluminum chassis with its 90 screentobody ratio and slim side bezels measures 0. 17inch thick while weighing less than 3. 5 pounds. It combines the latest AMD Ryzen 7000 Series processors and a stunning 1610 ratio OLED display with a 90 Hz frame rate providing productivity onthego. The Swift Go 14s display is supported with 500nit peak brightness 100 DCIP3 color range and VESA DisplayHDR True Black 500certification. It sports a 14inch 2. 8K OLED display with 28801800 resolution TV Rheinland Eyesafe display certification backlit keyboards and is finished off with a OceanGlass touchpad. It has battery power of up to 9. 5 hours. Acer added a TwinAir dualfan cooling system dual D6 copper heat pipes and an airinlet keyboard keep temperatures cool. The Swift Go 14 offers ports including USB TypeC HDMI 2. 1 and a MicroSD card reader. It also supports up to 2 TB PCIe Gen 4 SSD and up to 16 GB LPDDR5 memory. And it has a 1440p webcam with Acers Temporal Noise Reduction TNR paired with Acer PurifiedView and PurifiedVoice technology with AI noise reduction and tWiFi 6E. Price and availability The Acer Nitro 16 AN1641 will be available in North America in May starting at 1200 the Acer Nitro 17 AN1741 will be available in North America in May starting at 1250. The Acer Swift Go 14 SFG1442 will be available in North America in June starting at 850. GamesBeats creed when covering the game industry is where passion meets business. What does this mean We want to tell you how the news matters to you not just as a decisionmaker at a game studio but also as a fan of games. Whether you read our articles listen to our podcasts or watch our videos GamesBeat will help you learn about the industry and enjoy engaging with it. Discover our Briefings.,2023-01-05T03:30:00Z
