Article,Title,Description,URL,Content,Published
0,NVIDIA RTX 4070 Ti leaks reveal specs and potential price,"NVIDIA
 is expected to reveal its GeForce RTX 4070 Ti graphics card at CES next week, but it preemptively leaked the specs. Thanks to new rumors, we have a sense of the GPU's likely price too.The RTX 4070 Ti is slated to have 12GB of GDDR6X memory with 7,680…",https://www.engadget.com/nvidia-rtx-4070-ti-leak-specs-price-ces-2023-210303412.html,NVIDIA is expected to reveal its GeForce RTX 4070 Ti graphics card at CES next week but it preemptively leaked the specs. Thanks to new rumors we have a sense of the GPUs likely price too. The RTX 4070 Ti is slated to have 12GB of GDDR6X memory with 7680 Cuda cores that can be boosted to 2. 61GHz as Toms Hardware Cyberpunk 2077 when the new RT Overdrive mode is enabled. GeForce RTX 4070 Ti 188 momomous December 30 2022 Coming Month XXhttpst. coZ6Hv1Vv7ol pic. twitter. com7sudSwgsFZ It has been widely believed that the latest card would essentially be a rebranded version of the 12GB RTX 4080. In October NVIDIA reversed plans to release that model and suggested it would rebadge the GPU. Meanwhile rumors indicate NVIDIA will sell the RTX 4070 Ti for 799. It was previously expected that the price would be 899 but NVIDIA may have lowered it after the US delayed tariffs on GPUs that were set to resume on January 1st. Based on the RTX 4070 Tis expected performance Wccftech ran the numbers and found that on a terafloptodollar ratio the GPU will offer 97 percent of the value proposition of the 1599 RTX 4090. We should find out official details about the RTX 4070 Ti perhaps including the release date very soon. NVIDIA has scheduled a CES edition of its GeForce Beyond event for January 3rd at 11AM ET.,2022-12-30T21:03:03Z
1,NVIDIA's GeForce Now game streaming is coming to cars,You'll soon have access to a host of PC games in your car without buying a Tesla. NVIDIA has announced that it's bringing GeForce Now game streaming to cars using the company's Drive platform. The rollout will offer access to titles like Cyberpunk 2077 on a d…,https://www.engadget.com/nvidia-geforce-now-game-streaming-in-cars-164511641.html,Youll soon have access to a host of PC games in your car without buying a Tesla. NVIDIA has announced that its bringing GeForce Now game streaming to cars using the companys Drive platform. The rollout will offer access to titles like Cyberpunk 2077 on a driver display while youre charging or parked or any time from the backseat. That could be more than a little helpful on a vacation especially if youd rather not buy a Steam Deck or Switch for a budding young gamer. The cloud gaming option already has initial support from major brands like the Hyundai group including Genesis and Kia Polestar and Chinas BYD. NVIDIA didnt offer a timeframe for GeForce Now access although it noted that BYD would offer Drive Hyperionpowered cars in the first half of 2023. The Polestar 3 SUV built using Drive Orin arrives in late 2023. The incar GeForce Now client works on either Android or webbased infotainment systems. NVIDIAs service provides a catalog of 1500 games over 1000 of which are playable using gamepads. While most of the selection is paid there are freetoplay options like Destiny 2 and Fortnite. As with other game streaming services this could get costly if you plan to use it often. While basic GeForce Now use is free you can pay up to 200 per year for the full experience before you factor in the cost of the games themselves. In some cases though this might make more sense than buying a handheld console or tablet. You only need to pay for a higherend plan when you expect to use it after all you could subscribe during a road trip and stick to free usage when youre commuting around town.,2023-01-03T16:45:11Z
2,ASUS is bringing more Nebula Displays and better cooling to its gaming laptops,"ASUS is refreshing its gaming laptops with HDR Mini LED displays, better cooling and updated processors and graphics. However, since the company hasn’t yet announced pricing, it's harder to discern the latest models' value.The Nebula display is found in more …",https://www.engadget.com/asus-rog-gaming-laptops-ces-2023-190025449.html,ASUS is refreshing its gaming laptops with HDR Mini LED displays better cooling and updated processors and graphics. However since the company hasnt yet announced pricing its harder to discern the latest models value. The Nebula display is found in more models than ever this year. That company branding denotes screens with high frame rates 120Hz for 4K and QHD screens and 240Hz or higher for 1080p bright backlights and vivid colors. Meanwhile the new Nebula HDR variant is like an ultrapremium version highlighting Mini LED panels. For example the Nebula HDR display in the Strix SCAR 16 is a Mini LED with 1024 dimming zones double last years model and a 240Hz refresh rate. Although we dont yet know the pricing its a safe bet those models will fetch top dollar. The new laptops which launch in Q2 also have updated 13thgen Intel or AMD Ryzen Zen 4 processors depending on your configuration. NVIDIAs new GeForce RTX 40 Series Laptop GPUs power the graphics in maxedout variants of the new machines. ASUS added intelligent cooling to several new models including the Zephyrus M16 and Strix models in 16inch and 18inch variants. The company accomplished this using a fullwidth heatsink spanning the devices rear. ASUS also added a third cooling fan to more models. It was first seen in the Flow X16 from 2022. That extra fan improves airflow to the GPU and other internal hardware. The Strix SCAR line which ASUS calls the performance flagships have bigger 16 and 18inch screens than their 15 and 17inch predecessors including Nebula HDR in the most expensive tiers. In addition ASUS says this years cooling improvements let these models push higher frame rates. Meanwhile the Strix G16 and G18 are slightly less highend likely cheaper equivalents to the Strix 16 and 18 with the same CPU and GPU options. ASUS is also updating its lightandthin Zephyrus line. The ROG Zephyrus M16 has a Nebula HDR display. Like several other models topshelf models include a MUX Switch and NVIDIA Advanced Optimus. They bypass the machines integrated graphics using discrete graphics almost instantaneously. The fullwidth heatsink and trifan tech also let it run 25 watts higher than the 2022 version. Meanwhile the Zephyrus G16 has the same processor and graphics options with a QHD Nebula display that supports 240Hz. Its smaller sibling the Zephyrus G14 gets a Nebula HDR panel with 504 dimming zones and 600 nits of peak brightness. ASUS Duo 16 is the latest iteration of its quirky dualscreen laptop line. Like the 2022 model the updated version has a 16inch Mini LED panel as its main screen with a smaller 4K display below for multitasking. It also joins other models in offering the new NVIDIA graphics and MUX Switch in the highestend models. The company also updated the ROG Flow its 2in1 tablet PCs for gamers. The Flow X13 which has a 360degree rotating hinge has a 13inch Nebula display supporting a 165Hz refresh rate. Additionally ASUS redesigned its chassis making it 10mm smaller and increasing its battery capacity from 62 to 75 Wh while maintaining the same keyboard layout. The company also made its touchpad bigger and redesigned the 2in1 hinge with better ventilation and an easier grip. The X13s larger companion the Flow X16 has an HDR Mini LED touchscreen with a 240Hz refresh rate and 1100 nits peak brightness. In addition all ASUS 2023 Flow devices use Cornings Gorilla Glass DXC which can increase hardness by 40 percent and reduce glare. Meanwhile the Flow Z13 a detachable thats like a Microsoft Surface for gamers is updated with the new Intel and NVIDIA components and a QHD Nebula display with a 165Hz refresh rate.,2023-01-03T19:00:25Z
3,Samsung's 2023 Freestyle can combine projections from two units into a massive image,"As ever, Samsung has a ton of news up its sleeve for CES, including some updates about its Freestyle portable projector. It looks pretty similar to the company's previous Freestyle model, but this one includes Samsung's smart TV platform and features its Gami…",https://www.engadget.com/samsung-2023-freestyle-portable-projector-cloud-gaming-edge-blending-031336930.html,As ever Samsung has a ton of news up its sleeve for CES including some updates about its Freestyle portable projector. It looks pretty similar to the companys previous Freestyle model but this one includes Samsungs smart TV platform and features its Gaming Hub as well. This also provides access to services such as Xbox Cloud Gaming Amazon Luna and NVIDIA GeForce Now for cloud gaming. However the real magic with this years version of Freestyle may become apparent when you have two units. When projections from the two become one as the Spice Girls might have once sang Edge Blending tech can combine them into a single ultrawide display with a 219 aspect ratio. Samsung says the patented technology can automatically keystone the picture and make adjustments for an even more immersive cinematic experience. So if you have a living room with an enormous wall or happen to know a friend with an art gallery you may be able to set up two Freestyle projectors and play Fortnite on a massive display. There are very few details on pricing availability and full specs available at the moment but well update this post when they become available.,2023-01-04T03:13:36Z
4,The Morning After: Samsung’s latest mobile screen prototype slides and folds,"Samsung’s apparently tired of mobile displays that only fold in on themselves. At CES 2023 this week, the company revealed the Flex Hybrid OLED mobile screen. It folds from one side and slides out the other. This combination not only increases the size but al…",https://www.engadget.com/the-morning-after-samsungs-latest-mobile-screen-prototype-slides-and-folds-121516325.html,Samsungs apparently tired of mobile displays that only fold in on themselves. At CES 2023 this week the company revealed the Flex Hybrid OLED mobile screen. It folds from one side and slides out the other. This combination not only increases the size but alters the aspect ratio too. Starting off at a relatively compact 4. 2inch device it folds out to a 10. 5inch 43 display. Then because its not done the right side slides and expands out to create a 12. 4inch display with a 1610 aspect ratio which seems like itd be ideal for watching TV and movies. Samsungs folding phones won me over in 2022 even if they could do with longer battery life. With a screen this big that has to be a major consideration for any realworld devices. Weve seen rollout displays on concept phones before. TCL teased such a device in 2021 but it never showed off a working prototype. If Samsung has one at CES well check it out when the show floor opens. Already weve been barraged by PC and TV announcements. Keep track of all the news from CES 2023 right here. What are you hoping to see this year Mat Smith The biggest stories you might have missed Disgraced FTX founder Sam BankmanFried pleads not guilty to federal fraud charges Finally a fruit scanner to tell you if your avocados are ripe Pixel 7a handson leak appears to show 90Hz display and a familiar design Hitman 3 owners will get the previous two games for free Nintendo Switch Online deal brings a oneyear family plan and a 256GB microSD card down to 50 LOral created a motorized lipstick applicator for people with limited mobility GE made a 1000 stand mixer Alienware reveals its first 500Hz gaming monitor Intels 13thgen laptop CPUs offer up to 24 cores Alienwares new gaming laptops include an 18inch beast Samsungs 2023 QDOLED TVs will reach up to 2000 nits of peak brightness Dells Concept Nyx gamepad sure is... something NVIDIA unveils the pricey midrange RTX 4070 Ti GPU Even at 799 its better value than the 4080. NVIDIA finally unveiled its latest midrange GPU the RTX 4070 Ti. Starting at 799 its a slightly more reasonable alternative to NVIDIAs 1199 RTX 4090 and 1599 4090. But yes its still pretty costly. Is this the new GPU midrange NVIDIA is positioning the RTX 4070 Ti as the pinnacle of 1440p gaming beyond 120 fps. DLSS 3 is a big reason for that just like with the other 4000series cards it uses machine learning to generate entire frames rather than the pixels DLSS 2 created. That means it should be able to deliver better overall frame rates. The RTX 4070 Ti will be available on January 5th. Apple is raising the price of battery replacements for older iPhones It already costs more to give newer iPhones a fresh battery. Apple is adding 20 to the price of battery replacements for preiPhone 14 models on March 1st. For notched iPhones iPhone X through iPhone 13 this will bump the price from 69 to 89. If you have an iPhone SE or iPhone 8 the price will climb from 49 to 69. Its not clear if selfrepair prices will increase at the same time. However part prices roughly equal the cost of asking Apple to perform a battery swap. The company didnt elaborate on the reasoning but last year said inflation had affected business and it raised iPhone prices in several international markets. Hugging this pulsating cushion could help with anxiety The Fufulys movements can guide your breathing pattern. Yukai Engineering the team behind the strangely adorable cat tail pillow is back. The Fufuly is yet another anxietyreducing cushion from the Japanese company with a gentle rhythmical pulsation as the main therapeutic tool. The idea is hugging a Fufuly stimulates your belly to induce slower and deeper breathing thanks to the cushions lifelike behavior. The Fufuly will launch in Japan this year through crowdfunding. Dells revamped Gseries Surprisingly compelling budget gaming laptops With retro scifi designs and fun colors. Dells latest Gseries gaming notebooks seem to draw inspiration from gadgets in 80s scifi movies. You get simple lines with hard edges and bold twotone paint jobs with neonpastel accents. Color options may eventually change when these laptops go on sale but Dell is even painting small details like the radiator fins inside each laptops vents. In short theyre not as extra as the Alienware laptop family. The G15 will start at 849 for a 13thgen Intel Core i5 with a 1920 x 1080 screen and a choice of RTX 40series GPUs from NVIDIA. The larger G16 will start at 1499 with the same Core i5 chip but a higherres 165Hz 2560 x 1600 screen. Both should go on sale early this year. Test your pee where you pee with this oversized toilet clipon Not a fitness tracker. Vivoo has unveiled a smart toilet device that can test your urine and send the results to your phone. The tech is in a device that clips to existing toilets. Vivoo which has offered athome urine tests for the last few years designed the system with the elderly residential care and healthcare service providers in mind. The device will automatically align a testing strip with a persons urine stream which should reduce the risk of well mess. It analyzes the urine sample for four wellness parameters. The company suggests the results can offer indications of certain deficiencies or abnormalities and help with early detection of some conditions.,2023-01-04T12:15:16Z
5,"Nvidia, Foxconn to build autonomous vehicle platforms - Reuters","Chipmaker Nvidia Corp <a href=""https://www.reuters.com/companies/NVDA.O"" target=""_blank"">(NVDA.O)</a> and electronics manufacturer Foxconn <a href=""https://www.reuters.com/companies/2317.TW"" target=""_blank"">(2317.TW)</a> announced a partnership on Tuesday to …",https://www.reuters.com/business/autos-transportation/nvidia-foxconn-build-autonomous-vehicle-platforms-2023-01-03/,Foxconn to use Nvidia chips to build selfdriving vehicle platforms Jan 3 Reuters Chipmaker Nvidia Corp NVDA. O and electronics manufacturer Foxconn 2317. TW announced a partnership on Tuesday to develop autonomous vehicle platforms. Taiwanese contract manufacturer Foxconn said it will manufacture electronic control units ECUs for cars based on Nvidias DRIVE Orin chip made specifically for computing in connected and autonomous vehicles. The ECUs will serve the global automotive market Foxconn said. Companies developing electric and autonomous cars have struggled to bring products to the market in recent years as they grapple with rising costs and difficulties in ramping up production. Nvidia said its technology which includes chips to process information from sensors in real time will help Foxconn overcome some of those challenges. It sees a market opportunity of 300 billion in the automotive sector and reported revenue of 251 million in the third quarter from the segment. The chipmaker said the tieup will allow it to scale efforts to meet growing demand for chips made for autonomous and connected vehicles. Foxconn which operates a vehicle manufacturing facility in Ohio said its vehicles will contain ECUs based on DRIVE Orin and Nvidias DRIVE Hyperion sensors for autonomous driving. Taiwanbased Foxconn makes electric vehicles for Lordstown Motors Corp RIDE. O and has a contract to make Fisker Incs FSR. N second car model PEAR. It also manufactures Apple Inc AAPL. O products. The company said in October it hopes to eventually make cars for Tesla Inc TSLA. O as it ramps up electric vehicle manufacturing to diversify its business. Our Standards The Thomson Reuters Trust Principles.,2023-01-03T17:53:00Z
6,"New Dell G15, G16 Laptops Breathe New Life Into Budget Gaming - CNET","Dell revamped its gaming laptop with the latest Intel, AMD and Nvidia chips and gave them retro-inspired colors.",https://www.cnet.com/tech/computing/new-dell-g15-g16-laptops-breathe-new-life-into-budget-gaming/,Entrylevel gaming laptops arent typically exciting to look at or use. Dells G series has been an exception over the last several years as these models moved closer to being like lowerend Alienware laptops Dells premium gaming brand. But at CES 2023 Dell showed off redesigns that give the laptops a look all of their own. Read more The Wonders of CES 2023 3D Laptops Wireless TV and ShapeShifting Screens The new G15 and 16inch G16 have chunky angular bodies with twotone designs. The G15 features a choice of a 15. 6inch 1920x1080pixel resolution with a 120hertz refresh rate and 250nit brightness or 165Hz with sRGB 100 color coverage and 300nit brightness. The 16inch G16 changes to a 1610 aspect ratio with a 2560x1600 resolution and either a 165Hz 100 sRGB display panel or an optional 240Hz 100 DCIP3 display. The laptops will be available with a range of Intel 13thgen Core processors up to the i913900HX up to 32GB of memory and up to 2TB PCIe NVMe solidstate storage. AMD processors will be available also and youll be able to upgrade memory and SSDs on your own too. The laptops will also ship with nextgen Nvidia RTX graphics but theres no word just yet on which chips will land in which model. The cooling system is improved too with a vapor chamber and thermal interface inspired by those used in the higherend Alienware gaming laptops. Outside of screen size the distinguishing feature between the two models comes down to more subtle features. Those include wired and wireless connectivity port assortment and keyboard backlighting options. With the G16 you can even choose a Cherry MX mechanical keyboard. Dells G series is already a favorite of ours and the new designs only add to its likability. These are gaming laptop youll want to buy not just ones youll only choose because of the price. Theyre something all their own and not just cutrate versions of Alienware models. The new models are expected in the spring with the Dell G15 starting at approximately 849 and the G16 starting around 1499 No word on UK or Australia availability and pricing but the price for the G15 converts to approximately 705 or AU1250.,2023-01-03T17:00:14Z
7,"LG's updated Grams get thinner, add OLED and 'hidden touchpads'","LG has new Gram laptops at CES 2023. The latest entrants in the company’s ultra-portable line include the “thinnest Gram model yet” and a glass laptop with a “hidden” LED-lit trackpad.With a depth of 10.99 mm, LG says the new Gram Ultraslim is the company’s t…",https://www.engadget.com/lg-gram-2023-ultraslim-style-2-in-2-laptops-180038676.html,LG has new Gram laptops at CES 2023. The latest entrants in the companys ultraportable line include the thinnest Gram model yet and a glass laptop with a hidden LEDlit trackpad. With a depth of 10. 99 mm LG says the new Gram Ultraslim is the companys thinnest notebook. The device weighs a mere 998 g about nine percent lighter than the model its replacing and has a 15. 6inch OLED display with 1080p resolution. Of course it gets a processor bump with 13thgen Intel Raptor Lake chips. The Gram Style is a new variant for this year with a glass design. Shipping in 16 and 14inch variants the Style has antiglare OLED screens 3200 x 2000 resolution and a 120Hz refresh rate in the 16inch model and a 2880 x 1800 OLED with 90Hz for the 14inch variant. LG says the Style has a hidden touchpad with LED backlighting that illuminates when you touch it. Along with 13thgen Intel Raptor Lake chips the new machines include Gen4 NVMeTM solidstate drive in 256GB 512GB and 1TB tiers. LG has new variants of the standard Gram laptop line in 17 16 15 and 14inch variants. These models have IPS displays updated Raptor Lake Intel chips and NVIDIA GeForce RTX 3050 Laptop graphics. LG is also updating its Gram 2in1 line with 360degree rotating hinges. These updated models ships with 14 or 16inch touchscreen IPS displays at 2560 x 1600 16inch or 1920 x 1200 14inch resolution. Additionally they include preinstalled notetaking and drawing apps designed for the bundled LG Stylus Pen. All new Gram laptops this year include Dolby Atmos audio for the first time and LG touts the ultracompact power adapter shipping with all new Gram models. In addition their displays all have antiglare coatings and support the LG Glance privacy tool. Unfortunately weve run into buildquality issues with past Grams so hopefully the new models will fare better. LG hasnt yet announced pricing for the new laptops. They will launch globally starting in February. The company says it will announce US pricing and availability later.,2023-01-03T18:00:38Z
