Article,Title,Description,URL,Content,Published
53,NVIDIA relaunches 12GB RTX 4080 as the RTX 4070 Ti for $799,"NVIDIA scrubbed the launch of the 12GB RTX 4080 after user backlash, and the card is now being launched again under a new name. Say hello to the RTX 4070 Ti.",https://www.windowscentral.com/hardware/nvidia-relaunches-12gb-rtx-4080-as-the-rtx-4070-ti-for-dollar799,NVIDIA relaunches 12GB RTX 4080 as the RTX 4070 Ti for 799 The 12GB version of the RTX 4080 is back in a new avatar. What you need to know NVIDIA has officially launched the GeForce RTX 4070 Ti for 799. The card is identical to the 12GB version of the RTX 4080 that debuted in November 2022 but was later scrubbed. NVIDIA isnt rolling out a Founders Edition variant of the RTX 4070 Ti. Back when NVIDIA introduced the GeForce RTX 4080 in November there were two variants a 16GB model and a 12GB version with tweaks to the memory bus width and number of cores for 899 300 less than the 16GB RTX 4080. However a lot of users took issue with the 12GB model and the backlash got to a point where NVIDIA scrubbed the variant altogether. It was a given that the model would launch under a different name and the brand is doing just that the 12GB RTX 4080 is back and it is now called the RTX 4070 Ti. The best part about the introduction of the RTX 4070 Ti is that it is debuting at 799 100 less than its asking figure when it was branded as the RTX 4080. Thats great news for gamers looking to get their hands on a card based on the new Ada Lovelace architecture. The new architecture brings exciting efficiency gains and huge performance uplifts with NVIDIA touting that the card is 3x faster than the mighty 2000 RTX 3090 Ti. Theres obviously a caveat associated with a claim like that but in my testing I found the RTX 4080 to be noticeably faster than the RTX 3090 Ti at 4K and QHD resolutions and the 4070 Ti is likely to be in a similar boat. NVIDIA hasnt shared much in the way of technical details just yet but given that it was officially launched in November the hardware is unchanged. That means were looking at 7680 cores 12GB of GDDR6X memory at a 192bit wide interface leading to a bandwidth of 504GBs. And coming in at a requirement of 285W the RTX 4070 Ti is a little more efficient than the 4080. The RTX 4070 Ti is turning out to be the best GPU for customers still on the GTX 1080 Ti or the firstgen RTX 2080 and NVIDIA notes that the card is able to provide a 12x relative performance upgrade over the 1080 Ti. Sales of the RTX 4070 Ti will kick off starting January 5 for 799 and notably NVIDIA isnt offering a Founders Edition version of the card it will only be available with AIB vendors like Zotac ASUS MSI Gigabyte Colorful and others. Windows Central Newsletter Get the best of Windows Central in in your inbox every day Harish Jonnalagadda is a Senior Editor overseeing Asia for Android Central Windows Centrals sister site. When not reviewing phones hes testing PC hardware including video cards motherboards gaming accessories and keyboards. Windows Central Newsletter Thank you for signing up to Windows Central. You will receive a verification email shortly. There was a problem. Please refresh the page and try again.,2023-01-03T17:00:23Z
54,How to Fix Nvidia GeForce Drivers Not Downloading or Installing,The latest drivers will let you make the most out of your Nvidia GPU. But what should you do if you can't download and install them?,https://www.makeuseof.com/fix-nvidia-geforce-drivers-not-downloading-or-installing/,Having trouble downloading graphics drivers with Nvidia GeForce Experience or its other tools Have you tried installing the downloaded drivers only to find that they do not follow your directions If so you may not be able to fully utilize the powerful graphics card youve purchased for hundreds of dollars from Nvidia. Why does this happen So lets explore why Nvidia drivers wont download or install on your device and what you can do about it. How to Fix Nvidia Drivers Not Downloading on Windows There are two primary reasons why Nvidia drivers do not download the automatic download setting is disabled or there is a problem with the Nvidia graphics software itself. Here are the steps you need to follow to fix it. 1. Enable Automatic Downloads in the Nvidia GeForce Experience Client To enable the automatic downloads in the Nvidia GeForce client follow the below steps Launch GeForce Experience by searching for GeForce Experiencein Windows Search. In the topright corner click Settings gear icon. In the left sidebar click the Generaltab. Then scroll down to the bottom of the Generalsettings page and check the box for Automatically download driver updates and let me choose when to install. Close the Nvidia client and relaunch it after that. Then select the Drivers tab on the clients home screen and youll find the latest update available for installation. If you dont see any click the Check For Updates box which will load the latest update. If that doesnt help move on to the next step. 2. Manually Download the Drivers If the above method doesnt work you can manually download and install the driver. Here are the steps you need to follow. Go to the Nvidia Driver Downloads page. Choose the correct Product Type Product Series and Product. Next choose the proper Operating System. Select Game Ready Driver GRDfrom the Download Typedropdown menu. Click on the Searchbutton once the correct options have been selected. Depending on the hardware Nvidia will find the appropriate driver. Click on the Downloadbutton. Thats it. If Nvidia Experience or any other Nvidia client fails to download the driver automatically you can manually download them. But what if they dont install after downloading How to Fix Nvidia Drivers Not Installing on Windows Nvidia drivers fail to install due to interference from Windows security protection or an antivirus app protecting your device using an outdated Nvidia GeForce client downloading an incompatible driver that is not supported by your graphics card having a physical connection issue or having an outdated operating system. If Nvidia software fails to install drivers follow these steps. 1. Turn Off Antivirus Protection The Windows Defender or thirdparty antivirus software helps us catch viruses before they cause havoc on our devices. There are times however when they dont let even the safetoexecute processes complete because they consider them a threat. Firstly you should ensure that antivirus or Windows Defender doesnt interfere with the drivers installation. Disabling them is the best way to accomplish this. Not sure how to disable Windows builtin security Check out our guide on how to disable Windows Defender. Additionally if youre using any thirdparty antivirus software refer to the official instructions on their website explaining how to turn them off. After disabling them try installing the drivers again. Reenable Windows Defender or your antivirus after successfully installing the drivers. You could put your device at risk otherwise. 2. Ensure Windows Is UptoDate Running an outdated Windows OS can also impede the installation of drivers just as outdated GeForce Experience clients can cause problems. Therefore make sure that no operating system updates are pending. Our guide on managing Windows Updates will show you how to check for the most recent updates and install them. 3. Rule Out Compatibility Issues Your Nvidia drivers may also fail to install if youre trying to install incompatible drivers. Every graphics card requires a different driver. Hence the Nvidia client will simply give up if the driver you are trying to install does not match your hardware. Thus you should carefully check the graphics card installed on your device then manually download the driver corresponding to your hardware per the instructions about manually downloading drivers. If you are confident that your drivers are compatible with your hardware proceed to the next step. 4. Install the Driver Manually If the Nvidia client cannot install the drivers you can install them manually. To do that follow the instructions listed above for downloading drivers manually. When the driver has been downloaded rightclick the driver installer package and click Run as administrator. After that follow the onscreen instructions to install the drivers manually. 5. Install an Older Driver Version Are you trying to install a newly released driver Occasionally newly released drivers contain bugs that prevent them from installing. If you encounter this issue with a driver released recently by Nvidia try installing an older version. If the old version installs smoothly the problem must be with the new drivers. The Nvidia forum can be an excellent place to confirm this since other users may also have the same issue. If they are then wait for Nvidia to fix the problem. You can stick with the older version until then. 6. Reinstall the GeForce Experience Client If none of the above fixes helps you install the drivers your last resort should be to uninstall the GeForce Experience or any other client youre using and reinstall it. This will undoubtedly be timeconsuming. However it will save you from having to deal with this issue again in the future. For a successful reinstall uninstall your current installation and delete any junk files on your system. In some cases remnants of some client files may remain in the following locations which will need to be manually deleted CProgram FilesNVIDIA Corporation CProgram Files x86NVIDIA Corporation Smoothly Download and Install Nvidia Drivers Being unable to download and install newly released drivers can be tempting. If you follow the fixes in the list you should be able to download and install Nvidia drivers seamlessly. If the fixes dont work you can use thirdparty tools to update your drivers.,2023-01-11T22:00:06Z
55,"Mobileye touts bright future while Nvidia, Qualcomm win over automakers","Objects in mirror are closer than they appear
Analysis Mobileye, Intel's autonomous driving unit, offered a rather rosy outlook on the company's advanced driver assistance systems (ADAS), with CEO Amnon Shashua claiming more than $17 billion in bookings throu…",https://www.theregister.com/2023/01/06/mobileye_nvidia_qualcomm/,Mobileye touts bright future while Nvidia Qualcomm win over automakers Objects in mirror are closer than they appear Analysis Mobileye Intels autonomous driving unit offered a rather rosy outlook on the companys advanced driver assistance systems ADAS with CEO Amnon Shashua claiming more than 17 billion in bookings through 2030 during his CES keynote this week. However the autonomous vehicle market remains in its infancy with many of the enabling technologies still under active development. Israelbased Mobileye may have won early credibility among automakers like BMW Nissan Volkswagen and Chinas Zeekr but its not the only chipmaker eager to claim their share of the autonomous vehicle hype. At GTC last fall Nvidia unveiled its nextgeneration autonomous driving platform called Drive Thor. Based on the companys Hopper microarchitecture the system will reportedly deliver 2000 TOPS trillion operations per second of inferencing performance when it rolls out to automakers in 2025. Thats about the time Mobileye plans to launch its sixthgen EyeQ chips. Qualcomms Snapdragon Ride Flex SoC announced at the Consumer Electronics Show CES in Vegas this week is expected to hit the road a year earlier. Much like Nvidias Drive Thor the chip integrates multiple vehicle domains like infotainment ADAS and autonomous driving into a single platform. According to a Gartner report from September these autonomous vehicle AI chips which ingest and process the streaming data from vehicle sensors are among the more accessible technologies necessary to realize the dream of fully autonomous vehicles in the near term but theyre only part of the equation. Qualcomm Nvidia gain share steal customers In the six years since Intel acquired Mobileye for 15 billion the division has gained steady traction growing revenues quarter over quarter often by doubledigit margins. After much anticipation Intel spun off the division in an initial public offering IPO last October. However the IPO mustered just 16 billion a fraction of the nearly 50 billion valuation the division had hoped to fetch earlier in the year. Despite a somewhat lackluster entrance to the public market the company still leads Nvidia and Qualcomm at least when it comes to revenues. During Mobileyes first quarter as a publicly traded company it posted revenues of 450 million. Including the three quarters leading up to the companys IPO its 2022 revenues topped 1. 66 billion. By comparison Qualcomms automotive business managed 1. 4 billion while Nvidias netted just 566 million during the 2022 fiscal year. Tesla driver blames fullselfdriving software for eightcar Thanksgiving Day pile up Waymo selfdriving robotaxi goes rogue with passenger inside escapes support staff Intels Mobileye unveils first productiongrade fully electric selfdriving vehicle partners with Sixt for Munich launch When the chips fall Intel preps for 16b Mobileye IPO And while Shashua was quick to highlight the companys 17 billion in bookings Qualcomm claims its order pipeline is nearly twice that with General Motors Renault Volkswagen and BMW lining up to purchase its Snapdragon Ride Flex platform. If some of those names sound familiar thats because many of the same companies buying Mobileyes products today are also eyeing its competitors. Nvidia is also poised to steal customer share away from Mobileye. During his keynote Thursday Shashua touted automaker Zeekr which has already put 70000 vehicles using its ADAS platform on the road. But as we learned at GTC Zeekr was also one of Nvidias launch partners for Drive Thor. Robotaxis first autonomous vehicles later Interest in autonomous vehicles is gaining momentum quickly stoked by everimproving ADAS systems like Teslas Autopilot or GMs Super Cruise. Looking ahead Gartner predicts that by 2028 the number of assisted autonomous vehicles think lane keeping automatic cruise control and braking will increase to just under 75 percent up from 60 percent in 2020. Analysts expect more capable systems which Gartner refers to as partially autonomous will jump from 1. 5 percent of vehicles in 2020 to a quarter of all vehicles by 2030. This class reflects the kinds of handsoff autonomous driving capabilities available in some premium vehicles today. Where Gartner expects to see the most advanced fully autonomous systems first isnt in a vehicle youll be able to buy. Instead analysts believe that the first fully autonomous vehicles will show up in the form of robotaxis. Today a handful of companies have fielded autonomous taxis usually with a driver on board as a failsafe. Waymo and Sixt are just two examples. By 2025 Gartner expects robotaxis will be fairly common with services available in at least 25 cities in North America. But just like autonomous vehicles robotaxis face safety concerns. In 2021 a Waymo robotaxi went rogue evading support staff while Autopilotrelated crashes continue to be a source of controversy for Teslas Muskmobiles.,2023-01-06T16:15:11Z
56,Nvidia wants to stream GeForce NOW games into your car,"Nvidia wants to bring cloud gaming right into your car. In a press release, Nvidia announced that it is working to bring GeForce NOW, the …
The post Nvidia wants to stream GeForce NOW games into your car appeared first on BGR.",https://bgr.com/tech/nvidia-wants-to-stream-geforce-now-games-into-your-car/,Nvidia wants to bring cloud gaming right into your car. In a press release Nvidia announced that it is working to bring GeForce NOW the companys game streaming service directly into cars. The company says that it will take no additional hardware besides you know adding screens and processors and that it is already working with Hyundai Motor Group BYD and Polestar to launch the service in their vehicles. Stella Li Vice President of BYD and CEO of BYD America hailed the partnership. We are excited to offer our customers the best in technology comfort design from BYD and now the latest in gaming through NVIDIA GeForce NOW highperformance cloud gaming service. The experience of driving our cars is becoming increasingly sophisticated entertaining and sustainable. You can check out what it might look like in their announcement video below While you may be jumping at the screen screaming that drivers will turn the highway into an actual recreation of Grand Theft Auto due to their eyes being locked into the game dont worry. The company notes that drivers and front seat passengers can access games while parked or charging while those in the backseat of vehicles where rear entertainment is enabled can play anytime on the road. The gaming service seems to be coming only to vehicles that feature the companys NVIDIA DRIVE technology something that Hyundai BYD and Polestar all have. Nvidia says it should work with over 1000 titles on the service that support a controller and press images appear to indicate it will work with the Xbox Wireless Controller. Nvidia and the automakers did not provide a launch date for the service on any of their cars so we could have quite a wait. However if successful Nvidia could beat other game streaming services like Xbox Cloud Gaming to bring cloud gaming to the car. I for one am ready to play Battlefield while Im charging my electric car at Whole Foods. What a time to be alive,2023-01-03T23:33:16Z
57,"Microsoft Acquires Fungible, Gets Composable Infrastructure Hardware - CRN","<ol><li>Microsoft Acquires Fungible, Gets Composable Infrastructure Hardware  CRN
</li><li>Microsoft acquires Fungible, a maker of data processing units, to bolster Azure  TechCrunch
</li><li>Microsoft acquires Fungible, a data center infrastructure company…",https://www.crn.com/news/data-center/microsoft-acquires-fungible-gets-composable-infrastructure-hardware,Data center News Microsoft Acquires Fungible Gets Composable Infrastructure Hardware Joseph F. Kovar The acquisition for an undisclosed amount gives Microsoft hardware and software technology aimed specifically at accelerating data center storage and networking performance including highperformance NVMeoverTCP storage clustering technology. Microsoft Monday said it has acquired Fungible a developer of composable infrastructure based on the companys data processing unit or DPU hardware for accelerating data center network and storage performance. Terms of the deal were not disclosed. Santa Clara Calif. based Fungible which was formed in 2015 by Pradeep Sindhu who at the time was cofounder and chief scientist at Juniper Networks and Bertrand Serlet raised over 300 million including in 2019 a 200million Series C round of funding led by SoftBank Vision Fund. The Fungible DPU is a microprocessor aimed at optimizing storage and networking to offload those services away from the CPU along with software to manage the control plane while allowing the building of a highperformance data fabric. Related 2022 Storage 100 Whos Got Your Backup Fungible also develops technology for building an allflash NVMeoverTCP disaggregated storage cluster called the Fungible Storage Cluster which the company claims overcomes legacy limitations to deliver bestinclass performance at scale as well as advanced power utilization. Microsoft in a blog post authored by Girish Bablani corporate vice president for Azure Core said the Fungible team is slated to become part of Microsofts data center infrastructure team. Todays announcement further signals Microsofts commitment to longterm differentiated investments in our datacenter infrastructure which enhances our broad range of technologies and offerings including offloading improving latency increasing datacenter server density optimizing energy efficiency and reducing costs Microsoft wrote. A Microsoft spokesperson in an emailed response to a CRN request for more information said the acquisition closed on January 5. Microsoft is acquiring Fungible because of its technologies that help enable highperformance massively scalable hyperdisaggregated scaledout datacenter infrastructure with high reliability and security which is a need of the datacentric era. Through this acquisition Microsoft is looking to better accelerate datacenter innovation with lowpower data processing units DPUs the spokesperson wrote. Reports of the acquisition first appeared in December. Fungible was competing in an increasingly competitive market which includes such semiconductor and storage vendors as Nvidia Intel AMD Lightbits Liqid and GigaIO according to online news site Datacenter Dynamics.,2023-01-09T21:06:00Z
