Article,Title,Description,URL,Content
4,Guitar virtuoso Jeff Beck has died - CP24,"<ol><li>Guitar virtuoso Jeff Beck has died  CP24
</li><li>Jeff Beck, guitar virtuoso who influenced generations, dead at 78  CBC News
</li><li>Jeff Beck Dead At 78 - Jimmy Page & Gene Simmons React  Us Weekly
</li><li>Live updates: Bed Bath & Beyond shares…",https://www.cp24.com/entertainment-news/jeff-beck-guitar-god-who-influenced-generations-dies-at-78-1.6226876,Jeff Beck guitar god who influenced generations dies at 78 Mark Kennedy The Associated Press Published Wednesday January 11 2023 516PM EST Last Updated Wednesday January 11 2023 738PM EST NEW YORK AP Jeff Beck a guitar virtuoso who pushed the boundaries of blues jazz and rock n roll influencing generations of shredders along the way and becoming known as the guitar players guitar player has died. He was 78. Beck died Tuesday after suddenly contracting bacterial meningitis his representatives said in a statement released Wednesday. The location was not immediately known. Jeff was such a nice person and an outstanding iconic genius guitar player there will never be another Jeff Beck Tony Iommi guitarist for Black Sabbath wrote on Twitter among the many tributes. Beck first came to prominence as a member of the Yardbirds and then went out on his own in a solo career that incorporated hard rock jazz funky blues and even opera. He was known for his improvising love of harmonics and the whammy bar on his preferred guitar the Fender Stratocaster. Jeff Beck is the best guitar player on the planet Joe Perry the lead guitarist of Aerosmith told The New York Times in 2010. He is head hands and feet above all the rest of us with the kind of talent that appears only once every generation or two. Beck was among the rockguitarist pantheon from the late 60s that included Eric Clapton Jimmy Page and Jimi Hendrix. Beck won eight Grammy Awards and was inducted into the Rock and Roll Hall of Fame twice once with the Yardbirds in 1992 and again as a solo artist in 2009. He was ranked fifth in Rolling Stone magazines list of the 100 Greatest Guitarists of All Time. Jeff could channel music from the ethereal Page tweeted Wednesday. Beck played guitar with vocalists as varied as Luciano Pavarotti Macy Gray Chrissie Hynde Joss Stone Imelda May Cyndi Lauper Wynonna Judd Buddy Guy and Johnny Depp. He made two records with Rod Stewart 1968s Truth and 1969s BeckOla and one with a 64piece orchestra Emotion Commotion. I like an element of chaos in music. That feeling is the best thing ever as long as you dont have too much of it. Its got to be in balance. I just saw Cirque du Soleil and it struck me as complete organized chaos he told Guitar World in 2014. If I could turn that into music its not far away from what my ultimate goal would be which is to delight people with chaos and beauty at the same time. Beck career highlights include joining with bassist Tim Bogert and drummer Carmine Appice to create the power trio that released Beck Bogert and Appice in 1973 tours with Brian Wilson and Buddy Guy and a tribute album to the late guitarist Les Paul Rock n Roll Party Honoring Les Paul. Becks album credits include Talking Book Stevie Wonders landmark 1972 album. His tenderly rendered guitar solo on the ballad Lookin For Another Pure Love won him a warm Do it Jeff callout from Wonder that was included on the album cut. Geoffrey Arnold Beck was born in Surrey England and attended Wimbledon Art College. His father was an accountant and his mother worked in a chocolate factory. As a boy he built his first instrument using a cigar box a picture frame for the neck and string from a radiocontrolled toy airplane. He was in a few bands including Nightshift and The Tridents before joining the Yardbirds in 1965 replacing Clapton but only a year later giving way to Page. During his tenure the band created the memorable singles Heart Full of Soul Im a Man and Shapes of Things. Becks first hit single was 1967s instrumental Becks Bolero which featured future Led Zeppelin members Page and John Paul Jones and The Who drummer Keith Moon. The Jeff Beck Group with Stewart singing was later booked to play the 1969 Woodstock music festival but their appearance was canceled. Beck later said there was unrest in the band. I could see the end of the tunnel he told Rolling Stone in 2010. Beck was friends with Hendrix and they performed together. Before Hendrix most rock guitar players concentrated on a similar style and technical vocabulary. Hendrix blew that apart. He came along and reset all of the rules in one evening Beck told Guitar World. Beck teamed up with legendary producer George Martin a. k. a. the fifth Beatle to help him fashion the genremelding jazzfusion classic Blow by Blow 1975 and Wired 1976. He teamed up with Seal on the Hendrix tribute Stone Free created a jazzfusion group led by synthesizer player Jan Hammer and honored rockabilly guitarist Cliff Gallup with the album Crazy Legs. He put out Loud Hailer in 2016. Becks guitar work can be heard on the soundtracks of such films as Stomp the Yard Shallow Hal Casino Honeymoon in Vegas Twins Observe and Report and Little Big League. Beck recently completed a tour supporting his album with Depp 18 and was heard on Ozzy Osbournes Patient Number 9 album. Becks career never hit the commercial highs of Clapton. A perfectionist he preferred to make critically wellreceived instrumental records and left the limelight for long stretches enjoying his time restoring vintage automobiles. He and Clapton had a tense relationship early on but became friends in later life and toured together. Why did the two wait some four decades to tour together Because we were all trying to be big bananas Beck told Rolling Stone in 2010. Except I didnt have the luxury of the hit songs Erics got. Beck is survived by his wife Sandra. AP reporter Scott Stroud in Nashville contributed to this report.
5,Jeff Beck obituary,"Virtuoso musician who took the guitar in new directions with a firework display of contrasting techniques and texturesRenowned as a pioneering guitarist who pushed the boundaries of the instrument to places unknown to most of his contemporaries, Jeff Beck, wh…",https://www.theguardian.com/music/2023/jan/12/jeff-beck-obituary,Renowned as a pioneering guitarist who pushed the boundaries of the instrument to places unknown to most of his contemporaries Jeff Beck who has died from bacterial meningitis aged 78 could more than hold his own with fellow luminaries such as Jimmy Page and Eric Clapton all three of them played in the Yardbirds. Yet unlike them Beck was something of a reluctant celebrity unwilling to pursue the superstardom that his musical gifts could have brought him. When Led Zeppelin made it so big I was jealous absolutely jealous as hell Beck said in 1986. But Im glad I carried on as I was. I personally couldnt have put up with that mass adulation. When Clapton and Page appeared at Live Aid in 1985 Beck preferred to stay at home and tinker with his beloved collection of classic hot rod cars. I didnt want to go because I hate large crowds he claimed. The Melody Maker journalist Chris Welch wrote that he can appear sullen lazy and difficult. He has an expressive face that appears to give away his every mood and thought. Nonetheless Beck was a central figure in several key developments in rock musics history. As a member of the Yardbirds in 196566 he featured on some of their bestknown hits including Heart Full of Soul and Shapes of Things while expanding the bands musical palette hugely. His solo recording Becks Bolero was a firework display of contrasting guitar techniques and textures and pointed to Becks future in which he would move away from mere rock to embrace jazz fusion and even classical crossover. His 2010 album Emotion Commotion included versions of Benjamin Brittens Corpus Christi Carol and Puccinis Nessun Dorma interpreted through Becks uniquely sensitive touch. He would frequently pick strings with his thumb while modifying tone and pitch with the tremolo bar. Becks gifts burned most intensely after he left the Yardbirds in November 1966 and formed the first incarnation of the Jeff Beck Group in early 1967 featuring Ronnie Wood on bass and the telltale rasping vocals of Rod Stewart. Becks previously recorded solo hit Hi Ho Silver Lining which reached 14 on the UK chart in the spring of 67 gave the group a handy launch platform although their debut album Truth was not released until the following year. When it was it reached 15 on the US chart. This was largely down to the groups tour manager Peter Grant later Led Zeppelins manager who had taken the band to the US for some ecstatically received live performances and then persuaded Epic Records to sign them. Truths soulful mix of blues and hard rock was a trailblazer for a new wave of bands not least Led Zeppelin themselves whose own debut album appeared six months later. Although Truth failed to chart in Britain the Beck bands second album BeckOla gave them another No 15 hit in the US and this time reached the UK Top 40 and they followed up with successful touring in the US but internal friction was beginning to pull the unit apart. With impeccably poor timing they broke up just before they were due to play at the Woodstock festival. Stewart launched his solo career and formed the Faces with Wood. A rebuilt Jeff Beck Group released the albums Rough and Ready 1971 and Jeff Beck Group 1972 but the magic moment had passed. Beck was born at his familys home in Wallington then in Surrey but now in south London. His father Arnold was an accountant and his mother Ethel worked in a chocolate factory. Jeff attended Sutton Manor primary school and Sutton East county secondary modern. He credited his mother with pushing him to study music because she used to force me to play piano about two hours a day. But that was good because it made me realise I was musically sound. He became fascinated by the electric guitar when he heard Les Pauls version of How High the Moon. After experimenting with stretching rubber bands over tobacco cans and making horrible noises he graduated to an old and battered acoustic guitar and then built his own instrument using a cigar box and a picture frame. Beck attended Wimbledon Art College where he was mostly preoccupied with guitarplaying inspired by albums by American bluesmen such as Buddy Guy and Muddy Waters. He bought himself an electric guitar and played briefly with Screaming Lord Sutch and the Savages and in 1963 formed the Nightshift who recorded the single Stormy Monday. Later that year he joined an RB band the Tridents. He took a great leap forward in 1965 when he joined the Yardbirds replacing Clapton. This was on the recommendation of Page whom Beck had known since being introduced to him by his sister Annetta in his teens. He was with the Yardbirds for less than two years but during this period they recorded some of their bestknown material including the hit singles Heart Full of Soul featuring Becks ragalike guitar a UK No 2 and a Top 10 hit in the US Evil Hearted You UK No 3 Shapes of Things UK No 3 and Over Under Sideways Down UK No 10. Happenings Ten Years Time Ago 1966 only made it to 43 on the UK chart and 30 in the US but its complex mix of guitar parts by both Beck and Page have led to it being considered a milestone along the road to fullblown psychedelia. Page would go on to bend the boundaries of rock music with Led Zeppelin while Beck was experimenting with different tunings and feedback effects. In May 1966 Beck made his first solo recording Becks Bolero. It featured Page the Whos drummer Keith Moon and the future Zeppelin bassist John Paul Jones indeed the musicians on the track almost became Led Zeppelin but was not released until it became the B side of Becks single Hi Ho Silver Lining the following year. Based on the rhythm of Ravels Bolero it was a spectacular display of guitar tonalities from ethereal slide guitar to hardrock riffing and suggested the extent of Becks ambitions. After the Jeff Beck Group ended he formed the power trio Beck Bogert and Appice in 1972 his bandmates being exmembers of Vanilla Fudge but the project failed to match expectations and they split in 1974. In 1975 Beck reemerged in a jazzinflected guise with the allinstrumental album Blow by Blow produced by George Martin. It became Becks most successful album reaching No 4 on the US chart and selling a million copies. For Wired 1976 he teamed up with Narada Michael Walden and Jan Hammer veterans of the Mahavishnu Orchestra. Subsequent live shows were preserved on Jeff Beck With the Jan Hammer Group Live 1977. Beck released intermittent solo albums including Flash 1985 Jeff Becks Guitar Shop 1989 and Jeff 2003. Flash delivered a hit single with a cover version of Curtis Mayfields People Get Ready and the track Escape won Beck the first of his eight Grammy awards. He made guest appearances on Mick Jaggers album Primitive Cool 1987 and Roger Waterss Amused to Death 1992. In 2020 he released the single Isolation a John Lennon song on which he collaborated with the actor Johnny Depp. In July last year the pair released an album 18 after Depp had joined Beck onstage for some UK and European concerts. Beck was inducted into the Rock and Roll Hall of Fame in 1992 for his work with the Yardbirds and in 2009 for his solo career. He is survived by his second wife Sandra Cash whom he married in 2005.
6,Mercedes-Benz and ChargePoint are going to build thousands of EV fast chargers across North America,"ChargePoint and Mercedes-Benz are jumping into the race to build out a vast charging network for electric vehicles in the United States. In a press …
The post Mercedes-Benz and ChargePoint are going to build thousands of EV fast chargers across North America …",https://bgr.com/tech/mercedes-benz-and-chargepoint-are-going-to-build-thousands-of-ev-fast-chargers-across-north-america/,ChargePoint and MercedesBenz are jumping into the race to build out a vast charging network for electric vehicles in the United States. In a press release the two companies announced today that they will be partnering to create an electric car charging network featuring over 400 stations and 2500 DC fast chargers. The network which will be available to all electric vehicle drivers will be installed at locations throughout the United States and Canada. Pasquale Romano the CEO of ChargePoint said in a statement that he anticipates that charging hubs like the ones they are building will create a new 30minute retail economy. Automotive leaders like MercedesBenz continue to lead the transition to electric mobility by bringing new EVs to market and ChargePoint remains committed to enabling the simplicity that drivers expect and the charging speed they need for all vehicles whenever and wherever drivers want. With this partnership we are expanding upon our existing relationships with MercedesBenz and MN8 to deliver a seamless charging experience for drivers and turnkey charging solutions at no upfront cost to site hosts. We believe the expansion of charging hubs like these will enable the emergence of a new 30 minute retail economy at the intersection of innovation and accessibility that combines charging and commerce giving drivers a superior experience to charge quickly and easily. Ola Kllenius Chairman of the Board of Management of MercedesBenz Group AG said in a statement that the charging network will offer a charging experience to match the extraordinary Mercedes driving experience. MercedesBenz customers deserve a compelling charging experience that makes electric vehicle ownership and longdistance travel effortless and thats why we are launching a global highend charging network that will offer a charging experience to match the extraordinary Mercedes driving experience. We are excited to start right here in North America with two strong and experienced partners ChargePoint and MN8 Energy. While the charging network will be available to all electric vehicles the companies did note that Mercedes vehicles will get additional perks like preferential access when making a reservation automatic authentication and the ability to never have to use a card to pay for your charging session. The companies have not yet provided a timeline on when the charging stations will go live across the countries.
7,"Swiggy delivery executive dies after car hits, drags him for 500 metres in Noida","Kaushal Yadav was working late at night on January 1 when he was allegedly hit by a car in Noida’s Sector 14. The police are on the lookout for the accused, who fled after the accident.",https://indianexpress.com/article/cities/delhi/noida-swiggy-delivery-executive-hit-by-car-dragged-dies-8362413/,A 24yearold delivery executive was killed after a car allegedly hit his bike and dragged him for 500 metres in Noidas Sector 14 police said Thursday. The incident took place late at night on January 1 when the deceased Kaushal Yadav a resident of Etawa was on duty. Police said Yadavs brother Amit had called him at 1 am on January 2 to know his whereabouts. The phone was picked up by a local who told Amit about Kaushals accident the police said. In a case similar to 20yearold Anjali Singhs accident Yadav was also dragged on the road after the accident and the accused managed to flee the police said. Kaushal was riding near the flyover when the accused allegedly hit his bike dragged his body on the road and fled after the body fell from the car. We received information from a Delhi control room about the accident near Phase 1 area Noida Sector 14A. The man had died on the spot. He was taken to the hospital. We have formed three teams to identify and nab the accused. Locals alleged the man was dragged for metres. We are looking into that a senior police officer said. The information about the accident came from a cab driver from Ola. We do not know this driver and how he was there. We are trying to trace him as well. CCTVs around the spot are being analysed and technical surveillance on the offending vehicle is being done to arrest the accused added the officer. An FIR was registered on Amits complaint under sections of rash driving and causing death due to negligence. My cousin Kaushal works as a delivery agent with Swiggy. When I called him on January 1 an Ola cab driver picked up the phone and told me my brother was hit by an unknown vehicle that dragged him from the flyover to a nearby temple. I rushed to the spot and found my brothers body lying near the temple reads the FIR. Responding to the incident a spokesperson of Swiggy said We are deeply saddened by the loss of our delivery partner Kaushal Yadav in a heartbreaking incident on January 2. We are in constant touch with his family members and doing everything in our capacity to expedite this case including processing insurance and offering legal support to his family.
8,"Jeff Beck, guitar god who influenced generations, dies at 78","Jeff Beck, a guitar virtuoso who pushed the boundaries of blues, jazz and rock ‘n’ roll, influencing generations of shredders along the way and becoming...",https://news.yahoo.com/jeff-beck-guitar-god-influenced-220731301.html,Jeff Beck guitar god who influenced generations dies at 78 NEW YORK AP Jeff Beck a guitar virtuoso who pushed the boundaries of blues jazz and rock n roll influencing generations of shredders along the way and becoming known as the guitar players guitar player has died. He was 78. Beck died Tuesday after suddenly contracting bacterial meningitis his representatives said in a statement released Wednesday. The location was not immediately known. Jeff was such a nice person and an outstanding iconic genius guitar player there will never be another Jeff Beck Tony Iommi guitarist for Black Sabbath wrote on Twitter among the many tributes. Beck first came to prominence as a member of the Yardbirds and then went out on his own in a solo career that incorporated hard rock jazz funky blues and even opera. He was known for his improvising love of harmonics and the whammy bar on his preferred guitar the Fender Stratocaster. Jeff Beck is the best guitar player on the planet Joe Perry the lead guitarist of Aerosmith told The New York Times in 2010. He is head hands and feet above all the rest of us with the kind of talent that appears only once every generation or two. Beck was among the rockguitarist pantheon from the late 60s that included Eric Clapton Jimmy Page and Jimi Hendrix. Beck won eight Grammy Awards and was inducted into the Rock and Roll Hall of Fame twice once with the Yardbirds in 1992 and again as a solo artist in 2009. He was ranked fifth in Rolling Stone magazines list of the 100 Greatest Guitarists of All Time. Jeff could channel music from the ethereal Page tweeted Wednesday. Beck played guitar with vocalists as varied as Luciano Pavarotti Macy Gray Chrissie Hynde Joss Stone Imelda May Cyndi Lauper Wynonna Judd Buddy Guy and Johnny Depp. He made two records with Rod Stewart 1968s Truth and 1969s BeckOla and one with a 64piece orchestra Emotion Commotion. I like an element of chaos in music. That feeling is the best thing ever as long as you dont have too much of it. Its got to be in balance. I just saw Cirque du Soleil and it struck me as complete organized chaos he told Guitar World in 2014. If I could turn that into music its not far away from what my ultimate goal would be which is to delight people with chaos and beauty at the same time. Beck career highlights include joining with bassist Tim Bogert and drummer Carmine Appice to create the power trio that released Beck Bogert and Appice in 1973 tours with Brian Wilson and Buddy Guy and a tribute album to the late guitarist Les Paul Rock n Roll Party Honoring Les Paul. Becks album credits include Talking Book Stevie Wonders landmark 1972 album. His tenderly rendered guitar solo on the ballad Lookin For Another Pure Love won him a warm Do it Jeff callout from Wonder that was included on the album cut. Geoffrey Arnold Beck was born in Surrey England and attended Wimbledon Art College. His father was an accountant and his mother worked in a chocolate factory. As a boy he built his first instrument using a cigar box a picture frame for the neck and string from a radiocontrolled toy airplane. He was in a few bands including Nightshift and The Tridents before joining the Yardbirds in 1965 replacing Clapton but only a year later giving way to Page. During his tenure the band created the memorable singles Heart Full of Soul Im a Man and Shapes of Things. Becks first hit single was 1967s instrumental Becks Bolero which featured future Led Zeppelin members Page and John Paul Jones and The Who drummer Keith Moon. The Jeff Beck Group with Stewart singing was later booked to play the 1969 Woodstock music festival but their appearance was canceled. Beck later said there was unrest in the band. I could see the end of the tunnel he told Rolling Stone in 2010. Beck was friends with Hendrix and they performed together. Before Hendrix most rock guitar players concentrated on a similar style and technical vocabulary. Hendrix blew that apart. He came along and reset all of the rules in one evening Beck told Guitar World. Beck teamed up with legendary producer George Martin a. k. a. the fifth Beatle to help him fashion the genremelding jazzfusion classic Blow by Blow 1975 and Wired 1976. He teamed up with Seal on the Hendrix tribute Stone Free created a jazzfusion group led by synthesizer player Jan Hammer and honored rockabilly guitarist Cliff Gallup with the album Crazy Legs. He put out Loud Hailer in 2016. Becks guitar work can be heard on the soundtracks of such films as Stomp the Yard Shallow Hal Casino Honeymoon in Vegas Twins Observe and Report and Little Big League. Beck recently completed a tour supporting his album with Depp 18 and was heard on Ozzy Osbournes Patient Number 9 album. Becks career never hit the commercial highs of Clapton. A perfectionist he preferred to make critically wellreceived instrumental records and left the limelight for long stretches enjoying his time restoring vintage automobiles. He and Clapton had a tense relationship early on but became friends in later life and toured together. Why did the two wait some four decades to tour together Because we were all trying to be big bananas Beck told Rolling Stone in 2010. Except I didnt have the luxury of the hit songs Erics got. Beck is survived by his wife Sandra. AP reporter Scott Stroud in Nashville contributed to this report. Mark Kennedy is at httptwitter. comKennedyTwits
