Article,Title,Description,URL,Content
9,Mercedes to Build Thousands of EV Chargers Globally by 2030,"Say what you will about Tesla, but there’s no denying that the company’s charging network is a huge benefit and differentiator that has played a significant role in its growth and success over the years. Given the number of automakers moving toward electrific…",https://www.thetruthaboutcars.com/cars/news-blog/mercedes-to-build-thousands-of-ev-chargers-globally-by-2030-44498626,Mercedes to Build Thousands of EV Chargers Globally by 2030 Say what you will about Tesla but theres no denying that the companys charging network is a huge benefit and differentiator that has played a significant role in its growth and success over the years. Given the number of automakers moving toward electrification and the amount of money entering the arena its surprising that we havent seen another manufacturer doing the same. MercedesBenz is jumping in to change that announcing its intention to build a network of 10000 fast chargers. Automotive News reported that Mercedes made the announcement at CES. The automaker said its first steps would happen in Canada and the United States. The green energypowered chargers will expand to Europe and parts of Asia by 2030. The chargers wont be locked to Mercedes customers like Teslas Superchargers were until recently though owners will receive priority access and special pricing. The automaker plans to spend billions on developing and implementing the network but believes its investment will become an asset over time. This is something that you will be able to monetize when you come out of the investment phase the companys CEO noted. Mercedes boss Ola Kllenius also believes customers deserve a seamless charging experience and easy longdistance travel. Kllenius said the company would not be slow with the rollout. We wont take a waitandsee approach for this to be built he noted. The company appears to back that sentiment up with action plans saying it would build more than 400 charging locations and 2500 chargers across North America. Image MercedesBenz Become a TTAC insider. Get the latest news features TTAC takes and everything else that gets to the truth about cars first by subscribing to our newsletter. Comments Join the conversation Latest Car ReviewsRead more Latest Product ReviewsRead more Recent Comments FreedMike Anyway what is happening at Tesla Is it Elons Twitter involvement Is it just that Tesla is being battered by the same headwinds as the rest of the industry Is the companys reputation for poor quality catching up to it Is it because competition from other OEMs is increasing Something else Some combination of the aboveAll of the above. In years past Tesla was a mystique and the stock price reflected that. Turns out theyre a car company after all. Who knewI would say though that their quality has gotten a lot better not to say that its outstanding but its not embarrassing anymore. Oberkanone A sale is a sale is a sale. TESLA is fine nothing to see move along. TESLA has ability to cut prices short term. Zerofoo Tesla is also cutting priceshttpswww. theverge. com202311323553295teslapricecutsuseurope2023 MaintenanceCosts If youre willing to overlook Teslas and its founders foibles which Im not this is a great time to buy one of their cars. Just to pick one example a Model 3 Performance with the premium interior for 55k is a great deal. GrumpyOldMan This was the car that killed the British sports coupes. Much more car than an MGBGT or a Triumph GT6 and much cheaper than a Jaguar Etype coupe. I had a coworker who lived and breathed these things and was president of the Smoky Mountain Zcar club.
10,Ola to launch its own maps system,"The Ola Electric website now offers the Ola Maps service. The navigation service will likely be made available shortly across other Ola products, such as Ola electric scooters and Ola Cabs, according to the company.",https://nextbigwhat.com/ola-to-launch-its-own-maps-system/,
11,Changes in ASSA ABLOY's Nomination Committee,"Marianne Nilsson representing Swedbank Robur Fonder, Liselott Ledin representing Alecta and Ola Peter Gjessing representing CBNY Norges Bank have announced...",https://finance.yahoo.com/news/changes-assa-abloys-nomination-committee-093200770.html,Changes in ASSA ABLOYs Nomination Committee STOCKHOLM Dec. 23 2022 PRNewswire Marianne Nilsson representing Swedbank Robur Fonder Liselott Ledin representing Alecta and Ola Peter Gjessing representing CBNY Norges Bank have announced that they are leaving ASSA ABLOYs Nomination Committee before the 2023 Annual General Meeting. The Nomination Committee will now contact the shareholders that are next in turn on the shareholder list and offer them a seat on the Nomination Committee. Stockholm 23 December 2022 ASSA ABLOY AB publ For further information please contact Anders Mrck Chairman of the Nomination Committee Phone 46 706 46 52 11 Anders. Morcklatour. se This is information that ASSA ABLOY AB is obliged to make public pursuant to the EU Market Abuse Regulation. The information was submitted for publication through the agency of the contact persons set out above at 10. 15 CET on 23 December 2022. About ASSA ABLOY The ASSA ABLOY Group is the global leader in access solutions. The Group operates worldwide with 51000 employees and sales of SEK 95 billion. The Group has leading positions in areas such as efficient door openings trusted identities and entrance automation. ASSA ABLOYs innovations enable safe secure and convenient access to physical and digital places. Every day we help billions of people experience a more open world. The following files are available for download View original contenthttpswww. prnewswire. co. uknewsreleaseschangesinassaabloysnominationcommittee301709531. html
12,"The People Who Saw What Elon Musk Is Doing to Twitter and Said, “Yes, Hire Me”","“I think everyone says crazy stuff at a certain point,” one Twitter applicant said of his prospective new boss.",https://slate.com/technology/2022/12/twitter-jobs-hiring-elon-musk.html,Elon Musk took over Twitter on Oct. 28 becoming its owner chief twit and emotional weathermaker. Within seven days hed gotten rid of half of the companys 7500 employees. Within a couple of weeks hed oust an estimated 1000 more by urging anyone who was not extremely hardcore to go. As furious goodbyes wistful reflections and salute emojis filled the platform a different type of tweet also emerged. Though the language varied the message was the same I just applied for a job at Twitter Employees had long known that a Musk takeover meant layoffs. At one point he had told investors that he planned to cut 75 percent of Twitters workforce in order to push the company toward profitability. The company had been hemorrhaging 4 million a day he estimated in his layoff letter. But somehow this was even more chaotic and insulting than many had imagined it would be. It wasnt just that people were being asked to work 12hour shifts seven days a week following the companys sale as CNBC reported or that some laidoff employees were called back as Platformer reported. Nor was it simply that racist homophobic and antisemitic commentary was proliferating on the site. It was that he was treating the whole thing like it was a hilarious game. When it became clear that two employees giving interviews about losing their jobs were pranksters who did not work at Twitter he invited them in. During their meeting he offered one a job at Twitter making a lying performance artist one of the first hires of Twitter 2. 0. Still the readytoworkforyou tweets just kept coming. Together they helped reinforce the idea that no matter what Musk did there would be people jumping to join him. I found myself wondering Who were these people Had they actually applied And if so were they just a bunch of Musk superfans or were they motivated by something else The answerat least in a few caseswas something else Id learn from talking to them. And yes they really did apply. Daniel Zhao an economist at Glassdoor the workplace review and job search website was perhaps the first to try to quantify what you might call the Musk Effect on Twitter job applications. Once the Twitter board accepted Musks offer to buy Twitter in April interest in working at the company surged by around 260 percent over typical Glassdoor levels he observed in May. On Twitter Zhao offered a theory as to why Say what you will about Elon he does have a large fanbase of ppl excited to work for him. It was a logical theory. Everyone knows the man has fans. On Twitter they include lots of people with user names that feature long strings of numbers and Limp Bizkits frontman On all platforms they have a reputation for being not only uniquely loyal but also uniquely irritating. As one Oxford student who attempted to quantitatively analyze just how insufferable they are wrote Musk fans are the worst among all fandoms. Stunts like delivering their hero a 600000 statue of his head atop a goat straddling a rocket encourage this sentiment. So too does their willingness to defend him even as he had done things like lob unfounded accusations of pedophilia at a cave diver and threaten to pull Tesla workers stock options if they unionized. That said loyalty from actual employees makes sense according to Ben White senior director of talent strategies at Titus Talent a recruiting and coaching company. Hes a pretty impressive person that is accomplishing a lot with amazing missions that are meaningful said White who has interviewed many Tesla engineers in the process of making his YouTube video How to crush your Tesla interview. The video addresses how to answer the following question You are standing on the surface of the Earth. You walk one mile north one mile west and one mile north. You end up exactly where you started. Where are you Answer North Pole. Tesla and SpaceX engineers have told White that part of what they love about their jobs beyond the opportunity to work with the best and brightest anywhere is that it feels so missiondriven. He questioned whether Twitter would have the same pull. I dont know if the free speech mission is as powerful a mission as lets get to another planet or lets save this planet by reducing emissions he said. I reached out to Ben Price 39 because halfway through the companys employee purge he shared that he had applied to Twitter tagging elonmusk. Five days later a similar tweet from one of the most famous hackers in the world would succeed in getting Musks attention. George Hotz who made headlines as a teen for becoming the first person to jailbreak Apples iPhone proposed taking an internship at Twitter. Musk responded Sure lets talk. With Price here was a man with no obvious history of public stunts who was eager to share with the world that he wanted to join Twitter. Why What surprised me when we spoke on the phone was Prices blas attitude toward Musk. He didnt adore the man. Nor did he abhor him. Honestly I dont have strong feelings about him said Price who is a fraud specialist focused on employment matters in Oregon. He says crazy things. I think everyone says crazy stuff at a certain point said Price who is a registered Democrat. His decision to apply was not particularly personal Improving anything is fun and doing it with the greatest free speech platform to date seemed exciting he said. So Price went to the Twitter careers site. There just past a blownup tweet by an employee raving about her colleagues he found an information security engineer job to apply for. As it turns out the employee advertising the joy of working for Twitter had just been laid off. Her photo is yet to be removed from the site. Price is inclined to trust Musks ability to improve a place he said. But ultimately Musk wasnt the one who convinced him that improvements were needed. It was a Twitter whistleblower former security chief Peiter Mudge Zatko who accused the company of failing to protect the platform from exploitation by both employees and foreign agents in July. Reading Zatkos Congressional testimony prompted White to want to help patch things up he said. Perhaps the next applicant would be more of a true fanboy I thought. Nope. Jack Jacob of Chicago also applied in November amid the purge. His timing was mostly pragmatic he told me If employees were bailing on Twitter then there was an opportunity to fill a gap. Hes sick of scraping together money from restaurant jobs and cryptocurrency startups. Ive never had a job with benefits said Jacob who is 27. Musks companies are known for requiring people to go through every single item on their rsum during the interview process. Jacob never got there. And that was OK with him. Though in our initial interview he dismissed Musks inflammatory comments as classic troll behavior a few days later he messaged me that hed done more research and concluded he wouldnt want to work for Musk after all. Part of what convinced him he said was learning that Musk had offered a 250000 settlement to a flight attendant who accused him of exposing himself to her. Musk has claimed that the accusations were politically motivated. He wasnt the only one having a change of heart. On Tuesday Hotz the famous hacker shared that hed decided to quit his Twitter internship. Where were the true loyalists Theyre surely out there. Musks initial Twitter team includes numerous people he brought over from his other companies including 50 Tesla engineers according to CNBC. But the speed at which Musk began violating his own supposed free speech principlessilencing journalists among other hypocritical moveshas made it difficult to publicly defend him. Even one of the most recent additions to Twitters leadership teamDave Chen who came from Googlehas exhibited nonloyalist behavior some sleuthing on LinkedIn reveals. Chen who became the vice president of engineering at Twitter in October according to his LinkedIn profile liked a post criticizing Musk for failing to apologize for the layoffs. Update Dec. 31 2022 Of course one of the best ways to create loyalty is to dangle power in front of someone. On Wednesday following a poll Musk announced that hed be willing to step down from his CEO role at Twitter if he found the right replacement. Among those who are suddenly eager to work at Twitter are rapper Juicy J and Lex Fridman a popular podcaster and A. I. researcher at MIT. It seems that neither will get the job. As of Wednesday afternoon Juicy J was still trying to figure out how to get Musk to DM him. And Musks response to Fridman was less than encouraging. One catch you have to invest your life savings in Twitter and it has been in the fast lane to bankruptcy since May he wrote. Still want the job
13,Ola Electric plans to launch commercial EVs by 2023,"Ola’s co-founder Bhavish Aggarwal said, “there are teams working on cars, two-wheelers, there are teams working on commercial vehicles… same software, same cells, electronics is used across products.” Aggarwal stated that the company will soon begin making mo…",https://nextbigwhat.com/ola-electric-plans-to-launch-commercial-evs/,
14,Ola Electric to mass-produce battery cells by 2023,India-based electric two-wheeler (E2W) startup Ola Electric reaffirms its plan to venture into more diversified EV products and mass-produce battery cells over the next 12 months.,https://www.digitimes.com/news/a20221223VL201/india-ola-electric.html&chid=10,Indiabased electric twowheeler E2W startup Ola Electric reaffirms its plan to venture into more diversified EV products and massproduce battery cells over the next 12 months. Indiabased electric twowheeler E2W startup Ola Electric reaffirms its plan to venture into more diversified EV products and massproduce battery cells over the next 12 months.
