Article,Title,Description,URL,Content
0,"Heart full of soul: the maverick genius of Jeff Beck, the ‘guitarist’s guitarist’ | Alexis Petridis","He began with bubblegum pop in the Yardbirds, then moved on to psychedelia, funk, jazz fusion, even techno – but no matter what the genre, Beck was always ahead of the curve<ul><li>Legendary rock guitarist Jeff Beck dies aged 78</li></ul>Of all the career opp…",https://www.theguardian.com/music/2023/jan/12/heart-full-of-soul-the-maverick-genius-of-jeff-beck-the-guitarists-guitarist,Of all the career opportunities that could present themselves to an upandcoming guitarist in the mid60s the offer of replacing Eric Clapton in the Yardbirds was one you might think twice about accepting. It wasnt just that Clapton was talented it was that uniquely for British rock at the time he was the Yardbirds star attraction. His presence so obviously overshadowed that of their frontman Keith Relf that one of their peers wrote a song about it. Manfred Manns The One in the Middle affectionately mocked Relf as just a pretty face. Curiously Relf could never be talked into performing it. Trying to replace Clapton you might assume was a hiding to nowhere anyone who tried was being set up to fail. But Jeff Beck who had been recommended for the job by his friend Jimmy Page didnt just replace Clapton. He transformed the Yardbirds from blues purists struggling to square their love of Buddy Guy and Freddie King with the necessity of having pop hits Clapton had walked out in protest at the band recording and releasing Graham Gouldmans For Your Love as a single to a band at the vanguard of British pops relentless forward progress. The first single he recorded with them Heart Full of Soul was another Gouldman confection enlivened by Beck mimicking the sound of sitar some months before the Beatles first deployed the instrument on Norwegian Wood with a guitar played through a distortion pedal called a Tone Bender. There was a hint of Whoish feedback about his aggressive playing on its followup Evil Hearted You if you flipped the single over you were confronted with the droning Still Im Sad with its Gregorian chantinspired vocals a signpost en route to the experimentation of psychedelia. By the time of February 1966s Shapes of Things howling feedback a guitar solo audibly influenced by Indian raga or as Beck put it some weird mist coming from the east out of my amp the Yardbirds sounded like a completely different band from the one who had powered their way through covers of Smokestack Lightning and Good Morning Little Schoolgirl on 1964s Five Live Yardbirds. Beck could play the blues if he wanted to listen to his slide playing on Heart Full of Souls Bside Steeled Blues but he was no ones idea of a respectful purist. Tellingly the song that had first piqued his interest in playing guitar was Les Paul and Mary Fords groundbreaking 1951 hit How High the Moon a single that was as much about Pauls electronic manipulation of sound through multitracking as it was about his guitar playing. When Becks mother dismissed it as all tricks it only served to fire his enthusiasm further. Throughout his tenure with the Yardbirds Beck seemed as interested in the sonic possibilities of new technology as he did in demonstrating his instrumental prowess making all the weirdest noise I could. The result was a succession of tracks that propelled the Yardbirds to the forefront of pops avant garde Over Under Sideways Down Lost Woman Hot House of Omagararshid Hes Always There. When Jimmy Page joined briefly creating a lineup with two lead guitarists their sound got more extreme still. The single that coupled Happenings Ten Years Time Ago and Psycho Daisies was impossibly potent and sinister so farout even by the standards of 1966 that it succeeded in alienating their fans it barely scraped the charts in the UK and the critics one of whom derided it as an excuse for music. Not long after its release Beck acrimoniously departed the Yardbirds. They kicked me out fuck them he waspishly noted during the bands 1992 induction into the Rock and Roll Hall of Fame. Producer Mickie Most attempted to fashion him into a pop star a role to which Beck was entirely illsuited although the union produced the hit single and wedding disco perennial Hi Ho Silver Lining. His real future however lay on its Bside an instrumental called Becks Bolero that he had recorded with Page bassist John Paul Jones and the Whos Keith Moon back in May 1966. It was epic heavy and quite astonishingly prescient pointing towards the direction rock would follow in the postpsychedelic era a year before the Summer of Love. It still sounded ahead of the curve when it turned up on Becks solo album Truth two years later. By then Beck had recruited singer Rod Stewart with his bluesy vocals playing off Becks incendiary distorted guitar Truths eclectic set of material a reworking of Shapes of Things plus versions of Greensleeves Ol Man River and Willie Dixons I Aint Superstitous presaged the sound of Led Zeppelin the band Jimmy Page formed from the wreckage of the now defunct Yardbirds. Truth beat Led Zeppelins eponymous debut into the shops by six months. Perhaps the Jeff Beck Group which Truths followup BeckOla was billed under could have followed Zeppelins path to superstardom. But there were problems not least with maintaining a steady lineup. Stewart departed after BeckOla an attempt to replace him with the thenunknown Elton John only got as far the rehearsal studio taking bassist Ronnie Wood with him to form the Faces. Pianist Nicky Hopkins left too drummers came and went. The fact that Beck couldnt keep still musically may also have hindered their commercial progress. BeckOla was very much in the heavy style of Truth Spanish Boots is particularly fantastic but subsequent releases dabbled in funk jazz and soul. Both 1971s Rough and Ready and 1972s Jeff Beck Group have their moments Ive Been Used and Jody on the former Ice Cream Cakes and Going Down on the latter but the NME critic who noted that the bands musical skill frequently far exceeds that of the material had a point. In addition it was hard not to be struck by the sense that Beck wasnt that bothered about being famous hence BeckOlas selfdeprecating sleeve note Its almost impossible to come up with anything totally original so we havent. By 1973 Beck had formed a new band with bassist Tim Bogert and drummer Carmine Appice. They might have had a hit single with Superstition a song Stevie Wonder had given to Beck in return for performing on Talking Book you can hear his beautifully delicate and sympathetic playing on its penultimate track Lookin for Another Pure Love had Wonder not changed his mind and released it as a single himself complete with the iconic opening drum beat that Beck had come up with. The pair worked together again on Becks largely instrumental 1975 solo album Blow by Blow on which the guitarist changed course again this time to dextrous jazzrock fusion. Its successor Wired featured a version of Charles Minguss Goodbye Pork Pie Hat. By now no one could predict where Beck was going to head next. Flash from 1985 was a pop album produced by Nile Rodgers albeit a pop album decorated with guitar solos that sounded close to contemporary heavy metal. Beck subsequently professed to hate it. Jeff Becks Guitar Shop 1989 was an instrumental bluesrock album. Crazy Legs 1993 was entirely comprised of Gene Vincent covers. Who Else 1999 bore the influence of ambient electronica and techno THX138 and Psycho Sam sounded unbelievably not unlike the Chemical Brothers or the Prodigy. He collaborated with Guns N Roses Kate Bush Roger Waters Hans Zimmer and Jon Bon Jovi. It was all evidence of a disinclination to be pigeonholed the only thing you could rely on was that whatever direction his music took his guitar playing would be incredible. It was the kind of career that baffled the general public of his latterday albums only the relatively straightforward Emotion Commotion which saw him working with Joss Stone and Imelda May was really a hit and obscure quite how innovative Beck had been in the 60s. But it won him the undying admiration of his fellow musicians the phrase guitarists guitarist might have been invented for him. His influence spanned generations. Brian May David Gilmour Slash and The Edge all attested to being inspired by Beck. Metallicas Kirk Hammett claimed he learned guitar by playing along to the Jeff Beck Groups Let Me Love You. The Red Hot Chili Peppers John Frusciante recalled listening to Truth as a kid and marvelling at Beck pulling all these sounds out of the guitar I didnt know where they were coming from. Even Eric Clapton whose departure from the Yardbirds had kickstarted Becks career marvelled at his replacement the most unique guitarist and the most devoted. His last project was an album he released with Johnny Depp a move that catapulted him into the news 18 appeared in the wake of Depps defamation case against his former wife Amber Heard. The controversy overshadowed the albums contents which were as unpredictable as ever. Trying to explain its tracklisting on which a cover of the Velvet Undergrounds Venus in Furs lurked alongside versions of the Beach Boys Dont Talk Put Your Head on My Shoulder Killing Jokes Death and Resurrection Show and Smokey Robinsons Ooo Baby Baby Jeff Beck came up with a line that neatly summed up his entire career. Interesting things happen he said when youre open to trying something different.
1,‘I’m scared to think what Ethiopia will become’: Tigray war refugees fear return,"A fragile peace has been restored but for tens of thousands of displaced people who fled to Sudan there is no prospect of going homeWhen she remembers the corpses on the asphalt, the bodies of her neighbours and of the boy who used to play with her children, …",https://www.theguardian.com/global-development/2023/jan/05/im-scared-to-think-what-ethiopia-will-become-tigray-war-refugees-fear-return,When she remembers the corpses on the asphalt the bodies of her neighbours and of the boy who used to play with her children Lemlen Abraha breaks down in tears. They just shot him she says of 14yearold Kalayu Mebrahtom killed by government soldiers in the first weeks of Ethiopias civil war and left to be buried by his grandmother. Id left my home to buy sugar I saw it on the street I saw it with my own eyes. Since the war began two years ago Lemlen has been living in a refugee camp in Sudan with two of her teenage children and four others whose parents are missing. Lemlens sixyearold daughter Hiyab and her husband Fisseha are still lost separated in the chaos. When the Guardian met Lemlen in early December weeks after a peace deal ostensibly had ended the war she didnt know if they were alive or dead. She still doesnt. A fragile Yet in Sudan near the border of Ethiopia and the disputed territory of what is officially called western Tigray tens of thousands of refugees remain in limbo unable or too afraid to return home. Refugees mostly ethnic Tigrayans from the Wolkait district of western Tigray but also some from smaller ethnic groups such as the Kemant Kunama and Irob told the Guardian their land was still occupied by armed forces from Ethiopias Amhara region or in some cases allied troops from neighbouring Eritrea. Lemlen had found a piece of paper pinned to her door in the town of Baeker in western Tigray. Scrawled on it was a threat all Tigrayans must leave the town or face the consequences. She reached Sudan in November 2020. She says she has heard from her former neighbours in Amhara that her home has been occupied by newcomers who have also started working her familys plot of land. Human rights groups have described these patterns of dispossession and violence as ethnic cleansing. According to Amnesty and Human Rights Watch Amhara militia and volunteer fighters known as Fanos established Amhara government administration over the fertile agricultural territory between late 2020 and 2022. Hundreds of thousands of Tigrayans were expelled and Amhara farmers resettled there. If the international community protects the displaced people Lemlen suggests perhaps it would be safe for them to return. But she sees no imminent prospect of that. The peace deal stated that the question of disputed territories which include parts of south Tigray should be settled through constitutional means which may one day mean a referendum. But it set out no timeline. Eritrean troops who have been implicated in some of the wars worst atrocities pose another challenge. The peace deal signed in South Africa by the government of prime minister Abiy Ahmed and Tigrays leaders the Tigrayan Peoples Liberation Front TPLF made no mention of the Eritreans. But an implementation roadmap signed a few days later in Kenya specified that the gradual disarmament of Tigrays forces would take place alongside the withdrawal of foreign and nonENDF federal military forces from the region. In recent days there have been reports of Eritrean troops withdrawing from some towns in Tigray. But as recently as December according to minutes seen by the Guardian from a meeting of the Tigray Emergency Coordination Centre a hub of UN agencies and NGOs Eritrean troops continued to loot kill kidnap and rape. One refugee with relatives living near the town of Adwa told the Guardian his young cousin was killed by Eritrean forces in a nearby village in midDecember. Until Eritrea leaves there will be no peace says Solomon a Tigrayan teacher who fled Humera a city near the Sudan and Eritrea borders at the start of the war. On rare occasions when he has been able to reach friends and family in western Tigray they have said the same thing that until at least midDecember Eritrean troops were stationed along key highways and migration routes including those leading to Sudan. Aid workers confirmed these accounts but it is unclear how many Eritrean troops remain today. Elsewhere in Tigray food aid and medical supplies have been trickling in since November staving off the worst of starvation. Phone lines and internet services suspended during the war are being switched back on sporadically allowing communication with the outside world for the first time in many months. Mekelle has been reconnected to the national grid and partial banking services have resumed in some towns. In Mekelle the phone network is working a Tigrayan in Kenya told the Guardian by text message on 29 December. I spoke with my family I think they are OK. On 28 December an Ethiopian Airlines plane touched down in Mekelle the first commercial flight in 18 months effectively lifting the ban on movement in place since June 2021. The next day Ethiopian federal police arrived in Mekelle to guard federal government facilities a visible return to normality. However there remains a climate of uncertainty. Excitement over restored phone lines for example is tempered by fears of surveillance. If you call you put people in danger says Abeba a refugee who fled western Tigray at the start of the war. Three refugees said friends or family members had disappeared shortly after receiving phone calls from Sudan. If they security forces see someone receive a call from a Sudan number they will be arrested she says. Insecurity prevails in Ethiopia as war has wound down in Tigray it has escalated in Oromia the largest region which has seen drone strikes on civilians and a string of gruesome interethnic massacres. The Oromo Liberation Army OLA another armed group is not part of the current peace deal. Nor are smaller ones linked to minorities such as the Gumuz Agew or Kemant. OLA fighters as well as Oromo security forces stand accused of killing civilians in Oromia Amhara civilians continue to face indiscriminate violence in places where they are a minority. In recent months Amhara militias are also reported to have conducted raids and killings inside Oromia. In the Amhara region meanwhile violence continues against Kemant civilians by regional security forces and militias. Kemant refugees told the Guardian they would not return without security assurance as most of their lands are now occupied. Irob and Kunama refugees whose smaller populations live close to Eritrea want guarantees regarding Eritrean troops along the border with Ethiopia. UN officials say the current peace should be seen as a starting point an opportunity to build confidence among Ethiopians before seeking to address some of the more contentious issues around disputed territories. There is recognition that this will take time. Emebet a 23yearold university student has tried to stop daydreaming about going home. She learned from neighbours that her apartment in Humera damaged by shelling at the start of the war has been repaired and is being rented to newcomers. In the straw hut she shares with her husband Emebet has hung colourful drapes from the ceiling trying to make the place homely. There is a small Sudanese flag in the corner of her makeshift kitchen a tribute to the country that has offered them refuge. Im scared to think about what Ethiopia will become says Emebet referring to the deepening distrust between communities. She doubts whether refugees from western Tigray will ever return if the peace holds she thinks most of them will relocate elsewhere. I dont think we can ever go back.
2,Mercedes-Benz will build a $1 billion EV fast-charging network in the US,"Working with ChargePoint, it will install more than 2,500 chargers at 400 sites by 2027.",https://arstechnica.com/cars/2023/01/mercedes-benz-to-build-an-ev-fast-charging-network-starting-in-the-us/,On Thursday MercedesBenz announced that it is entering the DC fastcharging arena for electric vehicles. The German automaker is in the midst of an electrification push and a plan to be carbonneutral by 2039 and it evidently doesnt believe that the current charging infrastructure is as good as its new EVs so its doing something about the situation. Mercedes says it plans to deploy more than 10000 fast chargers around the world starting in North America. The new network is separate from and independent of Ionity the European fastcharging network backed by Mercedes BMW Ford and Volkswagen. Here in the US Mercedes is partnering with the charging company ChargePoint and MN8 Energy a solar and batterystorage company. Together they will deploy more than 2500 DC fast chargers at more than 400 sites around the US by 2027. MercedesBenz customers deserve a compelling charging experience that makes electric vehicle ownership and longdistance travel effortless and thats why we are launching a global highend charging network that will offer a charging experience to match the extraordinary Mercedes driving experience said Ola Kllenius chairman of the board of management of MercedesBenz Group AG. We are excited to start right here in North America with two strong and experienced partners ChargePoint and MN8 Energy. The chargers will feature plugandcharge compatibility and wont be restricted to Mercedes EVs. Mercedes also says the locations and surroundings will be carefully chosenall too often banks of DC chargers are located in desolate and lonely corners of mall parking lots that can make charging at night a stressful experience for some drivers. So the OEM plans to build the chargers with food outlets and restrooms situated nearby. It also says there will be surveillance cameras and other security in place to provide a safe and secure charging environment. At least four plugs per hub maybe as many as 30 Expect a minimum of four DC chargers at each hub similar to an Electrify America charging location. But some hubs will have as many as 12 chargers and there are plans for as many as 30 in some locations. The hubs will use ChargePoints modular Express Plus system which is capable of up to 500 kW per charging port although Mercedes says that chargers will be up to 350 kW in power. And load management will ensure that if multiple EVs are charging at the same time one charger doesnt end up throttling the rest. With this partnership we are expanding upon our existing relationships with MercedesBenz and MN8 to deliver a seamless charging experience for drivers and turnkey charging solutions at no upfront cost to site hosts said ChargePoint CEO Pasquale Romano. We believe the expansion of charging hubs like these will enable the emergence of a new 30minute retail economy at the intersection of innovation and accessibility that combines charging and commerce giving drivers a superior experience to charge quickly and easily. In keeping with the companys 2039 sustainability goals the electricity it uses will come from green energy suppliers or come with renewable energy certificates. Some hubs will use solar to power the lighting and security cameras. MN8 Energy is on a mission to provide enterprise customers such as MercedesBenz with renewable energy and related solutions on their journey to an electrified decarbonized world said MN8 Energy President and CEO Jon Yoder. Supporting the development of this exceptional charging experience helps address one of the most significant barriers to EV adoptionrange anxiety. With each party playing to their strengths we are thrilled to embark on this collaboration to expand charging access with MercedesBenz and ChargePoint. None of this will be particularly cheap. In fact the initiative will cost more than 1. 1 billion 1 billion euro over the next six or seven years with the costs split evenly between Mercedes and MN8 Energy. And this is just the startplans for more charger deployment in Europe and China will be announced in the future.
3,Mercedes could drop EQ product naming by the end of 2024,"Filed under:
 Green,Marketing/Advertising,Mercedes-Benz,Electric,Future Vehicles,Luxury
 Continue reading Mercedes could drop EQ product naming by the end of 2024
Mercedes could drop EQ product naming by the end of 2024 originally appeared on Autoblog on Thu,…",https://www.autoblog.com/2023/01/12/mercedes-eq-naming-will-end/,BERLIN MercedesBenz is set to drop the EQ product brand for batteryelectric cars as soon as the next generation of compact cars set to be on the market from the end of 2024 German daily Handelsblatt said on Thursday citing company sources. The decision is based on Chief Executive Ola Kaellenius focus on electriconly cars making the EQ brand redundant as Mercedes turns away from the combustion engine Handelsblatt cited the sources as saying. The German carmaker now markets its allelectric model series under the EQ brand first announced in 2016 with its first model the EQC electric SUV launched in 2019. A spokesperson for Mercedes EQ products said the brand is an important pillar in the carmakers electromobility strategy. With the goal of our parent brand MercedesBenz becoming fully electric by the end of the decade we will adapt the positioning of the vehicles and thus also the use of the brand in line with the times but it is too early for details on this at the moment said the spokesperson. Related video
