Article,Title,Description,URL,Content,Headline,Headline Sentiment,Offense Rating,Negative Words,Offensive Words,Tags
16,Seattle schools blame social media for a mental health crisis. Are tech companies liable?,"Seattle Public Schools says that Facebook, Instagram, Snapchat, TikTok, and YouTube are to blame",https://qz.com/seattle-schools-blame-social-media-for-a-mental-health-1849978157,Seattles public school system is unhappy. The district tasked with teaching approximately 50000 students across 100 schools is confronting what it calls a mental health crisis. And it has placed blame for this crisis on four social media companies Meta the parent company of Facebook Instagram and WhatsApp ByteDance the parent company of TikTok Alphabet the parent company of YouTube and Snap the company behind Snapchat. So the school district filed a lawsuit pdf against the four firms which are among the most valuable companies in the world with a combined market capitalization of about 2 trillion for wreaking havoc on its student population. From 2009 to 2019 there was an onaverage 30 percent increase in the number of students at plaintiffs schools who reported feeling so sad or hopeless almost every day for two weeks or more in a row that they stopped doing some usual activities lawyers for the school district wrote in a 92page complaint filed in the federal district court in Seattle on Jan. 6. Seattle Public Schools allege that the defendants violated Washington States public nuisance law a vague statute more commonly used for noise complaints than corporate malfeasance. The lawsuit is a headscratcher. Its built on a weak causality legal experts told Quartz between the actions of social media companies and the degraded mental health of its students and based on a claim of harm that would be better brought by affected students or parents rather than a school district. The suit also makes a legal argument about Section 230 of the Communications Decency Act an important but controversial statue that gives websites some legal liability protection for usergenerated content. But that argument could soon be made irrelevant by the US Supreme Court which is tackling the question of Section 230 in its current term. The Seattle school districts argument Seattle Public Schools says design and algorithms that power the named social media companies are responsible for the suffering of its students. There are wellestablished repercussions for using social media. Last year a Wall Street Journal investigation spurred by a whistleblower found that Metas own internal research for example showed Instagram negatively affected teenage girls body image. But in a legal context experts say its difficult to isolate the cause of mental health problems in individual children let alone the collective thousands who attend a major metropolitan school district. And of course social media might harm some students while helping others find community and friends online. Theres no doubt that teens are under extraordinary psychological pressure perhaps unprecedented pressure but theres so many reasons why that might be the case said Eric Goldman a professor at Santa Clara University School of Law who stressed the drastic effects of the pandemic. Its hard to isolate whats causing the stress among Gen Z... because its all interrelated. Jennifer Granick an attorney at the American Civil Liberties Union said in an interview that she was unsure how the school district can prove harm to its entire student body justify that its the right plaintiff and isolate the causes of the mental health crisis to social media. How are they going to show causation that that crisis is due to social media and not due to any one of the millions of other causes like stress and poverty and the pandemic she asked. Goldman also took issue with the school district bringing the case. I am puzzled by the idea that the school district is the right plaintiff he said. Think about all of the things going on in society that are manifesting in the school environment. Can school districts sue for all of those other problems Social media is the latest in a long list of bogeymen parents and officials have blamed over the years for corrupting the countrys youth Its a list that has included things like heavy metal video games and marijuana. Can the school districts sue the record labels that publish heavy metal or the game publishers who publish video games or the pot dealers who sell pot Goldman asked. Where does that start and stop It just makes no sense. The lawsuit only seeks one charge A violation of the states public nuisance law. But Goldman said that public nuisance laws typically apply to physical spaces not digital ones. Its an unusual claim he said. If theres a drug dealer setting up shop across the street that would be the kind of thing that might be a public nuisance. Calling software thats not connected to the school in any way a public nuisance is just weird. A spokesperson for Seattle Public Schools did not respond to a request for comment. The battle over Section 230 The most salient legal claim in the lawsuit is that Section 230 of the Communications Decency Act does not protect the four defendants from legal liability for the design decisions that control their respective algorithms. Section 230 has become a lightning rod for social media criticism in recent years. The statute passed into law in 1996 essentially shields the owners of websites that host thirdparty content from userssuch as web forums comment sections and social mediafrom certain liability. Scholars widely credit Section 230 as intrinsic to the growth and maturation of the modern web Its given website owners breathing room to exercise their legal right protected by the First Amendment to moderate content as they see fit. And its propped up Silicon Valleys largest companies who depend on usergenerated posts photos videos comments reviews recommendations and much more to grow. But techs critics have searched far and wide for a way to rein in social media companies that they feel have grown too powerful and are abusing that power. American politicians as ideologically varied as Republican senator Josh Hawley and Democratic senator Amy Klobuchar have introduced bills to amend Section 230. This week president Joe Biden wrote in the Wall Street Journal that Congress must fundamentally reform Section 230 of the Communications Decency Act which protects tech companies from legal responsibility for content posted on their sites. A Supreme Court date for Section 230 In its lawsuit Seattle Public Schools claims that Meta Alphabet Snap and ByteDance cannot hide behind Section 230 for what their algorithms have chosen to promote effectively asking a federal court to weigh in on liability for recommending and promoting harmful content to youth as the complaint puts it. That question is worth asking but theres one caveatits already an issue before the Supreme Court. In a troubling sign for the law justice Clarence Thomas has previously signaled that he thinks Section 230 needs to be reevaluated. Two cases related to Section 230 Gonzalez v. Google and Twitter v. Taamnehhave put 230s protections frontandcenter before the Courts justices this term. The two cases largely assess whether Section 230 protects Googleowned YouTube as well as Twitter from legal liability Granick said that while algorithms can be controversial they are inseparable from how social media companies exercise their legal right to moderate content. An algorithm is just an automated way of putting policies in place she said. Thats how they take down hate speech. Thats how they take down misinformation. Thats how they take down harassment.,"Social media use may impact adolescents’ brain development, study says",Generally Neutral,70,"['split', 'critical', 'limitations', 'difficult', 'risk', 'unclear', 'harmful', 'bad']",[],"[Eva, Telzer, Telzer]"
17,Seattle Public Schools Sue Meta and TikTok for Youth ‘Mental Health Crisis’,"The public school district in Seattle has filed a lawsuit against the companies behind TikTok, Instagram, Facebook, YouTube, and Snapchat, accusing them of harming young people’s mental health.
[Read More]",https://petapixel.com/2023/01/09/seattle-public-schools-sue-meta-and-tiktok-for-youth-mental-health-crisis/,Seattle Public Schools Sue Meta and TikTok for Youth Mental Health Crisis The public school district in Seattle has filed a lawsuit against the companies behind TikTok Instagram Facebook YouTube and Snapchat accusing them of harming young peoples mental health. Seattle Public Schools filed the lawsuit in U. S. District Court on Friday. It alleges that these social media companies have created a public nuisance by targeting their products to children. Seattle Public Schools claim the tech giants are responsible for creating a mental health crisis among Americas youth and have directly affected the schools ability to carry out their educational mission. Exploiting Vulnerable Youth According to AP News the lawsuit blames the social media companies for worsening mental health and behavioral disorders including anxiety depression disordered eating and cyberbullying. This has made it more difficult to educate students. The complaint also alleges that schools have been forced to take steps such as hiring additional mental health professionals developing lesson plans about the effects of social media and providing additional training to teachers. Defendants have successfully exploited the vulnerable brains of youth hooking tens of millions of students across the country into positive feedback loops of excessive use and abuse of Defendants social media platforms the complaint says. Worse the content Defendants curate and direct to youth is too often harmful and exploitive. Under section 230 of the Communications Decency Act federal law helps provide immunity for online platforms with respect to thirdparty users and what they choose to post as content. However the lawsuit argues that this provision does not protect the tech giants behavior in this case. Plaintiff is not alleging Defendants are liable for what thirdparties have said on Defendants platforms but rather for Defendants own conduct the lawsuit says. Defendants affirmatively recommend and promote harmful content to youth such as proanorexia and eating disorder content. The lawsuit went on to attribute the companies alleged misconduct to the rising rates of anxiety depression thoughts of selfharm and suicide ideation experienced among young people. According to the lawsuit from 2009 to 2019 there was on average a 30 percent increase in the number of students at Seattle public schools who reported feeling so sad or hopeless almost every day for two weeks or more in a row that they stopped doing some usual activities. Seattle Public Schools is seeking the maximum statutory and civil penalties permitted by law making the case that the social media companies have violated Washington states public nuisance law. Multiple families have pursued similar lawsuits against Meta the parent company of Instagram and Facebook contending that its social media platforms deliberately adjust its algorithms to hook young people. However Seattle Public Schools appears to be the first school district in the U. S. to file such a case against the companies. Image credits Header photo licensed via Depositphotos.,Seattle schools blame social media for a mental health crisis. Are tech companies liable?,Extremely Negative,1620,"['unhappy', 'crisis', 'blame', 'crisis', 'havoc', 'sad', 'hopeless', 'complaint', 'allege', 'nuisance', 'vague', 'noise', 'complaints', 'weak', 'harm', 'controversial', 'liability', 'irrelevant', 'suffering', 'difficult', 'isolate', 'problems', 'harm', 'doubt', 'drastic', 'hard', 'isolate', 'stress', 'unsure', 'harm', 'isolate', 'crisis', 'crisis', 'stress', 'issue', 'puzzled', 'sue', 'problems', 'corrupting', 'sue', 'violation', 'nuisance', 'nuisance', 'nuisance', 'nuisance', 'weird', 'liability', 'criticism', 'liability', 'critics', 'liability', 'harmful', 'complaint', 'issue', 'troubling', 'liability', 'controversial', 'hate', 'harassment']","['poverty', 'marijuana', 'drug', 'Republican']","['lawsuit', 'lawsuit', 'lawsuit', 'lawsuit', 'lawsuit', 'lawsuit', 'lawsuit', 'lawsuit', Eric, Goldman, Jennifer, Granick, 'harassment', Goldman, Goldman, 'lawsuit', Goldman, 'lawsuit', 'lawsuit', 'lawsuit', 'lawsuit', Josh, Hawley, Amy, Klobuchar, Joe, Biden, 'lawsuit', 'lawsuit', Clarence, Thomas, Gonzalez, Taamnehhave, 'lawsuit', Granick, 'lawsuit', 'lawsuit', 'harassment']"
18,"It’s 2023, Instagram should make an iPad app","Updated with love annually since 2018…
Despite Meta’s best efforts to tank it, Instagram has remained a population destination away from Facebook and Twitter. There’s something about the constraints of mostly photo and video sharing that just feels healthier.…",https://9to5mac.com/2023/01/01/instagram-make-an-ipad-app/,Updated with love annually since 2018 Despite Metas best efforts to tank it Instagram has remained a population destination away from Facebook and Twitter. Theres something about the constraints of mostly photo and video sharing that just feels healthier. Instagram is also an twelveyearold iPhone app it launched the same year as the iPad. As 2023 rolls in the refusal to make an iPad version that isnt just the web remains a head scratcher. Instagram made iPad apps It makes so much sense. Instagram is fantastic for sharing our favorite photos and videos and iPads are wonderful for appreciating both. Instagram Stories are even delightful despite being ripped off from Snapchat. And IGTV was a dud but a tablet version would have been neat if it wasnt Facebook and Instagram know the iPad exists. Facebook does a semiokay job or supporting Facebook and Messenger on the iPad and Instagram even made two iPad camera apps Hyperlapse and Boomerang just not you know the main app. Instagrams Layout app is also really nice. I see a lot of people use free adsupported alternatives with watermarks over the collage. Switch to Layout even if you dont want to post to Instagram. Instagram killed iPad apps The lack of a dedicated Instagram for iPad app used to be an opportunity for developers. Good times Instagram API good times Retro for Instagram was a great solution for example but Instagram changed its API that gave developers access to the service in their apps. Instagram killed the market for iPad app alternatives without making its own. Web apps arent apps One argument is that the progressive web app on Instagrams website is good enough if you save it to your Home screen. Its okay but native apps can simply do more. You can also run the iPhone version in a comically letterboxed window or scale it up at the cost of resolution fidelity but theres no landscape support and many iPads are attached to keyboards now. Update iPadOS 15 makes Instagram and other iPhoneonly apps a little less frustrating This but as a real app would be better than what we have now Theres a better way Another argument against Instagram for iPad is that its a legacy technology problem the quality of photos may be too low to properly present on a tablet display. I dont know that might be a legacy argument now. So much time has passed If so thats a problem that could easily be designed around Instagram could ship a grid of photos and even mix ads in between Bigger screen more ads Thats my best pitch to Instagram. This awesome concept by Parker Ortolani is another excellent example of how Instagram could adapt its iPhone app for the iPad without losing visual fidelity on the big screen. I would love to sit and browse photos and videos on Instagram for iPad in a dense layout with native resolution like that. I dont think theres any hope for the Gotham filter returning but Im optimistic that Instagram for iPad has to be around the corner. Now that video and messaging and Stories and group video calling and walkietalkie and hundreds of other features are now available thanks to Instagrams decision to aggressively compete with Snapchat Instagram for iPad has to be next on the list right Maybe Hopefully Things Instagram has done last year instead of making an iPad app Instagram rolls back TikTok design and limits suggested content doesnt credit the Kardashians Meta announces updates on NFT and other new features coming to Instagram and Facebook Instagram Web gets new more modern interface and yet no iPad app More ads are coming to Instagram including your profile feed Mark Zuckerberg says your Instagram feed is about to get even worse Instagram announces Subscriptions feature to increase creators revenue No your account isnt banned Instagram confirms ongoing outage Instagram has a few ideas for how to make you love the algorithm Instagram reverts recent change no longer plays Stories sound by default Facebook and Instagram boosts now have to give Apple a cut Meta calls it a tax Instagram users can now crosspost Reels to Facebook Instagram discontinues its standalone Boomerang and Hyperlapse apps In a callback to AIM Away Messages Instagram introduces new Notes feature Instagram rolling out new map experience to help users discover more places Meta threatens to pull Instagram and Facebook in Europe over privacy laws regulators say please do And I bet they havent even started working on the Apple mixed reality headset version of Instagram Check out 9to5Mac on YouTube for more Apple news,No Headline,Extremely Negative,810,"['Sue', 'Crisis', 'accusing', 'nuisance', 'crisis', 'Vulnerable', 'worsening', 'anxiety', 'depression', 'disordered', 'difficult', 'complaint', 'vulnerable', 'excessive', 'complaint', 'Worse', 'harmful', 'liable', 'harmful', 'disorder', 'anxiety', 'depression', 'sad', 'hopeless', 'nuisance']","['abuse', 'suicide']","['lawsuit', 'lawsuit', 'lawsuit', 'lawsuit', 'lawsuit', 'lawsuit', 'lawsuit', 'lawsuit', 'lawsuit']"
19,3 reasons why Seattle schools are suing Big Tech over a youth mental health crisis,"Seattle Public Schools is suing Facebook, Instagram, YouTube, TikTok and Snapchat for exacerbating the mental health crisis among its students.",https://www.kqed.org/mindshift/60788/3-reasons-why-seattle-schools-are-suing-big-tech-over-a-youth-mental-health-crisis,The public school district alleges that students are being recommended harmful content online exacerbating a mental health crisis and social media companies are allowing it to happen. Heres what you need to know about the lawsuit. The school system accuses social media platforms of increasing students anxiety and depression Seattle Public Schools alleges that the very design of these platforms which seek to maximize the amount of time users spend on them is flawed and dangerousparticularly to kids. They argue that the longer people stay on social media the more ads those companies sell and thus the more money they stand to make. And some features such as push notifications are designed to draw users in making it hard to ignore especially for kids the school district alleges. It also references studies that suggest teens who spend a lot of time using screens are more likely to receive diagnoses of depression or anxiety encounter cyber bullying and not get enough sleep. According to the lawsuit social media companies have exploited the vulnerable brains of youth hooking tens of millions of students across the country into positive feedback loops of excessive use and abuse. The lawsuit cites a 2021 investigation by the Wall Street Journal in which several teenage girls reported developing eating disorders or relapsing after TikTok promoted extreme diet videos to them. The issue of potentially dangerous content on social media is not a new one. As NPR reported in 2021 Facebook whistleblower Frances Haugen a former product manager testified before Congress saying that executives hid research about the risks the companys products posed to kids. Since then Meta Facebook and Instagrams parent company has ramped up safety features for teens including efforts to prevent unwanted contact from adults tools that let parents limit the amount of time their children spend on Instagram and ageverification technology. We want teens to be safe online Meta Global Head of Safety Antigone Davis told NPR in an email. We dont allow content that promotes suicide selfharm or eating disorders and of the content we remove or take action on we identify over 99 of it before its reported to us. She did not comment directly on the Seattle public schools lawsuit. Jose Castenada a Google spokesperson said that the company which owns YouTube has introduced strong protections and dedicated features to prioritize their well being. He also did not comment directly on the lawsuit. A spokesperson for Snap and a spokesperson for TikTok said they could not comment on litigation but that users wellbeing is a priority. The school system says it doesnt have the resources to manage a crisis made worse by social media In the lawsuit Seattle Public Schools says the number of students who report feeling so sad or hopeless almost every day for two weeks or more in a row that they stopped doing some usual activities increased by 30 from 2009 when smartphones gained steam to 2019 by which time theyd become ubiquitous. Our students and young people everywhere face unprecedented learning and life struggles that are amplified by the negative impacts of increased screen time unfiltered content and potentially addictive properties of social media said Seattle Public Schools Superintendent Brent Jones in a statement. But the school system says it doesnt have enough staff to treat the growing number of students seeking mentalhealth counseling. Our obligation is to create the conditions for students to thrive and have high quality learning experiences said Jones. The harm caused by these companies runs counter to that. Nationwide just over half of all public school systems say they can effectively provide mental health services to students in need according to the National Center of Education. The Seattlebased law firm Keller Rohrback is representing the school district in the lawsuit on a contingency basis which means attorneys will not get paid unless they win and companies are required to pay a fine according to Tim Robinson the head of media relations for Seattle Public Schools. Tech companies have a powerful legal shield but its about to be challenged Its nearly impossible to sue social media companies over the content on their platforms because of a law known as Section 230. Part of the 1996 Communications Decency Act it says tech companies cant be held liable for what others share on their sites. But that could soon change. The Supreme Court will hear arguments next month in a case that aims to limit Section 230 and puts social media companies recommendation algorithms front and center. Those recommendation formulas are at the heart of the Seattle Public Schools lawsuit too. Right now the public school system has a very steep legal road to climb according to Ryan Calo a professor at University of Washingtons School of Law. But if the plaintiffs in the case before the Supreme Court are successful it could open the door to this kind of argument he said. Calo is not involved in either lawsuit but he does have two children in Seattle Public Schools one in 7th grade and the other in 3rd. He said isnt surprised that this is happening in Seattle the home of tech giants including Amazon and Microsoft which has always been at the forefront of the internet and the digital world. Even if the case never gets its day in court its filing allows the school district to draw attention to the issue Calo said. They can do so as a pretty compelling and sympathetic plaintiff in the form of a school district that cares about its kids.,"It’s 2023, Instagram should make an iPad app",Extremely Negative,400,"['refusal', 'ripped', 'dud', 'lack', 'frustrating', 'problem', 'problem', 'losing', 'dense', 'limits', 'worse']","['killed', 'killed']","[Parker, Ortolani, Kardashians, Mark, Zuckerberg]"
