Article,Title,Description,URL,Content,Headline,Headline Sentiment,Offense Rating,Negative Words,Offensive Words,Tags
20,"Apple has its own social networking services, but won't call them that","After a few failed attempts at building wider social networks, Apple has hit upon a smaller-scale strategy that allows users to share items to the big social sites with ease, and on a more personal level as well.We don't often think of Apple's various efforts…",https://appleinsider.com/articles/23/01/02/apple-has-its-own-social-networking-services-but-wont-call-them-that,Editorial Apple has its own social networking services but wont call them that AppleInsider may earn an affiliate commission on purchases made through links on our site. After a few failed attempts at building wider social networks Apple has hit upon a smallerscale strategy that allows users to share items to the big social sites with ease and on a more personal level as well. We dont often think of Apples various efforts at helping users engage each other as a social network in the same sense as Tik Tok Instagram FaceBook Snapchat Mastodon or whats left of Twitter. But there is a social element built into many of Apples popular apps. After a few failed attempts to be truly social the companys approach is now focused on smaller communities of friends family or other groups. For example you can compete against friends playing the same games whether in Apple Arcade or through many thirdparty apps as long as they support Game Center. More recently Apple introduced a new way to share photos among your friends or family with iCloud Photo Library and has made it easy to pin group chats and do more together in Messages and FaceTime. Youll notice that the key dependency behind Apples social opportunities mostly revolves around others in your circle who are also using Apple products and services. Although of course interacting with all the big social networks and rival services like those from Google and Microsoft are supported this is largely the responsibility of those other companies made painless for users by Apples App Store marketplace. For several years now the share sheet and its corresponding icon in most apps including many thirdparty ones has been the chief way to send items from your own libraries or from the web to individuals or groups. Apple though takes a strong interest in helping users to share content on a smaller scale to their loved ones and reallife contacts in particular. Being social in Game Center Music and Photos Game Center which is supported in many iOSiPadOS and Mac games allows players to play along with or against friends or find other players to set up competitions. Depending on the game there may be a leaderboard achievements realtime multiplayer matches or points rewards. Apples Music app also has a social element where users can post profiles that feature what they are listening to and see the profiles of friends. This is intended to help you discover new artists and music and recommendations from friends you know and trust. Another important element of Apple Music is the ability to search playlists posted by other users and make your own playlists available for others to find. These playlists are shareable on other websites and social media sites as well widening the circle of people you can share your musical interests or discoveries with. There are even thirdparty tools designed to transfer playlists in Spotify to Apple Music or viceversa. It is also now possible to use a shortcut to share a created playlist in Apple Music to your friends who use Spotify or in the other direction via social media though it requires a bit of configuring. The Photos app can also of course let you upload pictures to social media sites or save photos posted by others. Once again Apples builtin features make it easy to share photos directly to your more personal circle of friends and family but also to the wider world if desired. By sharing via Messages Email or AirDrop there are a variety of ways to send or share pictures to people directly. Photos Shared Albums features allows users to create albums and invite friends and family who are also using Apple devices to contribute pictures Live Photos and videos. Being social with Messages and Group FaceTime As weve seen Apples own implementation of social features now is largely based around small world ideas realworld friends family and your socialmedia friend circle and less around whole world public sharing such as websites or public pages on social media. Apple has toyed with whole world sharing before with iWeb and Ping later Connect efforts that didnt fully take off going all the way back to the pioneering concept behind eWorld. This strategy has led to greater success with Messages and Group FaceTime in particular being extremely popular with AirDrop having also found a sizable audience and some notoriety with the public. The ability to create group chats and pin them has proven to be a big hit even finding popularity in business environments. Apple has also augmented Messages and FaceTime with an additional social feature SharePlay which allows a group to listen or watch together to movies audio and other media. A number of third parties have opted into the technology and in general the public has embraced Apples version of listeningviewing parties especially for people who cant be together in person. FaceTime has long been seen as the highestquality of the various videocalling services but it was limited to just Apple users unlike Messages until the company created a way for others to join via web links. Additional features in FaceTime like Center Stage available on devices with ultrawide cameras can move the focus or create a brilliant topdown effect for demonstrations leveraging the power of Apples Mclass chips and the outstanding cameras in iPhones. The feature set and privacy of Group FaceTime audio or video calling make it nearly effortless for small groups to enjoy conversations or meetings for free worldwide and have turned it into an invaluable resource for travelers. AirDrop the epitome of Apples small world social strategy By contrast Apples popular AirDrop technology has been used for over 10 years to quickly send files photos or other media from an iPhone exclusively to nearby Apple devices. This can either be targeted directly to a nearby device or sent out to everyone in a small radius typically 30 feet or so with an Apple device nearby that has WiFi and Bluetooth turned on. One of the first mass uses of AirDrop was to send and receive contact information at technology gatherings like CES but friend and family groups have also adopted it. It is pretty simple to explain even to people who arent adept with technology how to turn on AirDrop at least temporarily on their iPhone iPad or Mac. Of course if a user has their AirDrop settings to send to or receive from everyone there is an opportunity for abuse. Apple recommends a default setting of Contacts Only but there are times when Everyone will help you send or receive easily in a group. Apple has recently changed AirDrops Everyone status to only be active for 10 minutes first in China and then worldwide. It is unclear if Apple initially did this in response to the Chinese governments displeasure at protesters using the feature to share information but it can also be a help in preventing unwanted visuals appearing as part of the accept or reject process. At present more traditional methods like email or text messaging must be used if a recipient is using a nonApple platform. However since it is built on common networking standards like Bluetooth and WiFi Apple could consider expanding AirDrop compatibility to Windows or perhaps even Android. Apples philosophy has the sideeffect of mostly relying on Apples technology and leveraging FOMO the fear of missing out to convince family and friends to buy in on Apple products as well.,3 reasons why Seattle schools are suing Big Tech over a youth mental health crisis,Generally Neutral,750,"['harmful', 'crisis', 'accuses', 'anxiety', 'depression', 'hard', 'ignore', 'depression', 'anxiety', 'bullying', 'vulnerable', 'excessive', 'issue', 'dangerous', 'risks', 'unwanted', 'limit', 'crisis', 'worse', 'sad', 'hopeless', 'struggles', 'negative', 'harm', 'impossible', 'sue', 'liable', 'limit', 'steep', 'issue']","['abuse', 'suicide']","['lawsuit', 'lawsuit', 'lawsuit', Frances, Haugen, Meta, Global, Antigone, Davis, 'lawsuit', Jose, Castenada, 'lawsuit', 'lawsuit', Brent, Jones, Jones, 'lawsuit', Tim, Robinson, 'lawsuit', 'lawsuit', 'lawsuit', 'lawsuit', Ryan, Calo, Calo, 'lawsuit', Calo]"
21,"We Think in 3D. Social Media Should, Too",Social media still argues in two dimensions about real world issues.,https://time.com/6246077/social-media-3d/,Cooperation the thing we need most to solve big problems in the world is being collapsed by the thing that promised to connect us and bring us closer together social media. The problem is that social connection isnt actually the business modelengagement is. Social media platforms TikTok Instagram Snapchat Twitter and more make choices to show usthe userscontent that is most engaging. Unfortunately what is most engaging isnt always aligned with what we value. What gets the most engagementfollows shares and commentsare the fights takedowns and proverbial car crashes we cant take our eyes from. Seeing more divisive content pushes us further into polarized ways of thinking on every topicwhich spills over into our offline lives and makes cooperation a taller and taller task. Yet todays world requires unprecedented levels of coordination and cooperation to meet unprecedented challenges. Whether it is climate change reducing crime or how to harness and keep humanity safe in increasingly AIdriven realities our most pressing problems depend upon a shared reality. In the image above if we focus from one angle the 3D cylinders shadow looks like a 2D squarebut if you look from the other angle the cylinders shadow looks like a 2D circle. People standing on either side might fight back and forth yelling more and more loudly at each other over which 2D shape is true increasingly convinced that the other side is wrong. Meanwhile they would be missing the higherdimensional cylinder which requires synthesizing multiple perspectives. Todays social media is designed in a way that rewards us for arguing in 2D about 3D issuesseeing the world in squares and circles. Narrowly framed debates about circles and squares dont actually resolve our 3D problems. Take the issue of climate change 2D squarescircles ask Is climate change really an existential risk or overblown media hype While the 3Dcylinder perspective question remains What tradeoffs do we collectively want between economic growth energy needs global security and emissions required for that growth Additionally the classic social media debate between free speech and censorship is a circlesquare debate. Should platforms allow free speech Or should platforms moderate content to keep users safe Which is right the circle or the square Or can we ask a 3Dcylinder question What kind of information ecosystem design and incentives will reward the most goodfaith marketplace of ideas For example for all the talk of Twitter as a public square there is a big difference between the speech rewarded if that public square is designed like a Roman Colosseum that incentivizes violence and chaos compared with the speech rewarded by a Quaker meeting that incentivizes reflection. Cylindrical perspectives allow for nuance and promote a synthesis of ideasnot merely consensus or tyranny of the masses but a merging of ideas into a Venn diagram of agreement. By taking a cylinder view we learn that we actually can discuss complex topics and reach cooperative solutions required in democratic societies. Technology is made up of design choices. Engagement as a business model produced choices that have gotten us into the 2D situation were in. But we can make new design choices. Software is malleable. We can rebuild existing technology and design new ones with a more humane philosophy that strengthens our capacities for synthesis and cooperation. Rather than fall into the trap of 2D debates on this issue of free speech vs. content moderation we can take a collaborative 3D perspective. Change wont be easy but the cooperation we need to tackle all of our other existential challenges is at stake. Harris is cofounder of the Center for Humane Technology and cohost of the podcast Your Undivided Attention Why Russia Is Battling to Capture a Small Ukrainian Mining Town How Beige and Aesthetic Took Over TikTok How India Became the Most Important Country for the Climates Future Why Rapid COVID19 Test Results Are Getting More Confusing Inside the Making of Netflixs New Tennis Docuseries Column The Insurrection in BrazilIs Part of a Broader Crisis of Trust A New Tourist Train in Mexico Will Destroy Indigenous Land and Livelihoods 9 Ways to Squeeze in More Steps Every Day,"Apple has its own social networking services, but won't call them that",Extremely Negative,400,"['rival', 'notoriety', 'limited', 'unclear', 'displeasure', 'unwanted']","['abuse', 'reject', 'fear']",[]
22,Apple needs another hit product. But the rumored new AR/VR glasses will not be it.,"Michael Gartenberg, a former Apple exec and Gartner analyst, doesn't think Apple will succeed with the glasses where others have struggled.",https://www.businessinsider.com/apple-new-products-ar-vr-glasses-2022-12,Apple needs another hit product. But the rumored new ARVR glasses will not be it. Apple is widely rumored to be releasing augmentedrealityvirtualreality glasses in 2023. It needs another hit product. But ARVR glasses have struggled with consumers. With the market for smartphones wellsaturated Apple needs to look to new markets for its next big thing. While the iPod led to the iPhone as I previously wrote Apples most recent products like Watch or AirPods are nice highmargin additions to sell to iPhone users. But they are much like ordering fries and a drink to go with a burger. They dont create an ecosystem that Apple can grow. They rely on the iPhones ecosystem. It has long been rumored that Apple will create a car to take on the likes of Tesla. That would be an example of a new market for Apple. But I dont think an Apple car is going to happen and thats a topic for another time. What does seem likely is that Apple will release augmentedrealityvirtualreality glasses rumored to be coming in 2023 with an OS called xrOS. While Im always excited to see what innovations companies like Apple have in store I have some serious concerns about betting on ARVR glasses as a growth market. Weve already seen some attempts in this space including Microsoft HoloLens and Magic Leap. They have not exactly taken the world by storm. When was the last time you or anyone you know saw someone using those devices at their places of work or out in the wild Glass from Google I think its safe to say was a failure. And Snapchats Spectacles are not even for sale to the general public the companys website says only to developers. Then there are VR products like Oculus from Meta and competitors from Valve Sony and HP. These have made some inroads with gamers but years after they were introduced theyre still a small fraction of the enormous videogaming market. As for other uses We have so far seen none despite Mark Zuckerbergs diehard belief that the metaverse is the future of our social lives and work meetings and whatnot. There is a belief however that Apple which isnt usually first to market can enter a space and succeed where no one has before. When it comes to this market Im more than a little skeptical. First and foremost the battery life of an AR device is a major concern. AR as Google Glass and Snapchat Spectacles envisioned it is meant to be worn for long periods of time and superimpose digital imagery and functions onto the real world. While Apple has not released specifications on this front or any other it seems highly unlikely that any device in this category will work for extended periods without recharging. Plus despite all the ways that Apple is a leader in elegant hardware design battery life is not really its strong point. In the world of smartwatches for example some Garmin devices last as long as two weeks reviewers found while an Apple Watch in my experience gives a user two or three days. Theres also the question of comfort. Glasses are not the most comfortable things to wear for extended periods of time. And when you add the weight and bulk of the technology needed for AR and VR eyewear like this become more uncomfortable to wear. This is not to mention the fact that many people simply do not like wearing glasses at all which will limit the market for these products. Price is another major issue. Microsofts HoloLens costs between 3500 and 5200. Apples device is widely expected to be in the 1000 to 1500 price range even though Apple is known for selling premium devices with premium price tags. But even on the low end thats a significant investment for a product that will do far less than a comparably priced MacBook or iPad. Beyond the practical concerns of battery life comfort and price theres the fundamental issue of the lack of a compelling use case for AR or VR glasses. While these technologies have some exciting potential it is not yet clear beyond certain types of video games what the killer app will be to make them a musthave for consumers. All that is to say while Apples ARVR project may be interesting to diehard Apple fans and tech enthusiasts who buy into Apples marketing machine and wait in lines to buy its products on day one I dont believe its the companys next big thing. Until Apple or any other company can demonstrate a truly compelling reason for large numbers of people to want to wear AR around or add VR to their quiver of homeentertainment options I fear that the tech will struggle to gain widespread adoption. There is a reason Oculus devices have created a category known as closetware a gadget that winds up stored and forgotten somewhere in a closet. Michael Gartenberg is a former senior marketing executive at Apple and has covered the company for more than two decades as a marketresearch analyst at Gartner Jupiter Research and Altimeter Group. He is also an Apple shareholder. He can be reached on Twitter at Gartenberg. The thoughts expressed are those of the author. SMBs can easily upskill their workforce using this effective learning management solution Device deployment hits 1 million for two straight quarters How Paytm Soundbox is fuelling growth Jack Ma the billionaire founder of Alibaba who disappeared from public view in 2020 appears to resurface in Thailand as he prepares to give up control of his company Amazon Great Republic Day Sale best deals on phones iPhone 13 OnePlus Nord 2T 5G Redmi A1 and more Wipro sees FY23 revenue growth at 11. 512 Q3 profit growth beats analyst expectations Rupee falls 4 paise to close at 81. 34 against US dollar 13th Gen Intel Core i913900KS brings unprecedented speed to desktop users Credit expansion will taper down next year if deposits growth doesnt rise Axis Bank MD,"We Think in 3D. Social Media Should, Too",Generally Neutral,390,"['problems', 'problem', 'Unfortunately', 'crashes', 'divisive', 'problems', 'wrong', 'problems', 'issue', 'risk', 'overblown', 'hype', 'chaos', 'tyranny', 'fall', 'trap', 'issue', 'Confusing', 'Insurrection', 'Crisis']","['crime', 'fight', 'violence', 'Destroy']",[Harris]
23,Welcome to Salesforce's week from hell.,Employees can't sleep. Managers had to call their employees to see whether they still had a job. This was Salesforce's week from hell.,https://www.businessinsider.com/what-working-at-salesforce-was-like-during-week-from-hell-2023-1,Welcome to Salesforces week from hell. Hope you had a fun weekend reader. Im Diamond Naga Siu and by the time you read this Ill be in Missouri for a data reporting bootcamp. While I learn how to math my editors Matt Weinberger and Jake Swearingen will update you on tech this week via this newsletter. Before I bounce lets catch up on the big pains of Big Tech. By dint of being some of the largest corporations in the world Big Tech companies have the highest costs to cut when a downturn hits and thus have more layoffs to do when the time comes. Salesforce and Amazon each announced last week that thousands of employees would be laid off. Throughout this messy process even some Salesforce vice presidents felt blindsided by the layoffs and many managers remain unsure if the bloodbath is over. Salesforce CEO Marc Benioff also seems uncertain. After announcing the layoff he held a rambling twohour allhands meeting in which he dodged questions about the pending cuts as Insider reported. This type of messiness will likely permeate throughout Big Tech this year. But lets move onto more orderly things now by jumping into todays tech news. If this was forwarded to you sign up here. Download Insiders app here. 1. Welcome to Salesforces week from hell. The day after announcing big layoffs last week CEO Marc Benioff didnt seem to notice that he was a full 18 minutes late to an allhands meeting to discuss the cuts. And then it went downhill from there. Benioff joked that the layoffs ruined an execs birthday. He reminisced about a rabbi on a bicycle who helped him during the companys firstever layoffs back in the day. He lectured about gratitude compassion integrity and empathy. Meanwhile employees cant sleep. Managers had to call their employees to see whether they still had a job. At least one person learned about the layoffs through social media. Salesforce employees told my colleagues Ashley Stewart and Ellen Thomas all about their horrible week. This is what being a Salesforce employee was like last week. In other news 2. The second coming of Jeff Bezos. Amazon employees are chattering and joking about founder Bezos returning as CEO after almost two years away. In a group chat one employee shared Miss me yet with a smiling photo of Bezos. Another sent an image that said Return of the King. Read their other messages here. 3. This is how much the hottest tech jobs pay. California and New York City both major tech hubs now require companies to share how much their job openings pay. We grabbed the salary ranges of popular tech jobs compiled on the new Comprehensive. io. Check them out here. 4. Laid off Twitter employees just got severance agreements from Elon Musk now they must decide whether to sign or pursue legal action. Some affected workers say they will not sign because of how much they are being asked to give up. Read the full story. 5. Shopifys Chaos Monkey 2023 mess. Shockingly the sudden cancellation of all meetings wiping message histories and deleting all public Slack channels isnt going so well at Shopify. Heres how the week went for its worried employees. 6. Kicked off Kickstarter for AI porn. Last month a campaign to legitimize AI porn was kicked off the fundraising platform. It raised 56000 within 12 days but artists who are against AI art pressured Kickstarter into removing the campaign. More on the boot here. 7. Hiring tips from a company thats actively recruiting. This influencer marketing company has plans to hire more than 100 employees this year. The companys founder and president told Insider that reference checks and team players are important. More tips here. 8. The US should learn from India about banning TikTok. Instagram Snapchat and YouTube all greatly benefitted from India banning TikTok. The ban also further complicated already messy political tensions. This is what experts say the US should learn from India. Odds and ends 9. Getting taller could jumpstart your career. This 52 man got leglengthening surgery to add five vertical inches. It boosted his confidence and even helped him switch careers. More on the height difference here. 10. This family drove 2500 miles after Southwest canceled their flight. A determined family drove a rental car from Miami to Salt Lake City after Southwest canceled their flights three times. Hop into the passenger seat with us for their unexpected ride. What were watching today Prince Harry is dishing about his new memoir on Good Morning America A Cargo Dragon from SpaceX is departing the International Space Station Mad Love to Sean Paul on his bday Curated by Diamond Naga Siu in New York. Feedback or tips Email dsiuinsider. com or tweet diamondnagasiu Edited by Matt Weinberger tweet gamoid in San Francisco and Hallam Bullock tweet hallambullock in London. SMBs can easily upskill their workforce using this effective learning management solution Device deployment hits 1 million for two straight quarters How Paytm Soundbox is fuelling growth Jack Ma the billionaire founder of Alibaba who disappeared from public view in 2020 appears to resurface in Thailand as he prepares to give up control of his company Amazon Great Republic Day Sale best deals on phones iPhone 13 OnePlus Nord 2T 5G Redmi A1 and more Wipro sees FY23 revenue growth at 11. 512 Q3 profit growth beats analyst expectations Rupee falls 4 paise to close at 81. 34 against US dollar 13th Gen Intel Core i913900KS brings unprecedented speed to desktop users Credit expansion will taper down next year if deposits growth doesnt rise Axis Bank MD,Apple needs another hit product. But the rumored new AR/VR glasses will not be it.,Generally Neutral,230,"['struggled', 'concerns', 'skeptical', 'concern', 'worn', 'unlikely', 'uncomfortable', 'limit', 'issue', 'concerns', 'issue', 'lack', 'struggle', 'falls']","['killer', 'fear']","[Mark, Zuckerbergs, diehard, Michael, Gartenberg, Jack, Ma]"
