Article,Title,Description,URL,Content,Headline,Headline Sentiment,Offense Rating,Negative Words,Offensive Words,Tags
10,"Snapchat Marketing: An In-Depth Guide via @sejournal, @BrianFr07823616","This guide to Snapchat marketing, is an overview of an often misunderstood channel for marketers and how to start using it effectively. 
The post Snapchat Marketing: An In-Depth Guide appeared first on Search Engine Journal.",https://www.searchenginejournal.com/snapchat/474251/,Social media marketing is all about location. If your target audience is on a platform then you should be too. And if youre going after a younger demographic that means Snapchat. Snapchat is the sixth largest social media network its also one of the most misunderstood by marketers. So if youre panicking right now about missing the boat on this platform youre not alone and youre not old you just need a quick primer. In this guide to Snapchat marketing we are going to give you an overview of this multimedia messaging platform explain whos using it and give you the information you need for adding it to your marketing strategy. What Is Snapchat And How Does It Work Snapchat is a smartphone appbased social media platform. Sometimes referred to as SC or simply Snap it was initially designed with a focus on private persontoperson sharing. It sought to create a natural interaction flow with shared images videos and messages that are only available for a limited amount of time up to 10 seconds after viewing after which they are automatically deleted. Over time the apps developers began adding more features. They still allow private multimedia messaging but this is now supplemented with features like live video chat chronological stories and Bitmoji avatars. Users can also apply filters and use AR lenses to add animations and effects. Okay you may be saying this sounds like a fun app but what can it do for me as a marketer And more importantly what can it do for my brand Why You Should Be Using Snapchat For Marketing Successful marketers take advantage of every opportunity to reach potential targets that present themselves and Snapchat offers a lot of opportunities. As of October 2022 it had more than 363 million active daily users more than 82 of whom are 34 or younger. The most active users are 13yearolds. That means if your brand is going after Millennials or Gen Z you need a presence on the app. It may not have the sheer user volume of Facebook or YouTube but according to Snapchats own data the average user snaps between 20 and 40 times and spends at least 30 minutes on the app per day. Those are engagement numbers other sites would kill for. And not only does Snapchat offer incredible user engagement but its also a territory that is largely untapped by marketers. There are marketers on the platform but unlike sites like Facebook and Twitter where commercial presence is ubiquitous many brands have not yet established a presence on Snapchat. This presents a great opportunity for you. Snapchat marketing also tends to feel more authentic. By showing followers whats happening right now rather than using a digitally modified airbrushed and perfectlooking piece of marketing collateral youre showing your business as it really is. People love that. By now it should be clear why you should add Snapchat to your marketing mix but now comes the hard part how do you do that Well get into that in just a bit but when you have time you should first check out our podcast on how to use Snapchat in your marketing campaigns. Now lets take a closer look at just how to use Snapchat. How Does Snapchat Work If your social media experience is primarily from using Facebook Instagram and Twitter you may find Snapchat a bit frustrating at first. For one thing its design is fairly unique. Actions are controlled by unlabeled icons and swiping right or left takes you to a different part of the app. And whereas other platforms are friendly to predeveloped content Snapchat isnt. Instead youll need to create videos or photos messages known as Snaps or Snapchat stories in the app in realtime. There is a bit of a learning curve but with a little patience youll soon master it and be snapping like a pro. How To Take A Snapchat Picture Or Video After youve created an account and opened the app for the first time youll be faced with an ordinary backfacing camera. Play around with this to discover the functionality it provides including turning the flash on and off reversing the camera and putting the camera into night mode. To take a picture simply press the circle button at the bottom. To take a video press and hold it. Next you can edit your Snap with text filters stickers and links to your homepage or a special offer page for example. Youll also be able to adjust how long the content will last for the viewer. Once youre ready to send the video or image you can select who receives it or if you want to add it to your Snapchat story but well cover that in the next section. Thats it Congratulations youve just made your first Snapchat post. Create A Snapchat Story Just like Facebook and Instagram stories Snapchat stories are collections of videos and images that disappear after 24 hours. They collect your Snaps chronologically which allows you to create a narrative around your brand. To make yours impactful use original i. e. not previously used Snaps to create a story arc. You can determine who sees these under Settings. By default they will only be viewable by your friends but as a brand you should change this to Everyone to improve your exposure and visibility. Outlining Your Snapchat Marketing Strategy If youre trying to make an impression and you are just slapping together a profile and uploading the occasional video isnt going to cut it. You need a wellthoughtout strategy that will speak to your audience in a way that resonates and generate real results. But before you can generate results you need to know what youre hoping to achieve and write out your plan to make it happen. First consider your goals. Do you want to use Snapchat to Build awareness Expand your customer base Reengage cold prospects or past customers Generate a buzz around a new product Once youve decided what you want to achieve from this platform its time to develop your strategy. Decide who you want to reach and what action you want them to take then decide what type of content will best help you achieve that. Dont be afraid to experiment. And be aware that some of your approaches are going to fail. But thats what separates successful marketers from mediocre ones Successful marketers are always learning from failures and applying that knowledge to help them get better results. What kind of content should you be creating Read on weve got you covered. Types Of Marketing Content For Snapchat Like other forms of social media SC is all about encouraging engagement. There are several types of posts you can employ to make this happen including Sneak peeks If you have a new product or offering people have been clamoring for Snapchat is a great way to build excitement. A simple image with Its here can hype up the people who have been looking forward to this release inspire shares and increase the conversation around your brand. Behindthescenes People love to see how the sausage is made. Snapchat lets you provide this in an authentic unpolished way. It helps your audience feel connected and in the know while making them part of the experience. Usergenerated content Increase your exposure by inviting your audience into your Snaps. Tie giveaways and contests into your plan and reward people who use your custom hashtag or mention your brand in their own snaps. Interactivity Create activities your followers can take part in like asking your audience to send you Snaps of them using your product or interacting with you in another way. For example you may ask them to fill in the blank in I use my your product name to. Let them know the best answers will be featured in your story andor receive a prize. Testimonials Have a superfan who really loves your business Ask them to film a short video explaining why and then share this with your audience. Coupons or QR codes Give your audience an incentive for checking out your snaps. Include a digital coupon or QR code that redirects to an exclusive offer page. Snapchat Advertising So far weve only talked about ways to use SC for organic marketing but the app also offers paid options for varying price ranges. If you have the marketing budget you can buy advertising that goes directly into an audiences feed or purchase ads in the Discover section. You can also sponsor a Lens as a way to create user engagement and help bring your brand to life. On the other hand if you dont have access to a big marketing budget you can use Snapchat OnDemand Geofilters which use custom artwork to promote your brand location offerings or event. Snapchat Advertising Examples Snapchat Marketing Best Practices Now that you know how Snapchat works how to post content and how to develop your strategy lets look at some of the best practices to help you maximize your impact Let people know youre on Snapchat If youre just getting into SC mention it and solicit follows on your other social channels. Optimize your profile Choose a username that suits your brand. And be sure to include a URL to your site. Keep it light People are on SC for entertainment which means your content should be fun and enjoyable. Showcase your brand andor products It should be immediately clear to anyone viewing your Snaps what youre selling. Interact with other users If you want engagement you have to engage with others. Seek out collaboration opportunities respond to Snaps and follow other Snapchatters. Dont be overly salesy Despite the last point you have to walk a thin line between being informational and hardselling. Snapchat is generally not a good platform for highpressure sales tactics. Post regularly Consistent posting is essential to building your following and expanding your exposure. Try something new Dont be afraid to take a risk and try something different. In the worstcase scenario its gone in 24 hours. Lets Get Snapping Snapchat is a fun and effective platform for marketing but many marketers are put off by its difference from other more comfortable social media sites. But their loss is your gain. Snapchatters have 4. 4 trillion in spending power and theyre largely from a generation that is not only comfortable with online shopping but prefers it. Hopefully this guide has encouraged you to make a start decide on your strategy and get snapping. More resources 10 Ways Businesses Can Use Snapchat How to Find Influencers to Follow on Snapchat Snapchat vs Instagram Stories Which One Is Best For You Featured Image Marketa KuchynkovaShutterstock,Does Slack notify when you screenshot? What you need to know,Generally Neutral,110,"['Slack', 'Slack', 'doubt', 'Slack', 'Slack', 'Slack', 'concerned', 'Slack', 'Slack', 'Slack', 'Slack', 'Slack']",[],[]
11,Microsoft's reported $10 billion OpenAI bet is a gamble on the future of AI,"Microsoft is said to be prepping a $10 billion investment in OpenAI, the creator of ChatGPT. It's a big vote of confidence in the future of AI.",https://www.businessinsider.com/microsoft-10-billion-openai-gamble-2023-1,Microsofts reported 10 billion OpenAI bet is a gamble on the future of AI Happy Wednesday friends. This is Matt Weinberger deputy editor of Insiders tech analysis team writing to you from extremely rainy hopefully not flooded by the time you read this San Francisco. Were less than two weeks into 2023 and its already become clear that OpenAIs ChatGPT will be the defining technology of the year. The ability to ask a robot to write you anything from a cover letter to dating app responses has proven to be an addictive and enticing one sparking a new gold rush in the startup space. Microsoft clearly wants in on this in a big way The Redmondbased titan is said to be in talks to invest 10 billion in OpenAI at a 29 billion valuation. The two companies are already pretty cozy as Microsoft is said to plan to integrate OpenAIs technology into the Bing search engine and Office productivity suite. But this would take it to the next level Microsoft is reportedly asking for 75 of OpenAIs profits until it recoups the 10 billion. Thats some serious business in more ways than one. But it just goes to show you how much confidence Microsoft and others have in the future of AI. Heres what you need to know on this wintry Wednesday. If this was forwarded to you sign up here. Download Insiders app here. 1. Microsofts big bet on OpenAI is both totally wild and completely understandable. Microsoft is said to be prepping a 10 billion investment in OpenAI even as separate reports indicate that its bringing the ChatGPT AI chatbot and tech like it to products like Bing Office and Windows. The wouldbe deal really underscores just how quickly OpenAIs star has risen as ChatGPT hits the mainstream. Still that 29 billion valuation is rich for a company with limited revenue and the high costs of running advanced AI. It raises the question Is the AI boom just another bubble Consider also that even with all the hype ChatGPT aint perfect. Insiders Jordan Parker Erb used it to answer her Hinge matches and didnt get a single response. Artificial intelligence is great at pattern matching but perhaps less so at matchmaking. But if you wont find AI on the dating scene you might come across it in the courtroom sooner than you think. The founder of startup DoNotPay wants people to use its robot lawyer in traffic court as soon as February. The floodgates are officially open. Read more about Microsoft and OpenAI here. In other news 2. New footage shows a Tesla that was allegedly in selfdriving mode stopping short in a busy tunnel and the 8car pileup that followed. The incident happened in San Francisco on November 24th. Surveillance footage of the accident first reported by the Intercept shows the moment the Tesla stopped. 3. A reorg at Apple as a top exec exits. Insider reported this week that Peter Stern a key exec in Apples subscription business is out. Stern had helped build services like Apple Music Fitness and TV into the major players they are today. In the wake of his departure a new structure is coming to the unit. Read more here. 4. So much for move fast and break things A top Meta exec reportedly told employees that the companys headcount had ballooned too fast in recent years leading to the company moving far too slowly. Some meetings took a month to schedule out because too many people were involved he reportedly said. 5. AI comes to the creator economy. Read Insiders list of the top 12 AI tools that are helping content creators do their work from dubbing to writing copy according to industry insiders. The full list is here. 6. Googles next moonshot is a little more grounded. Meet Mineral a new company spun out of Googles famed X labs under the larger Alphabet umbrella. It aims to use AI to give farmers more data about their crops representing a new way for the tech giant to make money from its most cuttingedge tech. 7. Web3 joins the climate fight. Insiders April Joyner has an exclusive look at the pitch deck that startup Open Forest Protocol used to raise 4. 1 million for its Web3flavored approach to the carbon credit market. Read the deck here. 8. Whos to blame when remote workers underperform Salesforce CEO Marc Benioff poked the proverbial this week when he doubled down on his comments that younger remote employees are underperforming. Experts tell Insider that the real culprit is probably how those workers are trained and managed. Odds and ends 9. The nonenvironmentalist case for electric cars. Insiders Tim Levin is an expert on cars in general and electric vehicles in particular. From hightech bonus features to the benefits of charging instead of pumping gas heres his rundown of some lessobvious arguments to make your next car an electric. 10. How to be sneaky on Snapchat. Snapchats whole selling point is that the photos you send vanish after a set amount of time. Thats why its always told you when someone takes a screenshot. But maybe you want to be sneaky we dont judge. Read Insiders guide on how to take a Snapchat screenshot without alerting the other party. Curated by Matt Weinberger in San Francisco. Feedback or tips Email mweinbergerinsider. com or tweet gamoid. Edited by Hallam Bullock tweet hallambullock in London. SMBs can easily upskill their workforce using this effective learning management solution Device deployment hits 1 million for two straight quarters How Paytm Soundbox is fuelling growth Jack Ma the billionaire founder of Alibaba who disappeared from public view in 2020 appears to resurface in Thailand as he prepares to give up control of his company Amazon Great Republic Day Sale best deals on phones iPhone 13 OnePlus Nord 2T 5G Redmi A1 and more Wipro sees FY23 revenue growth at 11. 512 Q3 profit growth beats analyst expectations Rupee falls 4 paise to close at 81. 34 against US dollar 13th Gen Intel Core i913900KS brings unprecedented speed to desktop users Credit expansion will taper down next year if deposits growth doesnt rise Axis Bank MD,"
            Snapchat Marketing: An In-Depth Guide        ",Extremely Positive,180,"['panicking', 'limited', 'hard', 'frustrating', 'cold', 'afraid', 'fail', 'mediocre', 'failures', 'Sneak', 'hype', 'afraid', 'risk', 'loss']",['kill'],"[Marketa, KuchynkovaShutterstock]"
12,"Seattle schools sue TikTok, Meta, Snapchat, and YouTube over students’ mental health and behavioral issues","TikTok, Facebook, Instagram, Snapchat, YouTube; and their parent companies are facing yet another lawsuit over mental health issues in children. This time, it comes from Seattle’s public school district, claiming that apps have had a major role in the “youth …",https://www.diyphotography.net/seattle-schools-sue-tiktok-meta-snapchat-and-youtube-over-students-mental-health-and-behavioral-issues/,TikTok Facebook Instagram Snapchat YouTube and their parent companies are facing yet another lawsuit over mental health issues in children. This time it comes from Seattles public school district claiming that apps have had a major role in the youth mental health crisis. The district accuses social media platforms of causing a variety of mental health and behavioral issues in children and being exploitive and manipulative. According to the lawsuit all these platforms are deliberately manipulating and exploiting users targeting particularly the youngest ones among them. Defendants growth is a product of choices they made to design and operate their platforms in ways that exploit the psychology and neurophysiology of their users into spending more and more time on their platforms the lawsuit reads. It points out that these techniques have particularly affected and harmed the youth audience. According to the lawsuit these platforms have intentionally cultivated all of these techniques creating a mental health crisis among Americas youth. We can all agree that spending too much time on social media harms mental health. This is especially dangerous for children who arent fully developed in terms of selfawareness and critical thinking. After all even Meta itself admits that Instagram has a terrible effect on teenagers. This is bad on its own but the school district lawsuit points out another set of consequences related to children and their time at school. In the 202122 school year 96 percent of public schools reported offering at least one type of mental health service to their students the lawsuit reads. And as it appears more and more students are seeking them. However the need for these services is increasing as children suffer from more and more mental health and behavioral issues. As much as 88 percent of surveyed public schools did not strongly agree that they could effectively provide mental health services to all students in need. There arent enough mental health professionals to tackle these issues access to licensed mental health professionals is inadequate and there arent enough funds. Perhaps you remember that this isnt the first time social media were accused of affecting a teenagers suicide. In 2022 two women sued Instagram and Snapchat over their childrens suicides. Snapchat Google and Apple were also sued for failing to protect kids from online predators. But to my knowledge this is the first time that the entire school district has filed a lawsuit this big. Overusing social media causes major issues in children and it has further implications for their behavior learning selfesteem And ultimately it affects their loved ones and the entire school system these children are a part of.,Microsoft's reported $10 billion OpenAI bet is a gamble on the future of AI,Extremely Positive,140,"['limited', 'hype', 'Stern', 'Stern', 'break', 'blame', 'culprit', 'sneaky', 'sneaky', 'falls']",['fight'],"[Matt, Weinberger, Jordan, Parker, Erb, Peter, Stern, Stern, April, Joyner, Marc, Benioff, Tim, Levin, Matt, Weinberger, Hallam, Bullock, hallambullock, Jack, Ma]"
