Article,Title,Description,URL,Content,Headline,Headline Sentiment,Offense Rating,Negative Words,Offensive Words,Tags
1,Snapchat has a hidden library of built-in games — here's how to play them with friends,Snapchat has a library of built-in games in its Chat pages. Here's how to access and play these games with other users.,https://www.businessinsider.com/guides/tech/snapchat-games,Snapchat includes a library of multiplayer games within its Chat pages. To start a game tap the Rocket icon while youre in a chat with a friend or group. You can continue chatting even while you are in a Snapchat game with your friend. While you probably already use the Snapchat app for text chats as well as voice and video calls you can also use it for gaming. Heres everything you need to know about the hidden Snapchat Games feature. Snapchat has a library of builtin games Snapchat Games are designed as another way to keep you engaged with friends. They are generally short and simple multiplayer games designed for two or more players. You can browse and launch Snapchat games from within the Snapchat app and the games are an extension of the Chat page so you can easily launch a game while having a conversation with someone. While these games are relatively simple you can earn points and rewards in the game which are generally saved between sessions so you can progress through the game each time you play. Snapchat Games debuted back in 2019 and Snap has been steadily adding new titles to the collection since the launch. Currently there are nearly four dozen games to choose from in Snapchat. How to play Snapchat Games 1. In the Snapchat app tap the Chat tab at the bottom of the screen. 2. Tap the friend or group you want to play a game with. 3. Continue the conversation the way you normally would. When youre ready to start a game tap the Rocket icon beside the text field. 4. In the list of available games tap the game you want to launch. 5. After the game begins your friend or everyone in the group gets a notification and can tap a game icon to play as well. Once in the game you have some options Chat. You can continue to chat with your friend using the chat field at the bottom of the screen. Configure the game. You can set options in many games by tapping the threeline menu at the bottom right of the screen. Exit. To leave the game tap the Chaticon at the bottom of the screen to the left of the text field and then tap Leavein the popup window.,"Seattle Schools Sue TikTok, Facebook, Instagram, Snapchat, and YouTube Over Students' Mental Health",Extremely Negative,1280,"['crisis', 'complaint', 'addicting', 'harmful', 'issues', 'difficult', 'sadness', 'hopelessness', 'expensive', 'crisis', 'damages', 'liable', 'harm', 'exploit', 'complaint', 'depression', 'hard', 'hard', 'toxic', 'issues', 'detriment', 'difficult', 'dispute', 'sue', 'harms', 'sued', 'allegations', 'sued', 'harmful', 'addicting', 'deceptive', 'liable', 'violation', 'breaks', 'harmful', 'cracks', 'depression']","['suicide', 'died', 'death', 'died', 'suicide', 'suicide', 'death', 'suicide', 'suicide']","['lawsuit', 'lawsuit', 'lawsuit', 'lawsuit', 'lawsuit', 'lawsuit', 'lawsuit', 'lawsuit', 'lawsuit', Antigone, Davis, Davis, Molly, Russell, Russell]"
2,How to mute someone on Snapchat and limit notifications from them,You can mute someone on Snapchat to get fewer notifications without unfriending the individual. Here's how to mute a user's messages or Stories.,https://www.businessinsider.com/guides/tech/how-to-mute-someone-on-snapchat,You can mute a friend on Snapchat to get fewer notifications without unfriending the individual. To disable message notifications go to Chat Settings by tapping and holding the conversation you want to mute. You can also mute someones Snapchat Stories and notifications through the Story Settings option. Managing notifications from friends is always a bit of a balancing act you want to stay connected but you might not want to be inundated with their content every time they send you a message or post a story. Snapchat understands this and gives you multiple tools for muting people whom you might not want to hear from all the time. In fact you can disable notifications for a friends messages and separately mute someones Snapchat Stories so they dont pop to the top of your feed when they create or add to a story. How to mute someones message notifications on Snapchat 1. In the Snapchat app tap the Chat icon at the bottom of the screen. 2. Tap and hold a conversation with a friend you want to mute notifications for. 3. Tap Chat Settings. 4. Turn off Message Notifications by swiping the button to the left. You can also turn off Game and Mini Notifications by swiping that button to the left. 5. Tap Done. How to mute someones Snapchat Stories 1. In the Snapchat app tap the Chat icon at the bottom of the screen. 2. Tap and hold a conversation with a friend for whom you want to mute Snapchat Stories. 3. Tap Story Settings. 4. Turn on Mute Story by swiping the button to the right and confirm you want to do this by tapping Mute in the popup window. If Story Notifications was turned on itll automatically turn off. 5. Tap Done.,Snapchat has a hidden library of built-in games — here's how to play them with friends,Extremely Positive,0,[],[],[]
3,"A lawsuit filed by Seattle's public schools accuses Meta, TikTok, Google, and Snapchat of creating a youth mental health crisis","According to the American Psychological Association, the rate of 12 to 17-year-olds experiencing major depression increased by 52% from 2005 to 2017.",https://www.businessinsider.com/meta-tiktok-google-accused-creating-youth-mental-health-crisis-lawsuit-2023-1,A lawsuit filed by Seattles public schools accuses Meta TikTok Google and Snapchat of creating a youth mental health crisis Social media companies are named in a lawsuit filed by the Seattle public schools district. The suit accuses Meta Google TikTok and Snap of creating a mental health crisis among Americas youth. Giant social media companies are accused of creating a mental health crisis among Americas youth in a lawsuit filed Friday by the Seattle public schools district. The suit which Insider has reviewed names Facebook Instagram TikTok YouTube Snapchat Google and their associated companies as defendants and slams their business models claiming they harm youths. Seattles public school system said it had a responsibility to file the suit because children suffering from mental health problems perform worse in school and are less likely to attend at all affecting the schools educational mission. The lawsuit alleges that the apps have successfully exploited the vulnerable brains of youth hooking tens of millions of students across the country into positive feedback loops of excessive use and abuse of Defendants social media platforms. It added that the content they curate and direct to youth is too often harmful and exploitive pointing to examples encouraging selfharm and an extreme corpse bride diet. Increasing rates of mental illnesses further intensified by the pandemic are alleged to be a consequence of this. According to the American Psychological Association the rate of 12 to 17yearolds experiencing major depression increased by 52 from 2005 to 2017. During the first seven months of COVID19 lockdowns the APA later reported mental healthrelated emergency department visits for the same age group increased by 31 compared to 2019. Meta which owns Facebook and Instagram was fined 403 million in September 2022 by Irish regulators for failing to protect childrens privacy. It was fined a further 414 million on January 4 amid a row over whether it needs to ask users for consent to track them for advertisers. The lawsuit also quotes President Joe Bidens State of the Union address last year in which he said We must hold social media platforms accountable for the national experiment theyre conducting on our children for profit. A Snap spokesperson said nothing is more important to us than the wellbeing of our community and it works closely with mental health organizations to give users resources to help them deal with the challenges facing young people today. Metas global head of safety Antigone Davis said its developed over 30 tools to support teens and families encouraging time limits and identify over 99 of harmful content before its reported. Well continue to work closely with experts policymakers and parents on these important issues Davis added. Google and TikTok did not immediately respond to Insiders request for comment. SMBs can easily upskill their workforce using this effective learning management solution Device deployment hits 1 million for two straight quarters How Paytm Soundbox is fuelling growth Jack Ma the billionaire founder of Alibaba who disappeared from public view in 2020 appears to resurface in Thailand as he prepares to give up control of his company Amazon Great Republic Day Sale best deals on phones iPhone 13 OnePlus Nord 2T 5G Redmi A1 and more Wipro sees FY23 revenue growth at 11. 512 Q3 profit growth beats analyst expectations Rupee falls 4 paise to close at 81. 34 against US dollar 13th Gen Intel Core i913900KS brings unprecedented speed to desktop users Credit expansion will taper down next year if deposits growth doesnt rise Axis Bank MD,How to mute someone on Snapchat and limit notifications from them,Extremely Positive,20,"['disable', 'inundated', 'disable']",[],[]
4,How to use Quick Tap on Android 13,Android 13 has many great features and Quick Tap is one of them. Here's how you can use Quick Tap on Android 13.,https://www.androidcentral.com/apps-software/how-to-use-quick-tap-on-android-13,How to use Quick Tap on Android 13 Customize your phones tap gestures on Android 13. Quick Tap isnt exactly an exclusive new feature of Android 13. Many phones such as the Pixel 5 and Pixel 4a 5G have had back tap gestures formally known as Quick Tap for a while now. If youre new to the feature and dont know how to use it we can help you figure things out. Lets walk through the steps that show you how to use Quick Tap on Android 13. How to use Quick Tap on Android 13 1. Open Settings on your phone. 2. Select System. 3. Tap Gestures. 4. Select Quick Tap to start actions. 5. Enable the toggle to Use Quick Tap. 6. Assign a function for Quick Tap on your phone by picking one of the options. 7. After assigning a function to your phones Quick Tap double tap the back of your device to trigger it. You can choose from a wide set of functions when customizing the Quick Tap. This includes carrying out the following tasks Take screenshot Access your digital assistant Play or pause media See recent apps Show notifications Toggle flashlight Open app Should you decide to open an app via Quick Tap on your phone the skys the limit. You can choose any Android app from your phone be it Snapchat or Settings. The best part is that many apps have further customizable options designed for the Quick Tap feature. For instance if you set your phone to open Snapchat through the back tap function you can further customize Quick Tap settings by choosing the Stories Map Chat or Spotlight options. Back tap gestures arent available to all If you cant find the Quick Tap feature on your device it means that your Android phone does not support it natively. Currently only select Google Pixel and Samsung Galaxy models have Quick Tap on them. Feeling envious of those who can use Quick Tap on Android 13 while you cant Why not treat yourself to a little upgrade so that itch is finally scratched You dont even need to break the bank because Googles Pixel phones have back tap gestures and are very costeffective. Ultimate Android Googles Pixel 7 Pro is the culmination of all its efforts to date. The company has finally created the perfect Android flagship with zero compromises. Everything about this phone is perfect from the hardy gear inside it to the gorgeous software experience. Android Central Newsletter Get the best of Android Central in in your inbox every day Android Central Newsletter Get the best of Android Central in in your inbox every day Thank you for signing up to Android Central. You will receive a verification email shortly. There was a problem. Please refresh the page and try again.,"A lawsuit filed by Seattle's public schools accuses Meta, TikTok, Google, and Snapchat of creating a youth mental health crisis",Extremely Negative,630,"['accuses', 'crisis', 'accuses', 'crisis', 'crisis', 'harm', 'suffering', 'problems', 'worse', 'vulnerable', 'excessive', 'harmful', 'depression', 'emergency', 'failing', 'limits', 'harmful', 'issues', 'falls']",['abuse'],"['lawsuit', 'lawsuit', 'lawsuit', 'lawsuit', 'lawsuit', Joe, Bidens, 'harassment', Antigone, Davis, Davis, Jack, Ma]"
5,Seattle schools sue tech giants over social media harm,"The public school district in Seattle is suing the tech giants behind TikTok, Instagram, Facebook, YouTube and Snapchat, seeking to hold them accountable for the mental health crisis among youth",https://abcnews.go.com/US/wireStory/seattle-schools-sue-tech-giants-social-media-harm-96290958,SEATTLE The public school district in Seattle has filed a novel lawsuit against the tech giants behind TikTok Instagram Facebook YouTube and Snapchat seeking to hold them accountable for the mental health crisis among youth. Seattle Public Schools filed the lawsuit Friday in U. S. District Court. The 91page complaint says the social media companies have created a public nuisance by targeting their products to children. It blames them for worsening mental health and behavioral disorders including anxiety depression disordered eating and cyberbullying making it more difficult to educate students and forcing schools to take steps such as hiring additional mental health professionals developing lesson plans about the effects of social media and providing additional training to teachers. Defendants have successfully exploited the vulnerable brains of youth hooking tens of millions of students across the country into positive feedback loops of excessive use and abuse of Defendants social media platforms the complaint said. Worse the content Defendants curate and direct to youth is too often harmful and exploitive.... While federal law Section 230 of the Communications Decency Act helps protect online companies from liability arising from what thirdparty users post on their platforms the lawsuit argues that provision does not protect the tech giants behavior in this case. Plaintiff is not alleging Defendants are liable for what thirdparties have said on Defendants platforms but rather for Defendants own conduct the lawsuit said. Defendants affirmatively recommend and promote harmful content to youth such as proanorexia and eating disorder content. In emailed statements Sunday Google and Snap said they had worked to protect young people who use their platforms. Snap launched an inapp support system called Here For You in 2020 to help those who might be having a mental health or emotional crisis find expert resources and it also has enabled settings that allow parents to see whom their children contact on Snapchat though not the content of those messages. It also has recently expanded content about the new 988 suicide and crisis phone system in the U. S. We will continue working to make sure our platform is safe and to give Snapchatters dealing with mental health issues resources to help them deal with the challenges facing young people today the company said in a written statement. Jos Castaeda a spokesperson for Google said Google which owns YouTube had also given parents the ability to set reminders limit screen time and block certain types of content on their childrens devices. We have invested heavily in creating safe experiences for children across our platforms and have introduced strong protections and dedicated features to prioritize their well being Castaeda said. Meta and TikTok did not immediately respond to requests for comment. The lawsuit says that from 2009 to 2019 there was on average a 30 increase in the number of Seattle Public Schools students who reported feeling so sad or hopeless almost every day for two weeks or more in a row that they stopped doing some typical activities. The school district is asking the court to order the companies to stop creating the public nuisance to award damages and to pay for prevention education and treatment for excessive and problematic use of social media. While hundreds of families are pursuing lawsuits against the companies over harms they allege their children have suffered from social media its not clear if any other school districts have filed a complaint like Seattles. Internal studies revealed by Facebook whistleblower Frances Haugen in 2021 showed that the company knew that Instagram negatively affected teenagers by harming their body image and making eating disorders and thoughts of suicide worse. She alleged that the platform prioritized profits over safety and hid its own research from investors and the public.,How to use Quick Tap on Android 13,Extremely Positive,90,"['limit', 'envious', 'scratched', 'break', 'problem']",['itch'],[]
6,‘I went downhill’: man falsely accused of rape on becoming a hate figure,Jordan Trengove faced trial after being accused by Eleanor Williams after a night out in 2019When 18-year-old Jordan Trengove agreed to go on a night out with Eleanor Williams in 2019 he had no idea that accepting her invitation would not just land him in jai…,https://www.theguardian.com/uk-news/2023/jan/03/i-went-downhill-man-falsely-accused-of-on-becoming-a-hate-figure,When 18yearold Jordan Trengove agreed to go on a night out with Eleanor Williams in 2019 he had no idea that accepting her invitation would not just land him in jail but make him the enemy of a global antigrooming movement with its own line of merchandise. The teenagers and some friends went drinking in Barrow on 9 March 2019 and as far as Trengove can remember Williams disappeared halfway through the night. He didnt pay much attention because he was distracted by another girl Ebony that evening. Ebony ended up with him in the back of a police van after officers spotted him arguing at a taxi rank in the early hours. They said youre drunk lets take you home remembers Trengove. The duo were dropped off at a friends house and ended up having sex on the sofa according to Ebony when she was called to give evidence at Williamss trial more than three years later. Weeks passed and one day Trengove was asleep in bed when police arrived to arrest him on suspicion of raping drugging and assaulting Williams. He protested his innocence and cooperated with police handing over his phone and submitting to an intimate body check so that officers could look for signs of the violent struggle Williams had described. There was no bruising no markings says Trengove now. But the damage was done. The next day someone painted the word rapist on his house and smashed in the windows. Before he knew it he was in court being remanded in custody charged with three counts of rape. Williams had produced evidence that Trengove had admitted to the rapes goading her on Snapchat calling her a dirty slag who was well up for a shag that night. It took police all too long to realise that this Snapchat account had been created using the wifi at the Barrow home of Williamss mother. Prison was very very scary he said. I was put in cells with actual rapists and paedophiles. I shared with a man who admitted to me he was guilty of sending pictures to eightyearold kids. Trengove spent his 19th birthday in prison serving 10 weeks on remand before police realised the evidence against him didnt stack up. The girl Trengove actually had sex with on 9 March gave police a selfie she had taken in the back of the police van while suspicion grew that far from being a particularly unlucky victim of multiple rapes Eleanor Williams was in fact a fantasist making one false allegation after the other with the help of social media. Not only did she create fake profiles to frame Trengove and some of her other victims she started up explicit conversations with innocent men on Tinder Snapchat or the intimate photo sharing site OnlyFans where she had an account and renamed them in her phone so that it looked as though their penis photos and propositions were coming from those she falsely accused. Out of jail Trengove was a free man but an outcast in Barrow. I was barred from everywhere. I was called a rapist a nonce. Within a few months he moved away. I thought it would end but the first day we moved in I had someone shout rapist at me. It was clear then that no matter where I went someone would always know. Things calmed down and then on 20 May 2020 Williams posted the fatal Facebook page alleging that she had been trafficked and exploited by an Asian grooming gang. She didnt name Trengove but his name soon became linked with the case regardless of his skin colour as more than 100000 people joined the Justice For Ellie Facebook page and bought elephantthemed wristbands keyrings and bumper stickers to express solidarity. A rally was organised where convoys of cars drove from Barrow to the town where Trengove now lives flying Justice for Ellie banners. He tried to tell protesters the truth but no one would listen. I went downhill he said. I tried killing myself over it. I tried running away from it all. I tried ending my relationship walking away from my family. The amount of problems put on my life just from one Facebook post is ridiculous. Because Im autistic its even harder. I got diagnosed with complex PTSD because of it all. Ever since this went on I feel like Ive been trapped in my own little prison he added. I dont feel like I have a life any more. Trengove became a father in August 2021 but struggled to bond with his son as Williamss trial kept getting postponed. When I was in his newborn stage I couldnt love him like a dad should. I tried to distance myself away. My whole life just became sitting in playing video games. That was the way of escaping the reality of my life. Trengove now 22 was in court on Tuesday to hear the jury find Williams guilty of eight counts of perverting the course of justice including three involving him. Im over the moon he said afterwards pledging to go home and give his son a big hug. Ive got my life back.,Seattle schools sue tech giants over social media harm,Extremely Negative,930,"['crisis', 'complaint', 'nuisance', 'worsening', 'anxiety', 'depression', 'disordered', 'difficult', 'vulnerable', 'excessive', 'complaint', 'Worse', 'harmful', 'liability', 'liable', 'harmful', 'disorder', 'crisis', 'crisis', 'issues', 'limit', 'sad', 'hopeless', 'nuisance', 'damages', 'excessive', 'problematic', 'harms', 'allege', 'suffered', 'complaint', 'worse']","['abuse', 'suicide', 'suicide']","['lawsuit', 'lawsuit', 'lawsuit', 'lawsuit', 'lawsuit', Jos, Castaeda, Castaeda, 'lawsuit', 'lawsuit', 'lawsuit', 'lawsuit', Frances, Haugen]"
