Article,Title,Description,URL,Content,Headline,Headline Sentiment,Offense Rating,Negative Words,Offensive Words,Tags
1,Match Group rolls out campaign to stop romance scams,The parent company of several popular dating apps has launched a new campaign to raise public awareness regarding online romance scams and how to avoid them.,https://www.foxnews.com/tech/match-group-campaign-stop-romance-scams,Match Group rolls out campaign to stop romance scams Match Group is the parent company of Tinder Hinge Match Plenty of Fish Match Group Inc. the parent company of popular dating apps Tinder Hinge and Match has rolled out a new campaign to warn and inform daters about online romance scams. The company said Tuesday that users across Tinder Hinge Match Plenty of Fish Meetic and OurTime in more than 15 countries would begin to receive messages alerting them to tips and common behaviors to watch out for help identify possible online fraud. The tips were created with the assistance of law enforcement and financial exploitation experts. Theyll be displayed via an inapp message on Tinder and Meetic whereas Match Hinge Plenty of Fish and OurTime users will be sent notifications. HINGE APP ROLLING OUT VIDEO VERIFICATION FEATURE TO CONFIRM USER AUTHENTICITY Match Group noted that its brands had previously taken steps to help prevent scams or fraud including the introduction of selfie verification and video chat to sending popup messages with safety tips if certain language is detected in conversations between users. Citing the Federal Trade Commission the release highlighted that romance scams reported in the U. S. result in higher losses than any other type of scam with more than 300 million in losses each year. As a former detective and special agent I know firsthand how scammers lure unsuspecting individuals into giving personal information and ultimately money including preying on those looking for love or companionship Buddy Loomis senior director of law enforcement operations and investigations at Match Group said in a statement. Its the reason we are committed to investing in building the safety tools available to users by leveraging technology and resources that aim to help users protect themselves from the harms in the world around them and make safer connections. CLICK HERE TO GET THE FOX NEWS APP Among the list of tips for users written by Match Group investigators and victim advocates Stay on the app when getting to know a new connection. If a match wants to move platforms but does not want to meet up or video chat it is a red flag. Make sure to verify your profile and look out for verification checks on matches. If a new love interest is giving you crypto or investment advice there is a high probability that its a scam. According to experts scammers will also use techniques to focus on how a large sum of returns could improve your life or what you could do with this new money. Scammers play on users heartstrings telling stories of desperation where money is involved. Online scams have evolved as platforms have become more accessible with bad actors often playing the long game. Never send or receive money via a wire transfer money order currency exchange gift card or investment with someone youve never met in person.,The 10 biggest losers in the S&P 500 this year have seen $1.6 trillion in market value erased,Extremely Negative,800,"losing, losses, losers, doubt, turbulent, losses, risky, dragged, fall, decline, carnage, negative, recession, fears, laid, declines, losers, Decline, difficult, inflationary, shallow, recession, Decline, rough, unexpected, issues, Decline, loud, Decline, lost, Decline, aggressive, debt, hurt, controversial, problems, fallen, Decline, infections, declines, Decline, hurt, fears, recession, rough, Decline, hurt, strict, Decline, pinch, challenging, Decline, slow",deposit,"Dan, Schulman, Schulman, Steve, Randle, Joe, DePaolo, Mark, Zuckerbergs, Zuckerbergs, Elon, Musk, Musk, lawsuit, Joe, Hogan"
2,Guy Allegedly Stole Hundreds Of Thousands From Work And Then Lost It All On GameStop,"Crime never pays. Unless you get away with it. Ermenildo “Ernie” Castro seemingly did not. The former software engineer at Zulily is accused of stealing over $300,000 from the online retailer through a scheme straight out of the 1999 slacker revenge movie Off…",https://kotaku.com/office-space-gamestop-meme-stock-crime-theft-1849953405,Crime never pays. Unless you get away with it. Ermenildo Ernie Castro seemingly did not. The former software engineer at Zulily is accused of stealing over 300000 from the online retailer through a scheme straight out of the 1999 slacker revenge movie Office Space. He now claims the moneys all gone telling police he lost most of it betting on GameStop meme stock options. Documents filed by prosecutors in Kings County Superior Court last month detail an audacious scheme by a white collar worker to rip off his bosses a scheme whose execution left more than a little to be desired. Charged with two counts of felony theft and one count of felony identity theft Castro allegedly manipulated the code on Zulilys checkout page to siphon off at least 261885 in shipping fees into his personal Stripe banking account. He then allegedly proceeded to change the prices on products paying pennies on the dollar for them and having them shipped directly to his home where they piled up in front of his door. Prosecutors claim he stole 40842 this way for a total theft amount of 302278. 52. When interviewed by police after his arrest Castro admitted the figure could have been even higher but said the money was all gone. He clarified that he had used the money to invest in stock options particularly GameStop stock options the court documents read. Its unclear which exact options he bet on that left him zeroed out by the meme stock. According to prosecutors Castro began skimming off the top of Zulilys transactions in February 2022. The company became aware of the discrepancies the following month and ordered Castro and others to investigate. Thats when he allegedly updated the code to double charge customers. The company had also started to flag the unusual purchases shipping to Castros home. In June a fellow employee visited to investigate and found several Zulily labeled boxes piled outside of the homes front door and driveway. Vertagear 800 Series Gaming Chair Ergonomic comfort Adjustable seat height neck support memory foam pillow adjustable back rest and tilt locking system and 4D armrests that move in 4 directions to fit you best. Castro told Zulily and police that the purchases were just test orders that he just forgot to cancel. However email records allegedly show Castro ordering stuff specifically for a woman he met on Tinder. She would send him links to stuff she wanted and he would respond back with a heart emoji to show it had been purchased. When asked about this by police Castro was unable to provide an immediate answer and ultimately said he placed the orders for her in order to peacock. Castro returned his work laptop on June 9 when he was fired which also didnt do him any favors. When Zulily searched it the company reportedly discovered a OneApp file named OfficeSpace Project. Prosecutors say it went through his scheme in detail including adjustments he made to try and keep it hidden from management. Asked by police Castro even admitted that Office Space a movie about workers selfactualizing by stealing small amounts of money from millions of company transactions was what the scheme in the file was named after. Its unclear who Castros attorney was or if he ever called one. Possibly cementing the case for police was what they reportedly discovered when they searched Castros home. After executing a warrant on July 21 they claimed to have located an exorbitant number of Zulily orders many still in their original packaging. Among them was a Gray Linen Convertible Sofa Bed priced at 565. 99 that Castro allegedly only paid 1 for. Maybe he should have tried to sell it to GameStop. Castros arraignment is scheduled for later this month. At 16 a share GameStops stock is currently lower than at any time since the Office Space plan allegedly started to unfold. But it is possible the funds are still out there somewhere. Prosecutors believe Castro may have made preparations prior to his arrest. In one part of the OfficeSpace Project document he reportedly wrote Prepare offgrid backup plan.,Match Group rolls out campaign to stop romance scams,Extremely Negative,430,"scams, scams, exploitation, scams, scams, losses, scam, losses, unsuspecting, harms, scam, desperation, scams, bad","fraud, fraud","Buddy, Loomis"
3,Fiction to look out for in 2023,"With new work from Richard Ford, Lorrie Moore and Zadie Smith, plus second novels by Caleb Azumah Nelson and Guy Gunaratne, this is shaping up to be a memorable 12 months<ul><li>Nonfiction to look out for in 2023</li></ul>During the lockdown years, I kept rea…",https://www.theguardian.com/books/2023/jan/01/fiction-to-look-out-for-in-2023,During the lockdown years I kept reading articles by novelists saying how unproductive they were feeling how virus narratives had colonised their subconscious minds destroying the creative impulse. 2023s novels or at least those of them Ive read suggest otherwise. Its an extraordinary crop with memorable books from both celebrated and lesserknown authors. As usual Ive concentrated on those released in the first half of the year and have left first novels to the New Reviews best debut novelists feature. Lets start with some big names. Theres inevitable excitement surrounding a new Bret Easton Ellis. The Shards Swift January is a riotous tale of privilege and psychosis at a swanky prep school. After the horrors of last year its splendid that Salman Rushdie has a new novel out Victory City Jonathan Cape February. Better still its a cracker. Purportedly a rediscovered ancient epic its about the transformative power of human creativity the enduring ability of art to shape the world. Birnam Wood by Eleanor Catton Granta March comes 10 years after the Bookerwinning The Luminaries and is worth the long wait. Full of wit big ideas and the most beautiful writing its the story of a group of guerrilla gardeners who clash with a billionaire prepper. I loved it. To be honest 2023 feels like a monthbymonth parade of my favourite writers. Theres new work from Benjamin Myers Cuddy Bloomsbury March Shy Faber April Deborah Levy August Blue Hamish Hamilton May and Amanda Craig The Three Graces Abacus June. Theres Richard Fords fifth and final Frank Bascombe book Be Mine Bloomsbury June in which Bascombe now entering his own last years takes his terminally ill son on a trip to Mount Rushmore. Theres also a new novel from the great Paul Murray. The Bee Sting Hamish Hamilton June is the tale of a dysfunctional family trying to hold things together. Its a thing of beauty a novel that will fill your heart. Another welcome return is Lorrie Moores I Am Homeless If This Is Not My Home Faber June. Her first novel since A Gate at the Stairs 2009 this is an uncanny tale stretched between the 19th century and the present. Im always interested in second novels in the vulnerability of the followup. Aybmi Adby was shortlisted for the Womens prize for her debut Stay With Me. Now with A Spell of Good Things Canongate February she has delivered a poised and luminous love story set against the backdrop of a violent contemporary Nigeria. New Review best debut alumnus Caleb Azumah Nelsons Open Water was a slim masterpiece. His second novel Small Worlds Viking May is a similarly lapidary comingofage story set over three years in the life of an extraordinary young man. Another New Review pick Guy Gunaratne won a host of prizes with their first novel In Our Mad and Furious City. Their enthralling second Mister Mister Tinder May is about the enigmatic Yahya Bas sitting mute in a government detention centre after being captured in Syria. Finally perhaps spurred by his brother Richards success Mat Osman has written a superb second novel. The Ghost Theatre Bloomsbury May finds its way into the hidden corners of Elizabethan London telling the story of a group of misfit actors. Beautifully written and completely convincing. A few more to look out for theres a blast from the past in the form of Michael Bracewell whose Unfinished Business White Rabbit January is his first novel in more than two decades. The story of a putupon everyman it is a sad and quietly devastating portrait of middleaged life in suburbia. Meg Clothier is best known for her YA historical novels but her first adult work The Book of Eve Wildfire March is a wonderfully rich and absorbing tale. With nods to Umberto Eco it tells the story of Beatrice the librarian of a convent who comes into possession of a book of dark and stunning power. Chinese author Wang Xiaobo died aged just 44 in 1997 but his masterpiece Golden Age Penguin April has now been translated into English for the first time by Yan Yan. Its a scabrous bawdy novel set in the years of the Cultural Revolution. Its also very moving. Han Kang is back with Greek Lessons Hamish Hamilton April beautifully translated by Deborah Smith and Emily Yae Won. Lastly James Hynes is wellknown in the US but the 67yearold has never been published in the UK before. Sparrow Picador May is a stunning work of historical imagination. The story of a young man making his name in the dying days of the Roman empire Sparrow is masterful in its portrayal of love sex and friendship. Finally two novels to look forward to later in the year. The Fraud by Zadie Smith Hamish Hamilton September is a wonderfully rich historical novel based on a reallife trial. With two memorable central characters it looks at the darkness that underpinned the triumphant exceptionalism of Victorian Britain. Sebastian Faulkss Modern Love Hutchinson September is a work of visionary ambition. Set in the future its partmystery partromance all told with typical panache. Whatever else the year ahead brings at least we have this collection of supremely good novels to comfort challenge instruct and entertain us through it.,Guy Allegedly Stole Hundreds Of Thousands From Work And Then Lost It All On GameStop,Extremely Negative,520,"stealing, revenge, lost, audacious, stole, unclear, unable, stealing, unclear, exorbitant",Crime,"Ermenildo, Ernie, Castro, lawsuit, lawsuit, lawsuit, Castro, lawsuit, Castro, Castro, Castro, Castros, Castro, Zulily, Castro, Castro, Castro, Zulily, Castro, lawsuit, Castros, Castros, Castro, Castros, lawsuit, Castro"
4,‘I went downhill’: man falsely accused of rape on becoming a hate figure,Jordan Trengove faced trial after being accused by Eleanor Williams after a night out in 2019When 18-year-old Jordan Trengove agreed to go on a night out with Eleanor Williams in 2019 he had no idea that accepting her invitation would not just land him in jai…,https://www.theguardian.com/uk-news/2023/jan/03/i-went-downhill-man-falsely-accused-of-on-becoming-a-hate-figure,When 18yearold Jordan Trengove agreed to go on a night out with Eleanor Williams in 2019 he had no idea that accepting her invitation would not just land him in jail but make him the enemy of a global antigrooming movement with its own line of merchandise. The teenagers and some friends went drinking in Barrow on 9 March 2019 and as far as Trengove can remember Williams disappeared halfway through the night. He didnt pay much attention because he was distracted by another girl Ebony that evening. Ebony ended up with him in the back of a police van after officers spotted him arguing at a taxi rank in the early hours. They said youre drunk lets take you home remembers Trengove. The duo were dropped off at a friends house and ended up having sex on the sofa according to Ebony when she was called to give evidence at Williamss trial more than three years later. Weeks passed and one day Trengove was asleep in bed when police arrived to arrest him on suspicion of raping drugging and assaulting Williams. He protested his innocence and cooperated with police handing over his phone and submitting to an intimate body check so that officers could look for signs of the violent struggle Williams had described. There was no bruising no markings says Trengove now. But the damage was done. The next day someone painted the word rapist on his house and smashed in the windows. Before he knew it he was in court being remanded in custody charged with three counts of rape. Williams had produced evidence that Trengove had admitted to the rapes goading her on Snapchat calling her a dirty slag who was well up for a shag that night. It took police all too long to realise that this Snapchat account had been created using the wifi at the Barrow home of Williamss mother. Prison was very very scary he said. I was put in cells with actual rapists and paedophiles. I shared with a man who admitted to me he was guilty of sending pictures to eightyearold kids. Trengove spent his 19th birthday in prison serving 10 weeks on remand before police realised the evidence against him didnt stack up. The girl Trengove actually had sex with on 9 March gave police a selfie she had taken in the back of the police van while suspicion grew that far from being a particularly unlucky victim of multiple rapes Eleanor Williams was in fact a fantasist making one false allegation after the other with the help of social media. Not only did she create fake profiles to frame Trengove and some of her other victims she started up explicit conversations with innocent men on Tinder Snapchat or the intimate photo sharing site OnlyFans where she had an account and renamed them in her phone so that it looked as though their penis photos and propositions were coming from those she falsely accused. Out of jail Trengove was a free man but an outcast in Barrow. I was barred from everywhere. I was called a rapist a nonce. Within a few months he moved away. I thought it would end but the first day we moved in I had someone shout rapist at me. It was clear then that no matter where I went someone would always know. Things calmed down and then on 20 May 2020 Williams posted the fatal Facebook page alleging that she had been trafficked and exploited by an Asian grooming gang. She didnt name Trengove but his name soon became linked with the case regardless of his skin colour as more than 100000 people joined the Justice For Ellie Facebook page and bought elephantthemed wristbands keyrings and bumper stickers to express solidarity. A rally was organised where convoys of cars drove from Barrow to the town where Trengove now lives flying Justice for Ellie banners. He tried to tell protesters the truth but no one would listen. I went downhill he said. I tried killing myself over it. I tried running away from it all. I tried ending my relationship walking away from my family. The amount of problems put on my life just from one Facebook post is ridiculous. Because Im autistic its even harder. I got diagnosed with complex PTSD because of it all. Ever since this went on I feel like Ive been trapped in my own little prison he added. I dont feel like I have a life any more. Trengove became a father in August 2021 but struggled to bond with his son as Williamss trial kept getting postponed. When I was in his newborn stage I couldnt love him like a dad should. I tried to distance myself away. My whole life just became sitting in playing video games. That was the way of escaping the reality of my life. Trengove now 22 was in court on Tuesday to hear the jury find Williams guilty of eight counts of perverting the course of justice including three involving him. Im over the moon he said afterwards pledging to go home and give his son a big hug. Ive got my life back.,Fiction to look out for in 2023,Somewhat Positive,330,"unproductive, virus, inevitable, clash, Sting, violent, Furious, misfit, Unfinished, sad, devastating, dark, dying, darkness","adult, died, sex, Fraud","Bret, Easton, Ellis, Salman, Rushdie, Eleanor, Catton, Benjamin, Myers, Cuddy, Bloomsbury, Shy, Faber, Deborah, Levy, Blue, Hamish, Hamilton, Amanda, Craig, Richard, Fords, Frank, Bascombe, Bascombe, Paul, Murray, Hamish, Hamilton, Lorrie, Moores, Aybmi, Adby, Caleb, Azumah, Nelsons, Guy, Gunaratne, Yahya, Bas, Richards, Mat, Osman, Michael, Bracewell, Meg, Clothier, Umberto, Eco, Beatrice, Wang, Xiaobo, Yan, Yan, Han, Kang, Deborah, Smith, Emily, Yae, Won, James, Hynes, Sparrow, Zadie, Smith, Hamish, Hamilton, Sebastian, Faulkss, Modern"
