Article,Title,Description,URL,Content,Headline,Headline Sentiment,Offense Rating,Negative Words,Offensive Words,Tags
19,Student accused of egging King Charles 'banned from Tinder and Hinge' after being charged,"Patrick Thelwell (pictured), 23, says he has been blocked from Tinder and Hinge - saying that 'the state' will 'stop you getting laid' if you do not 'obey' - after he was charged with trying to egg King Charles.",https://www.dailymail.co.uk/news/article-11614593/Student-accused-egging-King-Charles-banned-Tinder-Hinge-charged.html,Student accused of egging King Charles says he has been banned from dating apps Tinder and Hinge after being charged with threatening behaviour Patrick Thelwell 23 accused of trying to egg the King is kicked off dating apps He complained about ban from Tinder and Hinge and how it affected his sex life Student was charged with threatening behaviour after allegedly throwing eggs Obey the state or theyll stop you getting laid he complained on Instagram A student accused of egging King Charles has complained that he has been banned from dating apps after being charged with threatening behaviour. Patrick Thelwell says he has been blocked from both Tinder and Hinge saying that the state will stop you getting laid if you do not obey. Student and campaigner Thelwell 23 was held by police in November after he allegedly threw eggs at King Charles. All four eggs missed and the monarch walked away unscathed after the incident in York on November 9 last year. Student and campaigner Patrick Thelwell 23 was held by police in November after he allegedly threw eggs at King Charles pictured on November 9 last year Patrick Thelwell pictured 23 will appear at York Magistrates Court on January 20 charged with threatening behaviour contrary to Section 4 of the Public Order Act 1986 The activist claims he is facing a 5000 fine and up to six months in prison and was charged with threatening behaviour in December. He will appear at York Magistrates Court on January 20 charged with threatening behaviour contrary to Section 4 of the Public Order Act 1986. On a Instagram story he wrote LOL I got banned from Tinder and Hinge because Im accused of a threatening crime. Obey the state or theyll stop you getting laid. After two attempted alleged attempted eggings of the King over the course of two months last year an urgent review was launched into his safety. Mr Thelwell previously said that he may call the monarch to give live evidence at court in his defence. He said in December I am charged with section four of the public order act. My plea hearing is on the 20th of January I will plead not guilty of course. The charge relates to someone feeling fear of imminent physical violence. The question is did the King fear imminent violence So I dont know how to get an answer to that without getting a statement from him. Asked if he would also call the King to give live evidence he replied These are questions for my solicitor I think. It should be fun. On a private Instagram story Mr Thelwell wrote LOL I got banned from Tinder and Hinge because Im accused of a threatening crime Obey the state or theyll stop you getting laid Mr Thelwell pictured told his Instagram followers Hinge does not authorise people to create accounts if they have committed been convicted of or plead no contest to a felony or any crime involving violence or threat of violence. North Yorkshire Police said at the time Yesterday we arrested a 23yearold man on suspicion of a public order offence during the Royal visit. The man has been interviewed and released on police bail. He was detained following an incident which occurred as King Charles III and the Queen Consort arrived at Micklegate Bar in York yesterday. A University of York spokesperson said in November We are aware of eggs being thrown and are appalled by the images reported by the media today. As a community built on the values of respect and decency the University condemns such behaviour and we will be reviewing the incident in line with our misconduct procedures. Nick Price head of the CPS special crime and counter terrorism division said in December The CPS has authorised North Yorkshire Police to charge Patrick Thelwell with threatening behaviour contrary to Section 4 of the Public Order Act 1986. This follows an investigation by police into an incident in which eggs were thrown at HM The King in York on November 9 2022. The Crown Prosecution Service reminds all concerned that criminal proceedings against Patrick Thelwell are active and that he has the right to a fair trial. A statement by the CPS added at the time It is extremely important there should be no reporting commentary or sharing of information online which could in any way prejudice these proceedings. The function of the CPS is not to decide whether a person is guilty of a criminal offence but to make fair independent and objective assessments about whether it is appropriate to present charges for a criminal court to consider. Sorry we are not currently accepting comments on this article.,No Headline,Extremely Negative,190,-,-,-
20,The Cut’s 20 Most-Read Stories in 2022,"The Cut stories our readers were most deeply engaged with in 2022, including features on Meghan Markle, Dianne Feinstein, Marjorie Dannenfelser, Nell Diamond, pronouns, ten years of Tinder, the true story behind Netflix’s ‘The Watcher,’  and more.",http://www.thecut.com/article/the-cuts-20-most-read-stories-in-2022.html,Our mission at the Cut is to meet you the readers where you are in your careers your relationships styles and skincare routines. We want to bring you authoritative service thoughtprovoking reporting and intimate personal essays that youll share in your group text. The 20 stories below our most read this year are ones that did just that. From Brock Colyars meditation on pronouns to original reporting on the dangers of the latest trendy weightloss drug Ozempic from Allison P. Daviss vibe shift heard round the digital world to the definitive take on the Amber Heard backlash beautifully written by Claire Lampen these are the articles you spent the most time with. This list which is measured by total collective minutes of audience engagement is just a small sample of the work the Cut puts out alongside New Yorks print edition and its other five digital sites and a growing portfolio of newsletters. For more of all of it be sure to sign up for the Cuts daily newsletter and subscribe to New York. 20. Girl Power Gets Sober By Katie Heaney Can Holly Whitaker help women quit drinking better than AA can Read the story 19. The Woman Who Killed Roe By Kerry Howley Marjorie Dannenfelsers singleminded pursuit of an end to abortion. Read the story 18. Waking Up From the Nap Dress By Matthew Schneier How the proudly personally privileged Nell Diamond convinced so many women to wear pajamas in public. Read the story 17. I Didnt Start Weight Lifting Because I Wanted to Be Strong By Casey Johnston I was still obsessed with dieting. But eventually I saw what Id been missing. Read the story 16. Tinder Hearted By Allison P. Davis How did a dating app become my longest running relationship Read the story 15. What White Men Say in Our Absence By Elaine Hsieh Chou Their darkest thoughts on Asian women have obsessed me for years. With the spike in violence against us my private fear has become a public one. Read the story 14. They Then and Now By Brock Colyar Asking for pronouns has become a social standard. Who is it serving Read the story 13. My Mom Has No Friends By Monica Corcoran Harel The loneliness of growing older made bearable with playdates. Read the story 12. Losing My Ambition By Amil Niazi After a career of making strategic moves Im embracing mediocrity. Read the story 11. The Institutionalist By Rebecca Traister Dianne Feinstein fought for gun control civil rights and abortion access for half a century. Where did it all go wrong Read the story 10. A Murder Solved in DMs By Jennifer Swann When Daisy De La O was killed friends looked to social media for the man they suspected had done it. They found him. Read the story 9. Epiphany in the BabyFood Aisle By Jessi Klein On a trip to the grocery store one day I had a realization about me my son and the meaning of life. Read the story 8. The Rich New York Women Who Love Their Fake Birkins By Sangeeta SinghKurtz Among a certain set counterfeit luxury bags may be more popular than the real thing. Read the story 7. You Might Go Through Hell for Your PostOzempic Body By Devin Tomb Patients describe constant nausea and vomiting. But doctors say everyone is asking for it. Read the story 6. A Vibe Shift Is Coming By Allison P. Davis Will any of us survive it Read the story 5. Teenage Justice By Elizabeth Weil A list of boys to look out for appeared on a highschool bathroom wall last fall. The story of one of them. Read the story 4. Which Women Do We Choose to Believe By Claire Lampen Amber Heard claims an extremely famous man abused her for years. Why do so many people hate her for it Read the story 3. What Happened to Maya By Dyan Neary When a 10yearold girl complained of mysterious pain a doctor suspected child abuse. How far would she go to prove it Read the story 2. Taking Another Look at The Watcher By Reeves Wiedeman What we know about the case four years later. Read the story 1. Meghan of Montecito By Allison P. Davis Shes left the Firm behind. Harrys found a polo team in Santa Barbara. The kids are doing great. Now shes ready for her next act. Read the story,Student accused of egging King Charles 'banned from Tinder and Hinge' after being charged,Extremely Negative,1380,"threatening, complained, threatening, laid, complained, complained, threatening, laid, missed, threatening, prison, threatening, threatening, threatening, laid, urgent, plea, guilty, threatening, laid, threat, suspicion, offence, appalled, condemns, terrorism, threatening, concerned, prejudice, guilty, offence, Sorry","sex, crime, fear, violence, fear, violence, crime, crime, violence, violence, crime, criminal, criminal, criminal","King, Charles, Patrick, Thelwell, lawsuit, King, Charles, Patrick, Thelwell, Thelwell, Charles, Patrick, Thelwell, Charles, Patrick, Thelwell, Thelwell, Thelwell, Thelwell, Hinge, Charles, III, Nick, Price, Patrick, Thelwell, lawsuit, lawsuit, Patrick, Thelwell, harassment, lawsuit"
21,Vizio’s M-Series Sound Bar Turned My Apartment Into a Movie Theater,Want to feel like you’re scaling Mount Doom or racing against Vin Diesel? Get this affordable but surprisingly powerful speaker set.,https://www.vice.com/en/article/bvm49w/vizio-m-series-sound-bar-review,I remember the first flat screen TV my family got. It was in the late 2000s when nice TVsaka TVs with fancy remotes onscreen guides and slimmer profileswere becoming ubiquitous. At the time I was obsessed with the Sony Bravia bouncyball commercial soundtracked by Jose Gonzalezs Heartbeatsit had basically become part of my personality thank god Tinder didnt exist then. I started to believe that in order to have real beauty in my life I needed superior electronics. When the Great TV Wave finally hit my family I went to Walmart with my dad and we ended up picking up a nascent modestly sized Vizio flat screen. At the time I thought it was the sickest TV ever but as more and more of my friends picked up better tubes from Samsung Sony Hisense and Phillips I started to feel the Vizio was a cheap subpar alternative to brands that represented The Good Stuff. This is all to say that Ive had an emotional bias against Vizio for a long time. I know Im not alone Im now a Vizio apologistdefender as Ill get into below and almost every time I tout the brand to people theyre shocked. If we were playing a word association game a year ago and you said Vizio I would have said garbage. But I no longer believe any of this. The new Vizio MSeries 2. 1 sound bar has changed my perception of the entire brand. Recently I had a week off work and made it my goal to do two things rewatch all three Lord of the Rings movies and finally start playing Elden Ring on my Playstation 5 I dubbed it Ring Week. It had long been on my apartment todo list to pick up a sound bar for my TV a TCL 5Series that I really like which has a great picture but subpar speakers as most factory TVs do. I knew that to reach multimedia paradise it was time for an upgrade. I set out first to find an allinone sound bar since my living room isnt humongous and surround sound wasnt a priority of mine. After surveying the singlepiece sound bars I found that some of Vizios models are actually quite beloved like this toprated Vizio MSeries with over 2000 reviews. Ultimately however I decided that I deserved a subwoofer and that I didnt care if my downstairs neighbor had to listen to a deafening runthrough of The Two Towers iconic Battle of Helms Deep. I knew I wanted 2. 1 channels Dolby Atmos a wireless subwoofer and something that would pair well with 4K HDR since Ive been waiting for the right time to watch my Criterion Collection 4K UHD copies of Lost Highway and Raging Bull. Id already watched a 4K UHD transfer of The Last Waltz which looked absolutely unreallike otherworldly but I unfortunately experienced it through my TCLs mediocre speakers crying face emoji. After scouring the internet for opinions and reviews and taking into account a lot of user comments on Amazon I came to accept that Vizio is actually one of the most respected sound bar brands for under 400. The internet seems pretty confident that if youre shopping over that price range the Sonos Arc and Sonos Beam reign supreme. So for 300 smackers The Vizio MSeries 2. 1 sound bar seemed like the best option to me. And since thats the price of seeing the new Avatar movie in IMAX about 10 times it felt justified. The equipment couldnt have been easier to put togetherI just connected the main sound bar to the HDMI to the TV and hooked up the power. For the subwoofer I figured it would be pretty complicated to set up since it was wireless instead I literally turned it on and it paired immediately and Ive never had to think about it since. I wondered if syncing the sound bar to my TV would be a pain in the ass but it quickly recognized it and paired and now I barely even have to use the remote that came with the sound bar except to switch between Movie and Game modes. The experience of watching TV and playing games with the sound bar is amazing especially if youve never owned a good sound bar. Within minutes of starting The Fellowship of the Ring I was floored by the depth of bass and general fullness of sound the speaker and subwoofer brought into my apartment. I felt like I was at the movies watching Sauron hammer people mercilessly and literally sensing the vibrations in my body. Later on while screening Return of the King as Sam and Frodo scaled Mount Doom it felt like lava flowed around me as I too struggled to ward off the grip of evil. Watching a Fast and Furious movie as I give this piece a final read I briefly questioned whether Ill ever even go to the movies again. Spoiler alert I definitely will. But this bad boy isnt only good for action. Im also rewatching Friday Night Lights for the sixth or eighth time dont hate and the Vizio makes even the quiet moments feel immersive. Case in point In one scene characters are eating at a diner having a conversation as music plays in the background. Not yet used to the sound bar I literally paused the show thinking someone was playing music outside my apartment in the street of course I realized that the bar and subwoofer just made it sound like music was coming from a different part of the room. Amazing moment. TLDR The Vizio MSeries 2. 1 sound bar isnt just proof that an affordable sound bar can be mindblowingly goodits proof that people can change. While I went into 2022 thinking that Vizio was a wack brand that should be avoided at all costs I exited the year feeling like scoring one of its sound bars was among the best things Id ever done for myself. Literally everything sounds better on this thing even talk show clips on YouTube. If you do one nice thing for yourself in 2023 and you dont already have a sound bar or have a bad one pick up the Vizio MSeries 2. 1. On my end I reckon its time to revisit The Hobbit so if you need me I wont be available for the next nine hours MGM Lion roar. The Vizio MSeries 2. 1 sound bar is available on Amazon. The Rec Room staff independently selected all of the stuff featured in this story. Want more reviews recommendations and redhot deals Sign up for our newsletter.,The Cut’s 20 Most-Read Stories in 2022,Extremely Positive,670,"Sober, Absence, loneliness, Losing, mediocrity, wrong, Fake, vomiting, fall, abused, hate, complained, pain","drug, Killed, abortion, violence, fear, gun, abortion, Murder, killed, Hell, abuse","Brock, Colyars, Allison, P., Daviss, Amber, Heard, Claire, Lampen, Katie, Heaney, Holly, Whitaker, Kerry, Howley, Marjorie, Dannenfelsers, Matthew, Schneier, Nell, Diamond, Casey, Johnston, Allison, P., Davis, Elaine, Hsieh, Chou, Brock, Colyar, Monica, Corcoran, Harel, Amil, Niazi, Rebecca, Traister, Dianne, Feinstein, Jennifer, Swann, Daisy, De, La, O, Jessi, Klein, Sangeeta, SinghKurtz, Devin, Tomb, Allison, P., Davis, Elizabeth, Weil, Claire, Lampen, Amber, Heard, Dyan, Neary, Reeves, Wiedeman, Allison, P., Davis, Harrys"
22,"The Moneyist: ‘I want to meet someone rich. Is that so wrong?’ I’m 46, earn $210,000, own a $700,000 home. I’m tired of dating losers.",‘I see wealth as a sign that someone is ambitious and aims high.’,https://www.marketwatch.com/story/i-want-to-meet-someone-rich-is-that-so-wrong-im-46-earn-210-000-own-a-700-000-home-im-tired-of-dating-losers-11671690192,Dear Quentin Ive reached the point in my life where I want to settle down but I recently had a disagreement with a friend about my priorities and I would appreciate your perspective. Im 46 a collegeeducated singleton and earn 210000 not including my annual bonus. I have paid off my student loans and own my home. Its worth about 700000 and theres about 400000 left on the mortgage. Heres my issue I want to meet someone rich. Is that so wrong My friend expressed dismay when I told her that but I see wealth as a sign that someone is ambitious and aims high. Im sick of dating losers. The last person I dated had been living in the same rentcontrolled apartment for nearly 20 years. Its the size of my dining room. I know living in a rentcontrolled apartment is something that is sought after in a city like Los Angeles and its environs. Maybe that was good when he was 20. But hes now nearly 50. Am I being too judgmental When I expressed my feelings about limiting my search to dating a wealthy man my friend gave me a look and took a long slow drink of her margarita. That was her way of showing disapproval. But I have worked hard to have what I have and I dont see anything wrong with wanting a partner who has the same level of assets and ambition as I have. I work as an interior designer and my business continues to grow. P. S. I come from an uppermiddleclass family one that has always worked for what they have. My parents were both successful Realtors. Single for the Holidays Dear Single If you objectify someone for earning less than your annual salary be prepared for an even wealthier person to do the same to you. There are many people who earn a quarter of what you earn who would rightly see themselves as winners. The median household income in the U. S. hovers at around 71000 a year. Better to regard your own income as a gift rather than a barometer by which to measure or judge others. Theres a big difference between wanting to date a guy who is wealthy andor has a job and is financially independent and describing someone you dated as a loser. Its possible that your friend quietly rolled her eyes at that. Perceptions of what constitutes wealthy are relative. The first suggests you believe you are owed the same yield on your relationship as you have earned andor inherited from your parents in your own lifetime. That inheritance may include an education that enabled you to go to college andor money inherited from your parents. The second implies anyone who has not had the same opportunities as you or has not chosen a job that pays as well such as a teacher nurse or social worker some of the most important professions in the world is not up to par. Neither of these positions sit well with me. Nearly half of people who are dating said in this survey that financial transparency makes them more comfortable early on in the relationship. In other words money matters. And yet more than a third of people have hidden debt from their partner. Translation They know money matters. That said using wealth as the one filter for your search for a life partner could limit your choices and put the desire for material things or a certain lifestyle above other important criteria humility kindness intelligence compassion etc. They dont have Instagram META Baby boomers are expected to transfer up to 68 trillion in wealth to younger generations over the next 20 years according to one projection by the Investment Company Institute a global association of regulated funds. That would be the biggest intergenerational transfer in history. Some of that wealth will be in the form of property. The world is not built equitably or fairly. Black homeownership hovers at around 45 according to one recent estimate while the white homeownership rate is closer to 75. Against the backdrop of redlining the 2008 housing crisis and other structural barriers Black Americans are also far more likely than their white counterparts to be rejected for mortgages. Using wealth as the one filter for your search for a life partner could limit your choices and put the desire for material things or a certain lifestyle above other important criteria. Before we congratulate ourselves on where we have ended up in life its important to take a reality check about where we started. You want to find a life partner who has a similar or larger bank balance to you. They may or may not share your outlook on life financial goals regardless of their net wealth or income or have similar views on rich vs. poor. Most people are just lucky to own their own home. The median income needed to buy a typical home in the U. S. has risen to 88300 nearly 40000 more than it was before the start of the pandemic Lawrence Yun chief economist at the National Association of Realtors said last month. Silicon Valleys commercialization of peoples personal lives the lucrative crossroads of finance and romance which results in people swiping left or right on a carousel of images has brought new meaning to the dating market. And it is a market a carousel of smiling faces hoping for their dream match. People swipe right or left based on a variety of factors. Dating sites like Hinge Match. com MTCH A picture can tell a lot more about a person than they may be willing to reveal. So its hard to criticize you for something that most people do in myriad other ways. Just be mindful of the words you use and try not to allow one aspect of life however important it may be to you cloud your judgment. If youre looking at dollar signs and real estate you may miss the other factors that comprise a happy relationship. Do you share the same values Does he listen when you have something important to say Is he consistent Is he a man of his word Does he share his time generously Dating a rich guy wont make you happy even if one persons rich is another persons moderately well off. The bitter truth is that youre not the first person to want to use wealth as a green light to swipe right and you wont be the last. Just dont shortchange yourself in all those other areas. You can email The Moneyist with any financial and ethical questions related to coronavirus at qfottrellmarketwatch. com and follow Quentin Fottrell on Twitter. Check out the Moneyist private Facebook group where we look for answers to lifes thorniest money issues. Readers write to me with all sorts of dilemmas. Post your questions tell me what you want to know more about or weigh in on the latest Moneyist columns. The Moneyist regrets he cannot reply to questions individually. More from Quentin Fottrell I feel so betrayed Who should get my mothers diamond rings My late sister left them to her daughterinlaw. What options do I have I sold my late mothers home for 250000. I make 80000 and have 220000 in student debt. I want to buy a house. Should I use all my inheritance for a down payment This guy grifted me hard My date chose an exclusive L. A. restaurant. After dinner he accepted my credit card and we split a 600 bill. Shouldnt he have paid,Vizio’s M-Series Sound Bar Turned My Apartment Into a Movie Theater,Extremely Positive,290,"cheap, bias, tout, shocked, garbage, Lost, Raging, unfortunately, mediocre, complicated, pain, floored, mercilessly, struggled, evil, Furious, bad, hate, wack, bad","ass, Doom","Jose, Gonzalezs, Heartbeatsit, Sauron, Sam, Frodo"
