Article,Title,Description,URL,Content,Headline,Headline Sentiment,Offense Rating,Negative Words,Offensive Words,Tags
9,Microsoft is reportedly in talks to pump in $10 billion into OpenAI — the owner of ChatGPT — valuing the company at $29 billion,"Microsoft is negotiating to receive 75% of OpenAI's profits until it gets it recovers its investment, after which it would own 49% of the startup.",https://www.businessinsider.com/microsoft-talks-invest-billions-openai-chatgpt-owner-report-2023-1,Microsoft is reportedly in talks to pump in 10 billion into OpenAI the owner of ChatGPT valuing the company at 29 billion Microsoft is in talks to invest about 10 billion into OpenAI the startup behind the ChatGPT chatbot per Semafor. The investment would value OpenAI at 29 billion. Its now valued at about 20 billion. Tech giant Microsoft is in talks to invest about 10 billion into OpenAI the owner of the popular ChatGPT chatbot per a Semafor report on Tuesday which cited people familiar with the matter. The investment would value OpenAI at about 29 billion Semafors Liz Hoffman and Reed Albergotti reported. Its now valued at about 20 billion. The deal was targeted to close by the end of 2022 but it isnt clear if it has been finalized yet Semafor reported citing documents sent to prospective investors. The Wall Street Journal reported last Thursday that OpenAI was in talks to sell existing shares of the company in a tender offer that would value the firm at 29 billion. Venture capital firms including Thrive Capital and Founders Funds were in talks to invest at least 300 million in the share sales according to the Journal. As part of the current deal Microsoft is negotiating its proposing to get 75 of OpenAIs profits until it gets it recovers its investment after which Microsofts aims to get 49 stake in the company per the media outlet. Other investors are expected to own another 49 of the company while OpenAIs nonprofit parent would hold the remaining stake per Semafor. Microsoft told Insider it does not comment on speculation. OpenAI did not immediately respond to Insiders request for comment sent outside regular business hours. This would not be the first time Microsofts looking at an investment into OpenAI. The tech titan has already invested 1 billion into OpenAI in 2019. The Information reported in October that Microsoft was looking to increase its investment in the startup. OpenAI an artificial intelligence research lab was cofounded by Y Combinator alum Sam Altman Tesla SpaceX and now Twitter CEO Elon Musk and others in 2015. Sam Altman sama January 4 2023 It has been making waves recently with ChatGPT a platform launched in November as its able to generate written humanlike text. ChatGPT has been so hot Googles management has even issued a code red over the potential rival the The New York Times reported in December. Insider reporter Beatrice Nolan tested out the platform and asked ChatGPT to help her write cover letters for real jobs and recruiters told her they looked good enough for them to follow up. SMBs can easily upskill their workforce using this effective learning management solution Device deployment hits 1 million for two straight quarters How Paytm Soundbox is fuelling growth Jack Ma the billionaire founder of Alibaba who disappeared from public view in 2020 appears to resurface in Thailand as he prepares to give up control of his company Amazon Great Republic Day Sale best deals on phones iPhone 13 OnePlus Nord 2T 5G Redmi A1 and more Wipro sees FY23 revenue growth at 11. 512 Q3 profit growth beats analyst expectations Rupee falls 4 paise to close at 81. 34 against US dollar 13th Gen Intel Core i913900KS brings unprecedented speed to desktop users Credit expansion will taper down next year if deposits growth doesnt rise Axis Bank MD,"NASA's James Webb Telescope Finds Its First Exoplanet, a Major Milestone",Somewhat Positive,20,"['rocky', 'rocky']",[],"[Jacob, LustigYaeger, LustigYaeger, Kevin, Stevenson]"
10,How Big Is The Moon? - Worldatlas.com,"Earth’s moon is the fifth largest moon in the solar system with a diameter of 2,159-miles (3,475-kilometers), making it about 25% the size of Earth.",https://www.worldatlas.com/space/how-big-is-the-moon.html,The moon has a radius of 1080miles 1737kilometers. This means that the moons diameter is 2159miles 3475kilometers across. For comparison the diameter of Earth is 7918miles 12742kilometers. This shows that the moon is approximately a quarter the width of Earth. The moons size impacts specific processes on Earth the most notable of which is the tides. The moons gravitational pull causes the oceans to bulge on either side. As the planet rotates these bulges also rotate causing the rise and fall of seawater. Gravitational force is dictated by the size and distance of objects so if the moon were the size of Marss moons Phobos and Deimos it would not have as strong of a gravitational pull and thus would not affect the tides. Compared To Other Objects in the Solar System It can be hard to visualize just how big celestial bodies are and the moon is no exception. Earths moon is fairly big in comparison to other moons in the solar system but what exactly does that mean The moon orbiting Earth is the fifth largest moon in the solar system. Moons larger than ours include in decreasing order Ganymede Titan Callisto and Io. Even though Earths moon is not the biggest in the solar system it is the largest when compared to the planet it orbits. The moon is also quite a bit bigger than the dwarf planet Pluto which has a radius of 1477miles 2377kilometers. This makes Pluto around 70 the size of Earths moon. Compared to countries on Earth It still might be hard to visualize just how large the moon is when only comparing it to other celestial objects. Comparing the size of our moon to countries and continents on Earth might show more context into its sheer size. The United States of America has a diameter of 2897miles 4662kilometers making it almost the same width as the moon. However having the diameter of the moon only paints a part of the picture. To compare the moons size to the size of countries on Earth the surface area is required. The moons surface area is 14. 6million square miles 38million square kilometers. When compared again to the United States of America the moon has approximately four times as much surface area. This is smaller than the continent of Asia including Russia which boasts a surface area of 17. 2million square miles 44. 6 million square kilometers.,Microsoft is reportedly in talks to pump in $10 billion into OpenAI — the owner of ChatGPT — valuing the company at $29 billion,Extremely Negative,210,"['rival', 'falls']",[],"[Liz, Hoffman, Reed, Albergotti, Sam, Altman, Elon, Musk, Sam, Altman, sama, Beatrice, Nolan, Jack, Ma]"
11,Factbox: Global banks cut jobs as cost pressures mount - Reuters,"Banks have begun to trim jobs globally, hit by cost pressures as a result of inflation and shrinking revenues in many core business lines amid volatile markets that are making bank bosses nervous about profitability through the year.",https://www.reuters.com/business/finance/global-banks-cut-jobs-cost-pressures-mount-2023-01-11/,Factbox Global banks cut jobs as cost pressures mount LONDON Jan 13 Reuters Global banks are in the process of cutting over 6000 jobs as profits at lucrative investment banking units come under pressure from volatility in capital markets and fastrising interest rates according to a Reuters tally of reported cuts. Rapidly deteriorating economic conditions have also prompted lenders to build rainyday funds to brace for potential defaults. The following major banks have announced or been reported to be making job cuts BARCLAYS Barclays BARC. L cut its workforce in corporate and investment banking by under 3 a source told Reuters on Nov. 8 weeks after reporting a 45 slump in merger advisory fees. The British investment bank has performed well in recent quarters especially in fixed income trading but a blunder in the United States that saw it sell more securities than permitted has cost it hundreds of millions of dollars in penalties. CITIGROUP Citi C. N eliminated dozens of jobs across its investment banking division as a dealmaking slump continues to weigh on Wall Streets biggest banks Bloomberg News reported on Nov. 8. The U. S. lender has like its peers boosted its lending income as interest rates rise but the aggressive action by the Federal Reserve and other central banks has sparked fears of a downturn that could hit banks loan books in time. CREDIT SUISSE Credit Suisse CSGN. S is accelerating cost cuts Chairman Axel Lehmann said on Dec. 2 confirming a Reuters report as the bank races to slash its cost base by around 2. 5 billion Swiss francs 2. 68 billion. Credit Suisse had already said it would lay off some staff. The cost savings reported are likely to involve more job cuts than previously announced for the first wave of reductions including in its wealth business Reuters reported. The bank is cutting about 5 of its private banking headcount in Hong Kong two sources said. DEUTSCHE BANK Deutsche Bank DBKGn. DE Germanys largest bank cut staff in its investment banks origination and advisory teams in October in a move that affected mostly junior bankers. The cuts included dozens of staff in New York and London Reuters reported. GOLDMAN SACHS Goldman Sachs GS. N began laying off staff on Jan. 11 in a sweeping costcutting drive with around a third of those affected coming from the investment banking and global markets division a source familiar with the matter told Reuters. Just over 3000 employees will be let go the source who could not be named said on Jan. 9. A separate source confirmed on Jan. 11 that cuts had started. The longexpected jobs cull at the Wall Street titan is expected to represent the biggest contraction in headcount since the financial crisis. HSBC Under pressure from his biggest shareholder Chinas Ping An Insurance Group to improve profit HSBC HSBA. L Chief Executive Noel Quinn has in recent months accelerated plans to shrink its global empire and streamline its management. Reuters reported HSBC is shedding at least 200 senior managers as it prunes the ranks of chief operating officers it has across an array of country and business lines. The bank also announced it is selling its Canadian business for 10 billion removing around 4000 employees from its wage bill in a stroke. It also announced on Nov. 30 the sale of its much smaller New Zealand business and the closure of a further 114 branches in Britain leaving it with around a third of the outlets it had as recently as 2016. MORGAN STANLEY In December Morgan Stanley MS. N slashed about 2 of its workforce a source familiar with the companys plans told Reuters. The cuts reportedly affect about 1600 positions. The investment bank is making modest job cuts worldwide Chief Executive James Gorman said at the Reuters NEXT conference on Dec. 1 without giving numbers. Reuters had on Nov. 3 reported layoffs were coming at Morgan Stanley with dealmakers in its Hong Kong and mainland China businesses among those affected as strict Chinese lockdown rules weighed on activity. Sources said the cuts would go beyond usual attrition. WELLS FARGO CO Wells Fargo Co WFC. N slashed hundreds of jobs in its mortgage business across the United States Bloomberg News reported in December citing people familiar with the banks plans. We regularly review and adjust staffing levels to align with market conditions and the needs of our businesses the bank had said in an emailed statement to Reuters at the time without giving any details on the number of employees or units affected. BANK OF NEW YORK MELLON CORP Bank of NY Mellon Corp BK. N is preparing to cut about 3 of jobs this year according to a source familiar with the matter. The cuts would affect around 1500 employees. 1 0. 9321 Swiss franc Our Standards The Thomson Reuters Trust Principles.,How Big Is The Moon?,Generally Neutral,20,"['fall', 'hard', 'hard']",[],[]
12,MSI's newest Titan GT gaming laptop comes with the world's first 4K 144Hz Mini LED display,"MSI's Titan GT and Raider GE gaming laptops come with amazing new displays, along with powerful Intel and Nvidia CPUs and GPUs.",https://www.xda-developers.com/msi-titan-raider-vector-gaming-laptops-ces-2023/,MSI is refreshing some of its most popular and most powerful gaming laptops at CES 2023. Getting special treatment with options for up to the new 13th Gen Intel Core i9 HX CPUs and Nvidia RTX 4090 mobile GPU are the Titan GT series Raider GE series and Vector PE series. To make the lineup even more special the Titan GT and Raider GE pack special displays with the Titan GT having the worlds first 4K 144Hz Mini LED display. Alongside those there are creator laptops and more. The MSI Titan Raider and Vector gaming laptops The entire new series from MSI packs in plenty of performance with processors and graphics being pushed to 250W total full power and 5. 2 GHz frequency across all 8 performance cores in Intels 13thgen chip. Starting with the Titan GT that new 17. 3inch 4K 144Hz Mini LED display can hit 1000 nits of peak brightness and sport 1000 local dimming zones for more efficient gaming. Other design elements include the Cherry Mechanical PerKey RGB gaming keyboard 720p Windows Hello webcam with shutter and a MUX graphics mode switch. As for the Raider GE it has a 1610 aspect ratio 17inch QHD 240 Hz display which is new. The Raider GE also sports a new chassis and a new light bar at the front which is more vibrant. With the design of the Vector GP meanwhile the profile is much slimmer and theres a new minimalist effect that better suits STEM and engineering users. Youll notice that performance and design are a theme of a lot of MSIs new laptops at CES 2023. The MSI Titan GT77HX starts at 4299 when available. The MSI Raider GE78HX will start at 2999 when available. MSI Stealth gets a redesign and comes in different sizes MSIs Stealth series of gaming and content creation laptops are better than ever thanks to a refresh at CES 2023. The lineup now comes in 14 15 16 or 17inch screen sizes and is picking up performance refreshes with the latest 13th Gen Intel Core Hseries CPUs and Nvidia RTX 40series mobile GPUs. Of special note in the refreshed Stealth series are the newly designed Stealth 14 Studio and Stealth 16 Studio. These two new laptops sport a newer thin and lightweight magnesium alloy chassis. Other than that the Stealth 14 Studio sports MSI Vapor Chamber thermal design for better cooling and more thermal coverage. The Stealth 16 Studio meanwhile has a special trilateral Dynaudio 6speaker setup for immersive audio experiences. More importantly though the Stealth 16 Studio sports a 1610 aspect ratio UHD screen which has a high 120Hz refresh rate. Theres also new RGB lighting at the back of all of these laptops which illuminates the Stealth branding and bigger touchpads. Note that these two laptops along with the bigger Stealth 17 Studio also sport Nvidia Studio validation for use in game development or content creation. As for the special new Stealth 15 this gaming laptop sports a 240Hz QHD OLED display which is quite a rarity. The display hits 0. 2 ms response times and covers 100 of the DCIP3 Color Gamut. In terms of pricing the Stealth 17 Studio starts at 2799. The new Stealth 15 starts at 1600. The Stealth 14 will be available at Best Buy and will start at 1600. MSIs Stealth 16 will also be available at Best Buy and will come in at 1200. It isnt clear when these new products will be made available. The Cyborg 15 hits the entrylevel gaming price point In addition to refreshing its existing lineup MSI has launched a new entrylevel gaming laptop the Cyborg 15. This new gaming laptop sports quite a unique design sporting a translucent chassis. Its also thin and light and seems to be great for those who want retrofeeling tech. Priced starting at 999 the new Cyborg 15 comes with a 15. 6inch FHD screen tuned to the 144Hz refresh rate. It also features options for either the Intel Core i712650H or the Core i512450H CPU both of which are still last years 12thgeneration chipsets. As for the GPU you can pick either the Nvidia RTX 4050 or RTX 4060 mobile GPUs which come with either 8GB of GDDR6 RAM or 6GB of GDRR6 memory respectively. DDR5 RAM and WiFi 6E are standard as well as a PCIe Gen4 NVMe SSD. But going back to the design youll notice that the Cyborg 15 comes with a translucent scifilike outline around the side of the laptop. This means youll be able to peek through the corners and under your laptop and see the inner workings of the fan blades as well as the cooling. Its a trendy look and MSI has embedded its branding into geometric shapes for an extra show in the chassis. Even the keyboard has a bit of a translucent touch as the WASD keys are highlighted for instant ingame control. For curious minds MSI says this keyboard sports 1. 7mm key travel and there are even handy hotkeys for controlling your audio. As for the weight it comes in at 1. 98kg and is 21. 95 mm thin. In a press release MSI says this Cyborg 15 laptop is for those bored with the ordinary entry gaming design but those who are seeking something a bit more ordinary can check out the Katana Sword and Pulse MSI laptops. Along with bumps to Intel 13th Gen CPUs and RTX 40series graphics these have been updated with MUX switches for increased performance in gaming and for switching between hybrid graphics mode and discrete graphics mode. MSIs new pen with haptic feedback MSI is launching the new MSI Pen 2 at CES 2023. This nextgeneration digital stylus is quite unique as it works as a traditional pencil on paper thanks to a graphite tip but also with any laptop or Windows device that supports MPP 2. 6 technology. Pricing on the new pen was not shared but the new stylus sports 4096 levels of pressure sensitivity and like the Surface Pen 2 also has haptic feedback. Related MSI has refreshed the Creator series so that the Creator Z17 HX Studio and Creator Z16 HX Studio sport the latest 13thgen Intel HX CPUs and NVIDIA Studio graphics. The laptops also sport Vapor Chamber Cooler thermals for increased performance. Related to this is the refreshed Prestige series too. The new Prestige 14 Evo and Prestige 16 Evo support the latest Intel Core i7 Hseries CPU and the Prestige 16 Studio has the new GeForce RTX 40 series Laptop CPU. Theres even a new 13inch Prestige 13 Evo which is the lightest MSI laptop yet coming in at 2. 18 pounds. Capping out MSIs announcements is a refresh of the Modern series. The laptop picks up new color options including star blue and beige rose. These laptops also have a more MacBooklike design catered to everyday passion according to MSI. Pricing on these laptops was not announced ahead of CES 2023. Pricing on the Creator series was also not announced at the time of publishing. But you can pick up the Prestige 13 Evo for 1199. The Prestige 14 Evo will be 1299. And finally the Prestige 16 Evo will be 1899. Note that the Prestige 14 and Prestige 13 dont have a dedicated GPU. Only the Prestige 16 will offer the option for Nvidia RTX 4060 graphics with 8GB of GDDR6 memory.,Factbox: Global banks cut jobs as cost pressures mount,Generally Neutral,190,"['volatility', 'deteriorating', 'slump', 'blunder', 'slump', 'aggressive', 'fears', 'downturn', 'crisis', 'strict']",['stroke'],"[Axel, Lehmann, Noel, Quinn, James, Gorman, 'harassment']"
13,What is the Titan M2 security chip in Google’s Pixel phones?,Google's Titan M2 is a dedicated security co-processor made specifically for Pixel smartphones. Here's everything you need to know.,https://www.androidauthority.com/titan-m2-google-3261547/,Links on Android Authority may earn us a commission. Learn more. What is the Titan M2 security chip in Googles Pixel phones With the Pixel 6 series Google began developing its inhouse Tensor SoC. But that wasnt the first time the search giant used a piece of custom silicon in its smartphones the Pixel 2s Pixel Visual Core was technically the first. One generation later the company announced that Pixel 3 devices would include a hardware security module dubbed Titan M. Then in 2021 Google followed it up with the Titan M2. The security chip has since become a selling point for Google phones like the Pixel 7 series and Pixel 6a. So in this article lets take a closer look at the role of the Titan M2 in Pixel devices how it works and why its even necessary in the first place. What is the Titan M2 chip all about The Titan M2 is a dedicated security chip included in Pixel 6 and Pixel 7 series smartphones. Google designed the Titan M2 inhouse so that it could exercise complete control over its feature set. The chip is based on the RISCV CPU architecture and contains its own memory RAM and cryptographic accelerator. The Titan M2 is one of the many measures Google has employed to improve smartphone security over the years. The company uses the chip in its Pixel phones to provide an additional layer of protection on top of Androids default security measures. Google designed the Titan M2 chip to augment Androids default security measures. Take Androids mandatory fulldisk encryption. On most devices it relies on a security feature known as a Trusted Execution Environment TEE which is essentially the secure area of a processor. Android devices store their encryption keys within this secure area which is in turn guarded with your pattern PIN or passcode. In other words the TEE isolates cryptographic keys and never reveals them to the user or even the operating system. Related Everything you need to know about encryption Virtually all smartphone SoCs in this day and age have a TEE or similar secure environment. On Snapdragon chips its commonly referred to as the Qualcomm Secure Execution Environment QSEE. Apples Armbased chips like the M1 have the Secure Enclave. With these secure environments in place malicious apps cannot access decryption keys biometrics and other sensitive data. With the Pixel 3 Google decoupled the TEE from the chipset and used a separate security module instead. The Titan M which has now been replaced by the Titan M2 can almost be considered a standalone processor by itself. The chip has its own flash memory for storing sensitive data and runs its own minimal operating system sometimes called a microkernel. The Titan M2 is a separate chip that doesnt share resources like memory or cache with the main processor. Its worth noting that dedicated security chips arent a new concept. Many computer motherboards have a Trusted Platform Module TPM chip that serves the same purpose albeit with less flexibility. What does the Titan M2 chip do Unlike the main SoC that performs generalpurpose tasks a dedicated security chip like the Titan M2 executes very few functions. This vastly reduces the number of potential attack vectors since most software cannot directly interact with the security chip. As for what the security chip actually does lets start with booting the Android operating system. When you turn on a Pixel device the Titan M2 communicates with the bootloader to validate that youre running the latest known version of Android. This check ensures an attacker hasnt rolled back your devices operating system to an older potentially unsafe version. Google also states that the chip safeguards against malicious attempts to unlock the bootloader. The Titan M2 comes into play as soon as you press the power button quite literally. Once booted the phones storage remains encrypted and inaccessible until you clear the lock screen prompt. The Titan M2 plays a key role here as it stores the decryption keys. Even if an attacker tampers the operating system to try and bruteforce their way through the lock screen the chip will limit the number of attempts at the hardware level. Titan M2 will only reveal the decryption keys if you enter the correct pattern or PIN. But what if an attacker tries to tamper with the Titan M2 directly Google thought of that too. You cant change or update the chips firmware without the devices pattern or PIN. The company also says it hardened the chip against sidechannel attacks like power analysis and voltage fluctuations. The Titan M2 also supports Android StrongBox which is a safe storage space for cryptographic keys used by thirdparty apps. A payment app for example could request the chip to generate and store a private key for your saved cards. And with Androids Protected Confirmation the chip also supports the universal FIDO authentication standard. This means you can use Pixel phones as a physical twofactor authentication key for your online accounts. In terms of security Google treats it as on par with the 30 Titan Security Key. The Titan M2 hasnt revolutionized smartphone security by any means but it does eliminate some key potential attack vectors. Google is currently the only smartphone maker to use a dedicated security module. However that doesnt mean other Android devices arent secure enough. The Arm chips used in modern smartphones also have isolated and secure environments just not to the same degree as the Titan M2. Read next The best Pixelonly features explained,No Headline,Extremely Negative,210,"['bored', 'bumps']",[],[]
