Article,Title,Description,URL,Content,Headline,Headline Sentiment,Offense Rating,Negative Words,Offensive Words,Tags
22,"Michael Jordan Spotted Picking Up New $60,000 USD De Bethune DB27 Titan Hawk JPS Watch","NBA icon, watch collector, and WatchBox investor, Michael Jordan has just debuted De Bethune's latest creation the DB27 Titan Hawk JPS. Channel the heritage of competitive motorsports, the watch arrives in a stealthy black zirconium case matched with yellow t…",https://hypebeast.com/2022/12/michael-jordan-de-bethune-db27-titan-hawk-jps-watch-info,Michael Jordan Spotted Picking Up New 60000 USD De Bethune DB27 Titan Hawk JPS Watch Number 23 out of 25. NBA icon watch collector and WatchBox investor Michael Jordan has just debuted De Bethunes latest creation the DB27 Titan Hawk JPS. Channel the heritage of competitive motorsports the watch arrives in a stealthy black zirconium case matched with yellow titanium accents a direct translation of the John Player Special Formula One livery used by the F1 Lotus team. In keeping with the Titan Hawk familys use of advanced technical features combined with wearability and clean styling the 43mm watch is subtle at quick glance but offers 60 hours of power reserve via its caliber AUTOV2 movement and is incredibly light in both actual weight and appearance thanks to its floating lugs and lightweight material. Priced at 60000 USD and limited to just 25 pieces Michael Jordan was captured picking up number 23 from the WatchBox office. Check out the moment below. In other watch news the first Nautilus 5811 sale tests the market auctioning for 144000 USD.,"
		The best gaming laptops from CES 2023: ROG, Alienware, Razer, and more	",Extremely Positive,20,"['odd', 'doubt', 'expensive']",[],[Heres]
23,Big news and big views dominate 2022 - Reuters,This year has not been short on drama. Our best-read stories of 2022 are testament to that.,https://www.reuters.com/breakingviews/big-news-big-views-dominate-2022-2022-12-30/,Big news and big views dominate 2022 HONG KONG Dec 30 Reuters Breakingviews This year has not been short on drama. Our bestread stories of 2022 are testament to that. Elon Musks willtheyorwontthey Twitter debacle kept readers on tenterhooks via Refinitivs platforms and our two websites Breakingviews. com and Reuters. com. Among those headlines a column listing the many reasons why he might not seal the deal proved to be our most popular story of the year even though the entrepreneur ultimately decided to do it anyway. Another piece posing the hardhitting question What is Morgan Stanley MS. N smoking in Twitter LBO garnered plenty of clicks on Breakingviews. com and via Refinitiv. Vladimir Putins invasion of Ukraine thrust Russia into the spotlight. Almost a third of the bestread lists tackled the outbreak of war in Europe and its terrible ramifications. Views on the rouble and the prospect of the countrys economic collapse demanded attention. Its impact on China India and beyond was a recurrent theme. The seismic shock to oil and energy markets was another. Deals are a perennial favourite. This year was no exception. Two of our annual predictions envisaging that Mark Zuckerberg will break up Meta Platforms META. O and that Microsoft MSFT. O will buy Netflix NFLX. O respectively climbed to the bestread list on Reuters. com just as this piece went to press. A persuasive pitch for breaking up Chinese technology titan Tencent 0700. HK caused a stir across multiple platforms earlier in the year. On Breakingviews. com readers were more inclined to plunge into longer analytical articles including a column explaining why its time to worry about Greece again and a deep dive into the financial black hole otherwise known as zerointerest rates. A tasty mix of puns and crunchy arguments helped our coverage of food delivery group Just Eat Takeaway. coms TKWY. AS postdeal indigestion to go down a treat. The sorry story of leveragedfinance bankers 1. 5 billion writedowns also hit the spot. On Refinitivs news services a crisis at Credit Suisse CSGN. S surging inflation nailbiting U. S. midterms and Wall Street job cuts were among the other fastmoving stories to grab eyeballs. Mustreads were without a doubt the driver for our mostread lists in 2023. MOSTREAD OF 2022 ON EIKON Credit Suisse can stop rot with 5 bln cash call Wall Street job cuts will be shallow and painful Tencents Beijing woes make case for breakup Republican victory paves road to softer dollar Elon Musk probably wont buy Twitter If 8 inflation is worrying 3 could be worse What is Morgan Stanley smoking in Twitter LBO Oil price cap will harm not help Asia Russia is dry run for bigger China sanctions test Indias Russian oil binge carries hidden costs ON BREAKINGVIEWS. COM Tencents Beijing woes make case for breakup Elon Musk probably wont buy Twitter Banks LBO debt hangover may leave lasting scars Just Eat Takeaways best U. S. call is late dropoff Its time to worry about Greece again Central banks get sucked into financial black hole What is Morgan Stanley smoking in Twitter LBO Roubles strength is sign of Russias weakness Russian economic collapse will be hard to avoid China has already won and lost in Ukraine ON REUTERS. COM Elon Musk probably wont buy Twitter Mark Zuckerberg will split Meta take the verse Chinas belt and road strafed by Vladimir Putin Ukraine war flashes neon warning lights for chips Singapore trims Vladimir Putins fallback options Musks get out of Twitter card is worth 5 bln Tencents Beijing woes make case for breakup Netflix will be next on Microsofts shopping list Roubles strength is sign of Russias weakness Germanys gas action plan pulls its punches Follow KatrinaHamlin on Twitter CONTEXT NEWS The data for Breakingviews. com covers the period from Jan. 1 to Dec. 30 Reuters. com data covers Jan. 1 to Dec. 29 while Eikon data covers Jan. 1 to Dec. 25. Our Standards The Thomson Reuters Trust Principles.,"
Michael Jordan Spotted Picking Up New $60,000 USD De Bethune DB27 Titan Hawk JPS Watch
",Extremely Positive,10,['limited'],[],"[Michael, Jordan, Michael, Jordan, Michael, Jordan]"
24,Take Five: Welcome to 2023 - Reuters,"A potential shift by the world's most dovish major central bank, inflation pressures abating, a turn in the economic outlook and oil markets suffering their biggest tumble in decades: Welcome to 2023!",https://www.reuters.com/business/take-five/global-markets-themes-takealook-2023-01-06/,Take Five Welcome to 2023 LONDON Jan 6 Reuters A potential shift by the worlds most dovish major central bank inflation pressures abating a turn in the economic outlook and oil markets suffering their biggest tumble in decades Welcome to 2023 A raft of data should shed light on some of those trends and tribulations while in the United States the earnings season begins. Heres a look at the week ahead in markets from Kevin Buckland in Tokyo Lewis Krauskopf in New York and Amanda Cooper Naomi Rovnick and Karin Strohecker in London. 1 EARNINGS AND INFLATION The week ahead brings a critical read into two key themes for Wall Street in 2023 the health of corporate profits and inflation. Corporate America starts reporting fourthquarter results and investors will be looking for signs of a potential economic slowdown filtering through to companies bottom lines. Friday alone sees results from banks Wells Fargo WFC. N and Citigroup C. N healthcare titan UnitedHealth Group UNH. N asset manager BlackRock BLK. N and Delta Air Lines DAL. N. Consensus analyst estimates call for a 1. 6 decline in SP 500 Q4 earnings versus the yearago period according to Refinitiv IBES. Some reckon 2023 projections are still too rosy given recession risks. Meanwhile the December U. S. consumer price index is out on Thursday. Any signs that inflation continues to ease will not only reinforce the peak rates view but could fuel talk that rate cuts could come later this year. 2 GAME OF CHICKEN Investors will have a keen eye on Tokyos inflation numbers on Tuesday the data point that first tipped the market to a potential Bank of Japan BOJ policy shift. The Tokyo data which frontruns the national numbers often by several weeks surged to a fourdecade high in the previous reading on Nov. 25. Less than a month later the BOJ raised the tolerance ceiling for Japans 10year government bond yield catching market players wrongfooted. The yen has strengthened to sevenmonth highs on rising expectations for a further hawkish shift even as BOJ officials maintain the move was a oneoff. Their next policy decision comes on Jan. 18. Australias inflation data follows on Wednesday and could be crucial for a Reserve Bank board that is finely poised between pausing rate hikes and accelerating them. 3 A CRUDE AWAKENING Crude oil markets are off to a rocky start kicking off 2023 with a near doubledigit tumble in the worst start to a year in three decades. The outlook is far from certain. Worries about a recession especially in the worlds top two consumers the United States and China weigh heavily. But potential supply chain problems could provide support. Insuring vessels to ship Kazakh crude a replacement option for Russian crude for European consumers via the Black Sea could prove more expensive and challenging. A waiver for Russian oil shipments subject to a price cap introduced in early December runs out on Jan. 19. After that sanctions kick in for shipments breaching regulations. With crude oil volatility soaring 2023 might be anything but plain sailing for producers and consumers alike. 4 TROUBLE AND INDUSTRIAL STRIFE Transport and public sector strikes a softening housing market redhot inflation and consumers too fearful to spend. Thats the backdrop for November UK economic output data on Friday likely confirming that a lengthy recession is coming. Following nine consecutive rate rises by the Bank of England and more to come British mortgage approvals sunk to their lowest level in November since the coronavirusinduced market slump of June 2020 recent data showed. As price pressures and higher borrowing costs bite Prime Minister Rishi Sunak has pledged to halve inflation grow the economy reduce public debt and cut health service waiting lists. Still Deutsche Bank sees high inflation persisting this year no rate cuts until 2024 and fiscal policies becoming more austere. Barclays expects the UK economy to keep contracting until the end of the third quarter of 2023. 5 GREEN SHOOTS For the euro area at least the first green shoots of economic hope are emerging. Inflation is tumbling thanks to a decline in wholesale natural gas and power prices. Gas storage tanks boast healthy inventory levels and temperatures are mild after a vicious cold snap in early December. Dutch natural gas futures a benchmark for the region have wiped out all the gains made after Russias invasion of Ukraine last February. It takes time for declines in market prices to filter through into household bills but signs are positive for cashstrapped consumers and businesses. Average fuel prices are down sharply from the highs of mid2022 as well. Economic recovery may still be a way off but the anticipated recession might not be quite as bad as expected gas prices and data releases in coming days will no doubt be watched closely. Our Standards The Thomson Reuters Trust Principles. Read Next Take FiveMarket themes for the week ahead Please be advised there will be no Take Five market themes for the week ahead on either Friday Dec. 23 or Friday Dec. 30.,Big news and big views dominate 2022,Extremely Positive,500,"['debacle', 'outbreak', 'terrible', 'collapse', 'shock', 'break', 'breaking', 'worry', 'sorry', 'crisis', 'doubt', 'rot', 'shallow', 'painful', 'breakup', 'worrying', 'worse', 'harm', 'breakup', 'debt', 'scars', 'worry', 'sucked', 'weakness', 'collapse', 'hard', 'lost', 'split', 'warning', 'breakup', 'weakness']","['dive', 'hole', 'Republican', 'hole']","[Elon, Musks, Vladimir, Putins, Mark, Zuckerberg, Elon, Musk, Elon, Musk, Elon, Musk, Mark, Zuckerberg, Vladimir, Putin, Vladimir, Putins, KatrinaHamlin]"
25,‘I didn’t steal funds’ says former crypto titan Bankman-Fried,"In a highly unusual post-arrest blogpost a month after his arrest, he said he 'didn't stash billions away'.",https://www.aljazeera.com/economy/2023/1/12/i-didnt-steal-funds-says-former-crypto-titan-bankman-fried,I didnt steal funds says former crypto titan BankmanFried In a highly unusual postarrest blogpost a month after his arrest he said he didnt stash billions away. Sam BankmanFried has said he did not steal money and blamed the collapse of his nowbankrupt FTX exchange on a broad crash in cryptocurrency markets in a highly unusual blog post a month after his arrest on US fraud charges. Federal prosecutors in Manhattan in December said BankmanFried stole billions of dollars from FTX customers to pay debts for his cryptocurrencyfocused hedge fund Alameda Research buy lavish real estate and donate to US political campaigns. He has pleaded not guilty. The Substack blog post a rare public statement by a US criminal defendant amounts to a preview of the defence case BankmanFried may present when his trial begins on October 2. I didnt steal funds and I certainly didnt stash billions away BankmanFried wrote. Defence lawyers typically advise clients to stay silent before trial because prosecutors may use their comments against them in court. A spokesman for BankmanFried declined to comment. A spokesman for the US Attorneys Office in Manhattan declined to comment. In the post BankmanFried did not directly address many of the other charges brought against him by federal prosecutors in Manhattan last month namely that he misled investors and lenders about the financial conditions of FTX and Alameda. He wrote that he had a lot more to say. The 30yearold onetime billionaire wrote that Alameda failed to hedge against an extreme crash in the cryptocurrency markets which ultimately came to pass last year. As Alameda became illiquid FTX International did as well because Alameda had a margin position open on FTX BankmanFried wrote. Last month two of his closest associates pleaded guilty to defrauding the trading platforms customers and agreed to cooperate with prosecutors investigation. Caroline Ellison Alamedas former chief executive said in her plea hearing that BankmanFried and other FTX executives received billions of dollars in secret loans from Alameda. BankmanFried was released on a 250m bond in December and put under house arrest at his parents Palo Alto California home which was pledged as collateral for his return to court. Best recovery scenario In the post BankmanFried also said FTXs US wing is fully solvent and that its international unit has many billions of dollars in assets. If it were to reboot I believe there is a real chance that customers could be made substantially whole he wrote. The comments came after a lawyer for FTX on Wednesday told a federal bankruptcy court in Delaware that the exchange had located more than 5bn in liquid assets and that the company plans to sell nonstrategic investments that had a book value of 4. 6bn. That did not include assets seized by the Securities Commission of the Bahamas where FTX was based and where BankmanFried lived before he was extradited to the United States. Bahamian authorities said they have seized 3. 5bn but FTX says those funds are worth as little as 170m. On Wednesday night BankmanFried replied on Twitter to a user named wassielawyer who said a sale of the FTX exchange was viable. yup my sense is that is and always has been the best recovery scenario for customers wrote BankmanFried. FTX declared bankruptcy on November 11 the same day BankmanFried stepped down as chief executive officer.,Take Five: Welcome to 2023,Extremely Positive,370,"['suffering', 'tumble', 'critical', 'decline', 'recession', 'risks', 'hawkish', 'CRUDE', 'Crude', 'rocky', 'tumble', 'worst', 'Worries', 'recession', 'problems', 'crude', 'crude', 'expensive', 'challenging', 'crude', 'volatility', 'TROUBLE', 'STRIFE', 'fearful', 'recession', 'sunk', 'slump', 'debt', 'austere', 'decline', 'tanks', 'vicious', 'cold', 'declines', 'sharply', 'recession', 'bad', 'doubt']",[],"[Kevin, Buckland, Lewis, Krauskopf, Amanda, Cooper, Naomi, Rovnick, Karin, Strohecker, Rishi, Sunak]"
26,"MSI reveals an army of laptops, monitors, PC components, and more at CES 2023","MSI's products cover practically the entirety of the PC and PC gaming industry, and its latest horde of products announced during CES 2023 continues that trend.",https://www.windowscentral.com/hardware/laptops/msi-reveals-an-army-of-laptops-monitors-pc-components-and-more-at-ces-2023,MSI reveals an army of laptops monitors PC components and more at CES 2023 MSI has a long list of new products to show off during CES 2023. What you need to know MSI is a huge manufacturer of laptops desktops PC components accessories and more. During CES 2023 the company revealed a huge lineup of new gaming products. The announcements included four gaming laptops a gaming desktop four monitors and much more. The company also announced its lineup of GeForce 40Series GPUs a new motherboard and other components and accessories. CES 2023 is the place to be for the latest developments in the world of PC gaming and MSI is one of the biggest players in the space. During the tech conference MSI revealed a veritable avalanche of new products ranging from highend gaming laptops to individual PC components and accessories. Theres a lot here so well jump right into it. Many exact details are light on the moment for these products unfortunately but heres everything you need to know about MSIs announcements during CES 2023. MSI Stealth Studio gaming laptops MSIs Stealth line of gaming laptops are meant to deliver impeccable creative and gaming performance in a thin and light package. During CES 2023 MSI revealed two new laptops with the Stealth 14 Studio and the Stealth 16 Studio. As you can imagine these laptops are similar in many ways but with the former possessing a 14inch 240Hz 1610 QHD IPS display and the latter possessing a 16inch display with the same resolutions and specs. Both laptops are powered by the latest 13th Gen Intel Core processor and up to an NVIDIA GeForce RTX 4070 GPU. MSI also packed these laptops with RGBbacklit keyboards from SteelSeries quadspeaker audio setups and Thunderbolt 4 support. The 16inch model boasts a 99Whr battery the largest it can legally be which will hopefully lend it halfway decent battery life for a gaming laptop. The duo certainly looks sleek but it remains to be seen if they or any of MSIs latest gaming laptops have what it takes to compete with the best gaming laptops on the market. MSI Raider GE78 HX gaming laptop The MSI Raider GE78 HX is equipped with some of the most powerful and capable hardware you can currently find in a gaming laptop. With up to a 13th Gen Intel Core i913980HX and an NVIDIA GeForce RTX 4090 the Raider GE78 looks like a truly ridiculous powerhouse of a laptop. MSI also tweaked the laptops design with a new customizable RGB Matrix bar and threw in a ton of ports a high refresh rate display and a physical camera shutter. MSI Titan GT77 HX gaming laptop The MSI Titan GT77 HX may look comparable to the previous Raider GE78 HX on the surface but MSI is positioning this as a true desktop replacement laptop. The Titan GT77 HX which builds on the previous MSI Titan GT77 is powered by a 13th Gen Intel Core i913980HX and an NVIDIA GeForce RTX 4090 but also brings a massive 17. 3inch 4K 144Hz MiniLED display a mechanical keyboard an IRequipped webcam a massive 99Whr battery and an astonishing four fans and eight pipes to keep everything running cool. MSI desktops and PC components While MSIs laptops may steal the show for many the company also announced a multitude of desktopcentric products including the MSI MEG Trident X2 prebuilt gaming desktop powered by 13th Gen Intel Core and NVIDIA GeForce RTX 40Series hardware and an increased integration with MSIs gaming monitors. If MSIs desktop offers great performance at a reasonable price it could find its way onto our list of the best prebuilt gaming desktops. MSI also announced four new NVIDIA GeForce RTX 40Series GPUs ranging from the 4080 to the allpowerful 4090 which will allow users to upgrade their PCs with the latest GPUs enhanced by MSI with superior cooling. MSI has long made some of the best overall versions of the best graphics cards so its definitely worth keeping an eye on these. Those who desire faster loading speeds can consider the ultrapremium MSI SPATIUM M570 PCIe 5. 0 SSD which offers ludicrous speeds of up to 10GBs an up to 4TB of storage capacity. Finally the MSI MEG Z790 Godlike motherboard and MSI MEG Ai1300P PCIE5 power supply make it easy to build the perfect Intelpowered gaming desktop. MSI monitors MSI announced four new monitors at CES 2023 including three curved gaming monitors and a creatorfocused professional monitor. The MSI Modern MD271UL is a 27inch 4K monitor powered by USB TypeC with 65W Power Delivery and features an exclusive MSI app to allow users to customize the display. The MSI MAG 275CQRX on the other hand is a 27inch QHD monitor with 250Hz refresh rate a 1ms response time and 1000R curve. Finally the premium MSI MEG 342C and 491C QDOLED monitors feature stunning OLED displays with a 0. 1ms response time great color gamut support and curved 34inch and 49inch panels widescreen panels. Could these be the next greatest gaming monitors Well have to wait to find out. MSI routers and accessories Last but not least MSI announced a handful of new routers accessories and more. First the MSI RadiX series of gaming routers aim to deliver peerless WiFi performance in your home. The AX6600 boasts WiFi 6 support while the AXE6600 adds WiFi 6e support as well as customizable RGB lighting. Finally the ultrapremium BE22000 is one of the few WiFi 7 routers available with incredible range and autodetecting antennas that can track the exact location of your devices and ensure that youre always getting the strongest signal possible. Theres also the MSI Clutch GM51 a wireless gaming mouse that weighs only 85G the MSI Vigor GK71 Sonic midrange gaming keyboard and the stylish MSI Pen 2 with a graphite tip and wide device support thanks to the Microsoft MPP2. 6 protocol. Windows Central Newsletter Get the best of Windows Central in in your inbox every day Zachary Boddy They Them is a Staff Writer for Windows Central primarily focused on covering the latest news in tech and gaming the best Xbox and PC games and the most interesting Windows and Xbox hardware. They have been gaming and writing for most of their life starting with the original Xbox and started out as a freelancer for Windows Central and its sister sites in 2019. Now a fullfledged Staff Writer Zachary has expanded from only writing about all things Minecraft to covering practically everything on which Windows Central is an expert especially when it comes to Microsoft. You can find Zachary on Twitter BoddyZachary. Windows Central Newsletter Thank you for signing up to Windows Central. You will receive a verification email shortly. There was a problem. Please refresh the page and try again.,‘I didn’t steal funds’ says former crypto titan Bankman-Fried,Extremely Negative,500,"['steal', 'steal', 'collapse', 'stole', 'debts', 'hedge', 'guilty', 'steal', 'hedge', 'guilty', 'defrauding', 'plea']","['fraud', 'criminal']","['lawsuit', BankmanFried, Sam, BankmanFried, 'lawsuit', BankmanFried, 'lawsuit', BankmanFried, Caroline, Ellison, wassielawyer]"
